critic_id,critic_meter_score,critic_rating,movie_id,movie_review_blurb,movie_title
gregory-weinkauf,fresh,,china_the_panda_adventure,"Young delivers a spry, richly detailed adventure for general audiences, truly a feat deserving acclaim.",China: The Panda Adventure (2001)
gregory-weinkauf,rotten,,musketeer,Neither thrilling nor unbearable.,The Musketeer (2001)
gregory-weinkauf,rotten,,vengo,Gatlif's drama doesn't hold a candle to his documentary style.,Vengo (2001)
gregory-weinkauf,rotten,,glitter,"It's just an intentional hoot, sabotaged by clunky direction, a screenplay so awful it feels as though there are no vowels, and Carey's inability to recite a line of it.",Glitter (2001)
gregory-weinkauf,rotten,,dont_say_a_word,The movie's dramatic course becomes an excuse for excesses of familiar and not particularly engrossing technique.,Don't Say a Word (2001)
gregory-weinkauf,fresh,,joy_ride,Somehow this project manages to be both astoundingly derivative and reasonably entertaining at the same time.,Joy Ride (2001)
gregory-weinkauf,fresh,,mulholland_dr,"While this road may contain too many potholes -- and plotholes -- to sustain an even ride, there are moments of greatness scattered throughout to remind us why Lynch is vital.",Mulholland Drive (2001)
gregory-weinkauf,fresh,,my_first_mister,"Lahti stacks her movie high with silly clutter ... but when she dispenses with the tripe and gets down to the stuff of life, she can tickle us to the point of tears.",My First Mister (2002)
gregory-weinkauf,fresh,,waking_life,Linklater's earnest good tidings eventually win out over his fruity metaphysics.,Waking Life (2001)
gregory-weinkauf,fresh,,from_hell,"Despite their bloody tomfoolery, the brothers opt out of slumming with cheap slasher movies by delivering extremely impressive production values, a Merchant-Ivory horror show digging into the guts of history.",From Hell (2001)
gregory-weinkauf,rotten,,better_than_sex,"Josh and Cin really are strangers, so their sudden entry through the gates of true love makes not a lick of sense.",Better Than Sex (2001)
gregory-weinkauf,rotten,,thirteen_ghosts,"This bloody stab at William Castle's 1960 gimmick flick substitutes chaos for chills, much like the company's 1999 remake of Castle's House on Haunted Hill.",Thirteen Ghosts (13 Ghosts) (2001)
gregory-weinkauf,fresh,,tape,"When the project cuts through its own crap, it achieves its humble goals.",Tape (2001)
gregory-weinkauf,rotten,,1108799-score,"Oz seems determined to show us his tough-guy chops, but this simply isn't his bag, and it shows.",The Score (2001)
gregory-weinkauf,fresh,,simon_magus,"A movie worth your time, not only for its built-in debates, but also simply because it's lush and otherworldly.",Simon Magus (2001)
gregory-weinkauf,fresh,,ghost_world,"Succeeds where the comic fails, giving us characters we can actually care about while we're pointing at them and laughing our fool heads off.",Ghost World (2001)
gregory-weinkauf,rotten,,lost_and_delirious,Festering somewhere between an after-school special and kiddie porn lies this frank but heinously melodramatic open wound.,Lost and Delirious (2001)
gregory-weinkauf,rotten,,memento,"Although it's being trumpeted for its undeniably ambitious narrative structure, Memento feels mostly like an audacious prank.",Memento (2000)
gregory-weinkauf,rotten,,1105990-heartbreakers,"A joyless, soulless romp.",Heartbreakers (2001)
gregory-weinkauf,rotten,,tailor_of_panama,"What's most unnerving about The Tailor of Panama is the film's overall tone, which wavers uncomfortably between modest thrills and modest farce.",The Tailor of Panama (2001)
gregory-weinkauf,fresh,,blow,"A cool and clever pastiche of Scarface mingled with Goodfellas, wrapped in the polyester playfulness of That '70s Show. Whether this description serves as a beacon or a warning is up to you.",Blow (2001)
gregory-weinkauf,rotten,,bridget_jones_diary,The urge to laugh is superceded by the urge to slap everybody and command them to stop embarrassing all of humanity.,Bridget Jones's Diary (2001)
gregory-weinkauf,rotten,,center_of_the_world,The most lurid and frequently obnoxious sex drama seen in quite some time.,The Center of the World (2001)
gregory-weinkauf,fresh,,one_night_at_mccools,Big loud fun for when you're feelin' dumb.,One Night at McCool's (2001)
gregory-weinkauf,fresh,,knights_tale,"Unabashedly formulaic though it is, this roguish adventure guarantees sylvan fun for everyone.",A Knight's Tale (2001)
gregory-weinkauf,fresh,,bread_and_roses,"The themes here are obvious, and there's very little entertainment value at hand, but until Julie Taymor (or whoever) delivers a Janitors! musical, this is a fine study of the conflict.",Bread and Roses (2001)
gregory-weinkauf,rotten,,trumpet_of_the_swan,Frenetic mess.,The Trumpet of the Swan (2001)
gregory-weinkauf,fresh,,1107863-moulin_rouge,"This thing moves brilliantly, sparkling like nothing we've seen domestically since The Wiz or Xanadu.",Moulin Rouge! (2001)
gregory-weinkauf,rotten,,startupcom,"Those interested in the abrupt rise and fall of Internet commerce may recognize familiar themes and even draw comfort from the story arc, but for a general audience the entertainment factor is quite low.",Startup.com (2001)
gregory-weinkauf,fresh,,baisemoi,Its fleeting moments of pathos and humor occasionally lift it higher.,Baise-Moi (2000)
gregory-weinkauf,rotten,,anniversary_party,"By the end, one feels strangely compassionate yet intellectually detached, as if the hugs and not the lauding were their goal all along.",The Anniversary Party (2001)
gregory-weinkauf,fresh,,atlantis_the_lost_empire,"A thrilling tale smartly told, with an abundance of wit and invention. It's a classic.",Atlantis - The Lost Empire (2001)
gregory-weinkauf,fresh,,our_song,The realism is so effective it feels perilously close to eavesdropping.,Our Song (2001)
gregory-weinkauf,fresh,,baby_boy,"The gratuitous violence sucks, and the pat conclusion prompts one to shout don't believe the hope!, but otherwise Singleton has wrangled his characters into a very impressive emotional exorcism.",Baby Boy (2001)
gregory-weinkauf,rotten,,the_crimson_rivers,Bound to alienate its audience with its overdose of self-importance.,The Crimson Rivers (2001)
gregory-weinkauf,fresh,,pandaemonium,A sensationally dreamy manifesto.,Pandaemonium (2001)
gregory-weinkauf,fresh,,dr_strangelove,Kubrick's comic gem sparkles with enduring relevance.,Dr. Strangelove Or How I Learned to Stop Worrying and Love the Bomb (1964)
gregory-weinkauf,fresh,,1119037-nicholas_nickleby,"The tasteful little revision works wonders, enhancing the cultural and economic subtext, bringing richer meaning to the story's morals.",Nicholas Nickleby (2002)
gregory-weinkauf,rotten,,harrisons_flowers,Swiftly deteriorates into a terribly obvious melodrama and rough-hewn vanity project for lead actress Andie MacDowell.,Harrison's Flowers (2002)
gregory-weinkauf,fresh,,hours,"It's a noble work, an elegant work, a compassionate work -- and a somewhat tedious and glaringly self-important work.",The Hours (2002)
gregory-weinkauf,rotten,,art_school_confidential,An embarrassing and unsatisfying canvas unfit even for hanging.,Art School Confidential (2006)
gregory-weinkauf,fresh,,da_vinci_code,Grand Theft Grail,The Da Vinci Code (2006)
gregory-weinkauf,rotten,,omen,Devil Dog.,The Omen (2006)
gregory-weinkauf,rotten,,prairie_home_companion,"If ever there were a venue in this region in dire need of Prince dropping by, this is it. These Twin Cities folks desperately need to swap NPR for the NPG.",A Prairie Home Companion (2006)
gregory-weinkauf,rotten,,superman_returns,"Alas, a pumped-up forgery.",Superman Returns (2006)
gregory-weinkauf,fresh,,pirates_of_the_caribbean_dead_mans_chest,"It's mostly a moody thing, awash with dark and gruesome hues, possessed of a lost and aching spirit. Yay that!",Pirates of the Caribbean: Dead Man's Chest (2006)
gregory-weinkauf,fresh,,mad_cowgirl,"Absurd, dirty, powerful and disturbingly hilarious.",Mad Cowgirl (2006)
gregory-weinkauf,fresh,,snakes_on_a_plane,"Truly, this is the greatest movie about snakes on a plane ever made so far!",Snakes on a Plane (2006)
gregory-weinkauf,fresh,,everyone_stares_the_police_inside_out,"Fanciful, fun, funny, and frenetic -- all the great things about New Wave music brought gloriously into focus for posterity.",Everyone Stares: The Police Inside Out (2005)
gregory-weinkauf,rotten,,1148076-no_direction_home_bob_dylan,"A competent but fawning, focusless and utterly overlong tribute to a terribly mediocre entertainer who 'sings' like a bumblebee barfing. Bloated Boomers, feel free to be interred with a copy. Soon.",No Direction Home: Bob Dylan (2005)
gregory-weinkauf,rotten,,the_wicker_man_2006,"Idiotic, presumptuous and definitely unnecessary.",The Wicker Man (2006)
gregory-weinkauf,fresh,,tideland,This year's best film.,Tideland (2006)
gregory-weinkauf,rotten,,1158195-marie_antoinette,Filler Queen.,Marie Antoinette (2006)
gregory-weinkauf,rotten,,casino_royale,Junk Bond.,Casino Royale (2006)
gregory-weinkauf,fresh,,happy_feet,"A wonder, a true classic, one of the greatest motion pictures of all time.",Happy Feet (2006)
gregory-weinkauf,fresh,,nativity_story,"Well conceived. Indeed, there's something about Mary.",The Nativity Story (2006)
gregory-weinkauf,rotten,,good_german,"I tousle the hair of The Good German, pat it on the butt, and tell it to eat its vegetables so one day it may grow up into a real Motion Picture.",The Good German (2007)
gregory-weinkauf,rotten,,pursuit_of_happyness,Sings the blues with all the authority of Barry Manilow.,The Pursuit of Happyness (2006)
gregory-weinkauf,fresh,,starter_for_ten,The spirit of the music -- above all -- really does hold this movie together.,Starter for 10 (2006)
gregory-weinkauf,fresh,,donnie_darko_the_directors_cut,"Friends and neighbors, this is a Great American Movie.",Donnie Darko: The Director's Cut (2004)
gregory-weinkauf,fresh,,10006490,"Super-scintillating. We're fortunate to have a bright, bold documentary like Glastonbury to remind us how fun, weird and wonderful life can be.",Glastonbury (2007)
gregory-weinkauf,rotten,,tsotsi,Consider the difference between a complex environment and a simpleminded movie set within that environment.,Tsotsi (Thug) (2006)
gregory-weinkauf,fresh,,firewall,An engrossing thriller and stirring emotional ride.,Firewall (2006)
gregory-weinkauf,fresh,,1167452-her_majesty,An enjoyable family viewing experience.,Her Majesty (2001)
gregory-weinkauf,fresh,,star_wars_episode_iii_revenge_of_the_sith,"Way-neato Sith is, but its screenplay's logic I understand not.",Star Wars: Episode III - Revenge of the Sith (2005)
gregory-weinkauf,fresh,,batman_begins,And now a simple appraisal for the fanboys: Darkity-darkity dark-dark-dark! Happy now? You should be!,Batman Begins (2005)
gregory-weinkauf,rotten,,war_of_the_worlds,Mars Annoys!,War of the Worlds (2005)
gregory-weinkauf,rotten,,undead_2003,It's more a tribute movie than an original.,UNDEAD (2005)
gregory-weinkauf,fresh,,charlie_and_the_chocolate_factory,"Our Golden Ticket arrived in 1971, however this new Factory produces undeniably tasty confectionery of a newfangled sort.",Charlie and the Chocolate Factory (2005)
gregory-weinkauf,fresh,,me_and_you_and_everyone_we_know,"The writer-director-star is so aggressively 'alternative' that she'll have the Gyllenhaals diving for cover, however her peculiar handle on humanity proves quite engaging.",Me and You and Everyone We Know (2005)
gregory-weinkauf,fresh,,brothers_grimm,"It's a large, unwieldy cauldron of fantasticality. Yay that!",The Brothers Grimm (2005)
gregory-weinkauf,fresh,,mirrormask,Brilliant!,MirrorMask (2005)
gregory-weinkauf,fresh,,constant_gardener,"Peel away the melodramatic posturing and the stylistic overkill, and the African poetry proves stunning and very hard to shake.",The Constant Gardener (2005)
gregory-weinkauf,rotten,,just_like_heaven,"She's not corporeal, so she compensates by being totally irritating, which gradually causes him...to fall in love with her?",Just Like Heaven (2005)
gregory-weinkauf,fresh,,corpse_bride,"A serious contender for 'Best Picture.' Or, at least, in a just world, it should be.",Tim Burton's Corpse Bride (2005)
gregory-weinkauf,fresh,,harry_potter_and_the_prisoner_of_azkaban,Consistently glorious to the eye.,Harry Potter and the Prisoner of Azkaban (2004)
gregory-weinkauf,fresh,,zathura,It takes a special sort of imagination to make us wonder how possible it is to make macaroni and cheese in outer space.,Zathura (2005)
gregory-weinkauf,fresh,,harry_potter_and_the_goblet_of_fire,It's like this: The book is sensational. The movie is sensationalistic. Both are enjoyable. The book is better.,Harry Potter and the Goblet of Fire (2005)
gregory-weinkauf,fresh,,1153077-1153077-pride_and_prejudice,"It's a gorgeous and romantic production, but I didn't buy Keira Knightley for one second.",Pride and Prejudice (2005)
gregory-weinkauf,fresh,,memoirs_of_a_geisha,McSushi!,Memoirs of a Geisha (2005)
gregory-weinkauf,fresh,,chronicles_of_narnia_lion_witch_wardrobe,"If you love the book it is hard to imagine you not loving the movie, regardless of the ideological prism through which you view it.","The Chronicles of Narnia: The Lion, The Witch and The Wardrobe (2005)"
gregory-weinkauf,fresh,,king_kong,Credible grasshoppers.,King Kong (2005)
gregory-weinkauf,fresh,,cowboy_del_amor,Deft and ebullient.,Cowboy del Amor (2006)
gregory-weinkauf,fresh,,rocky_horror_picture_show,One of the greatest motion pictures ever made.,The Rocky Horror Picture Show (1975)
gregory-weinkauf,fresh,,mimzy,"Encourages viewers of all ages to Dream: Bigger, Sweeter, Smarter.",The Last Mimzy (2007)
gregory-weinkauf,fresh,,away_from_her,One of the most confident and unforgettable directorial debuts I have ever seen.,Away From Her (2007)
gregory-weinkauf,rotten,,ugly_truth,"Yet another wearying ""battle-of-the-sexes"" romp that's sure to please dumb people but didn't please me.",The Ugly Truth (2009)
gregory-weinkauf,fresh,,harry_potter_and_the_half_blood_prince,I'm applauding.,Harry Potter and the Half-Blood Prince (2009)
gregory-weinkauf,fresh,,harry_potter_and_the_deathly_hallows_part_1,"A poignant paean to longing, loss and love, drenched in shadow and glistening with magic.",Harry Potter and the Deathly Hallows - Part 1 (2010)
gregory-weinkauf,fresh,,10011582-TRON_legacy,An epic ride.,Tron Legacy (2010)
gregory-weinkauf,fresh,,true-grit-2010,"Tight, smart, funny and compelling.",True Grit (2010)
gregory-weinkauf,fresh,,dhobi_ghat,"Sleek, subtle, sensual, a very human time-capsule of now.",Mumbai Diaries (2011)
gregory-weinkauf,fresh,,harry_potter_and_the_deathly_hallows_part_2_2011,It's a classic to stand the test of time.,Harry Potter and the Deathly Hallows - Part 2 (2011)
gregory-weinkauf,fresh,,chicken_run,"The first feature film from England's Aardman Animation, and the first truly terrific film to be released by DreamWorks.",Chicken Run (2000)
gregory-weinkauf,fresh,,monty_python_and_the_holy_grail,"Watching it, it's hard to believe that these guys were actually meandering across heaths and trudging across rope bridges, with electricians and caterers not far away. It seems more as if this souvenir of the Absurd Ages has... existed for a millennium.",Monty Python and the Holy Grail (1975)
gregory-weinkauf,fresh,,harry_potter_and_the_chamber_of_secrets,"Despite its sophomoric awkwardness, the Chamber of Secrets is a welcome delivery of childlike wonder for a planet of ever- increasing ugliness.",Harry Potter and the Chamber of Secrets (2002)
gregory-weinkauf,fresh,,alien,Bloody brilliant.,Alien (1979)
gregory-weinkauf,fresh,,1009113-halloween,"Narratively anemic - but earns its hosannas primarily in terms of atmosphere and performances, both verging on brilliant.",Halloween (1978)
gregory-weinkauf,fresh,,devils_whisper,A mix of psychological and supernatural horror sure to linger after its final frame.,Devil's Whisper (2017)
gregory-weinkauf,rotten,,alien_covenant,"Cut to icky creatures eviscerating everybody, badass brunette showdown, yadda-yadda.",Alien: Covenant (2017)
gregory-weinkauf,rotten,,blade_runner_2049,Boring with spasms of viciousness: whee.,Blade Runner 2049 (2017)
gregory-weinkauf,fresh,,justice_league_2017,It's a blast to behold.,Justice League (2017)
gregory-weinkauf,fresh,,thor_ragnarok_2017,Pleasingly ostentatious.,Thor: Ragnarok (2017)
gregory-weinkauf,rotten,,star_wars_the_last_jedi,It's fun to look at.,Star Wars: The Last Jedi (2017)
gregory-weinkauf,fresh,,laserhawk,Perfect for a Saturday afternoon.,Laserhawk (2000)
gregory-weinkauf,fresh,,10010658-orphan,A pretty good little B-movie thriller.,Orphan (2009)
gregory-weinkauf,fresh,,spiderman_3,The sequences of romantic struggle and heartache prove unusually touching for a superhero movie.,Spider-Man 3 (2007)
gregory-weinkauf,fresh,,500_days_of_summer,"As with a lot of truly satisfying art, (500) Days asks many more questions than it answers, and does so in such a charmingly sloppy fashion that one's consciousness is left buzzing rather than sedated.",500 Days of Summer (2009)
gregory-weinkauf,fresh,,district_9,This ham-fisted Apartheid allegory involving beleaguered insectoid space aliens herded into the eponymous South African ghetto wins several points because it craftily hybridizes much that was cool about '80s sci-fi.,District 9 (2009)
gregory-weinkauf,fresh,,harry_potter_and_the_order_of_the_phoenix,Fans of death-obsessed Kid Lit may rejoice.,Harry Potter and the Order of the Phoenix (2007)
gregory-weinkauf,fresh,,stardust,A glorious yarn.,Stardust (2007)
gregory-weinkauf,fresh,,across_the_universe,Some sort of absurd miracle (or miraculous absurdity).,Across the Universe (2007)
gregory-weinkauf,fresh,,bucket_list,"Smart, sophisticated and witty. It's a movie for people.",The Bucket List (2007)
gregory-weinkauf,fresh,,sex_and_death_101,Genre-defying geniusness for smart people.,Sex and Death 101 (2007)
gregory-weinkauf,fresh,,iron_man,"The perfect fusion of Batman, Bond and Boba Fett.",Iron Man (2008)
gregory-weinkauf,rotten,,speed_racer,"Kudos to production designer the Marquis de Sade, and to script doctor Chim-Chim.",Speed Racer (2008)
gregory-weinkauf,fresh,9/10,indiana_jones_and_the_kingdom_of_the_crystal_skull,A triumphant return to form.,Indiana Jones and the Kingdom of the Crystal Skull (2008)
gregory-weinkauf,fresh,,the_dark_knight,"The Dark Knight is grim, loud, ugly, mean and disjointed (four out of five ain't bad!); thus, as an evening of fanboy fodder it's very hard to beat: Call it The Dork Night.",The Dark Knight (2008)
gregory-weinkauf,rotten,,vicky_cristina_barcelona,No amount of pretty scenery can conceal the tedium.,Vicky Cristina Barcelona (2008)
gregory-weinkauf,rotten,,tropic_thunder,Is this a comedy -- or a cry for help?,Tropic Thunder (2008)
gregory-weinkauf,rotten,,1195103-happy_go_lucky,A cute but shallow and generally sloppy enterprise.,Happy-Go-Lucky (2008)
gregory-weinkauf,rotten,,burn_after_reading,A bunch of pieces in search of a puzzle.,Burn After Reading (2008)
gregory-weinkauf,fresh,,valkyrie,"Ultimately it is redeemed by its palpably clammy sense of foreboding, plus its offering of a valuable history lesson.",Valkyrie (2008)
gregory-weinkauf,fresh,,watchmen,Watchmen rules.,Watchmen (2009)
gregory-weinkauf,fresh,,i_love_you_man,"I love I Love You, Man.","I Love You, Man (2009)"
gregory-weinkauf,rotten,,observe_and_report,"One exits feeling not amused, but sullied, weary.",Observe and Report (2009)
gregory-weinkauf,rotten,,star_trek_11,"It's been thirty years since I last found myself at the movies, rooting for a black hole.",Star Trek (2009)
gregory-weinkauf,fresh,,terminator_4,One of the coolest post-apocalyptic thrill-rides since the respective career peaks of Charlton Heston and Mel Gibson.,Terminator Salvation (2009)
gregory-weinkauf,fresh,,julie_and_julia,"Cutesy kitchen antics aside, one senses here -- across class lines, fifty years and an ocean -- huge shifts in the perception of romance, of profession, of identity.",Julie & Julia (2009)
gregory-weinkauf,fresh,,finding_neverland,The fiction is undeniably charming.,Finding Neverland (2004)
gregory-weinkauf,rotten,,time_travelers_wife,Rarely does a movie make me so dearly wish I could come unstuck in time.,The Time Traveler's Wife (2009)
gregory-weinkauf,rotten,,grudge,"The Grudge bears the imprimatur of Sam Raimi, but alas, neither his sense of fun nor his smarts.",The Grudge (2004)
gregory-weinkauf,fresh,,fellini_im_a_born_liar,"Fellini, you bastard!",Fellini: I'm a Born Liar (2003)
gregory-weinkauf,rotten,,lara_croft_tomb_raider_the_cradle_of_life,Joyless princess.,Lara Croft Tomb Raider - The Cradle of Life (2003)
gregory-weinkauf,rotten,,secret_lives_of_dentists,"Seems vaguely interested in American domestic ennui, but ends up feeling -- wait for it (yawn) -- like pulling teeth.",The Secret Lives of Dentists (2003)
gregory-weinkauf,rotten,,1124832-divorce,It illustrates why them French went and invented the word 'merde.',Le Divorce (2003)
gregory-weinkauf,fresh,,1124859-grind,"It may not be deep, but it's sincere -- even a bit weird.",Grind (2003)
gregory-weinkauf,fresh,,shane_macgowan_if_i_should_fall_from_grace,"A booze-soaked, rousing, engaging portrait, funnier and weirder than the bogus folkumentary A Mighty Wind and as touching as the Sex Pistols pic The Filth and the Fury.",Shane MacGowan - If I Should Fall From Grace (2003)
gregory-weinkauf,fresh,,gigantic,Comforting and pleasant.,Gigantic (2002)
gregory-weinkauf,fresh,,thirteen,It could have been called What a Girl Actually Has.,Thirteen (2003)
gregory-weinkauf,rotten,,lost_in_translation,"When work this potentially satisfying remains flatly obvious, it's almost worse than being flat-out bad.",Lost In Translation (2003)
gregory-weinkauf,rotten,,1125409-cabin_fever,The only thing scary about Cabin Fever is that well-connected hacks get deals.,Cabin Fever (2002)
gregory-weinkauf,fresh,,underworld,It engenders more comic-book comradeship than awe. (No rating: Neither 'Fresh' nor 'Rotten.'),Underworld (2003)
gregory-weinkauf,fresh,,once_upon_a_time_in_the_midlands,"This movie's just so-so, but at its heart lies a true leading lady.",Once Upon a Time in the Midlands (2003)
gregory-weinkauf,fresh,,my_life_without_me,My ducts opened right the hell up.,My Life Without Me (2003)
gregory-weinkauf,fresh,,1126413-sylvia,A rather amazing movie on its own terms.,Sylvia (2003)
gregory-weinkauf,fresh,,alien_the_directors_cut_2007,A rare and welcome work of genius.,Alien: The Director's Cut (2003)
gregory-weinkauf,fresh,,in_the_cut,"A work impressively realized, and all involved deserve acclaim.",In the Cut (2003)
gregory-weinkauf,rotten,,scary_movie_3,Feels like therapy for Hollywood freaks.,Scary Movie 3 (2003)
gregory-weinkauf,rotten,,matrix_revolutions,"Silly humans, Matrix is for kids!",The Matrix Revolutions (2003)
gregory-weinkauf,fresh,,master_and_commander_the_far_side_of_the_world,Weir's finest film since the brilliant The Mosquito Coast. Bettany is terrific.,Master and Commander: The Far Side of the World (2003)
gregory-weinkauf,fresh,,dirty_pretty_things,The best romantic love story I've seen so far this year.,Dirty Pretty Things (2003)
gregory-weinkauf,fresh,,tupac_resurrection,"This project makes it easy for anyone to understand not only the sanctified, semicrazed star, but the complicated web of elements that created and destroyed him.",Tupac: Resurrection (2003)
gregory-weinkauf,fresh,,i_capture_the_castle,A fabulous film.,I Capture the Castle (2003)
gregory-weinkauf,fresh,,pirates_of_the_caribbean_the_curse_of_the_black_pearl,"Orlando Bloom is the greatest actor who ever lived. The mortal cast members are also enjoyable...and indeed, Captain Jack will get you high tonight.",Pirates of the Caribbean: The Curse of the Black Pearl (2003)
gregory-weinkauf,fresh,,stage_beauty,A welcome treat.,Stage Beauty (2004)
gregory-weinkauf,fresh,,max,"As chilling and fascinating as Philippe Mora's modern Hitler-study, Snide and Prejudice.",Max (2002)
gregory-weinkauf,rotten,,how_to_lose_a_guy_in_10_days,The biggest challenge to viewing 10 Days is deciding whether to think of its lead characters as 'despicable swine' or 'vile dung-weasels.',How to Lose a Guy in 10 Days (2003)
gregory-weinkauf,rotten,,he_loves_me_he_loves_me_not,"Standing on its own, it's comme ci, comme ça, self-serious when it should be adventurous, coy when it should be revelatory.","He Loves Me, He Loves Me Not (2002)"
gregory-weinkauf,fresh,,cradle_2_the_grave,"Ultimately, it's the hip cast that keeps things hopping.",Cradle 2 the Grave (2003)
gregory-weinkauf,fresh,,till_human_voices_wake_us,"If a darkly dreamy, vaguely 'midcentury' antipodal experience appeals, you'll be well served here.",Till Human Voices Wake Us (2003)
gregory-weinkauf,fresh,,tears_of_the_sun,"There's an undeniable atmosphere here, in the visuals but also in the incredible aural jungle of sound designer George Simpson and crew, and in the tribal-New Age soundtrack.",Tears of the Sun (2003)
gregory-weinkauf,rotten,,irreversible,"Mostly just a tantrum, the sort of stuff Polanski at any stage of his career would've crumpled up and discarded for being too trite.",Irréversible (2002)
gregory-weinkauf,fresh,,gerry,"There's elegance and grace here, fostering an opportunity to reflect upon why men get so dutiful about being down. It's worth the hike.",Gerry (2003)
gregory-weinkauf,fresh,,bend_it_like_beckham,"Chadha's work oozes with compassion, charm and the power of compromise, and on a planet screwed up by enormous cultural ignorance she's both an artist and a heroine.",Bend It like Beckham (2003)
gregory-weinkauf,fresh,,spun,"The project leavens its grotesqueries with wit, truly funny supporting characters and even a couple of unexpectedly touching soliloquies.",Spun (2003)
