critic_id,critic_meter_score,critic_rating,movie_id,movie_review_blurb,movie_title
charles-koplinski,fresh,3.0/4.0,the_purge_anarchy_2014,"There's a sense of justified rage that propels ""The Purge: Anarchy,"" a film that simultaneously serves as a cathartic exercise for its audience as well as a screed against the current state of societal affairs.",The Purge: Anarchy (2014)
charles-koplinski,fresh,4.0/4.0,begin_again,"""Begin Again"" a cure for the summertime movie blues.",Begin Again (2013)
charles-koplinski,fresh,3.5/4.0,lucy_2014,"""Lucy"" ends up being one of the more pleasant surprises in this bleak summer, proving to be far more substantial than you'd expect.",Lucy (2014)
charles-koplinski,fresh,3.5/4.0,le_week_end,"Charming ""Le Week-End"" a Rare Breed",Le Week-End (2014)
charles-koplinski,fresh,3.5/4.0,guardians_of_the_galaxy,"""Star Wars"" for a new generation.",Guardians of the Galaxy (2014)
charles-koplinski,fresh,4.0/4.0,calvary_2013,"Father James' stature grows in our eyes, due in great part to Gleeson's powerful performance, which at the very least deserves an Oscar nomination if not the award itself.",Calvary (2014)
charles-koplinski,fresh,4.0/4.0,boyhood,"""Boyhood"" a subtle, powerful meditation on life.",Boyhood (2014)
charles-koplinski,rotten,1.5/4.0,if_i_stay,"""Stay"" a Dismal Example of Modern Storytelling.",If I Stay (2014)
charles-koplinski,rotten,2.5/4.0,the_november_man,"Surprisingly, this thriller from director Roger Donaldson isn't half bad, due in large part to its star Pierce Brosnan, who returns to the action genre after far too long an absence.",The November Man (2014)
charles-koplinski,fresh,3.5/4.0,as_aboveso_below,The best found-footage horror film since the first Paranormal Activity (2007).,"As Above, So Below (2014)"
charles-koplinski,fresh,3.0/4.0,a_walk_among_the_tombstones,"Slow and Steady Perfect for ""Tombstone.""",A Walk Among the Tombstones (2014)
charles-koplinski,fresh,4.0/4.0,rush_2013,"This is Howard's most assured film; it brims with life - and death - and he executes it with a degree of precision and confidence that mirrors the approach his characters take toward living, that of being constantly on the edge.",Rush (2013)
charles-koplinski,rotten,2.5/4.0,interstellar_2014,Nolan's Vision Exceeds his Grasp.,Interstellar (2014)
charles-koplinski,fresh,3.5/4.0,exodus_gods_and_kings,"Spectacle and Redemption Propel ""Exodus.""",Exodus: Gods and Kings (2014)
charles-koplinski,fresh,3.5/4.0,into_the_woods_2014,"A Grim, Glorious ""Woods.""",Into the Woods (2014)
charles-koplinski,fresh,4.0/4.0,the_imitation_game,"Cumberbatch Heartbreaking, Brilliant in ""Game.""",The Imitation Game (2014)
charles-koplinski,rotten,2.5/4.0,big_eyes,"""Eyes"" Struggles to Find its Voice",Big Eyes (2014)
charles-koplinski,rotten,2.0/4.0,unbroken_2014,"Fire Missing in Jolie's ""Unbroken.""",Unbroken (2014)
charles-koplinski,rotten,2.5/4.0,the_hobbit_the_battle_of_the_five_armies,"""Armies"" Finally Gets us Back Again",The Hobbit: The Battle of the Five Armies (2014)
charles-koplinski,fresh,3.5/4.0,hercules_the_thracian_wars,"Color me ""surprised"" in regards to Brett Ratner's Hercules, an unexpectedly thrilling, smart and at times moving new take on everyone's favorite demigod.",Hercules (2014)
charles-koplinski,fresh,3.5/4.0,enemy_2013,"Challenging ""Enemy"" Refuses to Pander",Enemy (2014)
charles-koplinski,fresh,4.0/4.0,john_wick,"A Bloody, Cathartic Ride.",John Wick (2014)
charles-koplinski,fresh,4.0/4.0,captain_america_the_winter_soldier_2014,"Rivals Christopher Nolan's ""The Dark Knight"" in complexity and scope in the way it looks at real-world issues through a deceptively simple comic book aesthetic.",Captain America: The Winter Soldier (2014)
charles-koplinski,fresh,3.5/4.0,47_ronin,"The most misunderstood, underrated film of 2013.",47 Ronin (2013)
charles-koplinski,fresh,3.5/4.0,the_wolf_of_wall_street_2013,"Scorsese Helms Familiar but Effective ""Wolf""",The Wolf of Wall Street (2013)
charles-koplinski,rotten,2.0/4.0,the_amazing_spider_man_2,Nothing but a blur...,The Amazing Spider-Man 2 (2014)
charles-koplinski,fresh,3.5/4.0,kill_your_darlings_2013,A Bracing Look at the Beats,Kill Your Darlings (2013)
charles-koplinski,fresh,3.0/4.0,blue_is_the_warmest_color,"""Blue"" Far More than its Rating Suggests",Blue Is The Warmest Color (2013)
charles-koplinski,fresh,3.0/4.0,the_hobbit_the_desolation_of_smaug,"Humanity, Dazzling Visuals Save ""Smaug""",The Hobbit: The Desolation of Smaug (2013)
charles-koplinski,fresh,3.0/4.0,grudge_match_2014,"Stallone, De Niro Shine in Pleasant ""Match""",Grudge Match (2013)
charles-koplinski,fresh,3.5/4.0,dallas_buyers_club_2013,"McConaughey and Leto make ""Dallas"" one of the Year's Best.",Dallas Buyers Club (2013)
charles-koplinski,fresh,3.0/4.0,the_hunger_games_catching_fire,A Welcome Improvement on The Hunger Games.,The Hunger Games: Catching Fire (2013)
charles-koplinski,fresh,3.5/4.0,all_is_lost_2013,An Amazing Minimalist Turn from Redford.,All Is Lost (2013)
charles-koplinski,fresh,4.0/4.0,12_years_a_slave,12 Years a Slave Devastating and Memorable,12 Years a Slave (2013)
charles-koplinski,fresh,3.5/4.0,thor_the_dark_world,Marvel Formula Alive and Well in Rollicking Thor 2.,Thor: The Dark World (2013)
charles-koplinski,fresh,3.0/4.0,carrie,"New ""Carrie"" Stands on its Own",Carrie (2013)
charles-koplinski,rotten,2.0/4.0,cloudy_with_a_chance_of_meatballs_2_2013,An Undercooked Concoction.,Cloudy with a Chance of Meatballs 2 (2013)
charles-koplinski,rotten,2.0/4.0,delivery_man,"""Man"" fails to Deliver",Delivery Man (2013)
charles-koplinski,fresh,3.5/4.0,nebraska,"Payne and Dern find Modest Nobility in ""Nebraska""",Nebraska (2013)
charles-koplinski,fresh,3.0/4.0,out_of_the_furnace,"Bale and Harrelson Formidable Duo in ""Furnace""",Out of the Furnace (2013)
charles-koplinski,fresh,4.0/4.0,american_hustle,"Grand Performances move ""Hustle""",American Hustle (2013)
charles-koplinski,fresh,3.0/4.0,300_rise_of_an_empire,"""300"" a Rousing, Blood-soaked Adventure",300: Rise of an Empire (2014)
charles-koplinski,fresh,3.0/4.0,need_for_speed,"Grounded ""Speed"" Outdistances ""Furious.""",Need For Speed (2014)
charles-koplinski,fresh,4.0/4.0,the_secret_life_of_walter_mitty_2013,"""MItty"" a Magical Tribute to the Possible",The Secret Life Of Walter Mitty (2013)
charles-koplinski,rotten,2.5/4.0,non_stop_2013,Neeson nearly trumps film's flaws,Non-Stop (2014)
charles-koplinski,fresh,3.5/4.0,1200731-robocop,"Not your father's ""Robocop.""",RoboCop (2014)
charles-koplinski,rotten,1.5/4.0,ride_along_2014,"""Ride Along"" an all too familiar trip.",Ride Along (2014)
charles-koplinski,rotten,1.5/4.0,devils_due,"""Due"" Should Never Have Been Found",Devil's Due (2014)
charles-koplinski,fresh,3.0/4.0,3_days_to_kill,"Costner's calm save ""Days.""",3 Days To Kill (2014)
charles-koplinski,fresh,3.0/4.0,lone_survivor,"A noble, moving tribute.",Lone Survivor (2014)
charles-koplinski,fresh,4.0/4.0,august_osage_county,Dysfunction at a Gallop.,August: Osage County (2013)
charles-koplinski,fresh,4.0/4.0,her,A Cautionary Tale of Alienation,Her (2013)
charles-koplinski,rotten,2.5/4.0,saving_mr_banks_2013,"""Banks"" Short on Key Details",Saving Mr. Banks (2013)
charles-koplinski,fresh,4.0/4.0,inside_llewyn_davis_2013,Davis a Tribute to Art for Art's Sake,Inside Llewyn Davis (2013)
charles-koplinski,fresh,3.0/4.0,jack_ryan_shadow_recruit,"Reluctant Spy Device Distinguishes ""Recruit""",Jack Ryan: Shadow Recruit (2014)
charles-martin,fresh,,what_happened_miss_simone_2015,"Ultimately, the documentary utilities a great deal of subtlety, but still manages to convey so much complexity, making it well worth the watch, even for someone not acquainted with her music.","What Happened, Miss Simone? (2015)"
charles-martin,rotten,,the_world_made_straight_2015,"The film's story is a simple one, which makes its two-hour running time absolutely confounding.",The World Made Straight (2015)
charles-martin,fresh,,alex_of_venice,"Alex Of Venice closes with a bit of a whimper, though it's a pleasant ride, nevertheless.",Alex of Venice (2015)
charles-martin,rotten,,marshland,"Marshland, while certainly engrossing and gorgeous to look at, comes off as a little superficial.",Marshland (La isla mínima) (2014)
charles-martin,fresh,3.5/5,1148702-face,It is an emotional and rewarding film for anyone who's ever struggled to find their place in their family and the world.,Face (2005)
charles-martin,fresh,3.5/5,the-backyard,"The Backyard is a very hard doc to watch, but it's as gruesomely riveting as a train wreck.",The Backyard (2002)
charles-martin,fresh,5/5,the-backyard,"An x-treme documentary, as riveting as a road accident and a lot more bloody.",The Backyard (2002)
charles-martin,rotten,1.5/5,charlotte_sometimes,It aimlessly and unsuccessfully attempts to fuse at least three dull plots into one good one.,Charlotte Sometimes (2003)
charles-martin,rotten,2/5,rare_birds,Has all the right elements but completely fails to gel together.,Rare Birds (2001)
charles-mcnulty,rotten,,broadway_the_golden_age,The autograph-hound sensibility that colors [McKay's] interviews ... provokes mostly unmemorable nostalgia from his roster of geriatric luminaries.,Broadway: The Golden Age (2004)
charles-mcnulty,rotten,2/5,wrestling_with_angels_playwright_tony_kushner,This uncritical cinematic embrace doesn't do justice to a playwright who never met a Brechtian dialectic he didn't want to ponder more deeply.,POV (2006)
charles-mcnulty,fresh,4/5,making-the-boys,Almost simultaneously a groundbreaking landmark and a period piece.,Making the Boys (2010)
charles-mcnulty,fresh,3.5/5,show_business,The film is a love letter to theater and the people who make it.,ShowBusiness: The Road to Broadway (2007)
charles-morgan,rotten,2/5,1075034-king_of_kings,"As a work of art it is a complete failure, because it is anaemic and because it shows us a Christ who, though obviously a virtuous and mild man, is completely lacking in the fire and spiritual vigor that go to the making of the great leaders of mankind.",The King of Kings (1927)
charles-mudede,fresh,,blade_runner,"Blade Runner is a rare work of science-fiction cinema in the sense that it's a machine that generates questions, not answers.",Blade Runner (1982)
charles-mudede,fresh,,1043378-stalker,"Stalker is in truth about the beginning of the end of the Soviet Union-and therefore, the end of the 20th century and the socialist experiment.",Stalker (1979)
charles-mudede,fresh,,chasing_trane_the_john_coltrane_documentary,"As a lover of jazz history or great Americans, it is your duty to not miss this documentary.",Chasing Trane: The John Coltrane Documentary (2017)
charles-mudede,fresh,,karl_marx_city,"The documentary is mostly good, but it does make one big mistake.",Karl Marx City (2017)
charles-mudede,rotten,,as_you_are_2017,Altogether lacking the magic of cinema.,As You Are (2017)
charles-mudede,fresh,,killer_of_sheep,To obtain an adequate understanding of the film-which is about a sad man in a black Los Angeles neighborhood who kills sheep for a living-you must watch it much more than once.,Killer of Sheep (2007)
charles-mudede,fresh,,before_i_fall,"This is, indeed, green gothic at its best.",Before I Fall (2017)
charles-mudede,fresh,,apprentice,This is a human story.,Apprentice (2017)
charles-mudede,fresh,,personal_shopper,"Hollywood must come to Paris, must become a part of Paris, must move up and down the streets of Paris. This is Personal Shopper.",Personal Shopper (2017)
charles-mudede,rotten,,ghost_in_the_shell_2017,Why wasn't the American version of Ghost in the Shell set in Los Angeles or New York City or something?,Ghost in the Shell (2017)
charles-mudede,fresh,,another_year_2010,This movie is really about a departure.,Another Year (2010)
charles-mudede,fresh,,blade_runner_2049,"Though Villeneuve has brilliantly continued the technological and commercial world of Blade Runner, he cleared a lot of clutter. So the urbanist in me was disappointed by 2049. But will Blade Runner 2049 be worth it to the rest of you? Visually, yes.",Blade Runner 2049 (2017)
charles-mudede,fresh,,the_square_2017,"[The Square is] funny, has an act that turns a person's world and family upside down, has lots of uncomfortable situations, and uses a dash of surrealism.",The Square (2017)
charles-mudede,fresh,,the_light_of_the_moon,"What the director wants us to understand, what the film dramatizes with a complexity that will likely feel personal, is that there isn't only one way to respond to rape.",The Light of the Moon (2017)
charles-mudede,fresh,,brimstone_and_glory,"The film is, of course, stunning and poetic. That is a given because fireworks, like movies, are above all about impressing the eyes.",Brimstone & Glory (2017)
charles-mudede,rotten,,bright,Critics are foolish to believe they have the critical tools to make meaningful judgments about a movie as confounding as Bright. They just don't. I don't. We have to admit this fact and surrender to Bright.,Bright (2017)
charles-mudede,fresh,,we_the_workers,"Yes, this formulation of capitalist society is vulgar, but that's precisely because the motor of history is vulgar. Nevertheless, the images in We the Workers, the images of factories and brand-new cities, are amazing.",We the Workers (2017)
charles-mudede,fresh,,flesh_and_blood_2017,"But the film, which is raw and gritty, is essentially about the ex-con rebuilding his life in a multi-cultural neighborhood.",Flesh and Blood (2017)
charles-mudede,fresh,,star_wars_the_last_jedi,The spectacles in Star Wars: The Last Jedi are some of the most powerful and believable in the franchises.,Star Wars: The Last Jedi (2017)
charles-mudede,fresh,,die_hard,"Here, postmodern architecture meets Reagan-era Hollywood cinema and makes lots of movie magic.",Die Hard (1988)
charles-mudede,rotten,,darkest_hour_2017,It's too long. Everything the film has to say could have been easily and neatly packed into 80 brisk minutes.,Darkest Hour (2017)
charles-mudede,fresh,,the_paris_opera,There are certain sequences in this doc that will lift your spirits up to the highest states of feeling that this art can reach.,The Paris Opera (L'Opéra) (2017)
charles-mudede,fresh,,step_2017,The documentary is straightforward and powerful.,Step (2017)
charles-mudede,fresh,,the_reagan_show,Ronald Reagan and his team changed the whole game of American politics by transforming the White House into a movie studio.,The Reagan Show (2017)
charles-mudede,fresh,,roman_j_israel_esq,"The film is not Washington's best, but it, and that mindless/lumbering walk, will not disappoint Washington's fans.","Roman J. Israel, Esq. (2017)"
charles-mudede,fresh,,the_commuter,It's got lots of action and tension. It has an amazing scene that involves smashing an electric guitar on someone's head.,The Commuter (2018)
charles-mudede,fresh,,the_road_movie,"If you are as addicted to the YouTube genre of Russian dashcam videos as I am, you will not want to miss The Road Movie. It has everything you want to see and much more.",The Road Movie (2018)
charles-mudede,fresh,,black_panther_2018,"But the most revolutionary thing about Black Panther is its city. The capital of Wakanda has skyscrapers, a monorail, sidewalks of grass, green buildings, farmers markets, and no cars.",Black Panther (2018)
charles-mudede,fresh,,memories_of_underdevelopment,No film in the history of cinema better captures the curse of the intellectual than Memories of Underdevelopment.,Memories of Underdevelopment (1973)
charles-nash,fresh,3/4,sleeping_with_other_people,"A much more conventional picture than Headland's debut: Sweeter, messier and far more determined to charm than to provoke.",Sleeping with Other People (2015)
charles-passy,rotten,,maid_in_manhattan,"Instead of a fairy tale, we have a tale told without imagination. It's Cinderella gone stale.",Maid in Manhattan (2002)
charles-passy,fresh,B+,wild_thornberrys_movie,An entertaining feature-length version of the Nickelodeon TV cartoon.,The Wild Thornberrys Movie (2002)
charles-passy,rotten,C+,brother_bear,It feels like a project that got quietly pushed through the pipeline while the studio gears up for bigger and better things.,Brother Bear (2003)
charles-petersen,fresh,,missing_victor_pellerin,"An uncanny, uncategorizable film, neither doc- nor mockumentary, Sophie Deraspe's debut feature shares more in common with Nabokov and Borges than recent fake-docs.",Rechercher Victor Pellerin (Missing Victor Pellerin) (2007)
charles-petersen,rotten,,memories-of-tomorrow-ashita-no-kioku,"Of course, it's no surprise that a melodrama would be melodramatic. But that doesn't mean it has to be graceless, and grace, that virtue most characteristic of Japanese film, is what Memories of Tomorrow completely lacks.",Memories of Tomorrow (Ashita no kioku) (2007)
charles-petersen,rotten,,good_bye_momo,"Though Momo is dedicated to 'the missing children and the children who are coming to save the world,' the most provocative question it asks is whether, with its conspicuous product placement, the film was secretly backed by Coca-Cola.",Good-Bye Momo (2007)
charles-petersen,rotten,,the_collector_2006,"For a film about obsession, Olympia Stone's biopic is remarkably laid back.",The Collector (2006)
charles-petersen,rotten,,reed_fish,"Add a bunch of indie bands, find a Braff look-alike (Jay Baruchel) to play the lead, top it off with some obscure animal hybrid -- a zorse instead of a liger -- and you've got writer Reed Fish's can't-fail debut.",I'm Reed Fish (2007)
charles-petersen,rotten,,looking_for_an_icon,"Made to honor the 50th anniversary of the 'World Press Photo of the Year,' this documentary fails as both birthday present and theoretical inquiry.",Looking for an Icon (2007)
charles-petersen,fresh,,10008390_blood_and_tears,"A well-balanced primer on the Arab-Israeli conflict, Blood and Tears takes just over an hour to go from the roots of Zionism to the recent electoral victory of Hamas.",Blood and Tears: The Arab-Israeli Conflict (2007)
charles-petersen,rotten,,10008343-miriam,"So bad it doesn't ever approach being good, doesn't even go from bad to good and back to bad again -- just bad bad bad, all the way through.",Miriam (2006)
charles-petersen,rotten,,goyas_ghosts,"Distinctly Goya in its emphasis on the grotesque, it shows none of the Spaniard's artistic economy.",Goya's Ghosts (2007)
charles-petersen,rotten,,laura_smiles,It would be difficult to come up with a more clichéd indie film than writer-director Jason Ruscio's Laura Smiles.,Laura Smiles (2006)
charles-petersen,rotten,,whos_your_caddy,"The movie, of course, is terrible.",Who's Your Caddy? (2007)
charles-savage,rotten,,how_high,Most of the movie is simply a series of sex-and-drug adventures as Method Man and Redman romp through campus and play pranks on the dean.,How High (2001)
charles-savage,rotten,,not_another_teen_movie,"Like the generations it entertains, the vitality of the teen movie genre waxes and wanes.",Not Another Teen Movie (2001)
charles-savage,rotten,,1111645-behind_enemy_lines,"Moore, just up from television commercials, relies too heavily on a pastiche of stylistic elements cribbed from others.",Behind Enemy Lines (2001)
charles-savage,rotten,,the_one,"When one actor plays both hero and villain, the viewer knows that what is being shown is not an authentic dance.",The One (2001)
charles-savage,rotten,,thirteen_ghosts,"The set design of Thirteen Ghosts may have been expensive, but its thrills are cheap.",Thirteen Ghosts (13 Ghosts) (2001)
charles-savage,rotten,,baisemoi,The movie's only value is in unwittingly defining more clearly how played out the whole transgressing-boundaries- as-art thing has become.,Baise-Moi (2000)
charles-savage,fresh,,1075984-iron_monkey,"Its production values may not be as good as when Ang Lee or the Wachowski brothers are behind the camera, but the creative vigor of its originality, distilled in a pure and unadulterated form, is simply exhilarating.",Iron Monkey (2001)
charles-savage,fresh,,rush_hour_2,Action and comedy are more impressive here than in the first film.,Rush Hour 2 (2001)
charles-savage,rotten,,bubble_boy,"Once the juggling balls have hit the floor, Bubble Boy must simply be endured until the lights come up. It seems that in the movies, at least, there is a limit to how far low expectations can take you.",Bubble Boy (2001)
charles-savage,rotten,,joe_somebody,"There's plenty of ABC After School Special dialogue here, along the lines of 'You've gotta find people in life who are there for you whether you're somebody or not.'",Joe Somebody (2001)
charles-savage,fresh,,kiss_of_the_dragon,"The Hollywood action genre, sliding into a lazy dependence on computer-generated fakery, needs this authentic kick to the head delivered by Jet Li.",Kiss of the Dragon (2001)
charles-savage,fresh,,1104038-double_take,"Once past the insanity, the movie achieves a strange sort of brilliance.",Double Take (2001)
charles-savage,fresh,,dungeons_and_dragons,"A splashy, silly movie that inexplicably stars Jeremy Irons but will delight 10-year-old boys across the realm.",Dungeons & Dragons (2000)
charles-savage,fresh,,1100039-bait,"Stands out for refusing to settle for the narcissism of Eddie Murphy and Martin Lawrence movies, instead addressing human vulnerabilities.",Bait (2000)
charles-savage,rotten,,1097865-gone_in_60_seconds,"Gone in 60 Seconds, a car theft caper starring Nicolas Cage and Angelina Jolie's lips, is slickly produced pornography for the sports car lover, and little more.",Gone in 60 Seconds (Gone in Sixty Seconds) (2000)
charles-savage,rotten,,musketeer,"Muddled where it should be exciting, The Musketeer presents most of its action in dark interiors with far too many cuts and blurry close-ups.",The Musketeer (2001)
charles-savage,rotten,,orange_county,"The essential problem in Orange County is that, having created an unusually vivid set of characters worthy of its strong cast, the film flounders when it comes to giving them something to do.",Orange County (2002)
charles-savage,rotten,,big_fat_liar,The result is so tame that even slightly wised-up kids would quickly change the channel.,Big Fat Liar (2002)
charles-savage,rotten,,pokemon_the_movie_2000,"Japanese anime can rise to a legitimate art form, as with the intricate and haunting post-apocalyptic classic Akira, but the disposable Pokémon 2000 is far lazier stuff.",Pokemon - The Movie 2000 (2000)
charles-savage,fresh,3/4,secondhand_lions,"Even without handicapping for the limitations of its gentle genre, the film has moments of whimsical humor and thoughtful plotting that soar tantalizingly close to something that could be enjoyed on its own merits.",Secondhand Lions (2003)
charles-savage,rotten,2/4,underworld,"A loud and relentlessly overstated B-movie, and yet not entirely stupid.",Underworld (2003)
charles-savage,rotten,1.5/4,dickie_roberts_former_child_star,"After a few initial pratfalls, the humor gives way to a saccharine pathos as Dickie is supposed to be growing up emotionally and becoming mutually attached to the family. Unbelievable conversations and stupid dance numbers replace the humor.",Dickie Roberts: Former Child Star (2003)
charles-savage,rotten,1/4,jeepers_creepers_2,"A stark regression from the intelligence of the Scream franchise, this teen horror sequel is about as satisfying as low-budget food that's been under the heat lamps too long.",Jeepers Creepers 2 (2003)
charles-savage,rotten,1.5/4,medallion,The Medallion exposes Jackie Chan as a shrunken master.,The Medallion (2003)
charles-savage,fresh,2/4,xxx,"This is a movie that wants to do nothing more than show its hero blowing things up, punching bad guys and wooing PG-13 hotties. For what it is trying to be, it's good.",XXX (2002)
charles-savage,rotten,1/4,master_of_disguise,"The Master of Disguise is full of jokes, but just about the only one that provokes widespread giggles from the short-pants set is the villain's tendency to have his maniacal laughing fits cut short by inadvertent toots of flatulence.",The Master of Disguise (2002)
charles-savage,rotten,,juwanna_mann,A sad and rote exercise in milking a played-out idea -- a straight guy has to dress up in drag -- that shockingly manages to be even worse than its title would imply.,Juwanna Mann (2002)
charles-savage,fresh,2.5/4,bartleby_2002,"Though this film can be clumsy, its ambitions are equally -- and admirably -- uncommercial.",Bartleby (2002)
charles-savage,rotten,1/4,1112617-new_guy,This is nothing but familiar territory.,The New Guy (2002)
charles-savage,rotten,2/4,life_or_something_like_it,The quirky potential of Herek's background and Jolie's charismatic persona ought to have been shaped into something more interesting than such pseudo-profound fluff.,Life or Something Like It (2002)
charles-savage,rotten,1/4,national_lampoons_van_wilder,"The problem is not that it's all derivative, because plenty of funny movies recycle old tropes. The problem is that Van Wilder does little that is actually funny with the material.",National Lampoon's Van Wilder (2002)
charles-savage,rotten,,resident_evil,Such a bad movie that its luckiest viewers will be seated next to one of those ignorant pinheads who talk throughout the show.,Resident Evil (2002)
charles-savage,fresh,3/4,40_days_and_40_nights,"The material may be lightweight, but it's been shaped into a film that deserves to become a classic in an admittedly lightweight genre.",40 Days and 40 Nights (2002)
charles-savage,rotten,2/4,queen_of_the_damned,"Aaliyah rarely dampens her diva persona enough to spark genuine chemistry with Townsend. When she speaks, her creepy Egyptian demigod voice is as computer processed and overproduced as it was in her music.",Queen of the Damned (2002)
charles-savage,fresh,,1110288-count_of_monte_cristo,The film excels at the small touches.,The Count of Monte Cristo (2002)
