critic_id,critic_meter_score,critic_rating,movie_id,movie_review_blurb,movie_title
al-alexander,rotten,C,collateral_beauty,"For the filmmakers, it's all about pandering. And for this group of outstanding actors it's a colossal waste of their time, like a molecular scientist working at McDonalds.",Collateral Beauty (2016)
al-alexander,fresh,A-,things_to_come_2016,Huppert is sensational at communicating both the frustration and the fight in a woman who never allows herself to dissolve into self-pity.,Things to Come (L'avenir) (2016)
al-alexander,fresh,B-,jackie_2016,"Larrain succeeds - to a point. His hindrance is Portman, whose Jackie exists without an inner-life.",Jackie (2016)
al-alexander,rotten,D,office_christmas_party,"It may have it's share of fart jokes, but it's no gas.",Office Christmas Party (2016)
al-alexander,fresh,B,allied,It befits a relic from the past. And I mean that in the most complimentary way.,Allied (2016)
al-alexander,fresh,A+,manchester_by_the_sea,"Affleck's Lee is a figure too tragic even for Shakespeare. But his pain, and yes, his courage, is seared into our memories, making ""Manchester"" not just a place by the sea, but also a piece of our hearts.",Manchester by the Sea (2016)
al-alexander,rotten,D,passengers_2016,"An inane space opera that eschews logic, not to mention a moral center.",Passengers (2016)
al-alexander,fresh,B+,the_edge_of_seventeen,"""Edge"" is the operative word, as Craig grinds the genre's conventions to a razor sharpness that cut deep and give Steinfeld a platform to tap all her best instincts in fleshing out the most loveable narcissistic cynic since Larry David.",The Edge of Seventeen (2016)
al-alexander,fresh,A,nocturnal_animals,"It's fabulous work that asks much of the viewer, who is left to interpret and distill. It's subliminal art at its finest. And it does what art does best: get you thinking and talking.",Nocturnal Animals (2016)
al-alexander,fresh,A-,arrival_2016,Villeneuve uses sci-fi the way it's meant to be used in melding the metaphysical and the metaphoric into a timely tapestry that echoes our turbulent times.,Arrival (2016)
al-alexander,fresh,B+,moonlight_2016,"It's a coming-of-age tale writ large, yet director Barry Jenkins renders it so small and intimate you almost feel like you're eavesdropping.",Moonlight (2016)
al-alexander,fresh,B,hacksaw_ridge,Gibson is giddy to once again be granted the all-mighty power to indulge his love of faith-based martyrdom.,Hacksaw Ridge (2016)
al-alexander,rotten,C-,inferno_2016,"Howard, in his third go-round at the helm of the much-maligned, but financially lucrative franchise, still hasn't gotten a handle on making these bungled endeavors anything more than a chore.",Inferno (2016)
al-alexander,fresh,B,oasis_supersonic,"You'll rush to your iPod to dial up those greats songs. But you'll also walk away disappointed that ""Supersonic"" doesn't dig deeper.",Oasis: Supersonic (2016)
al-alexander,fresh,B,certain_women_2016,"The beauty of ""Certain Women"" is in the subtle details.",Certain Women (2016)
al-alexander,rotten,C-,fantastic_beasts_and_where_to_find_them,"Rowling has no grasp of screenwriting. Her characters are flat and underdeveloped, her plotting scattershot and her action scenes tired and derivative. It's boring, and -- except for Fogler and Sudol -- utterly lacking in fun.",Fantastic Beasts and Where to Find Them (2016)
al-alexander,fresh,A,gleason_2016,"At times you sense the film is getting too intimate. But even then, you're too emotionally invested in this man, this family, to dare look away.",Gleason (2016)
al-alexander,fresh,B-,my_cousin_rachel_2017,"It isn't what you'd hope, but not as drab as you'd expect.",My Cousin Rachel (2017)
al-alexander,fresh,B,band_aid_2017,"The tunes are catchy; just like the movie, which hits more sharps than flats in a story that blissfully finds its rhythm.",Band Aid (2017)
al-alexander,fresh,A-,mollys_game,"When you ante up the mellifluous writing of Aaron Sorkin with the unparalleled acting of Jessica Chastain, you're bound to hit the jackpot.",Molly's Game (2018)
al-alexander,fresh,B,i_tonya,"It's puzzling why Gillespie opted to retell Harding's off-told story, but with big assists from Robbie and Janney, he makes it seem new.","I, Tonya (2018)"
al-alexander,fresh,B-,call_me_by_your_name,"The spirit of Eric Rohmer lives vibrantly in the luscious-looking ""Call Me by Your Name."" But, unfortunately, not his talent.",Call Me by Your Name (2018)
al-alexander,rotten,C+,tom_of_finland,"Touko Laaksonen sketched out an enduring legacy with his homoerotic images of hyper-masculine men. So, why then is Dome Karukoski's depiction of Laaksonen's rise from closeted pornographer to celebrated artist so flaccid?",Tom of Finland (2017)
al-alexander,rotten,C,wonder_wheel,"Much like ""Blue Jasmine"" owed a debt to Tennessee Williams, ""Wonder Wheel"" enables Woody Allen to indulge his inner Eugene O'Neill - but not in a good way. Call it ""A Long Day's Journey into Slight.""",Wonder Wheel (2017)
al-alexander,fresh,B,the_divine_order,Volpe undermines the gravity of her tale with periodic dashes of quirk that are admittedly funny but tonally deaf.,The Divine Order (Die göttliche Ordnung) (2017)
al-alexander,fresh,B+,the_disaster_artist,"Tommy Wiseau is flat-out weird, even a tad scary, but Franco seldom fails to make his character's acute form of self-delusion charming and infectious.",The Disaster Artist (2017)
al-alexander,fresh,A,coco_2017,"You'll go cuckoo for ""Coco.""",Coco (2017)
al-alexander,fresh,B,the_man_who_invented_christmas,It's hard to argue with an invention as amiable as this.,The Man Who Invented Christmas (2017)
al-alexander,fresh,B,the_breadwinner,"""The Breadwinner"" proves both eye-opening and insightful, vividly depicting how miserable life can be in a country where a woman has little or no worth.",The Breadwinner (2017)
al-alexander,fresh,B-,gods_own_country_2017,"Just about the time you're ready to secede from this dank, muddy pity party, HE walks in. And by ""he"" I mean Alec Secareanu's Romanian hunk, Gheorghe. You can't quit him.",God's Own Country (2017)
al-alexander,fresh,B-,wonder,"The whole enterprise goes down like a big ol' gulp of Robitussin. It's good for you, but the aftertaste is a tad pungent.",Wonder (2017)
al-alexander,fresh,A,mudbound,"It reads like a novel with its richness of characters, its palpable sense of place and its lacerating commentary on a nation where equality exists only on a dusty old document called the Declaration of Independence.",Mudbound (2017)
al-alexander,fresh,B-,dina_2017,"Romance, no matter what your mental capacity, is something beautiful. It's also a necessity for a woman like Dina, who has every reason to be mad at the world, yet soldiers on fueled by the unwavering belief that love conquers all.",Dina (2017)
al-alexander,fresh,B+,novitiate,"In Betts' highly capable hands the staid becomes excitingly alive with a story that pulses with energy and guile. Oh, and did I mention the sex? Yes, this could become a habit.",Novitiate (2017)
al-alexander,fresh,B,the_post,"Streep is magnificent, and when it comes time to compile her legacy, this performance, one full of fear, confidence, verve and doubt, will rank among her best.",The Post (2018)
al-alexander,rotten,C-,hostiles,"Clearly, it's Cooper's intent to make ""Hostiles"" his ""Unforgiven,"" but what he's wrought is closer to ""Unforgivable.""",Hostiles (2018)
al-alexander,fresh,A-,paddington_2,A nearly perfect movie that thoroughly and genuinely restores something we haven't seen a lot of lately - childhood wonder.,Paddington 2 (2018)
al-alexander,fresh,B-,the_final_year,"""The Final Year"" lacks the focus and urgency of other, better political documentaries like the superb ""Weiner"" or ""The War Room."" Even more disappointing, it's devoid of objectivity.",The Final Year (2018)
al-alexander,fresh,A,timbuktu_2015,"What sticks with you in writer-director Abderrahmane Sissako's devastating portrait of brutal, didactic rule is the indestructibility of the human spirit.",Timbuktu (2015)
al-alexander,fresh,B,midnighters,"The Ramsays still have a long way to go to match the Coens, but the endlessly fun ""Midnighters"" is one helluva step in the right direction.",Midnighters (2018)
al-alexander,fresh,B,oh_lucy_2018,"It's simultaneously silly and telling, cut through with unexpected emotion and satirical bite.",Oh Lucy! (2018)
al-alexander,fresh,A,loveless_2018,"A stunning indictment of complacency, and a reminder of how fast something you love -- like our democracy -- can suddenly go poof if you look away, even for a second.",Loveless (Nelyubov) (2018)
al-alexander,fresh,B,bombshell_the_hedy_lamarr_story,It confirms her prowess as an inventor of much more than male fantasy.,Bombshell: The Hedy Lamarr Story (2017)
al-alexander,fresh,A-,a_fantastic_woman,Vega establishes a milestone in the push for equality playing a transgender woman determined to properly grieve for her recently deceased lover.,A Fantastic Woman (Una mujer fantástica) (2018)
al-alexander,fresh,B+,the_party_2018,All this black and blue is delivered in glorious black and white by a septet of splendid actors spewing deliciously venomous discourse rendering you dazzlingly dizzied.,The Party (2018)
al-alexander,fresh,B-,thor_ragnarok_2017,"The stated goal in the schizophrenic ""Thor: Ragnarok"" is to liberate the Norse kingdom of Asgard. But what's really going on is the freeing of the Henny Youngman inside Chris Hemsworth. Take my hammer, Please!",Thor: Ragnarok (2017)
al-alexander,fresh,B,the_insult,"While the truisms come fast and furious (think of an episode of ""Perry Mason""), the underlying theme of hypocritical people willing to kill in the name of religion never fails to land its punches.",The Insult (L'insulte) (2018)
al-alexander,fresh,B+,2018_oscar_nominated_shorts_animation,This year's group of Oscar-nominated animation shorts range from the silly to the sublime.,2018 Oscar Nominated Shorts - Animation (2018)
al-alexander,fresh,B,2018_oscar_nominated_shorts_documentary,"The documentary portion of the Oscar-nominated shorts explore such topical issues as the opiate epidemic, prison reform, mental illness and police brutality.",2018 Oscar Nominated Shorts - Documentary (2018)
al-alexander,rotten,D,fifty_shades_freed,How high do you have to get to endure this drivel? I'd say a whole dime bag's worth. Better to fry your brain that way then by subjecting your gray matter to Grey natter.,Fifty Shades Freed (2018)
al-alexander,fresh,B+,bpm,"Campillo is terrific at conveying a spectrum of emotions through his richly drawn characters, allowing you to feel what they feel in a relentless fight to save themselves.",BPM (Beats Per Minute) (120 battements par minute) (2017)
al-alexander,fresh,B-,film_stars_dont_die_in_liverpool,"Bening can elevate even the dullest flicks to a higher level. You might even say, to paraphrase another noted Liverpudlian, she takes a bad movie and makes it better.",Film Stars Don't Die in Liverpool (2017)
al-alexander,fresh,B-,small_town_crime,"The one constant is Hawkes, who is so much fun you'd follow him anywhere, even through a flat-footed crime caper riddled with more clichés than bullets.",Small Town Crime (2018)
al-alexander,fresh,B-,happy_end_2017,"Haneke's ""family films"" offer zero warmth, little compassion and suicidal characters who've had it with phoniness and insincerity. So, why should we expect anything less from his latest dive into disappointment and despair?",Happy End (2017)
al-alexander,fresh,B,2018_oscar_nominated_shorts_live_action,"This year's package of Oscar-nominated live-action shorts aren't as strong as those in recent years, but there are a couple gems to be found.",2018 Oscar Nominated Shorts - Live Action (2018)
al-alexander,fresh,B,it_comes_at_night,"Will you be scared? Not really, but you will be made to squirm; not to mention forced to quell that uneasiness deep inside your gut.",It Comes At Night (2017)
al-alexander,fresh,B,the_square_2017,"It's a far cry from Östlund's last film, the marvelous, men-are-chickens comedy ""Force Majeure."" What's missing this time is any real sense of drama.",The Square (2017)
al-alexander,fresh,B+,human_flow,"Ai, in his own unsubtle way, dares us to ask ourselves what's become of empathy and humanity.",Human Flow (2017)
al-alexander,rotten,C,atomic_blonde_2017,"The only thing that keeps you watching - besides the terrific music -- is Theron, who establishes herself as the world's foremost action heroine (sorry Wonder Woman) by bringing style and -- yes! -- beauty to the old-fashioned butt-kicking.",Atomic Blonde (2017)
al-alexander,fresh,A-,city_of_ghosts_2017,"Perhaps films like ""City of Ghosts"" will help change minds, as it exposes the no-win situation Syrians are faced with on a daily basis.",City of Ghosts (2017)
al-alexander,fresh,A,dunkirk_2017,"It's the anti-blockbuster blockbuster, full of brains, grit and a fearlessness to challenge superhero-drunk filmgoers to invest fully of themselves by finding meaning in every exquisitely shot frame.",Dunkirk (2017)
al-alexander,fresh,B+,a_ghost_story,"Like a tough crossword puzzle, it challenges the mind, stimulates the brain and conjures a strong feeling of satisfaction when you think you've finally got a handle on it. Surprise! You probably don't.",A Ghost Story (2017)
al-alexander,fresh,A-,the_b_side_elsa_dorfmans_portrait_photography,"The mood is light and breezy, with Dorfman being as funny as she is candid. But there's an inescapable air of sadness lurking beneath the surface.",The B-Side: Elsa Dorfman's Portrait Photography (2017)
al-alexander,fresh,B-,the_little_hours,"A cheesy, breezy way to indulge in a little sacrilege without need of repentance.",The Little Hours (2017)
al-alexander,fresh,B+,spider_man_homecoming,"See ""Homecoming"" and tell me there's an Avengers character you love more. I don't expect to hear from you because I know I'm right. And I'm right because the magnificent Tom Holland proves I am.",Spider-Man: Homecoming (2017)
al-alexander,fresh,B+,okja,"It's everything you want a movie to be: smart, daring, lavish and packed with surprises. It's funny, scrumptious in look and design, and best of all, it's about something.",Okja (2017)
al-alexander,fresh,B-,maudie,"Don't let the lazy, pedestrian storytelling drive you away from experiencing the year's best -- so far -- performance by an actress. Hawkins is simply sensational.",Maudie (2017)
al-alexander,fresh,B,the_beguiled,"In remaking Don Siegel's sex-crazed Civil War tale, ""The Beguiled,"" Sofia Coppola accomplishes the difficult task of staying faithful to a story of females gone wild at a Southern boarding school while also making it intriguingly her own.",The Beguiled (2017)
al-alexander,fresh,B-,the_journey_2017,"""The Journey"" never loses sight of its goal to prove, especially in the age of parasitism, that talk doesn't sway opinions --it's listening.",The Journey (2017)
al-alexander,fresh,B,the_exception,"The film's worst faux pas, through no fault of its own, is that it's too much like Paul Verhoeven's exceptional ""Black Book."" It was sexier, more stylish and better imagined all around than ""The Exception."" Yet, I can't say I wasn't entertained.",The Exception (The Kaiser's Last Kiss) (2017)
al-alexander,fresh,B,beatriz_at_dinner,"It's fun watching Hayek and Lithgow work magic with their paper-thin characters, repeatedly butting heads in an escalating challenge to retain the upper hand in a caste war that grows increasingly bloody.",Beatriz at Dinner (2017)
al-alexander,fresh,B-,the_hero_2017,"Elliott's voice is magic, filled with wisdom and experience, a craggy baritone that says gravitas with every clearly enunciated syllable. You could listen to him all day -- and want to, but in a less pedestrian environment than what Haley provides",The Hero (2017)
al-alexander,rotten,C,the_book_of_henry,"Just who is this film for? It's too childish for adults and too adult for kids. More than that, it's too stupid and ridiculous for anyone with a half a brain. Don't judge this ""Book"" by its cover; judge it by the glaringly empty pages inside.",The Book of Henry (2017)
al-alexander,fresh,B-,landline,There's an affinity you form with the characters -- especially the budding camaraderie between Dana and Ali -- that enables the movie to involve and intrigue.,Landline (2017)
al-alexander,fresh,B,brigsby_bear_2017,"That their tale is told with a disarming gentleness and eerie goodwill, only adds to the creepiness they expose lurking in the consumer-friendly mind control that's children's TV.",Brigsby Bear (2017)
al-alexander,fresh,B+,step_2017,"Look deeper, beyond the plethora of feel-good tropes, and you'll find something startling raw and worrisome about a large segment of society -- in this case, young black women -- with little or no chance of ever bettering themselves.",Step (2017)
al-alexander,fresh,A-,menashe,"It leaves you feeling touched, and just a bit more enlightened. To that, all I can say is mazel tov!",Menashe (2017)
al-alexander,fresh,B,the_killing_of_a_sacred_deer,"It will either blow your mind or make you want to blow your brains out. Whichever side you come down on, you won't soon forget what you just saw.",The Killing of a Sacred Deer (2017)
al-alexander,fresh,B,the_kings_choice,"It's handsomely mounted, extremely well-acted and tells a little-known story of bravery on the part of one man daringly taking on the might of the Third Reich.",The King's Choice (2017)
al-alexander,fresh,A-,the_meyerowitz_stories,"Like they say, love hurts, and in Baumbach's capable hands, you can feel the sting right down to your funny bone.",The Meyerowitz Stories (New and Selected) (2017)
al-alexander,fresh,A,the_florida_project,A three-dimensional microcosm of the millions of families denied their share of the American dream by a corrupt system that tends to only reward the rich.,The Florida Project (2017)
al-alexander,fresh,B+,dolores_2017,"If you've never heard of Dolores Huerta, it's because there's been a concerted effort to erase her from the history books, a racially motivated slight the fascinating documentary ""Dolores"" determinedly seeks to correct.",Dolores (2017)
al-alexander,fresh,A,lucky_2017,Consistently finds profundity in the mundane.,Lucky (2017)
al-alexander,fresh,B,battle_of_the_sexes,"Instead of so much emphasis on the obvious, you wish Beaufoy had dug a bit deeper.",Battle of the Sexes (2017)
al-alexander,fresh,B-,thank_you_for_your_service_2017,You can't deny the movie serves its purpose by shedding light on forgotten heroes who love a country that shamefully doesn't always love them back.,Thank You for Your Service (2017)
al-alexander,fresh,B+,american_made_2017,"This is Cruise's show all the way, and he delivers with a performance that will take you higher than any drug or airplane ever could.",American Made (2017)
al-alexander,rotten,C,year_by_the_sea,"""Sea"" is little more than a lame excuse for good actors to embarrass themselves by uttering eye-rolling bromides about aging gracefully.",Year by the Sea (2017)
al-alexander,rotten,C,rebel_in_the_rye,"A slick, superficial attempt to define the 20th century's quintessential enigmatic personality by giving us the sort of commercialized phoniness that Salinger not only detested, but drove him into a decades-long seclusion in the New Hampshire woods.",Rebel in the Rye (2017)
al-alexander,fresh,A-,good_time,"If at the height of ""Twilight"" mania you had told me one day I would compare vampire-in-chief Robert Pattinson with young Al Pacino, I would have driven a wooden stake through your heart. But guess what? That day has arrived.",Good Time (2017)
al-alexander,fresh,B+,ingrid_goes_west,An eye-opening feature debut by Matt Spicer goes straight for the jugular with its lacerations of social media and what he sees as his generation's dive into unmitigated narcissism.,Ingrid Goes West (2017)
al-alexander,fresh,A-,whose_streets,"""Whose Streets?"" leaves you shaken, on the verge of tears, as we're left to wonder what's become of an America that espouses freedom, but more and more works to take our liberties away.",Whose Streets? (2017)
al-alexander,rotten,C,i_do_until_i_dont,"As the writer-director-star of ""In a World ...,"" Lake Bell delivered one of the most underrated comedies of 2013. So expectations are high for her three-hat follow-up, ""I Do ... Until I Don't."" But the dreaded sophomore slump hits, and hits her hard.",I Do... Until I Don't (2017)
al-alexander,fresh,B-,the_trip_to_spain_2017,"What little fun remains rests largely in the charm of our two self-deprecating traveling companions. Their appeal cannot be overstated. But like a houseguest who overstays his welcome, an animosity starts to set in before eventually festering.",The Trip to Spain (2017)
al-alexander,fresh,B,rumble_the_indians_who_rocked_the_world,"What ""Rumble"" lacks in comprehensiveness, is more than compensated by its level of fun and allure, as it fills you with a hefty dose of nostalgia.",RUMBLE: The Indians Who Rocked the World (2017)
al-alexander,fresh,A,dont_think_twice,A story that deftly sneaks up on you before grabbing your emotions by the throat.,Don't Think Twice (2016)
al-alexander,fresh,B+,the_son_of_joseph,"Surprisingly moving in a redemptive finale that pays homage to not just the Christmas story, but the French Resistance as well. And it does it with reverence and a sense of joy that's immaculate in its conception.",The Son of Joseph (Le fils de Joseph) (2017)
al-alexander,fresh,B-,les_cowboys,"It succeeds in humanizing the world's biggest political football without taking sides. No easy task, but the impartiality robs the story of any emotional or rooting interest.",Les Cowboys (2016)
al-alexander,fresh,A-,the_look_of_silence,"""The Look of Silence"" is likely to be the most important film of the year.",The Look of Silence (2015)
al-alexander,rotten,D-,vacation_2013,"The new ""Vacation"" is a true getaway, as in you'll want to get as far away as possible -- like, say, Pluto.",Vacation (2015)
al-alexander,fresh,B-,do_i_sound_gay,"There's nothing here that makes it a must-see. And gay or straight, you can't like the sound of that.",Do I Sound Gay? (2015)
al-alexander,fresh,B-,the_stanford_prison_experiment,"The acting is just too good to dismiss, as well as the fine camera work by Jas Shelton, who turns an innocuous hallway into a fittingly claustrophobic house of horrors.",The Stanford Prison Experiment (2015)
al-alexander,rotten,C-,inception,"The only thing for sure is that this Inception was nothing but a stratagem, a cheap trick, if you will. Leading me to wonder: Where are the Dream Police when you need 'em?",Inception (2010)
al-alexander,fresh,B,1194825-phoebe_in_wonderland,"Elle Fanning is vivid in her conveyance of the hurt, anger and loneliness of being different.",Phoebe in Wonderland (2009)
al-alexander,fresh,A-,bridesmaids_2011,"Full of heart, warmth and enough excrement to fill an all-white bridal shop.",Bridesmaids (2011)
al-alexander,rotten,C-,nanny_mcphee_returns,The magic is gone.,Nanny McPhee Returns (2010)
al-alexander,rotten,D,evan_almighty,It all goes down about as smoothly as an apple in the Garden of Eden.,Evan Almighty (2007)
al-alexander,rotten,C,curious_case_of_benjamin_button,Converts an F. Scott Fitzgerald short story about a man aging backward into an overly long exercise in pseudo-profundity bearing little resemblance to its source.,The Curious Case of Benjamin Button (2008)
al-alexander,fresh,A,up,"It's quite simply the best Pixar yet, seamlessly melding stirring emotions and thrilling adventure into a classic tale about letting go of the past and embracing the moment.",Up (2009)
al-alexander,fresh,B,zombieland,Fleischer is after only one thing: to entertain the pants off of you.,Zombieland (2009)
al-alexander,fresh,B,the_fighter_2011,"Russell walks a narrow line between laughing with the family and laughing at them, but the film never crosses over into parody.",The Fighter (2010)
al-alexander,fresh,B-,monsters-2010,"It's a new high in lows, as in lowbrow, low budget and low key. But there's something about it that's hard to shake.",Monsters (2010)
al-alexander,fresh,A-,tangerine_2015,"""Tangerine"" generously offers something unusual in a summer when relentless conformity could really use a dab of lipstick, a pinch of estrogen and an attitude that says I dare to be different.",Tangerine (2015)
al-alexander,fresh,B+,mission_impossible_rogue_nation,"""Rogue Nation"" delivers thrill after thrill to the point where your nerves can't take it anymore.",Mission: Impossible Rogue Nation (2015)
al-alexander,fresh,A-,the_end_of_the_tour_2015,"As veterans of numerous romcoms, Segel and Eisenberg know exactly how to let their simmering bromance play out organically, from kindred spirits found to passive-aggressive adversaries unleashed.",The End Of The Tour (2015)
al-alexander,fresh,B+,straight_outta_compton,"Despite its occasional whitewash of facts, ""Compton"" thrives both as a reminiscence for longtime fans and an introduction to those who aren't yet privy.",Straight Outta Compton (2015)
al-alexander,fresh,B-,the_man_from_uncle,"There's a stylish charm eagerly at work. Whether that's enough to sustain the equivalent of a James Bond tribute band is debatable, given how wan the rest of the well-meaning enterprise is when it comes to storytelling and starpower.",The Man From U.N.C.L.E. (2015)
al-alexander,fresh,A,room_2015,"There are no cheap Hollywood thrills, no manipulations, no special effects. Just nail-biting suspense. And that probing question: What would we do if this were us?",Room (2015)
al-alexander,rotten,D,goosebumps_2015,"Like most lazily made kids pictures, the filmmakers operate on the assumption that children will sit through anything as long as the screen is filled with multicolored busyness.",Goosebumps (2015)
