critic_id,critic_meter_score,critic_rating,movie_id,movie_review_blurb,movie_title
nathanael-hood,fresh,9/10,big_eyes,That Big Eyes is the best film Burton has directed in almost a decade is no exaggeration.,Big Eyes (2014)
nathanael-hood,fresh,,1018044-sabotage,Sabotage is possibly Hitchcock's most viscerally effective pre-Hollywood film. And yet it is not remembered half as warmly as some of his other films from that period.,Sabotage (1937)
nathanael-hood,rotten,5/10,taken_3,"Fool me once, shame on you. Fool me twice, shame on me. Fool me thrice, and now you're just sequel-baiting.",Taken 3 (2015)
nathanael-hood,fresh,,pigs-and-battleships,That Pigs and Battleships has neither a traditionally happy nor sad ending is further evidence of Imamura's fascination with the lower aspects of human life.,Pigs and Battleships (Buta to gunkan) (Hogs and Warships) (1961)
nathanael-hood,rotten,5/10,strange_magic,"The film doesn't have enough faith in itself to let the story, visuals, and atmosphere speak for themselves.",Strange Magic (2015)
nathanael-hood,fresh,7/10,black_or_white,"Ostensibly a courtroom drama, Black or White is actually one of the most sensitive and intelligent introspections of American race relations in quite some time.",Black or White (2015)
nathanael-hood,fresh,,kirikou_and_the_sorceress,"The film itself is a visual masterwork, both innovative and endlessly creative in design and execution.",Kirikou and the Sorceress (1998)
nathanael-hood,fresh,,1032434-killer,"Like any true artist, Woo didn't satisfy himself with merely copying his heroes: he transcended them with his own ideas and innovations.",The Killer (1989)
nathanael-hood,fresh,,black_god_white_devil,Hand-held cameras and stark black-and-white cinematography created a veneer of almost deliberate amateurism which rejected Western filmmaking norms.,"Black God, White Devil (Deus e o Diabo na Terra do Sol) (1964)"
nathanael-hood,rotten,2/10,hot_tub_time_machine_2,Hot Tub Time Machine 2 is a miserable movie.,Hot Tub Time Machine 2 (2015)
nathanael-hood,rotten,5/10,the_lazarus_effect,...the film's few sparks of originality and charisma are stamped out by a script and a director who refuses to take any genuine chances with the subject material.,The Lazarus Effect (2015)
nathanael-hood,rotten,3/10,unfinished_business_2015,The problem is that this movie shares screen-time with a mid-2000s shock comedy. Hardly five minutes go by without something gross or disgusting happening.,Unfinished Business (2015)
nathanael-hood,fresh,,it_happened_one_night,Frank Capra's It Happened One Night was a film that defied expectations to such an outrageous extent that the cinema has never fully recovered from its impact or influence.,It Happened One Night (1934)
nathanael-hood,fresh,,1013071-magnificent_ambersons,"The performances, the cinematography, the melancholy tone of loss make [The Magnificent Ambersons] one of the most technically inspired films of Hollywood's past.",The Magnificent Ambersons (1942)
nathanael-hood,rotten,3/10,get_hard,"Get Hard doesn't busy itself with being particularly innovative or original and instead either bastardizes or quotes much, much better films.",Get Hard (2015)
nathanael-hood,rotten,2/10,home_2015,"Home is a blithering mess, devoid of internal narrative logic, mired in obnoxious humor, and so poorly paced that its 94 minute run-time felt like it was over two hours long.",Home (2015)
nathanael-hood,fresh,8/10,furious_7,"Operating with the same adolescent, bacchanalian glee of a comic book... Furious 7 thrusts the series to new heights of intensity, emotion, and head-shaking absurdity.",Furious 7 (2015)
nathanael-hood,rotten,4/10,viktoria_2014,"... symbols can't exist in a vacuum or they become meaningless. Or, in the case of Viktoria, pointless.",Viktoria (2016)
nathanael-hood,fresh,7/10,mcfarland_usa,The film manages to transcend these clichés to create something that is original and innovative enough to warrant a watch even for veterans of the genre.,McFarland USA (2015)
nathanael-hood,rotten,6/10,momentum_2015,"Competently made, the film doesn't really bring anything truly original to the table other than Purefoy's turn as Mr. Washington.",Momentum (2015)
nathanael-hood,fresh,9/10,hungry_hearts_2014,Hungry Hearts is a tour de force: shocking without being shocking; tense yet controlled; emotional without the aid of melodrama.,Hungry Hearts (2015)
nathanael-hood,fresh,7/10,the_wolfpack,...even the tonal missteps can't detract from an otherwise engrossing documentary-quite possibly the most curious I have seen all year.,The Wolfpack (2015)
nathanael-hood,rotten,4/10,a_christmas_horror_story,...unfortunately the film's most admirable innovation doubles as its greatest problem since all four of the featured stories vary wildly in terms of tone and quality.,A Christmas Horror Story (2015)
nathanael-hood,rotten,6/10,tokyo_tribe_2014,"...Tokyo Tribe plays as a gleeful, explosive phantasm of color and energy.",Tokyo Tribe (2015)
nathanael-hood,fresh,9/10,dukhtar,"...a vital, urgent Pakistani film vibrating with life and truth... Rarely have I seen the mother-daughter bond depicted in the cinema with such candor and emotion.",Dukhtar (2015)
nathanael-hood,rotten,6/10,listening_2014,"... Listening displays courage: in embracing bold stylization and colors in an age of washed-out, gritty sci-fi; in not retreating from the more horrific aspects of the involved science...",Listening (2015)
nathanael-hood,rotten,6/10,paul_taylor_creative_domain,"...Geis never explores Taylor's illustrious career, thereby stripping any possible contextualization of ""Three Dubious Memories"" within his larger oeuvre.",Paul Taylor Creative Domain (2015)
nathanael-hood,rotten,6/10,a_walk_in_the_woods_2015,"... a casual, easy-going film that only gradually reveals a deeper profundity... I'm more than thankful that I could come along for the journey.",A Walk In The Woods (2015)
nathanael-hood,fresh,7/10,beyond_the_grave,"Calmness and reflexion need not prove anathema to horror, particularly in the kind of mystical, highly symbolic cosmos which Pinheiro chose to create.",Beyond The Grave (2010)
nathanael-hood,fresh,8/10,the_second_mother,...a piercing examination of the curious Brazilian practice of upper class surrogate motherhood.,The Second Mother (Que Horas Ela Volta?) (2015)
nathanael-hood,fresh,7/10,set_fire_to_the_stars,"Set Fire to the Stars may be thematically uneven, but the aforementioned performances and Chris Seager's cinematography more than make up for it.",Set Fire To The Stars (2015)
nathanael-hood,rotten,3/10,chloe_and_theo,In attempting to depict the Inuit with dignity... It transforms a member of a proud ethnic and cultural tradition into a living talking point used by white people to condemn global warming.,Chloe & Theo (2015)
nathanael-hood,fresh,7/10,ten_thousand_saints_2015,"Thousand Saints does not break any new ground for its genre. But it is competently, earnestly made by creators eager to understand, not judge, its subjects.",Ten Thousand Saints (2015)
nathanael-hood,rotten,4/10,return_to_sender_2015,Sub-par direction ruins whatever creativity and originality could be gleaned from the film's odd approach to the rape-revenge formula.,Return to Sender (2015)
nathanael-hood,rotten,2/10,,"But instead of focusing on two mature, if broken, adults trying to make sense of life, sex, and relationships, LaBute focuses on uncomfortable jokes that wouldn't pass muster on a public access television show...",Dirty Weekend (2015)
nathanael-hood,fresh,7/10,6_ways_to_die,"What could have been a smartly executed revenge drama gets thrown on its side in the last two minutes with an unnecessary, cringe-worthy twist ending...",6 Ways To Die (2015)
nathanael-hood,rotten,6/10,big_significant_things,"Big Significant Things feels unfinished, both in its story and in its thematic underpinnings.",Big Significant Things (2015)
nathanael-hood,rotten,6/10,catch_me_daddy,The second act stumbles through chaotic night-time sequences that seem to mistake confusion and audience disorientation with action.,Catch Me Daddy (2015)
nathanael-hood,fresh,8/10,runoff_2015,"Levin dares something practically unheard of in modern Hollywood movies: she asks the audience to watch, feel, and come to their own conclusions.",Runoff (2015)
nathanael-hood,rotten,4/10,max_2016,...it isn't sure how to properly blend the coming-of-age story with a rather serious and racially charged... thriller involving Mexican cartels and Afghani war crimes.,Max (2015)
nathanael-hood,rotten,2/10,some_kind_of_hate,"... in lieu of actually being frightening, it tries to be intense and disturbing. But it fails miserably...",Some Kind of Hate (2015)
nathanael-hood,fresh,7/10,we_the_people_the_market_basket_effect,We the People works best when it relegates itself to telling an unusual story about an unusual businessman.,We The People: The Market Basket Effect (2016)
nathanael-hood,fresh,7/10,mr_six,"Hu and actor Feng Xiaogang transform Mr. Six into a creature capable of making and admitting to mistakes, feeling and expressing sincere emotion.",Mr. Six (Lao Pao Er) (2015)
nathanael-hood,fresh,7/10,tabloid_vivant,Tabloid Vivant unabashedly embraces its own artificiality.,Tabloid Vivant (2015)
nathanael-hood,fresh,8/10,the_future_perfect_2016,It's powerful and quietly uplifting in a way I haven't seen a prominent European art movie be in quite some time.,The Future Perfect (El futuro perfecto) (2016)
nathanael-hood,rotten,5/10,thirst_street,"Thirst Street remains baffling and confused, unworthy of Burdge's performance.",Thirst Street (2017)
nathanael-hood,fresh,5/10,the_limehouse_golem,"The Limehouse Golem is perfect pulp: it isn't particularly scary or suspenseful, but it does deliver the grind house goods.",The Limehouse Golem (2017)
nathanael-hood,fresh,7/10,who_the_fk_is_that_guy_the_fabulous_journey_of_michael_alago,"An outsider by design but an insider by choice, Alago forced the world to bend to his own passions and will. May we all be so lucky.",Who The F**k Is That Guy? The Fabulous Journey of Michael Alago (2017)
nathanael-hood,rotten,4/10,despicable_me_3,I never thought I'd complain about a Despicable Me movie having too much plot.,Despicable Me 3 (2017)
nathanael-hood,rotten,6/10,camera_obscura_2017,"As a horror film, Camera Obscura disappoints.",Camera Obscura (2017)
nathanael-hood,fresh,7/10,moscow_never_sleeps,"The film still manages to hold our attention, and every now and then manages a brief profundity.",Moscow Never Sleeps (2017)
nathanael-hood,rotten,3/10,future_38_2017,It seems Greenberg can write and directly authentically compelling material. It's a shame the rest of the film was such a bore.,Future '38 (2017)
nathanael-hood,fresh,7/10,letters_from_baghdad,"But despite its shortcomings, Letters from Baghdad is one of the rare documentaries which is in itself an aesthetic achievement.",Letters From Baghdad (2017)
nathanael-hood,fresh,9/10,kuro_2017,"Joji Koyama and Tujiko Noriko's Kuro isn't just a movie; it's a mystery, a mood, an intangible atmosphere of alien dread and ethereal beauty.",Kuro (2017)
nathanael-hood,fresh,7/10,the_womens_balcony,"Throughout the film the people of this congregation bicker and argue, fight and squabble. They pull pranks and make jokes and cook meals and break hearts. Yet through it all there is a shared sense of earnest religious devotion.",The Women's Balcony (Ismach Hatani) (2017)
nathanael-hood,rotten,5/10,whisky_galore_2017,"Where the original film was deliciously subversive in that conservative ""Keep Calm and Carry On"" British manner, this remake feels unnecessarily anesthetized.",Whisky Galore (2017)
nathanael-hood,fresh,6/10,chuck,"Philippe Falardeau's Chuck is a meat-and-potatoes biopic about Mr. Wepner, and for the most part it sticks to the basics of the genre.",Chuck (2017)
nathanael-hood,fresh,8/10,city_of_ghosts_2017,"City of Ghosts is a tough, difficult sit. But it might just prove invaluable, both as an anthropological document of nascent social media resistance and as a profile of undaunted journalistic courage.",City of Ghosts (2017)
nathanael-hood,rotten,4/10,busters_mal_heart,The film's greatest outrage is its squandering of Malek's Oscar-caliber performance in the service of such self-important nonsense.,Buster's Mal Heart (2017)
nathanael-hood,fresh,6/10,the_wedding_plan,"Without proper knowledge of Jewish culture and religion, I suspect many viewers will find The Wedding Plan slow, ponderous, and even preachy. But for those in the know, I can attest that they will find it powerful, moving, and deeply rewarding.",The Wedding Plan (2017)
nathanael-hood,fresh,8/10,the_family_i_had,By the end I was consumed with an aching love and sorrow for this family; I wanted to bring wholeness to their brokenness.,The Family I Had (2017)
nathanael-hood,rotten,6/10,kissing_candice,"Freed from the constraints of shorter formats, McArdle rushes around her 102-minute runtime with all the curious abandon of a goldfish moved from a small bowl to a massive aquarium.",Kissing Candice (2017)
nathanael-hood,fresh,9/10,la_92,"LA 92 is less a straight-forward documentary than a cinematic symphony; it's less interested in the nitty-gritty...[but] the orgasmic release of the hate and fury that provoked it, and the shell-shocked disbelief that followed it.",LA 92 (2017)
nathanael-hood,fresh,7/10,blade_runner_2049,Blade Runner 2049 is remarkable in its willingness to embrace the original film's slow pacing and philosophical musings. But does it add up to more than just a succession of stunning images and thought experiments? It's difficult to tell.,Blade Runner 2049 (2017)
nathanael-hood,rotten,5/10,the_square_2017,We have the skeleton of a great film smothered in too many layers of fat and gristle.,The Square (2017)
nathanael-hood,rotten,1/10,theyre_watching,There is no reason why They're Watching needed to be found footage. And there's no reason for anyone to watch it.,They're Watching (2016)
nathanael-hood,rotten,4/10,7_guardians_of_the_tomb,"The more one seriously considers the film, the more slapdash and poorly executed it becomes.",7 Guardians of the Tomb (2018)
nathanael-hood,rotten,3/10,the_1517_to_paris,What is Clint Eastwood's The 15:17 to Paris? A bundle of ideological confusion.,The 15:17 to Paris (2018)
nathanael-hood,rotten,6/10,the_rainbow_experiment,"If Kallas had whittled her cast down by a third and gone a little easier on the kaleidoscopic split-screen, The Rainbow Experiment would have been stunning. But as it stands, it's too frustrating to overlook the forest for the trees.",The Rainbow Experiment (2018)
nathanael-hood,rotten,1/10,kill_order,What truly galls me is how derivative the film is.,Kill Order (2018)
nathanael-hood,rotten,6/10,man_on_fire_2017,"While Man on Fire does an admirable job demonstrating the racism within Grand Saline, it does relatively little to interrogate it and relate it to Moore's suicide.",Man on Fire (2017)
nathanael-hood,fresh,7/10,american_folk,American Folk didn't have to be good. Instead Heinz delivered a gentle yet nuanced exploration of America and Americans in one of our darkest hours.,American Folk (2018)
nathanael-hood,fresh,7/10,the_commuter,"It might be a flashy piece of entertainment, but it's not a stupid one.",The Commuter (2018)
nathanael-hood,fresh,8/10,phantom_thread,"Paul Thomas Anderson's Phantom Thread is a mesmeric glimpse into the world of high fashion and the cruelties exacted by selfish, self-centered love.",Phantom Thread (2018)
nathanael-hood,fresh,8/10,1945,"1945 is all about questions and apprehensions, not answers and catharses.",1945 (2017)
nathanael-hood,rotten,,the_divine_order,"Maybe these tonal shifts were intentional, but they're betrayed by predictable plot developments which make them seem more like window dressing than an intuitive part of their director's vision.",The Divine Order (Die göttliche Ordnung) (2017)
nathanael-hood,fresh,9/10,the_taking_of_tiger_mountain,"It doesn't matter if said story is preposterous patriotic grandstanding-the film is a work of proud cultural myth-making. See it. And when you do, make sure it's in 3D.",The Taking of Tiger Mountain (2015)
nathanael-hood,rotten,4/10,killing_ground_2017,There's not enough of a political or moral statement for it to be interesting to critical viewers and not enough blood and guts to satisfy the gore-hounds.,Killing Ground (2017)
nathanael-hood,rotten,6/10,motherland_2017,I must fight my biological predispositions and proclaim Motherland flawed.,Motherland (Bayang ina mo) (2017)
nathanael-hood,rotten,5/10,elizabeth_blue,It's weepy nonsense that plays up the film's worst melodramatic tendencies.,Elizabeth Blue (2017)
nathanael-hood,fresh,7/10,unrest_2017,It demonstrates an emotional truthfulness and vulnerability I wish more documentarians would mimic.,Unrest (2017)
nathanael-hood,rotten,5/10,ravenous_2018,None of [the] questions are answered as the film abandons this fascinating enigma for rote scenes of zombies and survivors killing each other. What a loss.,Ravenous (Les affamés) (2018)
nathanael-hood,fresh,6/10,bending_the_arc,"In a world that gets more inter-connected every year, its lessons are too vital to ignore.",Bending the Arc (2017)
nathanael-hood,rotten,6/10,house_of_z,"It's all trite, predictable stuff that settles comfortably into a traditional Hollywood three-act structure.",House of Z (2017)
nathanael-hood,rotten,4/10,the_boy_downstairs,"In trying to say something about life and the experiences of disillusioned, confused young people, it ends up saying nothing. The film is just so many recycled scenes from other, better films that had something original to say.",The Boy Downstairs (2018)
nathanael-hood,rotten,5/10,a_suitable_girl,"We're left with a stunted perspective of arranged marriages: if anything, the film seems to argue that the whole process of parental matchmaking is an endurable hassle that inevitably leads to happy marriages.",A Suitable Girl (2017)
nathanael-hood,rotten,6/10,a_family_affair_2016,"It's a mystery with no solution, only a handful of clues and a smoking gun.",A Family Affair (2016)
nathanael-hood,fresh,7/10,max_rose,"Daniel Noah's Max Rose is a sobering, powerful examination of grief and loss made essential by the casting of 87-year old Jerry Lewis as the titular character.",Max Rose (2016)
nathanael-hood,rotten,5/10,starving_the_beast,I found Starving the Beast a simultaneous triumph of content and a failure of form. It simply didn't engage me.,Starving The Beast (2016)
nathanael-hood,rotten,6/10,floyd_norman_an_animated_life,"... I felt like I was learning about the legend of Floyd Norman, not the man himself.",Floyd Norman: An Animated Life (2016)
nathanael-hood,rotten,5/10,is_that_you,"Like so many other wannabe indie darlings, Is That You? attempts to make bold statements about loneliness and love beneath a thin veneer of calculated unconventionality.",Is That You? (2016)
nathanael-hood,rotten,3/10,natural_selection_2016,"... it tries to be much more meaningful and intelligent than it is, wanting to make sweeping statements about humanity and cruelty but the end only manages to trip over its own contrived, soap opera dramatics.",Natural Selection (2016)
nathanael-hood,rotten,5/10,outlaws_and_angels,"Unfortunately Mollner isn't able to handle intimate, quiet scenes as well as he does action set pieces or special effects shots.",Outlaws and Angels (2016)
nathanael-hood,fresh,9/10,the_other_side_2015,It's the little details that hit the hardest in Roberto Minervini's new documentary The Other Side-an exploration of extreme poverty in northern Louisiana ...,The Other Side (Louisiana) (2016)
nathanael-hood,fresh,8/10,a_river_below,"There are plenty of documentaries about activism. But documentaries about the consequences of activism are few and far between. Of these, Mark Grieco's A River Below is one of the best in recent memory.",A River Below (2017)
nathanael-hood,rotten,5/10,a_bride_for_rip_van_winkle,"A Bride for Rip Van Winkle is woefully, fatally indulgent.",A Bride for Rip Van Winkle (Rippu van winkuru no hanayome) (2017)
nathanael-hood,fresh,8/10,the_priests,Here is part of what makes The Priests so fascinating and important: it's a Korean interpretation of a traditionally Western genre.,The Priests (Geomeun Sajedeul) (2015)
nathanael-hood,rotten,3/10,seattle_road_2016,Ryan David's directorial début Seattle Road feels like a frantic synthesis of all the more frustrating elements of Malick's oeuvre,Seattle Road (2016)
nathanael-hood,fresh,8/10,the_phenom_2016,"Deceptively quiet, unexpectedly still, Noah Buschel's The Phenom beckons with a firm power.",The Phenom (2016)
nathanael-hood,fresh,6/10,les_cowboys,"Unlike Ford's masterpiece, I didn't feel aesthetically stimulated or emotionally rewarded after watching it. Ultimately the film seems at a loss for what it wants to say.",Les Cowboys (2016)
nathanael-hood,fresh,8/10,my_love_dont_cross_that_river,Mo-young tears away at the fabric of their little lives and discovers the whole of mankind.,"My Love, Don't Cross That River (2016)"
nathanael-hood,rotten,5/10,now_you_see_me_2,The spectacle is all there. But the experience itself is as hollow as the film's CGI playing cards.,Now You See Me 2 (2016)
nathanael-hood,fresh,7/10,the_idol_2016,"The Idol may be uneven to Western viewers accustomed to the genre, but it still succeeds as an uplifting little piece of cinema.",The Idol (Ya Tayr El Tayer) (2016)
nathanael-hood,rotten,5/10,hard_sell,"... it's one of the most gently subversive films on the topic I've seen in some time, but Hard Sell treats these ideas as window-dressing for Hardy's coming-of-age story.",Hard Sell (2016)
nathanael-hood,fresh,7/10,saving_mr_wu,"But for a film where the audience already knows the ending, Saving Mr. Wu manages to satisfy and excite.",Saving Mr. Wu (2015)
nathanael-hood,rotten,1/10,the_rehearsal,"It is, in a word, repugnant.",The Rehearsal (2016)
nathanael-hood,fresh,7/10,my_king,I can't deny the merits of My King. But I stand by my assessment of this kind of movie. It's difficult to watch for all its meanness and destructive histrionics.,My King (Mon roi) (2016)
nathanael-hood,fresh,7/10,at_all_costs,At All Costs stands as a captivating look into the Hoop Dreams factory.,At All Costs (2016)
nathanael-hood,fresh,8/10,the_last_movie_star_2018,"It's a labor of love, of mutual admiration, of fraternal respect. But it's also a film of deep sacrifice.",The Last Movie Star (2018)
nathanael-hood,fresh,7/10,shadowman_2017,"Shadowman is equal parts disturbing and engrossing; it's a film grotesquely morbid yet beautiful, satisfying yet frustrating.",Shadowman (2017)
nathanael-hood,rotten,6/10,the_freedom_to_marry,... what we have instead is a documentary meant to inspire and elevate.,The Freedom to Marry (2017)
nathanael-hood,rotten,5/10,decanted,"Whatever the case, this admittedly well-meaning and beautiful film feels like it was served before its time.",Decanted. (2016)
nathanael-hood,fresh,8/10,withdrawn,"Never before have I seen a film that more closely captures the mindset, emotions, and speech patterns of millennials than Adrian Murray's Withdrawn.",Withdrawn (2017)
nathanael-hood,fresh,8/10,hotel_coolgardie,"Pete Gleeson's Hotel Coolgardie is a frequently nightmarish, occasionally heartbreaking documentary ...",Hotel Coolgardie (2016)
nathanael-hood,rotten,5/10,it_2016,"Maybe if the film tried to make a point about police ineffectuality or corruption, these preposterous twists could have been justified. But this isn't that kind of movie.",I.T. (2016)
nathanael-hood,rotten,6/10,the_son_of_joseph,There's more obvious method behind Green's madness than the majority of directors currently working the art house/film festival circuit.,The Son of Joseph (Le fils de Joseph) (2017)
nathanael-hood,fresh,7/10,dave_made_a_maze,Somebody needs to get this film in the hands of the programmers of the Alamo Drafthouse ASAP. We have the makings of a stone-cold cult classic with this one.,Dave Made a Maze (2017)
nathanael-hood,fresh,8/10,julieta_2016,"It's one of Almodóvar's most frustrating films. But for all these reasons, it's also one of my favorites of his entire career.",Julieta (2016)
nathanael-hood,rotten,5/10,mifune_the_last_samurai,... Mifune: The Last Samurai is a perfectly serviceable documentary on the great Japanese actor Toshirô Mifune if you aren't looking for any information you couldn't find on the man's Wikipedia page,Mifune: The Last Samurai (2016)
nathanael-hood,fresh,6/10,siren_2016,"But in spite of such clichéd grounding, Bishop manages to create something both compelling and oddly original.",SiREN (2016)
nathanael-hood,rotten,5/10,the_windmill_2016,The final shots of The Windmill feel like Jongerius surrendering his movie to how he thinks others would want it to end.,The Windmill (The Windmill Massacre) (2016)
nathanael-hood,fresh,7/10,theo_who_lived_2016,"I think more than anything else, Padnos himself keeps Theo Who Lived from feeling blandly derivative.",Theo Who Lived (2016)
nathanael-hood,rotten,2/10,fire_at_sea_2016,Rosi completely fails to connect the two sides of the story together.,Fire at Sea (Fuocoammare) (2016)
nathanael-hood,fresh,7/10,the_lost_city_of_z,The film skirts traditional biopic trappings by focusing more on the whys of Fawcett's obsession with exploration than just the whats and whens.,The Lost City of Z (2017)
nathanael-hood,rotten,5/10,the_tenants_downstairs,I can't say it's a bad film; it's too well written and plotted (despite featuring a twist ending that went completely over my head) for me to dismiss it as trash. But I can't and won't recommend it.,The Tenants Downstairs (Lou xia de fang ke) (2016)
nathanael-hood,fresh,7/10,the_ardennes,"The Ardennes wasn't so much an original film as a mishmash of ideas from other, more established filmmakers.",The Ardennes (D'Ardennen) (2017)
