critic_id,critic_meter_score,critic_rating,movie_id,movie_review_blurb,movie_title
guylaine-cadorette,rotten,2/5,juwanna_mann,Quote not available.,Juwanna Mann (2002)
guylaine-cadorette,rotten,2/5,windtalkers,Quote not available.,Windtalkers (2002)
guylaine-cadorette,fresh,3/5,undercover_brother,Quote not available.,Undercover Brother (2002)
guylaine-cadorette,fresh,3/5,spirit_stallion_of_the_cimarron,"While the visuals may be rich and intimate, the story is a little preachy and characters very simplistic.",Spirit - Stallion of the Cimarron (2002)
guylaine-cadorette,rotten,2/5,1114051-enough,Quote not available.,Enough (2002)
guylaine-cadorette,rotten,1.5/4,mr_deeds,Quote not available.,Mr. Deeds (2002)
guylaine-cadorette,rotten,2/4,hulk,"The most disconcerting thing about the film is that, in its leap from the four-color paneled pages to the big screen, it lost its wit.",Hulk (2003)
guylaine-cadorette,rotten,2/4,jonah_a_veggietales_movie,Quote not available.,Jonah - A VeggieTales Movie (2002)
guylaine-cadorette,fresh,3.5/4,terminator_3_rise_of_the_machines,"Jonathan Mostow stays true to the '80s popcorn actioner opus here both in storytelling and style, yet his updated special effects add a subtly modern element to the pic.",Terminator 3 - Rise of the Machines (2003)
guylaine-cadorette,rotten,2/4,cats_and_dogs,Quote not available.,Cats & Dogs (2001)
guylaine-cadorette,rotten,.5/4,taxi,"...might as well have been sponsored by NASCAR's ""Drive for Diversity"" program.",Taxi (2004)
guylaine-cadorette,rotten,2/4,ladder_49,"Ladder 49 layers the heroics on so thick that we never get a sense of what goes on underneath all the turnout gear. Once all the smoke clears, there's nothing there.",Ladder 49 (2004)
guylaine-cadorette,rotten,2/5,suspect_zero,Suspect Zero is trying so hard to be deliberately stylish that it forgets there's an interesting premise underneath all that vanity.,Suspect Zero (2004)
guylaine-cadorette,rotten,,cellular,"..has enough thrills to keep you hooked, provided you suspend your disbelief for 92 minutes--a hard feat, considering all the ludicrous curves it throws at you.",Cellular (2004)
guylaine-cadorette,fresh,3/5,sky_captain,"While the film is an artistic feat, its story just isn't as gripping as its fantastically composed shots.",Sky Captain and the World of Tomorrow (2004)
guylaine-cadorette,rotten,3/5,shaun_of_the_dead,Shaun of the Dead isn't as funny as it's purporting to be.,Shaun of the Dead (2004)
guylaine-cadorette,rotten,1/5,exorcist_the_beginning,Quote not available.,Exorcist: The Beginning (2004)
guylaine-cadorette,fresh,3/4,little_black_book,"An unexpectedly enjoyable romantic comedy, Little Black Book steers clear of conventional contrivances and sugary idealism--without being down with love.",Little Black Book (2004)
guylaine-cadorette,fresh,2.5,harold_and_kumar_go_to_white_castle,"The jokes aren't exactly smokin', but there are enough high points to make this a gratifying pot comedy.",Harold & Kumar Go to White Castle (2004)
guylaine-cadorette,fresh,3.5/4,bourne_supremacy,"A welcome throwback to blood-soaked espionage thrillers, The Bourne Supremacy is a gritty sequel that hasn't lost its popular appeal.",The Bourne Supremacy (2004)
guylaine-cadorette,fresh,3.5/4,metallica_some_kind_of_monster,"This silly juxtaposition of hardened, tattooed headbangers lamenting about abandonment issues is precisely what makes this documentary both touching and entertaining.",Metallica: Some Kind of Monster (2004)
guylaine-cadorette,rotten,2/4,1133964-king_arthur,The only way to derive any enjoyment from King Arthur is to bear in mind it's more of a Jerry Bruckheimerian tale than an Arthurian one.,King Arthur (2004)
guylaine-cadorette,rotten,1.5/4,clearing,"After an unbearably slow and deliberately long buildup, director Pieter Jan Brugge's kidnapping thriller The Clearing never delivers a payoff.",The Clearing (2004)
guylaine-cadorette,fresh,2.5/4,white_chicks,"... may not exactly knock your Jimmy Choos off, but Shawn and Marlon Wayans are so mesmerizing in their Juicy Couture you'll practically forget all about the lame storyline.",White Chicks (2004)
guylaine-cadorette,fresh,3/4,chronicles_of_riddick,...fans won't be disappointed by this big-budget sci-fi opera.,The Chronicles of Riddick (2004)
guylaine-cadorette,fresh,4/4,harry_potter_and_the_prisoner_of_azkaban,...the most multifaceted and intriguing Harry Potter film yet.,Harry Potter and the Prisoner of Azkaban (2004)
guylaine-cadorette,fresh,3/4,day_after_tomorrow,"A perfect blend of contemporary environmental issues and science fiction, director Roland Emmerich's big-budget disaster flick is summer movie entertainment at its best.",The Day After Tomorrow (2004)
guylaine-cadorette,fresh,2.5/4,breakin_all_the_rules,...may be shamelessly superficial but it's still an entertaining comedy.,Breakin' All the Rules (2004)
guylaine-cadorette,rotten,2.5/4,simpsons_movie,Doesn't live up to the hype.,The Simpsons Movie (2007)
guylaine-cadorette,rotten,1.5/4,new_york_minute,...a big-screen feature with a direct-to-video plot.,New York Minute (2004)
guylaine-cadorette,fresh,4/5,grudge,Quote not available.,The Grudge (2004)
guylaine-cadorette,fresh,3/5,i_robot,Quote not available.,"I, Robot (2004)"
guylaine-cadorette,fresh,3/4,28_days_later,"Danny Boyle injects his contemporary horror pic 28 Days Later with an interesting twist that, in a fearful post 9/11, anthrax and smallpox era, seems strangely fitting.",28 Days Later (2003)
guylaine-cadorette,fresh,3/5,star_trek_nemesis,Quote not available.,Star Trek - Nemesis (2002)
guylaine-cadorette,fresh,3.5/5,xxx,"Despite the blatant rips, XXX's storyline remains entertaining enough.",XXX (2002)
guylaine-cadorette,rotten,2/5,two_weeks_notice,Quote not available.,Two Weeks Notice (2002)
guylaine-cadorette,fresh,3/5,1108372-fast_and_the_furious,Quote not available.,The Fast and the Furious (2001)
guylaine-cadorette,rotten,2/5,devils_rejects,Quote not available.,The Devil's Rejects (2005)
guylaine-cadorette,fresh,4/5,bourne_identity,"A suspenseful thriller that showcases stunning visuals, great acting and a story that will keep you entertained from start to finish.",The Bourne Identity (2002)
guylaine-cadorette,fresh,3/5,just_visiting,Quote not available.,Just Visiting (2001)
guylaine-cadorette,rotten,1/5,glitter,Nothing redeemable could possibly have come out of Kate Lanier's ill-fated script.,Glitter (2001)
guylaine-cadorette,fresh,3/5,hardball,Quote not available.,Hardball (2001)
guylaine-cadorette,rotten,2/5,1108185-animal,Quote not available.,The Animal (2001)
guylaine-cadorette,rotten,1/5,1111103-texas_rangers,"A real loser, lock, stock and barrel.",Texas Rangers (2001)
guylaine-cadorette,rotten,2/5,black_knight,Quote not available.,Black Knight (2001)
guylaine-cadorette,fresh,3/5,honey,Quote not available.,Honey (2003)
guylaine-cadorette,rotten,1/5,bubble_boy,Quote not available.,Bubble Boy (2001)
guylaine-cadorette,rotten,1/5,dominion_prequel_to_the_exorcist,Quote not available.,Dominion: Prequel to the Exorcist (2005)
guylaine-cadorette,rotten,2/5,kingdom_come,Quote not available.,Kingdom Come (2001)
guylaine-cadorette,rotten,2/5,1110236-wash,Quote not available.,The Wash (2001)
guylaine-cadorette,fresh,3/5,one_night_at_mccools,Quote not available.,One Night at McCool's (2001)
guylaine-cadorette,rotten,2/5,rollerball,"The French accents go from Canadian to European within a sentence, and that's only from the ones I could pick up. Who knows what other languages were massacred in the process?",Rollerball (2002)
guylaine-cadorette,rotten,2/4,godsend,...a typical horror pic clone.,Godsend (2003)
guylaine-cadorette,fresh,3.5/4,fahrenheit_911,...will have moviegoers walking out of the theater fuming. Whether it's at President George W. Bush or the filmmaker depends on which side of the fence you're on.,Fahrenheit 9/11 (2004)
guylaine-cadorette,rotten,1.5/4,whole_ten_yards,"...fails to go the same distance its predecessors did in storytelling and, just like the title's dubious twist on the common expression, no one seems to know what it means.",The Whole Ten Yards (2003)
guylaine-cadorette,rotten,2/4,elf,"While the idea behind Elf may be gleefully outlandish, unfortunately this holiday comedy fails to take full advantage of its own absurdity.",Elf (2003)
guylaine-cadorette,rotten,1.5/4,scary_movie_3,Quote not available.,Scary Movie 3 (2003)
guylaine-cadorette,fresh,3/4,texas_chainsaw_massacre,Quote not available.,The Texas Chainsaw Massacre (2003)
guylaine-cadorette,rotten,2/4,1126165-good_boy,"Perhaps Good Boy! is not meant to be analyzed, but a film targeted at children should at least have some insight into the spirit of human nature or some sort of lesson. Instead, it's just a silly little dog tale.",Good Boy! (2003)
guylaine-cadorette,fresh,3.5/4,school_of_rock,"Richard Linklater delivers a family film that is hilarious, honest and inherently good-natured...",School of Rock (2003)
guylaine-cadorette,fresh,3/4,1131721-punisher,"...just the right mix of comic book poeticism, violence and comedy.",The Punisher (2004)
guylaine-cadorette,fresh,2.5/4,fighting_temptations,"Assembled under the guidance of music-savvy producers such as Loretha Jones and Benny Medina, The Fighting Temptations ends up being surprisingly entertaining.",The Fighting Temptations (2003)
guylaine-cadorette,fresh,3.5/4,1125409-cabin_fever,"Because of its gruesome subject matter, it is difficult to describe such a vile movie as being good, or even well made, but this one really is.",Cabin Fever (2002)
guylaine-cadorette,fresh,2/4,the_order_2003,The Order is a chilling film with an original premise that unfortunately gets lost in a maze of superfluous subplots and silly looking special effects.,The Order (2003)
guylaine-cadorette,fresh,4/5,alien,The film remains as gripping today as it was when it was first released in 1979.,Alien (1979)
guylaine-cadorette,rotten,1.5/4,jeepers_creepers_2,"Unlike its innovative predecessor, director Victor Salva's Jeepers Creepers 2 falls prey to the slasher syndrome.",Jeepers Creepers 2 (2003)
guylaine-cadorette,fresh,2/4,freddy_vs_jason,"Seeing the two horror icons come together for an ultimate showdown is definitely fun to watch, but the outcome of the most-hyped villainous face-off ever proves to be a bit of a letdown.",Freddy vs. Jason (2003)
guylaine-cadorette,rotten,1.5/4,swordfish,Quote not available.,Swordfish (2001)
guylaine-cadorette,fresh,3/4,buffalo_soldiers,Buffalo Soldiers is a haunting look at a Cold War era military that is not at war with the Soviet Union but with itself.,Buffalo Soldiers (2001)
guylaine-cadorette,fresh,3/4,freaky_friday,Director Mark Waters whips up a sweet and thoroughly modern version of the '70s movie that caters to young adults without being crass.,Freaky Friday (2003)
guylaine-cadorette,rotten,2.5/4,american_wedding,Quote not available.,American Wedding (2003)
guylaine-cadorette,rotten,2/4,bones,Quote not available.,Bones (2001)
guylaine-cadorette,rotten,2/4,lara_croft_tomb_raider_the_cradle_of_life,"The film plays out like the multilevel video game, but unlike its PlayStation2 counterpart, we have no control over the action.",Lara Croft Tomb Raider - The Cradle of Life (2003)
guylaine-cadorette,rotten,2/4,how_to_deal,"Screenwriter Neena Beber injected the script with scenes that didn't necessarily fit, but were added because they're expected in angst-y teen pics.",How to Deal (2003)
guylaine-cadorette,fresh,3.5/4,pirates_of_the_caribbean_the_curse_of_the_black_pearl,Pirates of the Caribbean is surprisingly good but it probably would not have been half as entertaining if it were not for Johnny Depp's commanding performance as Captain Jack Sparrow.,Pirates of the Caribbean: The Curse of the Black Pearl (2003)
guylaine-cadorette,rotten,0.5/4,my_bosss_daughter,"Unfortunately, moviegoers have not been punk'd; My Boss's Daughter is for real.",My Boss's Daughter (2003)
guylaine-cadorette,fresh,3.5/4,tupac_resurrection,Tupac: Resurrection is surprisingly direct...,Tupac: Resurrection (2003)
guylaine-cadorette,fresh,3/4,the_rundown,The Rock reveals his classy transition from WWE star to a charming and charismatic big-screen action hero.,The Rundown (2003)
guylaine-cadorette,rotten,2/4,timeline,"The story, acting and visual effects fail to effectively blend together into a coherent sci-fi adventure.",Timeline (2003)
guylaine-cadorette,rotten,1/4,johnson_family_vacation,"As headliner Cedric the Entertainer demonstrates in this mediocre road-trip flick, no amount of comedic genius can pump up this flat comedy.",Johnson Family Vacation (2004)
guylaine-cadorette,rotten,1/4,walking_tall,"...could have used more intelligent storytelling and less wrestlemania; it reeks of SmackDown!, but it never fully exploits its champ, The Rock.",Walking Tall (2004)
guylaine-cadorette,fresh,3/4,1127407-missing,Pesh-Chidin ... is by far the scariest son of a ***** to hit the big screen in a long while.,The Missing (2003)
guylaine-cadorette,fresh,3.5/4,never_die_alone,Ernest Dickerson's Goth-like vision of this troubling tale about the dark side of human nature encapsulates the film noir genre.,Never Die Alone (2004)
guylaine-cadorette,fresh,3/4,dawn_of_the_dead,...a masterful horror pic.,Dawn of the Dead (2004)
guylaine-cadorette,rotten,1/4,agent_cody_banks_2_destination_london,This is one franchise that should be grounded before it takes off for any more international forays.,Agent Cody Banks 2: Destination London (2004)
guylaine-cadorette,rotten,2/5,twisted,"There are so many diversions at work here that the film becomes a joke, one that culminates with a hokey punch line as the antagonist spills out an elaborate confession that partly patches up any holes in the outrageous plot.",Twisted (2004)
guylaine-cadorette,rotten,2/4,welcome_to_mooseport,TV comedy king Ray Romano makes his first foray into feature film in a spectacularly unfunny comedy.,Welcome to Mooseport (2004)
guylaine-cadorette,fresh,3/4,eurotrip,"With its fresh cast, unapologetically lewd storyline and laugh-out-loud predicaments, Eurotrip makes for a delectably rare fun time at the movies.",Eurotrip (2003)
guylaine-cadorette,rotten,1.5/4,jersey_girl,"Director Kevin Smith tries to appeal to a more mature audience with the dramatic comedy Jersey Girl but in doing so, he loses his edge.",Jersey Girl (2004)
guylaine-cadorette,fresh,2.5/4,you_got_served,"You Got Served may be a crudely acted, elementary story, but it's almost impossible not to be impressed by the film's dance numbers...",You Got Served (2004)
guylaine-cadorette,fresh,3/4,butterfly_effect,"While The Butterfly Effect isn't profoundly philosophical stuff, it is an intriguing look at how the past shapes the future...",The Butterfly Effect (2004)
guylaine-cadorette,rotten,.5/4,1129132-torque,Kahn delivers an action pic whose CGI effects more closely resemble a video game than reality and whose organizing principle is the three-minute music video...,Torque (2004)
guylaine-cadorette,rotten,1.5/4,my_babys_daddy,"This genreless film drifts without direction from a comedy, to a spoof, to a drama.",My Baby's Daddy (2004)
guylaine-cadorette,rotten,2/4,paycheck,Paycheck fails to fully explore the interesting question it poses and regresses into a brainless actioner.,Paycheck (2003)
guylaine-cadorette,rotten,1.5/4,cheaper_by_the_dozen,Let's just pray that this comedy doesn't spawn a sequel entitled The Baker's Dozen...,Cheaper by the Dozen (2003)
guylaine-cadorette,rotten,1.5/4,mona_lisa_smile,Mona Lisa Smile's lesson of the day is delivered in an unoriginal manner through such shallow and unlikable characters that its message lacks an emotional punch.,Mona Lisa Smile (2003)
guylaine-cadorette,rotten,1/4,love_dont_cost_a_thing,"Love Don't Cost a Thing, an comedy inspired by the 1987 teen romance Can't Buy Me Love, demonstrates that things aren't always better the second time 'round.",Love Don't Cost a Thing (2003)
guylaine-cadorette,rotten,2.5/4,last_castle,Quote not available.,The Last Castle (2001)
guylaine-cadorette,fresh,3/4,barbershop_2_back_in_business,"Overall, Barbershop 2 is a sweet comedy minus the sap, hilarious yet devoid of crudity, and political without ever being preachy.",Barbershop 2: Back in Business (2004)
gwen-ihnat,fresh,B-,my_little_pony_equestria_girls,"My Little Pony: Equestria Girls continues the appeal of Friendship Is Magic, as the heartening lessons of Ponyville-on friendship, leadership, morality, etc.-transcend its equine-dominated world.",My Little Pony: Equestria Girls (2013)
gwen-ihnat,fresh,B,the_unauthorized_melrose_place_story,"The Unauthorized Melrose Place Story does a good job of continuing that give-the-audience-what they want promise, with enough backstory inside info to make it a glee-filled watch, just like the show that spawned it.",The Unauthorized Melrose Place Story (2015)
gwen-ihnat,fresh,B+,the_spongebob_movie_sponge_out_of_water,"There's no heartfelt, overarching message here-even teamwork, as much as it's mentioned, doesn't seem to stick with anyone-but that doesn't detract from the fun.",The SpongeBob Movie: Sponge Out of Water (2015)
gwen-ihnat,rotten,C,my_little_pony_the_movie_2017,"The animation is certainly richer than the traditional flatness of the regular series, but you have to wonder to what use it's being put.",My Little Pony: The Movie (2017)
gwen-ihnat,fresh,B+,trolls,Trolls winds up transforming from a prospective toy commercial to a spiritual lesson about being content with what you already have.,Trolls (2016)
gwendolyn-ng,fresh,3.5/5,sea_fog,Credit is due for key members of the cast -- from veteran actor Kim Yoon Seok to rookie actor Park Yu Chun of boyband JYJ fame -- for carrying the provocative and controversial story well.,Sea Fog (Haemoo) (2015)
gwendolyn-ng,fresh,3/5,fabricated_city,"Though there is no revolutionary concept, it is still entertaining to watch the movie's handsome hero in action.",Fabricated City (2017)
gwendolyn-ng,fresh,3/5,packages_from_daddy,"Precocious child actor Sieh holds his own against the adults, moving easily from playful to contemplative.",Packages from Daddy (2016)
gwendolyn-ng,fresh,3/5,the_beauty_inside,"Do not expect a thought-provoking movie that pushes boundaries. Instead, first-time Korean feature film director Baek Jong Yul serves up a feel-good romance.",The Beauty Inside (2015)
gwilym-mumford,fresh,3/5,the_fate_of_the_furious,"Things race along at such a ferocious lick you scarcely have time to question the moments of incongruity (chiefly, how can so many supercars be also somehow explosion-retardant).",The Fate of the Furious (2017)
gwilym-mumford,rotten,2/5,tomato_red,"Ultimately it's a case of all surface, no feeling.",Tomato Red (2017)
gwilym-mumford,fresh,4/5,ziggy_stardust_and_the_spiders_from_mars_1973,"The moment where Bowie announces that this is ""the last show that we'll ever do"", to the screams and groans of the audience (most of whom assumed it was he, not Ziggy, who was retiring) remains utterly bracing.",Ziggy Stardust and the Spiders from Mars (1973)
gwilym-mumford,fresh,3/5,dont_take_me_home,"This is a fairly workaday affair, but in its brisk, cheerful telling it does a solid job of evoking the thrill of the Dragons' unlikely run.",Don't Take Me Home (2017)
gwilym-mumford,fresh,4/5,uncertain,"Uncertain is a vivid, pungent ode into a world that is fast disappearing.",Uncertain (2017)
gwilym-mumford,rotten,2/5,chips,"Shepard and Pena do at least throw themselves into proceedings with elan, but they can't prevent CHiPs from seeming a distinctly second-gear affair.",CHIPS (2017)
gwilym-mumford,rotten,2/5,city_of_tiny_lights,"Too often City of Tiny Lights is let down by an overeagerness to play up its source material, and hampered by unnecessarily showy direction and inadvisable attempts at gumshoe dialogue.",City of Tiny Lights (2016)
gwilym-mumford,fresh,3/5,la_92,"Arresting, certainly, but also something of a missed opportunity.",LA 92 (2017)
gwilym-mumford,fresh,3/5,seoul_station,"At times it is oppressively morose, but it has a nice dusting of social realism to go with the violence, and reaches an agreeably nasty conclusion.",Seoul Station (2016)
gwilym-mumford,fresh,4/5,get_me_roger_stone,"Stone himself would revel in the fact that so many people will be watching and seething silently at this documentary. There's no such thing as bad publicity, after all.",Get Me Roger Stone (2017)
gwilym-mumford,fresh,4/5,filmworker,A revealing and stirring celebration of one of cinema's unacknowledged heroes.,Filmworker (2018)
gwilym-mumford,fresh,3/5,i_am_not_a_witch,"Nyoni has delivered a pulsingly odd and strikingly original debut: a tale of dogma, prejudice and corruption in the country of her birth.",I Am Not a Witch (2017)
gwilym-mumford,fresh,4/5,joshua_teenager_vs_superpower,"Teenager vs Superpower does a solid job of contextualising this larger ideological battle, with talking heads and archive footage, but it's always clear that the focus here is Wong.",Joshua: Teenager vs. Superpower (2017)
gwilym-mumford,fresh,4/5,,"There are a few occasions when the quick-cut action becomes difficult to follow in black and white, but this is otherwise an intriguing counterpoint to an idiosyncratic minor masterpiece.",Mad Max: Fury Road: Black & Chrome (2016)
gwilym-mumford,fresh,3/5,dying_laughing,"The endless conveyor belt of talking heads does rather lose its lustre over time, and some actual standup would have been welcome, but there's a dizzying amount of insight ...",Dying Laughing (2017)
gwilym-mumford,rotten,2/5,the_house_2017,"The exuberant comic talents of Will Ferrell and Amy Poehler are largely wasted in this uninspired addition to the frat movie canon, which resembles reheated leftovers of the Hangover, albeit with a curious detour into some heavy bloodletting.",The House (2017)
gwilym-mumford,fresh,3/5,icarus_2017,It's hard to deny the power of Icarus's message and the remarkable nature of its delivery.,Icarus (2017)
gwilym-mumford,fresh,3/5,kingsman_the_golden_circle,"An exhausting, exhilarating watch.",Kingsman: The Golden Circle (2017)
gwynedd-stuart,rotten,,aloha_2015,"Even if this were well made in a technical sense, it would still be a weird heap of patriotism, astronomy, and Hawaiian folklore, piled atop a pat and predictable love story.",Aloha (2015)
gwynedd-stuart,rotten,,goodnight_mommy,"The boundlessness of the juvenile imagination is often treated as whimsical and wonderful, but in this Austrian shocker the fanciful ideas rattling around inside children's skulls grow hideously dark.","Goodnight Mommy (Ich seh, Ich seh) (2015)"
gwynedd-stuart,fresh,3/4,the_gallows,"The Gallows is a perfectly fun entry in Blumhouse Productions' ever-growing roster of low-budget, mock-verite chillers (Insidious, Paranormal Activity).",The Gallows (2015)
gwyneth-kelly,fresh,,a_war,"A War is the best possible title for Denmark's Oscar nominee, which, scrubbed of the patriotism and politics that define American war films, transcends the war in the Middle East to interrogate the struggle of all conflicted decisions.",A War (Krigen) (2016)
gwyneth-kelly,rotten,,in_the_heart_of_the_sea,A few scenes in In the Heart of the Sea hint at how effective the film might have been if told purely as a gripping story of man versus nature.,In the Heart of the Sea (2015)
gwyneth-kelly,fresh,,bridge_of_spies,"The details of the story in Bridge of Spies are specific to their time, but the broader conflicts from which they stem remain pertinent.",Bridge of Spies (2015)
gwyneth-kelly,fresh,,mistress_america,"Gerwig and Kirke are an excellent pair. Gerwig's frenetic gesticulations, noodle-y dancing and micro-expressions balance Kirke's more sedate and measured expressions.",Mistress America (2015)
hadley-freeman,fresh,,the_bling_ring_2013,"For a satire on America's modern day celebrity culture, The Bling Ring is hard to beat.",The Bling Ring (2013)
hal-boedeker,rotten,,the_wiz_live,"Maybe the sincere production of The Wiz Live! will inspire young theater lovers, but it didn't soar.",The Wiz Live! (2015)
hal-boedeker,fresh,,hairspray_live,Hairspray Live! worked best of NBC's recent live musicals because the show captured the excitement of live performance.,Hairspray Live! (2016)
hal-boedeker,rotten,,phil_spector,"The results are tedious, talky and self-important.",Phil Spector (2013)
hal-boedeker,rotten,,90th_academy_awards,The unwieldy thing was a chore even for movie lovers who had seen the nominees.,90th Academy Awards (2018)
hal-boedeker,fresh,,diana_our_mother_her_life_and_legacy,"Classy, insightful and extremely moving. Be prepared to shed a few tears because her sons, Prince William and Prince Harry, speak so frankly and lovingly.","Diana, Our Mother: Her Life and Legacy (2017)"
hal-hinson,fresh,,agantuk,It shows all the virtues of a master artist in full maturity.,Agantuk (The Stranger) (2003)
hal-hinson,rotten,,1056079-specialist,"With all the preening, posing and stretching, it's hard to know if The Specialist is an action movie or an exercise video.",The Specialist (1994)
hal-hinson,rotten,,10009001-the_freshman,"A great actor's self-parody might be fascinating, especially if the actor is Brando. But the performance Brando gives here is anything but a good-natured goof on himself.",The Freshman (1990)
hal-hinson,fresh,,madness_of_king_george,"Somehow ... this frail figure [George] is an immensely likable -- and, at times, deeply moving -- character.",The Madness of King George (1994)
hal-hinson,fresh,,bad_lieutenant,"This punishing film from director Abel Ferrara is something else altogether -- an illuminating, excoriating descent into the cesspool of sin, self-loathing and defilement. This is not an easy film to watch.",Bad Lieutenant (1992)
hal-hinson,rotten,,trespass,"It's mindlessly violent, profane and insultingly racist. It's also relentless, repetitious and tiresome, and leaves us feeling that a once-great director has run out of ammunition.",Trespass (1992)
