critic_id,critic_meter_score,critic_rating,movie_id,movie_review_blurb,movie_title
greg-bruce,fresh,,okja,"When the stuff we're watching in the theatre is mostly dross, and we're sharing not others' pleasure but their disappointment, isn't it nice to have something decent to watch at home, possibly with someone you at least sometimes like? Yes it is.",Okja (2017)
greg-burk,rotten,,masai_the_rain_warriors,A mythic quest ought to be more than pretty. It ought to stir ancient memories.,Masai: The Rain Warriors (2006)
greg-burk,fresh,,shadowboxer,"This is a sick flick. Sick, but satisfying.",Shadowboxer (2005)
greg-burk,rotten,,da_vinci_code,"The problem is the pace, which suffers when demands of explication force Howard to pull his foot off the gas.",The Da Vinci Code (2006)
greg-burk,fresh,,1158179-devil_and_daniel_johnston,[Johnston's] story opens a window on the nature of art and the power of myth.,The Devil and Daniel Johnston (2006)
greg-burk,fresh,,rape_of_the_soul,"Is Rape a hilariously stupid documentary or an ingenious put-on? Honest to God, it's hard to tell.",Rape of the Soul
greg-burk,rotten,,1144622-moog,"Largely, you get to watch a nice old guy waxing philosophical in his beloved vegetable garden, in his workshop or amid city traffic.",Moog (2004)
greg-burk,fresh,,metallica_some_kind_of_monster,Puts you eye to human eye with struggling creatures neither fully god nor fully beast.,Metallica: Some Kind of Monster (2004)
greg-burk,fresh,,star_wars_episode_i_the_phantom_menace,"I warn you, I'm gonna continue whining about the movie. Just keep in mind that I liked it.",Star Wars: Episode I - The Phantom Menace (1999)
greg-burkman,rotten,,congo,It's the first bomb of another endless summer of commercial Hollywood crap.,Congo (1995)
greg-cwik,rotten,D+,aloha_2015,"Equally hobbled by an amateurish script and vaguely defined characters, the movie's long list of mediocrities have an anonymous quality, as though the director has been completely reborn as a hack.",Aloha (2015)
greg-cwik,fresh,B+,an_open_secret,"For any filmmaker to take on wealthy and powerful Hollywood marquee names represents a tough proposition, but Berg tackles the topic with a courageous stance that's infectious.",An Open Secret (2015)
greg-cwik,fresh,3/5,the_secret_life_of_pets,"The character designs are decent and the swirling water and looming city skyline are gorgeous, but something about Pets feels overly familiar.",The Secret Life of Pets (2016)
greg-cwik,rotten,2/5,middle_school_the_worst_years_of_my_life,"There aren't many memorable visual gags or lines of dialogue, but at least Middle School plays it safe and doesn't go out of its way to be relentlessly irritating.",Middle School: The Worst Years of My Life (2016)
greg-cwik,fresh,,evolution_2016,"Evolution is a serene film, one that exists in a state of twilight sedation, but beneath the surface something stirs, like the percolating uncertainty of a boy stricken with fever and confined to his bed.",Evolution (2016)
greg-cwik,fresh,,hacksaw_ridge,"This ethical and philosophical quandary, of violence begetting enlightenment, is the soul of Gibson's artistry.",Hacksaw Ridge (2016)
greg-cwik,fresh,,de_palma,"No one kills people with the bravura relish of De Palma. He is the Michelangelo of Murder, a man who crafts decadent, deviant works of art using viscera and celluloid in lieu of paint.",De Palma (2016)
greg-cwik,fresh,,the_neon_demon,"With The Neon Demon, [director Nicolas Winding Refn] vivisects the idea of surface-level pleasure by creating a frightening world of surfaces gleaming with pleasure.",The Neon Demon (2016)
greg-cwik,fresh,,creepy,"[Director Kiyoshi] Kurosawa's approach to horror - quiet, calm, collected scenes of quotidian normality laced by that lingering feeling of something wicked this way coming - feels refreshingly out of touch.",Creepy (Kuripi: Itsuwari no rinjin) (2016)
greg-cwik,fresh,3/4,brawl_in_cell_block_99,Brawl in Cell Block 99's economy of storytelling is as efficiently brutal as the eventual skull-crackings.,Brawl in Cell Block 99 (2017)
greg-cwik,rotten,1/5,morgan_2016,Pseudo-science thriller Morgan manages the impressive feat of being simultaneously moronic yet utterly indistinct.,Morgan (2016)
greg-cwik,fresh,3.5/4,let_the_sunshine_in,Claire Denis finds the inexorable beauty (and sadness) in that most corrosive and fugacious of feelings.,Let the Sunshine In (Un beau soleil intérieur) (2017)
greg-cwik,rotten,2/4,sylvio,"Sylvio's banal depictions of everyday loneliness through the diurnal tedium of an anthropomorphic animal brings to mind BoJack Horseman, but without the caustic navel-gazing and self-destruction or the mordant pop-culture musings.",Sylvio (2017)
greg-cwik,rotten,2/4,wonder_wheel,"The tone throughout vacillates wildly from silly comedy to classic Hollywood melodrama, and all of it feels as artificial and unsatisfying as the cotton candy twirling in a vending cart.",Wonder Wheel (2017)
greg-cwik,rotten,2.5/4,the_killing_of_a_sacred_deer,The characters' emotional vacancy feels like another auteurist tic to which Yorgos Lanthimos is dauntlessly committed.,The Killing of a Sacred Deer (2017)
greg-cwik,rotten,2/4,joan_didion_the_center_will_not_hold,"It's an exercise in joviality, unflinching in its love for Joan Didion, and unwilling to be much more.",Joan Didion: The Center Will Not Hold (2017)
greg-cwik,rotten,2.5/4,1945,"The fractured rhythm of 1945 and the desolate aesthetic are engrossing, but Ferenc Török's film doesn't linger.",1945 (2017)
greg-cwik,fresh,2.5/4,jim_and_andy_the_great_beyond_featuring_a_very_special_contractually_obligated_mention_of_tony_clifton,"The film is about the idea of Andy Kaufman, about how artists channel their influences and keep the dead alive.","Jim & Andy: The Great Beyond - Featuring a Very Special, Contractually Obligated Mention of Tony Clifton (2017)"
greg-cwik,fresh,4/4,legend_of_the_mountain,"Every pan and snap zoom and dissolve is exact, every whorl of smoke and wind-thrown swath of leaves pulled from a dream and placed methodically before our eyes.",Legend of the Mountain (1979)
greg-cwik,fresh,2.5/4,double_lover,"Though Double Lover has a slight oneiric quality from the start, it grows increasingly delirious, the plot threads knotting in convoluted patterns and the overall mood more and more ridiculous.",Double Lover (L'amant double) (2018)
greg-cwik,fresh,,golden_exits,"In Golden Exits, Browning is finally given material worthy of her talents. She evinces a vague unhappiness, the tedium of a life spent going from place to place, infatuation to infatuation.",Golden Exits (2018)
greg-cwik,fresh,3/4,before_we_vanish,"Before We Vanish's beauty, its poignancy, comes from its relationship to Kiyoshi Kurosawa's other work.",Before We Vanish (Sanpo suru shinryakusha) (2018)
greg-dean-schmitz,fresh,3/4,songcatcher,"The music really is amazing, and so I do recommend this one.",Songcatcher (2001)
greg-dean-schmitz,fresh,3/4,8mm,Quote not available.,8MM (1999)
greg-dean-schmitz,rotten,2/4,lock_stock_and_two_smoking_barrels,"Just don't expect to be dazzled by the story, because if you're like me... you'll have trouble following the faces, and hence, the plot, from one scene to another.","Lock, Stock and Two Smoking Barrels (1999)"
greg-dean-schmitz,fresh,3/4,adventures_of_rocky_and_bullwinkle,The Adventures of Rocky and Bullwinkle appears to be one of the frontrunners for both the 'eye candy' crowd and children's audience.,The Adventures of Rocky & Bullwinkle (2000)
greg-dean-schmitz,rotten,1.5/4,simpatico,"Debut director Matthew Warchus didn't trim where needed, with some extraneous quiet moments that test the patience.",Simpatico (1999)
greg-dean-schmitz,rotten,2/4,stuart_little,Quote not available.,Stuart Little (1999)
greg-dean-schmitz,rotten,2/4,pushing_tin,Quote not available.,Pushing Tin (1999)
greg-dean-schmitz,rotten,1/4,1093614-double_jeopardy,Quote not available.,Double Jeopardy (1999)
greg-dean-schmitz,fresh,4/4,american_movie,Quote not available.,American Movie (1999)
greg-dean-schmitz,fresh,3.5/4,notting_hill,Quote not available.,Notting Hill (1999)
greg-dean-schmitz,fresh,3/4,1090759-deep_blue_sea,Quote not available.,Deep Blue Sea (1999)
greg-dean-schmitz,fresh,3/4,todo_sobre_mi_madre_1999,A powerful film of 4 women's experiences and friendships together.,Todo sobre mi madre (All About My Mother) (1999)
greg-dean-schmitz,fresh,3/4,insider,"A thriller that's really a drama in disguise, with excellent performances and a very cool, stylized look.",The Insider (1999)
greg-dean-schmitz,rotten,2/4,any_given_sunday,Quote not available.,Any Given Sunday (1999)
greg-dean-schmitz,rotten,2/4,loving_jezebel,"Sometimes entertaining, but is as a package a bit innocuous and lightweight.",Loving Jezebel (1999)
greg-dean-schmitz,fresh,3/4,best_in_show,"Sure, Best in Show seemed to fly by too fast (it felt a lot shorter than 90 minutes), but maybe that's just because the pace is quick and lively.",Best in Show (2000)
greg-dean-schmitz,rotten,2/4,existenz,Quote not available.,Existenz (1999)
greg-dean-schmitz,fresh,3.5/4,before_night_falls,A valuable film because it tells a tale of Cuban struggle and hardship of a type that we surprisingly don't see that often in film.,Before Night Falls (2001)
greg-dean-schmitz,fresh,3/4,arlington_road,Quote not available.,Arlington Road (1999)
greg-dean-schmitz,fresh,3/4,iron_giant,"It comes close enough to matter, and for me to recommend.",The Iron Giant (1999)
greg-dean-schmitz,rotten,2/4,deep_end_of_the_ocean,Quote not available.,The Deep End of the Ocean (1999)
greg-dean-schmitz,rotten,1.5/4,1093976-bachelor,Quote not available.,The Bachelor (1999)
greg-dean-schmitz,rotten,1/4,three_to_tango,Quote not available.,Three to Tango (1999)
greg-dean-schmitz,rotten,2.5/4,blast_from_the_past,Quote not available.,Blast From the Past (1999)
greg-dean-schmitz,fresh,3.5/4,deterrence,"The drama builds slowly and carefully, as surprises and twists crop up, and we can see that there are secrets still left to be discovered.",Deterrence (2000)
greg-dean-schmitz,rotten,2/4,trekkies,Quote not available.,Trekkies (1999)
greg-dean-schmitz,fresh,3/4,boys_dont_cry,Quote not available.,Boys Don't Cry (1999)
greg-dean-schmitz,fresh,10/10,truman_show,"The kind of film that people want to see again and again, for many reasons.",The Truman Show (1998)
greg-dean-schmitz,fresh,3/4,1093881-house_on_haunted_hill,Quote not available.,House on Haunted Hill (1999)
greg-dean-schmitz,fresh,3/4,three_kings,Refreshing.,Three Kings (1999)
greg-dean-schmitz,fresh,3/4,runaway_bride,Quote not available.,Runaway Bride (1999)
greg-dean-schmitz,rotten,1.5/4,girl_interrupted,Quote not available.,"Girl, Interrupted (1999)"
greg-dean-schmitz,rotten,2/4,snow_falling_on_cedars,Quote not available.,Snow Falling on Cedars (1999)
greg-dean-schmitz,rotten,1/4,nutty_professor_ii_the_klumps,I wasn't 'grabbed' by this teaser.,Nutty Professor II: The Klumps (2000)
greg-dean-schmitz,fresh,3/4,croupier,"Croupier is a stylish, riveting dramatic crime story, loaded to the gills with subtext, character development, and plot twists you'll be puzzling over all night.",Croupier (2000)
greg-dean-schmitz,rotten,1.5/4,generals_daughter,Quote not available.,The General's Daughter (1999)
greg-dean-schmitz,fresh,3/4,1087270-mummy,Quote not available.,The Mummy (1999)
greg-dean-schmitz,fresh,,mulan,One of Disney's best ever.,Mulan (1998)
greg-dean-schmitz,rotten,2/10,goodbye_20th_century,Quote not available.,"Goodbye, 20th Century (Zbogum na dvaesetiot vek) (1999)"
greg-dean-schmitz,rotten,2/4,bone_collector,Quote not available.,The Bone Collector (1999)
greg-dean-schmitz,rotten,2.5/4,bowfinger,Quote not available.,Bowfinger (1999)
greg-dean-schmitz,rotten,2.5/4,1094164-dog_of_flanders,Quote not available.,A Dog of Flanders (1999)
greg-dean-schmitz,fresh,6/10,uninvited_guest,Quote not available.,Uninvited Guest (2000)
greg-dean-schmitz,fresh,3.5/4,exorcist_the_version_youve_never_seen,"It's great to see The Exorcist back on the big screen in full glory, even if the impact of the story is weakened slightly by the stuff that should've gone to the 'deleted scenes' section of the DVD instead.",Exorcist: The Version You've Never Seen (2000)
greg-dean-schmitz,rotten,2/4,big_daddy,Quote not available.,Big Daddy (1999)
greg-dean-schmitz,fresh,10/10,1084398-life_is_beautiful,"Treat yourself, and seek out this film.",Life Is Beautiful (La Vita è bella) (1997)
greg-dean-schmitz,rotten,2/4,1097046-dinosaur,"It's certainly good to see that Disney didn't give us just another song-and-dance romp, but in their attempt to be serious, they forgot to keep us entertained as well.",Dinosaur (2000)
greg-dean-schmitz,rotten,1.5/4,twin_falls_idaho,Quote not available.,Twin Falls Idaho (1999)
greg-dean-schmitz,rotten,2/4,three_seasons_1999,Quote not available.,Three Seasons (1999)
greg-dean-schmitz,fresh,10/10,o_brother_where_art_thou,The photography in this film is among the most beautiful I've seen in years.,"O Brother, Where Art Thou? (2000)"
greg-dean-schmitz,fresh,3/4,pokemon-the-first-movie-mewtwo-vs-mew,"Pokemon is a quality example of the genre, and it is indeed one of the most successful anime shows ever.",Pokemon the First Movie - Mewtwo vs. Mew (1999)
greg-dean-schmitz,fresh,3/4,titanic_town,Quote not available.,Titanic Town (2000)
greg-dean-schmitz,rotten,1.5/4,astronauts_wife,Quote not available.,The Astronaut's Wife (1999)
greg-dean-schmitz,rotten,2/4,music_of_the_heart,Quote not available.,Music of the Heart (1999)
greg-dean-schmitz,rotten,1/4,dudley_doright,Quote not available.,Dudley Do-Right (1999)
greg-dean-schmitz,rotten,2/4,1093579-man_on_the_moon,Quote not available.,Man on the Moon (1999)
greg-dean-schmitz,fresh,2.5/4,1090805-dick,"Dick is pleasant, sometimes engaging, but overall, it's not for everyone.",Dick (1999)
greg-dean-schmitz,rotten,2.5/4,deuce_bigalow_male_gigolo,Quote not available.,Deuce Bigalow: Male Gigolo (1999)
greg-dean-schmitz,rotten,2/4,blue_streak,Quote not available.,Blue Streak (1999)
greg-dean-schmitz,fresh,3.5/4,1095420-high_fidelity,"This movie is great, and is recommended for anyone who loves pop music as something more than just the twinkling in the background in your car.",High Fidelity (2000)
greg-dean-schmitz,rotten,2/4,thats_the_way_i_like_it,Quote not available.,That's the Way I Like It (1999)
greg-dean-schmitz,fresh,3/4,whole_nine_yards,"There's a few cute jokes, but over all, it seems a bit fluffy.",The Whole Nine Yards (2000)
greg-dean-schmitz,fresh,4/4,1093843-mansfield_park,Quote not available.,Mansfield Park (1999)
greg-dean-schmitz,fresh,3/4,you_can_count_on_me,The small scale of the film is challenging on a big screen; but the performances ... transcend that scope and make it a small story worth seeing.,You Can Count On Me (2000)
greg-dean-schmitz,rotten,2.5/4,genghis_blues,Quote not available.,Genghis Blues (2000)
greg-dean-schmitz,rotten,2.5/4,mystery_men,Quote not available.,Mystery Men (1999)
greg-dean-schmitz,fresh,,menace_ii_society,This film is the mourning of the death of promise. Each of the young people who is struck down is one more nail in the coffin of the American Dream.,Menace II Society (1993)
greg-dean-schmitz,rotten,2.5/4,muse,Quote not available.,The Muse (1999)
greg-dean-schmitz,fresh,4/4,matrix,"The Matrix does indeed have a plot and sense of ""mythos"" that grounds it and makes it more than the sum of all of its special effects wizardry.",The Matrix (1999)
greg-dean-schmitz,fresh,3/4,run_lola_run,"it is a German film that is being hailed for its stylishness, even to the degree that it's worth seeing just for its look...",Run Lola Run (1999)
greg-dean-schmitz,rotten,2.5/4,analyze_this,Quote not available.,Analyze This (1999)
greg-dean-schmitz,rotten,1.5/4,outside_providence,Quote not available.,Outside Providence (1999)
greg-dean-schmitz,rotten,2.5/4,galaxy_quest,Quote not available.,Galaxy Quest (1999)
greg-dean-schmitz,fresh,3/4,american_pie,One of the better written teen movies.,American Pie (1999)
greg-dean-schmitz,rotten,2/4,bicentennial_man,Quote not available.,Bicentennial Man (1999)
greg-dean-schmitz,rotten,2/4,tigerland,"The narrative is weak, with the film consisting of a series of incidents that don't seem to be consistently connected.",Tigerland (2000)
greg-dean-schmitz,fresh,3/4,the_castle,Quote not available.,The Castle (1999)
greg-dean-schmitz,fresh,3.5/4,south_park_bigger_longer_and_uncut,Quote not available.,"South Park: Bigger, Longer & Uncut (1999)"
greg-dean-schmitz,fresh,4/4,straight_story,Less is more and boy does David Lynch know that.,The Straight Story (1999)
greg-dean-schmitz,fresh,3.5/4,into_the_arms_of_strangers_stories_of_the_kindertransport,"The tales here are worth being told, and worth hearing.",Into The Arms Of Strangers: Stories Of The Kindertransport (2000)
greg-dean-schmitz,rotten,1.5/4,lake_placid,Quote not available.,Lake Placid (1999)
greg-dean-schmitz,fresh,3.5/4,angelas_ashes,Quote not available.,Angela's Ashes (1999)
greg-dean-schmitz,fresh,4/4,felicias_journey,Quote not available.,Felicia's Journey (1999)
greg-dean-schmitz,fresh,4/4,1087053-go,Quote not available.,Go (1999)
greg-dean-schmitz,fresh,3.5/4,1087341-winslow_boy,Quote not available.,The Winslow Boy (1999)
greg-dean-schmitz,rotten,2.5/4,happy_texas,Quote not available.,"Happy, Texas (1999)"
greg-dean-schmitz,fresh,3/4,perfect_storm,This is one summer movie that is more about human drama.,The Perfect Storm (2000)
greg-dean-schmitz,fresh,1.5/4,coyote_ugly,I'm left to wonder if this movie might end up seeming like Cocktail with girls instead of Tom Cruise. Not that that's an inherently bad thing.,Coyote Ugly (2000)
greg-dean-schmitz,rotten,2/4,1093611-anna_and_the_king,Quote not available.,Anna and the King (2000)
greg-dean-schmitz,rotten,2.5/4,1093901-tumbleweeds,Quote not available.,Tumbleweeds (1999)
greg-dean-schmitz,fresh,2.5/4,magnolia,"The performances are all around great, with everyone fitting perfectly into their given role.",Magnolia (1999)
greg-dean-schmitz,fresh,3.5/4,cider_house_rules,Quote not available.,The Cider House Rules (1999)
greg-dean-schmitz,fresh,4/4,election,Quote not available.,Election (1999)
greg-dean-schmitz,rotten,2.5/4,austin_powers_the_spy_who_shagged_me,Quote not available.,Austin Powers: The Spy Who Shagged Me (1999)
greg-dean-schmitz,fresh,3/4,1093671-end_of_the_affair,Quote not available.,The End of the Affair (1999)
greg-dean-schmitz,fresh,3/4,topsyturvy,Quote not available.,Topsy-Turvy (1999)
greg-dean-schmitz,fresh,3/4,scary_movie,"One aspect of this project that particularly sparks my attention is the helming role for Keenen Ivory Wayans, who delivered one of the funniest movies of the 1990's.",Scary Movie (2000)
greg-dean-schmitz,rotten,1/4,1098652-in_crowd,"This college-age thriller is the second of two similarly themed movies this Spring about secret societies, with the other being The Skulls in February.",The In Crowd (2000)
greg-dean-schmitz,rotten,2/4,blair_witch_project,Quote not available.,The Blair Witch Project (1999)
greg-dean-schmitz,rotten,2/4,immortality,This film is probably really only best for fans of vampire films or stylish British erotic thrillers.,Immortality (2000)
greg-dean-schmitz,rotten,1/4,my_dog_skip,"In a 12 month period, [Warner Brothers will] have distributed 3 movies with either the word 'dog' in the title or primarily about canines, more than all other distributors combined.",My Dog Skip (2000)
greg-dean-schmitz,fresh,3.5/4,shadow_of_the_vampire,A complex film that is going to appeal to moviegoers on different levels.,Shadow of the Vampire (2000)
greg-dean-schmitz,fresh,3/4,1091577-ideal_husband,Quote not available.,An Ideal Husband (1999)
greg-dean-schmitz,rotten,2.5/4,legend_of_1900,Quote not available.,The Legend of 1900 (La leggenda del pianista sull'oceano) (1999)
greg-dean-schmitz,rotten,2.5/4,1093874-superstar,Quote not available.,Superstar (1999)
greg-dean-schmitz,rotten,2/4,dreaming_of_joseph_lees,"Most of the performances seem a bit thin and miscast, inspiring me to wonder what this film might've been like with different actors.",Dreaming of Joseph Lees (1999)
greg-dean-schmitz,fresh,3/4,1098149-patriot,The look and premise of a South Carolina farmer should be far enough away from the tartans and kilts of Scotland that this film will be able to stand ably on its own in the public's eye.,The Patriot (2000)
greg-dean-schmitz,fresh,3.5/4,xiu_xiu_the_sent_down_girl,Quote not available.,Xiu Xiu: The Sent Down Girl (1999)
greg-dean-schmitz,rotten,2/4,anywhere_but_here,Quote not available.,Anywhere but Here (2000)
greg-dean-schmitz,rotten,2/4,limey,Quote not available.,The Limey (1999)
greg-dean-schmitz,fresh,3/4,cookies_fortune,Quote not available.,Cookie's Fortune (1999)
greg-dean-schmitz,fresh,4/4,green_mile,"A wonderful, inspiring, touching, and often funny movie.",The Green Mile (1999)
greg-dean-schmitz,rotten,1/4,bats,Quote not available.,Bats (1999)
greg-dean-schmitz,rotten,2/4,random_hearts,Quote not available.,Random Hearts (1999)
greg-dean-schmitz,fresh,2.5/4,world_is_not_enough,I'd say that this James Bond movie may feature more dialogue and plot development than the last two films.,The World Is Not Enough (1999)
greg-dean-schmitz,fresh,3/4,story_of_us,Quote not available.,The Story of Us (1999)
greg-dean-schmitz,rotten,1.5/4,pokemon_the_movie_2000,"What I've seen of this 2nd film looks like it's even more action-packed (huge mid-air bird fights! sea monsters!), and the short looks like fun too.",Pokemon - The Movie 2000 (2000)
greg-dean-schmitz,fresh,3.5/4,dogma,Quote not available.,Dogma (1999)
greg-dean-schmitz,rotten,1/4,1090789-haunting,Quote not available.,The Haunting (1999)
greg-dean-schmitz,fresh,3/4,1087648-payback,Quote not available.,Payback (1999)
greg-dean-schmitz,fresh,10/10,crouching_tiger_hidden_dragon,"Success is destined for this movie because it has a mix of romance, fantasy, and action that will appeal to all audiences regardless of age, sex, or whether they watch many subtitled films.","Crouching Tiger, Hidden Dragon (2001)"
greg-dean-schmitz,fresh,10/10,1100998-contender,Wins the audience over with a smart script that doesn't insult the audience's intelligence.,The Contender (2000)
greg-dean-schmitz,fresh,4/4,tarzan,"With this new, rollercoaster-ride three-dimensional approach, Disney has indeed heralded a new age in animation.",Tarzan (1999)
greg-dean-schmitz,fresh,3/4,1108185-animal,"Considering that this is a movie about a man whose sex drive is controlled by animal urges, I was expecting a lot worse everytime a goat or cow appared on screen",The Animal (2001)
greg-dean-schmitz,fresh,3.5/4,amores_perros,"The performances here are, again and again, natural and convincing, with many of the actors making their debuts.",Amores Perros (2001)
greg-dean-schmitz,fresh,3.5/4,tailor_of_panama,"John Boorman's direction here is impeccable, capturing well the look and sounds of Panama City, and mixing it in with the film's story.",The Tailor of Panama (2001)
greg-dean-schmitz,rotten,2/4,swordfish,"Strictly style above content, to the point that even cracking is shown as being a bit like Tetris",Swordfish (2001)
greg-dean-schmitz,rotten,2/4,sexy_beast,Like a sandwich with great bread and distracting meat,Sexy Beast (2000)
greg-dean-schmitz,fresh,3.5/4,lost_and_delirious,"Piper Perabo is the real winner here, with a role that showcases her flamboyant acting style and personality we didn't see in 'Coyote Ugly.'",Lost and Delirious (2001)
greg-dean-schmitz,rotten,1/4,wild_wild_west,Quote not available.,Wild Wild West (1999)
greg-dean-schmitz,fresh,4/4,1107863-moulin_rouge,"...the 'Star Wars' of romantic musicals, reinventing and revitalizing the genre in one gutsy burst of cinematic glam and joy.",Moulin Rouge! (2001)
greg-dean-schmitz,rotten,1.5/4,1108389-pearl_harbor,"Bay and company chose to prop up a poorly written romance as an epic, with death, war, and mayhem as plot devices.",Pearl Harbor (2001)
greg-dean-schmitz,fresh,4/4,innocence2000,Approaches the subject with reason and a good dose of reality.,Innocence (2001)
greg-dean-schmitz,fresh,3/4,1107902-angel_eyes,Quote not available.,Angel Eyes (2001)
greg-dean-schmitz,fresh,4/4,shrek,Quote not available.,Shrek (2001)
greg-dean-schmitz,fresh,4/4,children_underground,"If you have a stomach for harrowing, depressing true tales of man's inhumanity to man, Children Underground is a fantastic document of a nation's priorities gone wild.",Children Underground (2001)
greg-dean-schmitz,fresh,4/4,dogtown_and_zboys,"The rebellion, the rock music, and the frenetic introduction to skating culture all combine to make [this] one of the most entertaining and fun movies of the year.",Dogtown and Z-Boys (2001)
greg-dean-schmitz,fresh,3/4,otomo,"I was impressed by the decision to make Otomo a bit of an anti-hero, seeming aware that in desperate times, good people may say or do things outside the norm.",Otomo (2000)
greg-dean-schmitz,fresh,3/4,knights_tale,What a great idea to plunder the history books (and Renaissance airs) and single out a now-defunct sport like jousting.,A Knight's Tale (2001)
greg-dean-schmitz,fresh,4/4,in_the_bedroom,"an amazingly deft debut for actor-turned-director Todd Field, who has obviously been watching the great directors he's had a chance to work with",In the Bedroom (2001)
greg-dean-schmitz,rotten,2/4,1108624-road_home,...story of an illiterate young woman so completely in love with a man who doesn't seem to care left me with a bitter taste.,The Road Home (Wo de fu qin mu qin) (2001)
greg-dean-schmitz,rotten,2/4,mummy_returns,"I think perhaps Sommers accomplished all that he wanted to with that first film, because there is very, very little here that is new or fresh anymore.",The Mummy Returns (2001)
greg-dean-schmitz,fresh,3/4,1104207-panic,"Another case of a film that is exactly what many people would like to see more of in theaters, and yet... Hollywood flinched.",Panic (2000)
