critic_id,critic_meter_score,critic_rating,movie_id,movie_review_blurb,movie_title
nathan-rabin,rotten,C,1203732-me_and_orson_welles,A terminally bland coming-of-age story about a pretty young man with the worldâ(TM)s most awesome after-school job.,Me and Orson Welles (2009)
nathan-rabin,rotten,C,ten9eight,"Ten9Eight will induce shivers of excitement in free-market proponents who get off on watching ambitious, money-minded young people pull themselves up by their bootstraps and set out to become future titans of industry.",Ten9Eight: Shoot for the Moon (2009)
nathan-rabin,rotten,D,end_of_poverty,The End Of Poverty? offers simplistic answers to many of the most pressing questions of our time.,The End Of Poverty (2008)
nathan-rabin,fresh,B-,youth_in_revolt,"Youth In Revolt is a little too clever and a little too willfully verbose for its own good, but it's rare and a little wonderful to see a comedy about the sex lives of teenagers that suffers from an excess of ideas and ambition instead of a dearth.",Youth in Revolt (2010)
nathan-rabin,rotten,C+,chant_des_mariees,"The bond between Brocheré and Borval is more physical than verbal; they often seem on the verge of a deep, soulful lip-lock, but since neither character is developed satisfactorily, it's hard to develop a rooting interest in...their friendship.",Le Chant des Mariées (The Wedding Song) (2008)
nathan-rabin,fresh,B+,black_dynamite,"Sanders delights in the amateurishness of blaxploitation, from clunky exposition to shootouts that violate all rules of continuity and perspective to a visible boom mic, which spends so much time onscreen that it practically deserves its own credit.",Black Dynamite (2009)
nathan-rabin,fresh,B+,paranormal_activity,"At best, Paranormal Activity makes the banal and commonplace deeply unsettling.",Paranormal Activity (2009)
nathan-rabin,fresh,A-,an_education,"An Education shares with Hornby's best work trenchant insight into the way smart, hyper-verbal young people let the music, films, books, and art they love define themselves as they figure out who they are and what they want to be.",An Education (2009)
nathan-rabin,fresh,B+,good_hair,"In chronicling the permutations of black hair, the filmmaker ends up making a breezy statement on the universality of narcissism.",Good Hair (2009)
nathan-rabin,rotten,C,yes_men_fix_the_world,"Given the duo's withering take on capitalism, it's ironic that their stumbling second feature feels throughout like an infomercial for a shtick whose expiration date is rapidly approaching.",The Yes Men Fix the World (2009)
nathan-rabin,fresh,B+,zombieland,"The four protagonists aren't about to let something as minor as the complete breakdown of society get in the way of having a good time, and their fun proves infectious.",Zombieland (2009)
nathan-rabin,rotten,D+,pandorum,"Quaid and Foster spend far too much time trying to figure out what's going on, but audiences are liable to respond only with a dispirited ""Who cares?""",Pandorum (2009)
nathan-rabin,rotten,C+,1208165-boys_are_back,"In spite of the fine lead performance, Back is a grey, unedifying slog from grief and hopelessness to parental semi-competence.",The Boys Are Back (2009)
nathan-rabin,fresh,B-,1197321-paris,Agreeable but highly forgettable.,Paris (2008)
nathan-rabin,rotten,C+,michael_jackson_this_is_it,"At best, it angrily demands to be rechristened This Is It! Too often, however, an incredulous This Is It? seems more apt.",Michael Jackson's This Is It (2009)
nathan-rabin,rotten,C+,pop_star_on_ice,"Documentaries thrive on candor and intimacy, two qualities the film fatally lacks. Weir has a reputation as a wild child and a loose cannon with little concern for propriety, but he's awfully cautious here about what he reveals about himself.",Pop Star on Ice (2009)
nathan-rabin,rotten,D,valentines_day_2010,"Valentine's Day explores love in all its myriad forms, from the sickeningly sappy to the cornball to the groaningly precious and obnoxiously cute.",Valentine's Day (2010)
nathan-rabin,rotten,C+,brooklyns_finest,"From the moment Gere is introduced waking up to whiskey for breakfast, Brooklyn's Finest segues smoothly and slickly from one cliché to another.",Brooklyn's Finest (2010)
nathan-rabin,fresh,B-,fierce-people,"Dunne's messy, unpredictable, yet weirdly vital movie veers from one extreme to another without finding a consistent tone, but Sutherland never strikes a wrong note.",Fierce People (2005)
nathan-rabin,fresh,B,the_expendables,"Delivers pretty much exactly what its audience wants and expects: big, dumb, campy fun so deliriously, comically macho, it's remarkable that no one in the cast died of testosterone poisoning.",The Expendables (2010)
nathan-rabin,rotten,C,middle_men,[A] frenetic jumble of subplots and sleazy characters...,Middle Men (2010)
nathan-rabin,rotten,D+,dry_land,Writer-director Ryan Piers Williams seems to be diligently working through a checklist of returning-warrior-movie clichés.,The Dry Land (2010)
nathan-rabin,fresh,,spiderman_2,"Simultaneously funnier, darker, and more emotional than its forebear.",Spider-Man 2 (2004)
nathan-rabin,rotten,C-,love_ranch,"With two great, ideally cast actors and such potentially fascinating subject matter, why does Love Ranch feel like a clumsy TV movie?",Love Ranch (2010)
nathan-rabin,fresh,A-,joan-rivers-a-piece-of-work,"A Piece Of Work is funny, heartbreaking, and casually profound about the insatiable need for validation and approval that fuels so much stand-up comedy.",Joan Rivers: A Piece Of Work (2010)
nathan-rabin,rotten,C-,a_team,The film's featherweight tone and self-conscious excess would be a lot more palatable if everyone didn't seem so insufferably pleased with themselves. The film acts as if it's won the race before the starting gun has even been fired.,The A-Team (2010)
nathan-rabin,rotten,C+,macGruber,"MacGruber alternates quick bursts of laugh-out-loud funniness with long dry stretches. It isn't exactly good, but for audiences in search of nothing more than a few silly chuckles, it should prove good enough.",MacGruber (2010)
nathan-rabin,rotten,C-,holy_rollers,Holy Rollers gives a fascinating story the low-rent TV-movie treatment. Ecstasy profiteers and Hasidic Jews both deserve better than Asch's glum slog through their disparate worlds.,Holy Rollers (2010)
nathan-rabin,rotten,C-,living_wake,Wes Anderson has much to answer for.,The Living Wake (2010)
nathan-rabin,rotten,C,mercy-2009,"With Glenn offscreen for huge sections of the film, Mercy devolves into yet another navel-gazing drama about a glib cad redeemed by the love of a good woman.",Mercy (2010)
nathan-rabin,rotten,C,back_up_plan,"It's really two movies, one silly and one serious. Too bad neither is particularly compelling.",The Back-up Plan (2010)
nathan-rabin,rotten,D+,death_at_a_funeral_2010,"Rock acquits himself nicely as the responsible brother and resident straight man, but everyone else in the cast has apparently been advised to mug shamelessly and yell their lines as loudly as possible, especially Tracy Morgan...",Death at a Funeral (2010)
nathan-rabin,fresh,B-,the_cartel,"The Cartel makes a persuasive argument for vouchers and magnet schools, but its case might be a little stronger if Bowdon didn't appear to be frothing at the mouth with indignation much of the time.",The Cartel (2010)
nathan-rabin,fresh,B-,date_night,"There's something genuine and more than a little sad at the core of Levy's poorly staged, modestly amusing comedy, but it isn't the part that involves flash drives, blackmail, and glowering, gun-toting bad guys.",Date Night (2010)
nathan-rabin,rotten,C+,hot_tub_time_machine,"Machine is engaging enough, but its characters' path to redemption would be more satisfying if it weren't greased with authentically '80s-style casual sexism, gay panic, and frat-comedy clichés.",Hot Tub Time Machine (2010)
nathan-rabin,fresh,B-,1212640-eclipse,"Though The Eclipse travels a sleepy route to a shrug of anticlimax, it's refreshing to see a film acknowledge that life and love don't end at 50, even in the outsized shadow of a soulmate's death.",The Eclipse (2010)
nathan-rabin,fresh,A-,greenberg,"Bittersweet and beautifully realized, harsh but humane, Greenberg is a self-consciously small film that nevertheless leaves an indelible mark.",Greenberg (2010)
nathan-rabin,rotten,C,the_runaways,"The Runaways were the first major all-girl punk band. In honor of this distinction, they're now the first major all-girl punk band to inspire a bleary, excessive, and altogether mediocre big-screen biography.",The Runaways (2010)
nathan-rabin,rotten,D-,our_family_wedding,"Most comedies would be content to mine the comic possibilities of Viagra only once, especially if they're going to devote considerable screen time to the dramatic acting of Carlos Mencia.",Our Family Wedding (2010)
nathan-rabin,fresh,B-,daniel_ellsberg_doc,"Dangerous Man does a serviceable job of mapping out the particulars of his struggle, but the definitive cinematic version of his too-strange-for-fiction story has yet to be made.",Most Dangerous Man in America: Daniel Ellsberg and the Pentagon Papers (2009)
nathan-rabin,rotten,C,10009458-defiance,Defiance groans under the weight of its deadly earnestness: it's handsomely mounted yet strangely inert.,Defiance (2009)
nathan-rabin,fresh,B-,i_can_do_bad_all_by_myself,"Perry plugs into the primal power of gospel, blues, soul, and the black church in ways that make Bad far more affecting than it has any right to be.",I Can Do Bad All By Myself (2009)
nathan-rabin,fresh,B-,september_issue,"A fascinating, frustrating documentary.",The September Issue (2009)
nathan-rabin,fresh,B-,every_little_step,"It's a huge improvement over the Attenborough film; given the film's non-fiction roots, it seems poetically apt that a documentary take is much more satisfying and engaging than the Hollywood treatment.",Every Little Step (2009)
nathan-rabin,fresh,B-,10009702-in_a_dream,"What's onscreen is vivid and compelling, but the film only seems to tell part of the story.",Chasing a Dream (Miles from Nowhere) (2009)
nathan-rabin,rotten,C,hannah_montana_the_movie,"Has there ever been a more critic-proof film than Hannah Montana? Montana is targeted with laser precision at an audience barely old enough to read, let alone pay attention to what laptop-toting wretches have to say about its aesthetic shortcomings.",Hannah Montana: The Movie (2009)
nathan-rabin,fresh,B+,10009355-sugar,"Think of it as a subtle arthouse antidote to the groaning galaxy of baseball movies, a film more concerned with character, mood, and capturing a highly specific cultural milieu than with big games that invariably come down to the very last inning.",Sugar (2008)
nathan-rabin,fresh,A-,adventureland,"Adventureland refreshingly inhabits a world without clear-cut heroes or bad guys, just richly realized characters struggling to get by.",Adventureland (2009)
nathan-rabin,rotten,C+,12_rounds,"There's something strangely charming about films that are all artifice, explosions, and naked calculation. 12 Rounds is at least honest trash: It never pretends to be anything other than manic schlock.",12 Rounds (2009)
nathan-rabin,rotten,C+,1189629-the_great_buck_howard,"Malkovich refuses to make his arrogant, prickly has-been remotely likeable, but the movie isn't as uncompromising as his performance, which gets drowned in a sea of schmaltz.",The Great Buck Howard (2009)
nathan-rabin,rotten,C+,duplicity_2009,"For a sexy comedy that tries and fails to recapture the sensual smarts of vintage screwball fare, Duplicity is regrettably short on sex and comedy.",Duplicity (2009)
nathan-rabin,rotten,C,brothers_at_war,Rademacher's strange vanity project ends up saying a lot more about his family issues and need to be seen as a swaggering badass than it does about the day-to-day life of soldiers in Iraq.,Brothers at War (2009)
nathan-rabin,fresh,B-,1208128-tyson,"Tyson can be brutal with himself, but Toback's fawning documentary lets him off easy.",Tyson (2009)
nathan-rabin,rotten,C+,sunshine_cleaning,"The film's secondhand feel wouldn't be so problematic if it had a sense of urgency, but director Christine Jeffs' ambitions begin and end with transferring Megan Holley's earnest script from the page to the screen.",Sunshine Cleaning (2009)
nathan-rabin,rotten,F,street_fighter_the_legend_of_chun_li,"Chun-Li understandably wasn't screened for critics. It shouldn't be screened for audiences, either. Even Uwe Boll could have done better; at least he makes terrible videogame adaptations with a little personality.",Street Fighter: The Legend of Chun-Li (2009)
nathan-rabin,fresh,,megiddo_the_omega_code_2,"Delirious, top-notch camp for viewers of all faiths and denominations, Megiddo: Omega Code 2 offers so much goofy fun, it's sinful.",Megiddo: The Omega Code 2 (2001)
nathan-rabin,rotten,c+,madea_goes_to_jail,Perry's playing-to-the-cheap-seats drag shenanigans hijack a morose street melodrama every 15 minutes and haul it into places even Flavor Flav fears to tread.,Madea Goes to Jail (2009)
nathan-rabin,rotten,C+,confessions_of_a_shopaholic,"Fisher makes for a winning Cinderella, but by its third act, this hokey, old-fashioned vehicle turns back into a pumpkin.",Confessions of a Shopaholic (2009)
nathan-rabin,rotten,C+,international,Its premise aches with timely resonance. It's directed with meticulous artistry. So why does it ultimately feel so empty and forgettable?,The International (2009)
nathan-rabin,rotten,C+,10009632-notorious,"A great rapper deserves a great biopic, but B.I.G. fans will have to settle for this merely passable one.",Notorious (2009)
nathan-rabin,rotten,C-,paul_blart_mall_cop,A shamelessly sentimental comedy with a few crude gags thrown in arbitrarily.,Paul Blart: Mall Cop (2009)
nathan-rabin,rotten,D,not_easily_broken,"It's as simplistic, reductive, and heavy-handed as Deep Cover was gloriously ambiguous.",Not Easily Broken (2009)
nathan-rabin,rotten,D-,bride_wars,Bride Wars takes the burgeoning Anne Hathaway wedding-movie subgenre from the sublime to the despicable.,Bride Wars (2009)
nathan-rabin,rotten,D,10010760-miss_march,"March gets the mean-to-funny ratio wrong; it's misanthropic, smutty, and smug, but with a few notable [Craig] Robinson-engineered exceptions, never even remotely chuckle-inducing.",Miss March (2009)
nathan-rabin,fresh,B-,merry_gentleman,Gentleman is a screamingly quiet film distinguished by a haunting score and terrific lead performances.,The Merry Gentleman (2009)
nathan-rabin,fresh,B,rudo_y_cursi,"Bernal gives his flashy would-be pop star a daft, wide-eyed innocence and it's great to see Bernal and Luna together again, but Cuarón nearly ruins a wonderful comedy by turning it into a much less distinguished drama.",Rudo y Cursi (2009)
nathan-rabin,fresh,B+,10011262-outrage,"After a relatively dry beginning, the film builds in passion and intensity until attaining a stirring cumulative power.",Outrage (2009)
nathan-rabin,rotten,D+,marc_pease_experience,Louiso's misfiring comedy feels less like a comic feast than a thrown-together assemblage of haphazardly nuked leftovers.,The Marc Pease Experience (2009)
nathan-rabin,fresh,B-,1216754-art_and_copy,"Art & Copy is mightily diverting, for those who don't mind being sold a slick bill of goods.",Art & Copy (2009)
nathan-rabin,fresh,B+,1213731-worlds_greatest_dad,"[A] savagely funny, unexpectedly touching exploration of the human need to idealize and romanticize the dead.",World's Greatest Dad (2009)
nathan-rabin,fresh,B-,bandslam,"Like a less oppressively hip Juno, Bandslam captures the way young people too smart and pop-culture-savvy for their own good let the music and movies they love define them during adolescence's crucible of humiliation and self-doubt.",Bandslam (2009)
nathan-rabin,rotten,,killing_me_softly,"As Graham attempts to uncover the truth about his past, the film grows increasingly convoluted, leading to a twist ending that will come as a surprise only to those who've never seen a Shannon Tweed movie.",Killing Me Softly (2003)
nathan-rabin,rotten,,simon_sez,"Dennis Rodman may be a great rebounder, but as a pop-culture icon, he's a one-trick pony.",Simon Sez (1999)
nathan-rabin,fresh,C+,1208105-adam,"The film is afflicted with a fatal case of the cutes: It's never an encouraging sign when The Little Prince, that eternal touchstone of precious perma-children, emerges as a major motif for a romantic drama.",Adam (2009)
nathan-rabin,rotten,C-,answer_man,"The Answer Man combines the worst of both worlds: It offers the ugly digital video, negligible production values, and manufactured grit of a Sundance loser with the pandering formula, sentiment, and romantic-comedy clichés of Hollywood pap.",The Answer Man (Arlen Faber) (2009)
nathan-rabin,rotten,C-,10011435-shrink,"It soon becomes apparent that Shrink is exactly like virtually all [Spacey's] post-American Beauty vehicles: flashy, phony, nakedly melodramatic, and full of big actorly moments disconnected from real life.",Shrink (2009)
nathan-rabin,fresh,B+,soul_power,Soul Power works fabulously as both a concert film and a time capsule of a time and place when gods of black masculinity joined forces to make an international statement of togetherness.,Soul Power (2009)
nathan-rabin,fresh,B+,bruno,"Cohen no longer has freshness and novelty on his side, but he's retained the power to shock, offend, provoke, unsettle, and most importantly, entertain a jaded, desensitized public.",Bruno (2009)
nathan-rabin,rotten,F,i_hate_valentines_day,"An unspeakable nadir in the career of its writer-director-star, My Big Fat Greek Wedding's Nia Vardalos.",I Hate Valentine's Day (2009)
nathan-rabin,rotten,C-,surveillance,"Surveillance suggests 'Jennifer Lynchian' should be used for films that aspire to David's moody, idiosyncratic genius and fall woefully short.",Surveillance (2009)
nathan-rabin,fresh,B-,youssou_ndour_i_bring_what_i_love,"Love looks and sounds great, but in depicting N'Dour as a lofty symbol for music's power to bridge worlds and inspire, it sometimes loses sight of the man.",Youssou Ndour: I Bring What I Love (2009)
nathan-rabin,fresh,B+,food_inc,It's entertaining and fast-moving enough to make audiences intermittently forget they're consuming cinematic health food.,"Food, Inc. (2009)"
nathan-rabin,rotten,D,1207149-taking_of_pelham_1_2_3,"John Travolta's wildly successful post-comeback crusade to become synonymous with crap continues with The Taking Of Pelham 1 2 3, Tony Scott's bracingly awful remake/desecration of the classic '70s thriller.",The Taking of Pelham 1 2 3 (2009)
nathan-rabin,fresh,B+,ohorten,"Powered by lush cinematography, a moody score, and Owe's subtly majestic lead performance, O'Horten oscillates confidently between the mundane and the rapturously beautiful.",O' Horten (2007)
nathan-rabin,rotten,C-,my_life_in_ruins,A quasi-sequel to My Big Fat Greek Wedding that shamelessly recycles the sitcom-and-schmaltz formula of Vardalos' breakthrough hit.,My Life in Ruins (2009)
nathan-rabin,rotten,C-,dance_flick,"Only in the Wayans-brothers universe would ""surprisingly not terrible"" almost qualify as a ringing endorsement.",Dance Flick (2009)
nathan-rabin,rotten,C+,management,"A film that flaunts its contempt for plausibility and psychological realism, but damned if Zahn doesn't almost sell the scene and the movie with his naïve, wide-eyed slacker charm.",Management (2009)
nathan-rabin,fresh,B,next_day_air,"A very pleasant surprise, Next Day Air is the rare crime comedy that does justice to both sides of the equation.",Next Day Air (2009)
nathan-rabin,rotten,F,all_about_steve,It's a celebration of brazen nonconformity centered on an insufferable flibbertigibbet who makes the worst case for nonconformity imaginable.,All About Steve (2009)
nathan-rabin,fresh,B-,dedication,"Crudup delivers a bracing, uncompromising performance, but it's unmistakably a solo turn in a romantic comedy that's supposed to be about the blurring of egos and the fusing of two idiosyncratic voices into a single harmonious duet.",Dedication (2007)
nathan-rabin,fresh,B,quinceanera,"Westmoreland and Glatzer adopt a bare-bones documentary-style approach for this sensitive, sharply observed tale.",Quinceañera (2006)
nathan-rabin,fresh,B-,december_boys,"Radcliffe is the big draw, but he's really a supporting player, just one of the parentless wonders sent to live with a loving couple one glorious, life-changing summer.",December Boys (2007)
nathan-rabin,fresh,B-,art_school_confidential,"Art School Confidential constitutes two-thirds of a worthy follow-up to Ghost World, but it doesn't feel nearly as substantial.",Art School Confidential (2006)
nathan-rabin,rotten,B-,american_dreamz,Great satires draw blood. American Dreamz barely nicks the surface.,American Dreamz (2006)
nathan-rabin,fresh,B-,akeelah_and_the_bee,"If [director] Atchison's well-acted, good-intentioned crowd-pleaser can trick even one moviegoer into thinking that knowledge and spelling are somehow cool, then his film will be performing a societal good that offsets its slack reliance on formula.",Akeelah and the Bee (2006)
nathan-rabin,rotten,C-,10006270,But even the film's seeming singularity proves deceptive once it becomes apparent that When Do We Eat? is less a Passover movie than a Thanksgiving or Christmas movie dolled up in Jewish drag.,When Do We Eat? (2006)
nathan-rabin,fresh,B,te_doy_mis_ojos,"Though deceptively straightforward in its exploration of the causes and effects of domestic abuse, Take My Eyes benefits from the grubby verisimilitude Bollaín brings to his material, which otherwise might have lapsed into movie-of-the-week superficiality",Te doy mis ojos (Take My Eyes) (2006)
nathan-rabin,rotten,C,la_mujer_de_mi_hermano,"Once upon a time, Americans snuck off to arthouses largely to sample the forbidden fruit of naked foreign boobs. Some things never change.",La mujer de mi hermano (2006)
nathan-rabin,rotten,C-,kinky_boots,"Drag queens are people too, Kinky Boots limply, earnestly pleads. Most viewers will respond, 'Yes. And?'",Kinky Boots (2006)
nathan-rabin,rotten,C+,hard_candy,"As Hard Candy moves further and further away from its opening scenes' gripping ambiguity, the frightening conviction Page brings to her role becomes the only thing keeping the film from lurching into sleazy, pulpy camp.",Hard Candy (2006)
nathan-rabin,rotten,C-,benchwarmers,"Like pretty much everything else bearing Happy Madison's name, The Benchwarmers kind of sucks.",The Benchwarmers (2006)
nathan-rabin,rotten,C-,10002516-lost_city,"As a director, Garcia is such a sucker for gratuitous crosscutting and glossily elliptical filmmaking that viewers can be forgiven for mistaking Lost City for a 143-minute montage sequence.",The Lost City (2005)
nathan-rabin,fresh,A-,friends_with_money,Holofcener's film remains rooted in keen observations about everyday life.,Friends With Money (2006)
nathan-rabin,rotten,D,larry_the_cable_guy_health_inspector,"It'd be tempting to call Larry the Ernest of his generation, but that'd be a grave insult to Jim Varney's enduring legacy.",Larry the Cable Guy: Health Inspector (2006)
nathan-rabin,rotten,D,basic_instinct_2,"As a showcase for Sharon Stone's physique, Basic Instinct 2 is a rousing success. In every other respect, it's a colossal failure.",Basic Instinct 2 (2006)
nathan-rabin,fresh,B-,find_me_guilty,"It takes some time to accept the miscast Diesel in a role that even he'd probably concede would be a better fit for Pesci, but Diesel delivers his liveliest and funniest performance in ages.",Find Me Guilty (2006)
nathan-rabin,rotten,C-,hills_have_eyes,"Hills isn't terrible, only terribly unnecessary.",The Hills Have Eyes (2006)
nathan-rabin,rotten,C-,failure_to_launch,Launch writes itself into such a corner that the only way it can manage a happy ending is to lock its leads in a room and force them to have a meaningful conversation.,Failure to Launch (2006)
nathan-rabin,fresh,B,our_brand_is_crisis,Our Brand Is Crisis' queasy power comes from its understanding of how elections have tangible real-world consequences that are measured in deaths and riots as wells as polls and ballots.,Our Brand Is Crisis (2005)
nathan-rabin,fresh,B-,joyeux_noel,"Though a painless time-passer, Joyeux Noël ultimately contributes little to the venerable anti-war genre.",Joyeux Noël (Merry Christmas) (2006)
nathan-rabin,rotten,D-,1156283-doogal,"Hungering for more references to the 'Wassup' commercials, Dr. Phil, 'Bling Bling,' The Lord Of The Rings, MC Hammer, or The Matrix? Don't worry, Doogal contains nods to all of these.",Doogal (2006)
nathan-rabin,fresh,B+,block_party,"This rare sense of wonder at life's infinite possibilities is what unites Chappelle with the work of Michel Gondry, a filmmaker on unusually good terms with his inner child.",Dave Chappelle's Block Party (2006)
nathan-rabin,rotten,D-,10006370-stay_alive,"Teen fodder like this isn't known for sophistication or storytelling depth, but the filmmakers seem to take the film's video-game theme as permission to eschew even the horror genre's exceedingly lenient minimums for characterization.",Stay Alive (2006)
nathan-rabin,fresh,B,sir_no_sir,Sir! No Sir! movingly captures the raw excitement of grunts discovering their power and their voices in their ability to resist.,Sir! No Sir! (2006)
nathan-rabin,rotten,D,american_haunting,"It's never an encouraging sign when a horror movie based on a true story fatally lacks the verisimilitude of, say, Alone In The Dark.",An American Haunting (2006)
nathan-rabin,fresh,B,keeping_up_with_the_steins,What begins as a scathing but loving satire of materialism loses its way once it turns into a warmhearted after-school special...,Keeping Up With The Steins (2006)
