critic_id,critic_meter_score,critic_rating,movie_id,movie_review_blurb,movie_title
adrian-mack,fresh,,the_demons_2015,Easily one of the best Canadian films of the year.,Les démons (The Demons) (2015)
adrian-mack,fresh,,cosmos_2016,With this already heady material heightened by Zulawski's antic style... Cosmos might be asking how much gratuitous expression we can tolerate in a world built entirely on weekend box office.,Cosmos (2016)
adrian-mack,rotten,,hitman_agent_47,Fans of the ancient craft of filmmaking will want to look the other way.,Hitman: Agent 47 (2015)
adrian-mack,fresh,,how_to_change_the_world,"In the end, it's hard to fathom the scale of his accomplishments or the mythic breadth of the story, although this film takes a pretty good whack.",How To Change The World (2015)
adrian-mack,rotten,,selfless_2015,"Has anybody made a ""sloppy Seconds"" joke yet?",Self/less (2015)
adrian-mack,fresh,,eisenstein_in_guanajuato,"Master British provocateur Peter Greenaway decided to fill the gaps in this strange tale, focusing on the wild-haired Russian's out-and-loving-it dalliance with his local guide, the too perfectly named Palomino Cañedo.",Eisenstein In Guanajuato (2016)
adrian-mack,fresh,,guidance_2014,"If Guidance struggles to find the right tone for its mounting provocations, it never yields to the kind of flat-out cynicism that's fashionable in Hollywood comedies.",Guidance (2015)
adrian-mack,fresh,,peter_de_rome_grandfather_of_gay_porn,"Indeed, de Rome comes off as the type of effortlessly magical person to whom remarkable things just happen. He's adorable. This film is adorable.",Peter De Rome Grandfather Of Gay Porn (2014)
adrian-mack,fresh,,mad_max_fury_road,"Amid a masterful, epic symphony of truly insane stuntwork, Miller establishes Fury Road as something much greater than the average blockbuster.",Mad Max: Fury Road (2015)
adrian-mack,rotten,,the_transporter_refueled,The Transporter Refueled wants to be an austerity-flouting caper set on the Riviera at a time when the best blockbuster of the year is calling for revolution and an end to patriarchy.,The Transporter Refueled (2015)
adrian-mack,fresh,,in_the_shadow_of_women,"This 73-minute, black-and-white tale of Parisian infidelity comes from French master Philippe Garrel and unfolds like a point-by-point exercise in the primary language of cinema.",In The Shadow of Women (2016)
adrian-mack,fresh,,sicario_2015,"Working from a tight script by actor Taylor Sheridan, Quebec's Denis Villeneuve directs Sicario with the same ruthless lack of sentiment he brought to 2013's breakthrough Prisoners.",Sicario (2015)
adrian-mack,fresh,,into_the_forest,Into the Forest is carried by Rozema's confident approach and spectacular performances by Ellen Page and Evan Rachel Wood.,Into The Forest (2016)
adrian-mack,fresh,,hyena_road,"Writer-director-star Paul Gross spent a lot of time over in Afghanistan as he prepared to make Hyena Road, and the verisimilitude of its combat sequences, both on the ground and back at command centre, is one of the payoffs.",Hyena Road (2016)
adrian-mack,fresh,,freeheld_2015,"Not to be frivolous about the subject of Freeheld -- Moore is routinely excellent, for the record -- but the true story of Laurel Hester deserves better than this unprepossessing group hug for masochistic liberals.",Freeheld (2015)
adrian-mack,fresh,,observance,This stylish flick about a PI surveilling the blond crumpet across the road has a lot to recommend it.,Observance (2015)
adrian-mack,rotten,,the_demolisher,Muddled storytelling is just one of the reasons this generally undercooked vigilante flick ends up flat.,The Demolisher (2015)
adrian-mack,fresh,,the_similars,"And then it gets really weird, with Ezban drumming up a high visual style to match his outlandish concept, and almost succeeding heroically at both.",The Similars (Los Parecidos) (2016)
adrian-mack,fresh,,my_golden_days,The evocation of period is subtle and the insights into young amour fou even more so in Arnaud Desplechin's masterful film.,My Golden Days (Trois Souvenirs De Ma Jeunesse) (2016)
adrian-mack,fresh,,the_incident_2014,[The film] takes a big risk -- and succeeds -- when everything is explained in a bravura end sequence.,The Incident (El Incidente) (2014)
adrian-mack,fresh,,room_2015,A devastatingly effective piece of entertainment.,Room (2015)
adrian-mack,fresh,,hadwins_judgement,"A slew of environmental docs are coming our way as the Paris climate-change conference in late November approaches. Rather than remind us again that we're all doomed, this haunting entry accesses a deeper and much stranger area of inquiry.",Hadwin's Judgement (2015)
adrian-mack,fresh,,spotlight_2015,[A] neatly accomplished movie.,Spotlight (2015)
adrian-mack,rotten,,the_hunger_games_mockingjay_part_2,The only thing murkier than the politics of this final chapter in the Hunger Games series is the photography.,The Hunger Games: Mockingjay - Part 2 (2015)
adrian-mack,fresh,,,"Rebecca Cremona's debut is ravishing on the surface, merciless beneath, and handy for shoving down the neck of anyone currently ranting about migrants and refugees on Facebook.",Simshar (2014)
adrian-mack,fresh,,liza_a_rokatunder,"The artifice-heavy Liza has been compared to Amélie, but its flip darkness comes from the same macabre (and much more eastern) vein as Czech fantasy Valerie and Her Week of Wonders.","Liza, a rókatündér (Liza, the Fox-Fairy) (2015)"
adrian-mack,rotten,,legend_2015,"Movie violence -- it's all just a lark, innit?",Legend (2015)
adrian-mack,fresh,,sour_grapes_2016,This breezy doc about a remarkable con inside the rare-wine market raises worthwhile questions about authenticity.,Sour Grapes (2016)
adrian-mack,fresh,,demon_2016,A fistfight between the bridegroom and one of his guests is the least bad thing that happens at the wedding of Piotr (Itay Tiran) and Zaneta (Agnieszka Zulewska).,Demon (2016)
adrian-mack,fresh,,hell_or_high_water,[A] near-perfect film.,Hell or High Water (2016)
adrian-mack,fresh,,i_am_heath_ledger,That his gifts were beyond rare is inarguable by this point. I Am Heath Ledger makes the same case for his soul.,I Am Heath Ledger (2017)
adrian-mack,fresh,,i_daniel_blake,"Sounds a bit dry? I, Daniel Blake is anything but, British humour being the indefatigable thing that it is, especially the finely tuned sarcasm of the eternally depressed north.","I, Daniel Blake (2017)"
adrian-mack,fresh,,vancouver_no_fixed_address,"Dissects Vancouver's housing crisis from all angles, including the one that wants to conflate the heartless vicissitudes of global economics with racism.",Vancouver: No Fixed Address (2017)
adrian-mack,fresh,,ambulance_2016,Utterly heartbreaking.,Ambulance (2016)
adrian-mack,rotten,,47_meters_down,The film contrives to fill its thin 85 minutes with dicey escape attempts and a fake-out that horror buffs will recall from a better film best left unnamed.,47 Meters Down (2017)
adrian-mack,rotten,,the_bad_batch,The film wants ambiguity -- not the kind of thing generally found in pulp -- leaving us with unreadable characters and a distinct petering-out of tension.,The Bad Batch (2017)
adrian-mack,fresh,,the_big_sick,"With his welcome appearance at the top of the bill, Silicon Valley's Kumail Nanjiani is just one of the good reasons to catch this summer charmer.",The Big Sick (2017)
adrian-mack,rotten,,risk_2017,"Risk brings an odd lack of focus to Poitras's dour exercise, made no more convincing by her flat voice-over interjections.",Risk (2017)
adrian-mack,fresh,,nocturama,Testing the viewer's position on who or what the victims are here is partly what makes Nocturama such a horribly exhilarating and rewarding piece of cinema.,Nocturama (2017)
adrian-mack,fresh,,this-is-the-life-how-the-west-was-one,"There's a slew of unmissable films at this year's DOXA, and this insanely inspiring effort is easily one of them.",This Is the Life (2007)
adrian-mack,fresh,,black_is_black_aint,"By the end of Black Is... Black Ain't, an almost entirely non-black audience in Vancouver will have been disabused of its narrow perceptions of African-American life. It's an important gift, bequeathed by a beautiful soul.",Black Is... Black Ain't (1995)
adrian-mack,rotten,,the_infiltrator,"It strives to deliver the painful truths of Sicario, but with none of that film's vicious elegance.",The Infiltrator (2016)
adrian-mack,fresh,,lucky_2017,We should consider ourselves Lucky too.,Lucky (2017)
adrian-mack,fresh,,blade_of_the_immortal,"Even at his most casual, Miike's blade is way sharper than most.",Blade of the Immortal (Mugen no jûnin) (2017)
adrian-mack,fresh,,sweet_virginia_2017,"Sweet Virginia manages to skirt all manner of clichéd setups and crime-thriller illogic to arrive at a climax that still meets the lurid bang-bang requirements of the genre, but also plants its slugs a little deeper than most.",Sweet Virginia (2017)
adrian-mack,fresh,,there_is_a_house_here,"The cold hard message is that reconciliation-and more vitally, understanding-means a hell of a lot more than sending Trudeau up to the podium with another apology.",There is a House Here (2017)
adrian-mack,fresh,,bernard_and_huey,"... Bernard and Huey deserves to exist if only to bug the insufferably Stalinist ""woke"" among us who might not want an inside critique of toxic masculinity with this much wry compassion attached.",Bernard and Huey (2017)
adrian-mack,rotten,,wonder_wheel,"Tom of Finland briefly moves to California when Laaksonen's fortunes begin to rise in the '70s, but it becomes a weak-tea Boogie Nights along the way.",Wonder Wheel (2017)
adrian-mack,fresh,,dark_harvest_2016,"Honestly, Dark Harvest is the kind of film I wish Vancouver would make more of; a humble but smart B-movie made with grit, economy, and a real sense of place elevated by Ryan Petey's bruised cinematography.",Dark Harvest (2017)
adrian-mack,fresh,,hostiles,"To put all this another way: here's an exceptionally timely neowestern that goes out of its way to press all the right buttons, and ends up being tremendously entertaining in the process",Hostiles (2018)
adrian-mack,fresh,,a_skin_so_soft,"The compositions are never less than immaculate, producing all manner of random correspondences and a recurring touch of camp that occasionally blossoms into full-blown Tom of Finland territory.",A Skin So Soft (Ta peau si lisse) (2017)
adrian-mack,fresh,,never_steady_never_still,"Hepburn's film boasts mammoth confidence, inching along with often spellbinding effect at a pace that mirrors the physical impairments suffered by Judy, a mother in the advanced stages of Parkinson's disease.","Never Steady, Never Still (2017)"
adrian-mack,fresh,,too_funny_to_fail,"With some of the funniest people on Earth enthusiastically discussing their greatest failure, it's the interviews that really sell this insanely entertaining film.",Too Funny To Fail (2017)
adrian-mack,fresh,,the_death_of_stalin,"I enjoyed this so much that I screened it twice, back-to-back.",The Death of Stalin (2018)
adrian-mack,fresh,,before_we_vanish,"In some ways, a distant and much less portentous cousin to 2016's Arrival.",Before We Vanish (Sanpo suru shinryakusha) (2018)
adrian-mack,fresh,,manifesto_2017,"As a conservative southern mom, an imperious Russian choreographer, or a wild-eyed homeless Glaswegian, Blanchett is clearly having a blast.",Manifesto (2017)
adrian-mack,fresh,,rumble_the_indians_who_rocked_the_world,Rumble makes it abundantly clear that the time has come to rewrite the book on American music.,RUMBLE: The Indians Who Rocked the World (2017)
adrian-mack,rotten,,waking_the_sleeping_giant_the_making_of_a_political_revolution,[Sleeping Giant] frustrates with the indication that America's mainstream left still doesn't perceive itself inside a political superstructure that needs to be much more honestly eviscerated before it's overhauled.,Waking the Sleeping Giant: The Making of a Political Revolution (2017)
adrian-mack,fresh,,before_the_streets,"An evocative look at life on one of Canada's First Nations reserves, Before the Streets is the brainchild of debut feature director Chloé Leriche.",Before the Streets (2016)
adrian-mack,fresh,,pornocracy_the_new_sex_multinationals,[A] deeply depressing investigation.,"Pornocracy: The New Sex Multinationals (Pornocratie, les nouvelles multinationales du sexe) (2017)"
adrian-mack,fresh,,edge_of_winter,Edge of Winter is still frosty enough to cut through its sometimes inert tone and a flat soundtrack.,Edge of Winter (2016)
adrian-mack,fresh,,the_interior,The Interior pulls off an unlikely transformation from absurdist comedy to authentically disturbing psychological horror. It barely makes a wrong move along the way.,The Interior (2015)
adrian-mack,fresh,,in_order_of_disappearance,"There are echoes of the Coen brothers and any number of sub-Tarantino '90s gangster movies in this Scandinavian effort, which still musters a hardheaded charm of its own.",In Order of Disappearance (2016)
adrian-mack,fresh,,neither_heaven_nor_earth,"There's a conscience to this film, and if it takes a spooky metaphor to express it, then Neither Heaven nor Earth has landed on a subtly memorable one.",Neither Heaven nor Earth (Ni le ciel ni la terre) (2016)
adrian-mack,fresh,,the_beatles_eight_days_a_week_the_touring_years,"The mandate here is to guarantee a splendid time for all, and it's achieved admirably, given that we already know the story a thousand times over.",The Beatles: Eight Days a Week - The Touring Years (2016)
adrian-mack,fresh,,paths_of_the_soul,No less extraordinary than the action depicted in director Zhang Yang's festival hit is the fact that it's so watchable.,Paths of the Soul (Kang rinpoche) (2016)
adrian-mack,fresh,,we_are_x_2016,A hard focus on drummer-pianist-composer Yoshiki turns We Are X into a riveting experience.,We Are X (2016)
adrian-mack,fresh,,command_and_control,"In case it has slipped your mind, Robert Kenner's doc is here to remind us that nuclear technology inspired the very acme of human scientific stupidity and arrogance.",Command and Control (2016)
adrian-mack,fresh,,two_lovers_and_a_bear,"Two Lovers and a Bear is preposterous and too infatuated with itself, but between its appealing leads and a surplus of other pleasures -- the super-crisp imagining of the Nunavut community of Apex, for one -- it's also pretty hard to resist.",Two Lovers and a Bear (2016)
adrian-mack,fresh,,endless_poetry,"Beginning exactly where 2013's The Dance of Reality left us, Alejandro Jodorowsky extends his autobiographical meditation into early adulthood and further still into a crowning, late-career achievement.",Endless Poetry (Poesía Sin Fin) (2017)
adrian-mack,fresh,,the_handmaiden,"Whether this is Park's best film is up for debate, but it could be in the running for your new favourite.",The Handmaiden (Ah-ga-ssi) (2016)
adrian-mack,fresh,,another_evil,"A couple of seriously freaky, J-horror-calibre scares only add to the already outrageously entertaining kicks.",Another Evil (2017)
adrian-mack,fresh,,sonita_2015,You won't soon forget the precocious and indomitable subject of Rokhsareh Ghaem Maghami's heart-rending doc.,Sonita (2015)
adrian-mack,fresh,,free_fire,"As a reductio ad absurdum picture of gun violence, it might have even less of a soul than Reservoir Dogs, and yet Free Fire feels wonderfully, gleefully alive.",Free Fire (2017)
adrian-mack,rotten,,trespass_against_us_2017,Slick and superficial to the last drop.,Trespass Against Us (2017)
adrian-mack,fresh,,versus_the_life_and_films_of_ken_loach,"This doc more than satisfies as a look back at Loach's pioneering work as a kitchen-sink social realist with films like Poor Cow and Kes, while inevitably uncovering the man's internal contradictions.",Versus: The Life and Films of Ken Loach (2016)
adrian-mack,fresh,,the_other_half_2017,[Maslany] is entirely your best reason to catch this homegrown effort.,The Other Half (2017)
adrian-mack,fresh,,london_road,"London Road emerges as a marvellous, uplifting exercise, brimming with humanity and sensitivity towards its subject matter.",London Road (2016)
adrian-mack,fresh,,first_girl_i_loved,"Director Kerem Sanga's gift for quantum observation is one thing, but it's the performances that make this Sundance audience favourite really sing.",First Girl I Loved (2016)
adrian-mack,fresh,,being_17,"The thin line between love and hate dissolves almost entirely in Being 17, a deeply satisfying coming-of-age and coming-out tale set at the picturesque foot of the Pyrenees by director André Téchiné.",Being 17 (Quand on a 17 ans) (2016)
adrian-mack,fresh,,the_love_witch,The Love Witch is some sort of classic.,The Love Witch (2016)
adrian-mack,fresh,,a_legacy_of_whining,Amiably gonzo.,A Legacy of Whining (2016)
adrian-mack,fresh,,in_a_valley_of_violence,"While perfectly entertaining, this western-for-wiseacres is also a little undernourished.",In a Valley of Violence (2016)
adrian-mack,fresh,,women_who_kill_2016,Wickedly funny.,Women Who Kill (2017)
adrian-mackinder,rotten,2/10,jeepers_creepers_2,Quote not available.,Jeepers Creepers 2 (2003)
adrian-mackinder,fresh,9/10,shaun_of_the_dead,"British comedy that is actually funny. Not only that, but it's clever, funny, anarchic, funny and refreshing. And it's funny too.",Shaun of the Dead (2004)
adrian-mackinder,fresh,8/10,buffalo_soldiers,Quote not available.,Buffalo Soldiers (2001)
adrian-mackinder,fresh,,alien,"At the risk of sounding like an old man, they really don't make 'em like this anymore.",Alien (1979)
adrian-mackinder,fresh,9/10,lost_in_translation,"Coppola reigns in Murray's usual sarcastic schtick and as a result he delivers a truly wonderful performance that is warm, understated and charming.",Lost In Translation (2003)
adrian-mackinder,fresh,8/10,american_splendor,"A wonderfully dry, well-crafted piece of filmmaking.",American Splendor (2003)
adrian-mackinder,rotten,6/10,passion_of_the_christ,"Overall this is a remarkably unremarkable film, lacking in subtlety and enshrouded in that depressing sense of Catholic guilt which Gibson no doubt wrestles with every night.",The Passion of the Christ (2004)
adrian-mackinder,fresh,,starsky_and_hutch,Part of the reason this film succeeds is because it manages to be both an affectionate mickey-take of the television show as well as glorifying everything that was cool about the era.,Starsky & Hutch (2004)
adrian-mackinder,fresh,8/10,troy,"The battle scenes are impressive, but you get the feeling that you've already seen this kind of monumental scrap done with more finesse.",Troy (2004)
adrian-mackinder,fresh,9/10,1152019-good_night_and_good_luck,The film slowly draws the audience into the drama with utter conviction.,"Good Night, And Good Luck (2005)"
adrian-mackinder,fresh,8/10,metallica_some_kind_of_monster,Quote not available.,Metallica: Some Kind of Monster (2004)
adrian-mackinder,rotten,4/10,1141193-hide_and_seek,Quote not available.,Hide and Seek (2005)
adrian-mackinder,fresh,7/10,constantine,A pretty good set up for what could be a franchise that has potential to get better and better.,Constantine (2005)
adrian-mackinder,fresh,,for_a_few_dollars_more,The best of the so-called Dollars Trilogy.,For a Few Dollars More (Per Qualche Dollaro in Più) (1965)
adrian-mackinder,fresh,,fistful_of_dollars,A wonderful cinematic experience.,A Fistful of Dollars (Per un Pugno di Dollari) (1964)
adrian-mackinder,fresh,8/10,star_wars_episode_iii_revenge_of_the_sith,Revenge Of The Sith is brilliant. It's as if it took Lucas two goes to get comfortable in the director's chair and can now actually apply a bit of style to the proceedings.,Star Wars: Episode III - Revenge of the Sith (2005)
adrian-mackinder,fresh,10/10,,Quote not available.,
adrian-mackinder,fresh,7/10,family_guy_presents_stewie_griffin_the_untold_story,Quote not available.,Family Guy Presents Stewie Griffin: The Untold Story (2005)
adrian-mackinder,fresh,8/10,hellboy,It works big time.,Hellboy (2004)
adrian-martin,fresh,,time_regained,"...he envisaged Proustian time not as a private sensation, but as a fully external, physical and objective ""dimension""...This is what makes his Time Regained both hallucinatory and concrete, wayward and exact.",Time Regained (1999)
adrian-martin,fresh,,pasolini_2014,"Despite Ferrara's insistence that he and his key crew are devout students of Pasolini's cinema, he applies the lessons of this apprenticeship freely, without mimicry.",Pasolini (2014)
adrian-martin,fresh,,jauja,"For all its evocation of the 'classical' western, Jauja also, at moments, conjures a chilled-out Alejandro Jodorowsky -- less obviously surrealistic but no less provocative in its core propositions.",Jauja (2015)
adrian-martin,rotten,,norte_the_end_of_history,"Diaz's most vocal fans do him no favours in this regard: he might become a better, more self-critical director if people stopped reassuring him that every new film he makes is a deathless masterpiece.","Norte, the End of History (2014)"
adrian-martin,fresh,,elle_2016,"Verhoeven invites us to enjoy Michèle's behaviour, no matter how morally dubious it seems. This is what makes Elle so special and captivating.",Elle (2016)
adrian-miles,fresh,,largent,"Sacred cause and action is outside of reason, this is one of its sacred aspects, and will always remain mysterious. In Bresson's world we are fallen too.",L'Argent (1983)
adrian-monserrat,fresh,7/10,,Paula wanted and could. [Full Review in Spanish],Paula (2016)
adrian-monserrat,fresh,7/10,norman_2017,[Richard] Gere exposes his best facet. [Full Review in Spanish],Norman (Norman: The Moderate Rise and Tragic Fall of a New York Fixer) (2017)
adrian-monserrat,fresh,8/10,happy_death_day,This film has the right idea. [Full Review in Spanish],Happy Death Day (2017)
adrian-monserrat,fresh,7/10,veronica_2017,A movie that puts hairs on end. [Full Review in Spanish],Verónica (2017)
adrian-monserrat,rotten,4/10,be_afraid_2017,Films like these should remain hidden. [Full Review in Spanish],Be Afraid (2017)
adrian-monserrat,rotten,4/10,the_crucifixion_2017,Undoubtedly the direction in The Crucifixion is a weak point. [Full Review in Spanish],The Crucifixion (2017)
adrian-monserrat,fresh,8/10,i_tonya,"Gillespie's film in a breath of fresh, icy air, in the midst of so many serious and emotionless films that only seek to win prizes. [Full Review in Spanish]","I, Tonya (2018)"
adrian-ruiz,fresh,,chronic,Franco dissects pain magnificently even if the ending feels a little rushed. [Full review in Spanish],Chronic (2016)
adrian-ruiz,fresh,,miracles_from_heaven,"A movie destined for a sensitive audience where parents, more suceptible to the premise, can cry all they want watching it. [Full review in Spanish]",Miracles from Heaven (2016)
adrian-ruiz,fresh,,eddie_the_eagle,"It might have some irregularities, especially in the middle of the film, but the idea manages to soar. [Full review in Spanish]",Eddie The Eagle (2016)
adrian-ruiz,fresh,,compadres_2016,"A well manufactured piece of comercial cinema that will draw audiences in, especially fans of Omar Chaparro. [Full review in Spanish]",Compadres (2016)
adrian-ruiz,rotten,,batman_v_superman_dawn_of_justice,"Overcharged in its ideas, visually impeccable, this battle is not able to be epic. Part of its kryptonite is the long duration and a script that wants to cover a lot but doesn't. [Full review in Spanish]",Batman v Superman: Dawn of Justice (2016)
adrian-ruiz,rotten,,the_divergent_series_allegiant,"Fans will be pleased, but the average viewer will get confused and probably bored. [Full review in Spanish]",The Divergent Series: Allegiant (2016)
adrian-ruiz,rotten,,london_has_fallen,"Excesive when it comes to explosions and deaths, you can see all the cliches in the genre rolled up in a single film. [Full review in Spanish]",London Has Fallen (2016)
adrian-ruiz,fresh,,kung_fu_panda_3,The chi of the film is bight and mighty. [Full review in Spanish],Kung Fu Panda 3 (2016)
adrian-ruiz,fresh,,spotlight_2015,"The effort and teamwork highlighted in this film is absorbing, intelligent and it remarks how exciting investigative journalism is, perhaps it lacks adrenaline, but its cinematic importance is undeniable. [Full review in Spanish]",Spotlight (2015)
adrian-ruiz,rotten,,gods_of_egypt,Mildly entertaining but ultimately forgettable. [Full review in Spanish],Gods Of Egypt (2016)
adrian-ruiz,fresh,,zootopia,"Disney created a fun fable, as smart as a dolphin, quick as a hare and with a message as strong as a bull. [Full review in Spanish]",Zootopia (2016)
adrian-ruiz,fresh,,deadpool,"Full of violence, a couple of X-men, and plenty of jokes, this film delivers entertainment on every level. [Full review in Spanish]",Deadpool (2016)
adrian-ruiz,rotten,,carol,"Every piece fits perfectly to tell a story about love and passion, but ultimately, it feels like you've already seen this film. [Full review in Spanish]",Carol (2015)
adrian-ruiz,fresh,,anomalisa,An extremely human story that doesn't need humans to be told. [Full review in Spanish],Anomalisa (2015)
adrian-ruiz,rotten,,the_huntsman_winters_war,"A film with no flaws on the visual aspect, but many on its narrative. [Full review in Spanish]",The Huntsman: Winter's War (2016)
adrian-ruiz,rotten,,burnt,"The cast really tries to make it work, however, as the movie goes on the premise turns boring and we get a cold and flavorless dish. [Full review in Spanish]",Burnt (2015)
adrian-ruiz,fresh,,youre_killing_me_susana_2017,A comedy with really funny moments and a natural colloquial language just as in the novel that this film is based on. [Full review in Spanish],You're Killing Me Susana (Me estás matando Susana) (2017)
adrian-ruiz,fresh,,daddys_home_2014,The usual formula is used to make this a generic but fun comedy. [Full review in Spanish],Daddy's Home (2015)
