critic_id,critic_meter_score,critic_rating,movie_id,movie_review_blurb,movie_title
alberto-abuin,fresh,,may_god_forgive_us,"One of those films with well assimilated influences and a universe of its own. Sorogoyen has managed to overcome the blissful, and annoying tag ""doesn't look Spanish"". [Full review in Spanish]",May God Forgive Us (Que Dios nos perdone) (2016)
alberto-abuin,fresh,,tokyo_drifter,"A piece to worship that, even today, continues to challenge the viewer. [Full review in Spanish]",Tokyo Drifter (1966)
alberto-abuin,fresh,,bonnie_and_clyde,"'Bonnie and Clyde' moves between comedy and drama, making an energetic portrait of an America sunk in the depression, made in another vital period, in which the cinema changed to forced marches. [Full review in Spanish]",Bonnie and Clyde (1967)
alberto-abuin,fresh,,shane,"A film that continues to maintain its condition of unscathed classic, although it has its detractors. [Full review in Spanish]",Shane (1953)
alberto-abuin,rotten,,ambush-at-cimarron-pass,"A presumably tense story as the protagonists are without horses and harassed at all times by indians, but never manages to transmit that danger. [Full review in Spanish]",Ambush at Cimarron Pass (1958)
alberto-abuin,rotten,,i_am_a_hero,It isn't a bad movie and it's well aware of its limitations but falls into repetition and has remarkable rhythm downturns. [Full review in Spanish],I Am a Hero (2015)
alberto-abuin,fresh,,the_discovery_2017,A science fiction film that starts from a very interesting premise: what is behind death. [Full review in Spanish],The Discovery (2017)
alberto-abuin,fresh,,the_bye_bye_man,"A waste of time that, given its end, and taking into account its economic results, it's very likely to have a continuation. [Full review in Spanish]",The Bye Bye Man (2017)
alberto-abuin,rotten,,aftermath_2017,"Flat characters and full of clichés. A story that, except for its narrative structure, tries to focus on the human side, opting for the easy way, perhaps not to defraud a viewer. [Full review in Spanish]",Aftermath (2017)
alberto-abuin,fresh,,realive,"A story of impossible love, like the great stories of love in cinema, which also doesn't deserve anonymity. [Full review in Spanish]",Realive (2017)
alberto-abuin,fresh,,get_out,Peele plays a risky move using the film genre to establish a very real terror that usually faces hypocrisy. [Full review in Spanish],Get Out (2017)
alberto-abuin,fresh,,spanish_main,"A classic (sub) genre that has betrayals, fight sequences, beloved secondary characters, some comic detail and an impeccable rhythm. [Full review in Spanish]",The Spanish Main (1945)
alberto-abuin,rotten,,street_people,"A very badly finished film, as if they were expected to make a sequel, something that they could never dream of because of their crashing failure. [Full review in Spanish]",Street People (1976)
alberto-abuin,fresh,,dont_breathe_2016,'Don't Breathe' is a film that deserves to be treated as a fundamental title in horror genre films. [Full review in Spanish],Don't Breathe (2016)
alberto-abuin,fresh,,the_innocents_2016,An estimable film in spite of an end that pleads too much for hope. [Full review in Spanish],The Innocents (Les innocentes) (2016)
alberto-abuin,rotten,,last_tango_in_paris,A film that loses all interest and is even quite unbearable when Brando is not on screen. [Full review in Spanish],Last Tango in Paris (1972)
alberto-abuin,fresh,,st_vincent,"The cast raise the film to a considerable height, especially Bill Murray and Jaeder Lieberher, who has a surprising naturalness for a child of that age. [Full review in Spanish]",St. Vincent (2014)
alberto-abuin,fresh,,the_keeping_room,"At times the film approaches pure horror, shocking the audience and making it expectant of what can happen next. [Full review in Spanish]",The Keeping Room (2015)
alberto-abuin,fresh,,the_fury_of_a_patient_man,"A movie that comes from the heart, and gets deep inside. [Full review in Spanish]",The Fury of a Patient Man (Tarde para la ira) (2016)
alberto-abuin,fresh,,el_hombre_de_las_mil_caras,"A solid, entertaining and enjoyable film with impeccable performances and great directing. [Full review in Spanish]",El hombre de las mil caras (2016)
alberto-abuin,fresh,,the_magnificent_seven_2016,An unnecessary film but with will make you have a good time. The audacity to redo an already excellent film doesn't bother much. [Full review in Spanish],The Magnificent Seven (2016)
alberto-abuin,fresh,,man_of_a_thousand_faces,"'Man of a thousand faces' draws the figure of a myth, showing that you can get to the true essence of something, or someone, without being true to facts. [Full review in Spanish]",Man of a Thousand Faces (1957)
alberto-abuin,fresh,,the_infiltrator,"'The Infiltrator' manages to entertain in its two long hours of duration, while exposing things that we have already seen thousands of times. [Full review in Spanish]",The Infiltrator (2016)
alberto-abuin,fresh,,600_miles,"A film that constantly questions several issues like law, arm trafficking and a greater evil: the ease of getting them in the United States. [Full review in Spanish]",600 Miles (2015)
alberto-abuin,fresh,,les_cowboys,"A drama where the echoes of western are clear and puts on the table, once again, the futility of the system in a kidnapping case. [Full review in Spanish]",Les Cowboys (2016)
alberto-abuin,fresh,,sing_street,"A nostalgic film about dreams, illusion, falling in love, wanting to discover the world, write love songs and running away with your loved one. [Full review in Spanish]",Sing Street (2016)
alberto-abuin,fresh,,1095636-story_of_gi_joe,"A desolating masterpiece from beginning to end, like any war is. [Full review in Spanish]",The Story of G.I. Joe (1945)
alberto-abuin,fresh,,elle_2016,"A film that has a precise rhythm, a great combination of genres and an extreme moral hardness that doesn't judge anyone. [Full review in Spanish]",Elle (2016)
alberto-abuin,fresh,,veteran_2015,"A film that saves the best for the last, going from being a detective comedy to drama. [Full review in Spanish]",Veteran (2015)
alberto-abuin,rotten,,skiptrace,Doesn't even brings something new to eastern thrillers or tries to offer a modern look on buddy movies. [Full review in Spanish],Skiptrace (2016)
alberto-abuin,fresh,,my_dear_killer,"An unforgettable film with an outstanding soundtrack where its director, Valerii, was brilliant doing what something that no one expected. [Full review in Spanish]",Mio caro assassino (My Dear Killer) (1972)
alberto-abuin,fresh,,baskin,"A film that is like a trip to hell. Even though its plot seems to deflate a bit, the final part becomes a catharsis of terror. [Full review in Spanish]",Baskin (2016)
alberto-abuin,fresh,,ikarie_xb1,"A very interesting film, like a journey towards hope through madness and death, with a very consistent ending. [Full review in Spanish]",Ikarie XB1 (Icarus XB 1) (1964)
alberto-abuin,rotten,,mechanic_resurrection,"'Mechanic: Resurrection' is a narrative loop, with (supposedly) spectacular scenes that run out of fun from the beginning. [Full review in Spanish]",Mechanic: Resurrection (2016)
alberto-abuin,fresh,,hatchet-for-the-honeymoon-1969,"A horror film that turns giallo subgenre around, making it something ""new"". [Full review in Spanish]",Hatchet for the Honeymoon (Il rosso segno della follia) (1970)
alberto-abuin,fresh,,the_neon_demon,Vampire witches eager for eternal beauty take over the most twisted film of its director. [Full review in Spanish],The Neon Demon (2016)
alberto-abuin,fresh,,my_name_is_nobody,A classic film with a stunning soundtrack and a pretty magnetic and elegiac personality. [Full review in Spanish],My Name Is Nobody (Il mio nome è Nessuno) (1973)
alberto-abuin,fresh,,arrival_2016,"A film that speaks of opening the mind to understand others. A universal message more necessary than ever. The film comes at the right time, when it seems that we're sinning of an enormous susceptibility. [Full review in Spanish]",Arrival (2016)
alberto-abuin,fresh,,love_and_friendship,"A film that gains interest because of Tom Bennett's presence, the perfect character for a story full of gossip, appearances and hidden interests. [Full review in Spanish]",Love & Friendship (2016)
alberto-abuin,fresh,,1008391-glass_menagerie,A film where Newman's staging and Henry Mancini's nostalgic soundtrack truly stands out. [Full review in Spanish],The Glass Menagerie (1987)
alberto-abuin,fresh,,the_accountant_2016,"A film that can be entertaining, mainly because Gavin O'Connor already had demonstrated that he can make good movies with ridiculous premises and here confirms that ability. [Full review in Spanish]",The Accountant (2016)
alberto-abuin,rotten,,fat_man_and_little_boy,"A boring film that fails to transcend from its basic idea, remaining as a story without too much tell about that small group, and how it affects their work to their respective personal lives. [Full review in Spanish]",Fat Man and Little Boy (1989)
alberto-abuin,fresh,,jack_reacher_never_go_back,A conventional movie that doesn't really have everything in its favor but it offers a more personal look of its hero. [Full review in Spanish],Jack Reacher: Never Go Back (2016)
alberto-abuin,rotten,,rendezvous_2016,"A film that has no life, not even a second of the plot is interesting. [Full review in Spanish]",Rendezvous (2016)
alberto-abuin,fresh,,benavidezs_case,A film difficult to categorize with a story that has disturbing images and moments. [Full review in Spanish],Benavidez's Case (La valija de Benavidez) (2016)
alberto-abuin,fresh,,sully,"Eastwood's most optimistic film, narrated with an astonishing skill and has a great cast. [Full review in Spanish]",Sully (2016)
alberto-abuin,fresh,,two_thousand_maniacs,"A film considered essential by many filmmakers who clearly inspired in it to compose their horror symphonies, with a delusional premise and daring situations. [Full review in Spanish]",Two Thousand Maniacs! (1964)
alberto-abuin,rotten,,captain_kronos_vampire_hunter,A film with laughable dialogues and some awkwardness in its staging. [Full review in Spanish],Captain Kronos - Vampire Hunter (1974)
alberto-acuna,rotten,2/5,margarita_with_a_straw,"Contrary to what recent films that take on the same themes with a lot more honesty, Margarita with a Straw feels manufactured to perfection with a main character with no flaws. [Full review in Spanish]",Margarita with a Straw (2016)
alberto-acuna,fresh,,mexico_barbaro,México Bárbaro will definitely become the cornerstone for Mexican horror and will open the door to new filmmakers in the genre. [Full review in Spanish],Mexico Bárbaro (2014)
alberto-acuna,rotten,2/5,ghoul_2015,"It's time to accept that the ""based on a true story"" legend is completely meaningless. [Full review in Spanish]",Ghoul (2015)
alberto-acuna,fresh,,the_chosen_ones_2015,A brilliant and crude portrait of how prostitution rings work in Mexico and how this has become a sad part of a reality of everyday life. [Full review in Spanish],The Chosen Ones (Las elegidas) (2015)
alberto-acuna,fresh,,atroz_2015,Lex Ortega exploits in a smart way the traits of the sub-genre like the shaky cam or low fidelity to make the gore effects much better and believable. [Full review in Spanish],Atroz (Atrocious) (2015)
alberto-acuna,rotten,2/5,la_vida_despues,"The billionth road trip movie that Mexican cinema has produced (military outposts, abandoned towns, drunken confessions in the carn fights and a photo album to ground us in reality included). [Full review in Spanish]",La vida después (2013)
alberto-acuna,fresh,3/5,retribution_2015,"Even though the formula sounds familiar, the subtext of the social struggles in the labor crisis in Spain add much more value to this film. [Full review in Spanish]",Retribution (El Desconocido) (2015)
alberto-acuna,fresh,,rezeta,Rezeta is a strange film that sways between the most pleasing romantic comedy and hard drama. [Full review in Spanish],Rezeta (2012)
alberto-acuna,fresh,,the_incident_2014,A unique and visionary film debut with a disturbing premise... [Full review in Spanish],The Incident (El Incidente) (2014)
alberto-acuna,fresh,4/5,elvira_i_will_give_you_my_life_but_im_using_it,It achieves to impose the director's own dramatic and visual style with a lot of personality. [Full review in Spanish],"Elvira, I Will Give You My Life But I'm Using It (Elvira, te daría mi vida pero la estoy usando) (2015)"
alberto-acuna,fresh,3/5,san_andreas,Disaster porn suitable only for fans of the genre. [full review in Spanish],San Andreas (2015)
alberto-acuna,rotten,,familia_gang,Proof that these type of films no longer have a place in modern day cinemas. [Full review in Spanish],Familia Gang (2015)
alberto-acuna,rotten,,5_flights_up,It shows two actors (Keaton and Freeman) who don't even make the slightest effort to get out of their comfort zone. [full review in Spanish],5 Flights Up (2015)
alberto-acuna,fresh,3/4,stockholm,"Spanish director Rodrigo Sorogoyen flips the classic formula of boy meets girl, and ventures intelligently in inserting it within the grounds of the closet spaced thriller. [full review in Spanish]",Stockholm (2013)
alberto-acuna,fresh,3/4,beyond_the_reach,The director makes the confrontation interesting and factual because he makes the best use of the environment and landscape. [full review in Spanish],Beyond The Reach (2015)
alberto-acuna,fresh,,gett_the_trial_of_viviane_amsalem,"Shlomi Elkabetz and his sister develop a strong narrative, free of melodrama. [full review in Spanish]",GETT: The Trial of Viviane Amsalem (2015)
alberto-acuna,fresh,4/5,gueros,"Risky, fresh, irreverent and visually clever. [full review in Spanish]",Güeros (2015)
alberto-acuna,rotten,,navajazo,It definitely represents the worst of documentary cinema. [full review Spanish],Navajazo (2014)
alberto-acuna,fresh,,en_el_ultimo_trago,The filmmaker show us that he knows his comedy.,En el último trago (One for the Road) (2014)
alberto-acuna,rotten,1/5,el_cumple_de_la_abuela,It resumes into a bunch of sketches coming and going to deliver puns and continue rolling gags. [Full review in Spanish],El cumple de la abuela (2015)
alberto-acuna,fresh,3/5,tiempos_felices_2015,"Features a beautiful performance by Cassandra Ciangherotti as our own Manic Pixie Dream Girl, great humor, a smart premise, and an awesome soundtrack. [Full review in Spanish]",Tiempos Felices (2015)
alberto-acuna,rotten,1/5,chapo_el_escape_del_siglo,A failed thesis about the privatization of cocaine in the U.S. [Full review in Spanish],Chapo: El Escape del Siglo (2016)
alberto-acuna,rotten,,atl_tlachinolli,"It synthesizes the worst aspects of the genre, even making it exploitation of sorts to force a point across. [Full review in Spanish]",Atl Tlachinolli (2015)
alberto-acuna,fresh,3/5,plastic_2014,"Plastic isn't an instant classic mainly because of its visual style, sometimes more in touch with an electronic music video than a film. [Full review in Spanish]",Plastic (2014)
alberto-acuna,fresh,3/5,mad_max_fury_road,"It's not the masterpiece that people prematurely announced, but it's deffinately one of the best films of 2015. [Full review in Spanish]",Mad Max: Fury Road (2015)
alberto-acuna,rotten,2/5,the_beginning_of_time,Their actions and dialogues ending up being redundant. [Full review in Spanish],The Beginning of Time (El comienzo del tiempo) (2014)
alberto-acuna,rotten,2.5/5,the_program,It's a shame Frears didn't fully approach the character and its subjects as expected. [Full review in Spanish],The Program (2016)
alberto-acuna,fresh,,leaf_blower,"It has some tone variations going to the final third of the film, but the honest humor and great interactions between the actors work as a great counterweight for it. [Full review in Spanish]",Leaf Blower (Sopladora de Hojas) (2015)
alberto-acuna,fresh,,el_charro_de_toluquilla,A demythification of the mexican macho figure. [Full review in Spanish],El Charro de Toluquilla (2016)
alberto-acuna,rotten,2/5,correspondence_2016,It never quite finds the type of movie it wants to be. [Full review in Spanish],Correspondence (La corrispondenza) (2016)
alberto-acuna,fresh,,schneider_vs_bax,"Alex van Warmerdam knows how to play with your expectations with lots of acid humor and a tone that takes you by surprise, making good use of the cliches in the genre. [Full review in Spanish]",Schneider vs. Bax (2015)
alberto-acuna,fresh,,love_and_peace_2015,It's easy to tell the creative force and imagination of the Japanese director hasn't been lost. [Full review in Spanish],Love & Peace (2015)
alberto-acuna,fresh,,maquinaria_panamericana,"It explores the middle class of Mexico with great narrative rhythm, humor and avoids being condescending at all costs. [Full review in Spanish]",Maquinaria Panamericana (2016)
alberto-acuna,fresh,,semana_santa,The filmmaker manages to capture perfectly and naturally the awkwardness of every situation she presents. [Full review in Spanish],Semana Santa (2015)
alberto-acuna,fresh,,ten_no_chasuke,A very smart and meta film. [Full review in Spanish],Ten no Chasuke (Chasuke's Journey) (2015)
alberto-acuna,fresh,2.5/5,marguerite,"An irregular tale about frustration, loneliness and lies. [Full review in Spanish]",Marguerite (2016)
alberto-acuna,fresh,,plaza_de_la_soledad_2016,"Plaza de la Soledad isn't focused on the profession these women have, it's focused on showing us their most intimate and personal moments. [Full review in Spanish]",Plaza de la Soledad (2016)
alberto-acuna,rotten,,the_man_who_saw_too_much,Many themes are touched superfluosly making the main character dissapear in the mess. [Full review in Spanish],The Man Who Saw Too Much (2015)
alberto-acuna,fresh,,bellas_de_noche_2016,"Making use of priceless archive footage, we find touching confessions, the charm, the extravagant memories and stories of sex symbols to reflect on the fragility of beauty and fame.... [Full review in Spanish",Bellas de Noche (2016)
alberto-acuna,fresh,,tempestad,"Making use of great camera work, Huezo rescues the stories of two women linked to human trafficking rings. [Full review in Spanish]",Tempestad (2016)
alberto-acuna,rotten,1/5,backtrack_2016,Seems like writer/director Michael Petroni never really understood how the film he references actually work. [Full review in Spanish],Backtrack (2016)
alberto-acuna,fresh,2.5/5,un_peu_beaucoup_aveuglement,"If this romantic comedy works in spite of having every cliché in the book, it's because it respects the one rule of the genre: there's chemistry between the leads at all times. [Full review in Spanish]","Blind Date (Un peu, beaucoup, aveuglément) (2015)"
alberto-acuna,rotten,1/5,gods_of_egypt,Far behind are the times where Proyas used comic book and noir film aesthetics. [Full review in Spanish],Gods Of Egypt (2016)
alberto-acuna,rotten,,julieta_2016,Adriana Ugarte and Emma Suárez are the only spark of life in this dull film. [Full review in Spanish],Julieta (2016)
alberto-acuna,rotten,2/5,busco_novio_para_mi_mujer,"A bad remake with zero innovations, almost replicating every frame in a poor manner and bad comedic timming. [Full review in Spanish]",Busco Novio Para Mi Mujer (2016)
alberto-bermejo,fresh,,the_dancer_2016,An uneven film but full of fascinating moments that recreates a superhuman eagerness to overcome. [Full review in Spanish],The Dancer (La danseuse) (2016)
alberto-bermejo,fresh,,el_destierro,An intense story turned into an exercise of narrative virtuosity within the reach of very few. [Full review in Spanish],El destierro (2015)
alberto-bermejo,fresh,,aloys_2016,"The director describes the story in a dry and extremely precision, turning over its protagonist. [Full review in Spanish]",Aloys (2016)
alberto-bermejo,fresh,,gimme_danger,"A documentary of a singer who has reinvented rock, and that it will please the unconditional fans. [Full review in Spanish]",Gimme Danger (2016)
alberto-bermejo,rotten,,anthropoid,"A film that relies on a competent cast, but suffers from a rather simplistic look at the murderous ferocity of the Nazis and paints its soldiers as a large bunch of incompetent robots. [Full review in Spanish]",Anthropoid (2016)
alberto-bermejo,fresh,,love_and_friendship,"An agile and funny story, with a simple but effective atmosphere. [Full review in Spanish]",Love & Friendship (2016)
alberto-bermejo,fresh,,loving_2016,A concentrated story with an impeccable staging and the dazzling interpretation of Joel Edgerton and Ruth Negga. [Full review in Spanish],Loving (2016)
alberto-bermejo,rotten,,its_only_the_end_of_the_world,"With this film, Dolan seems less inspired with a cast that only manages to get an irregular game. [Full review in Spanish]",It's Only the End of the World (Juste la fin du monde) (2016)
alberto-bermejo,fresh,,frantz,An aesthetic pleasure as a wrapping of an intense drama of unequivocally anti-war intentions. [Full review in Spanish],Frantz (2017)
alberto-bermejo,fresh,,the_red_turtle,"A hypnotic story, risky and overflowing with sensitivity that arouses curiosity, tension, surprise, admiration, empathy or emotion. [Full review in Spanish]",The Red Turtle (La tortue rouge) (2017)
alberto-bermejo,fresh,4/5,death_in_sarajevo,"A film where the director formulates a suggestive, lucid and torn diagnos about an Europe loaded with the past but apparently paralyzed. [Full review in Spanish]",Death in Sarajevo (2016)
alberto-bermejo,rotten,2/5,the_birth_of_a_nation_2016,"Dramatically shocking, it resorts to a bloody hyperrealism that can be understood as documentary rigor but also as an effective and simplistic manipulative mechanism. [Full review in Spanish]",The Birth of a Nation (2016)
alberto-bermejo,fresh,,after_love,A painful story that portrays a couple trying to survive its broken emotional wreck. [Full review in Spanish],After Love (L'économie du couple) (2017)
alberto-bermejo,fresh,,the_innocents_2016,An austere film that portrays a very illustrative episode of history. [Full review in Spanish],The Innocents (Les innocentes) (2016)
alberto-bermejo,fresh,3/5,the_here_after,"A film where Magnus von Horn built an overwhelming universe, observed by a distant camera that emphasizes the hardness of the behaviors and maintains neutral position about moral judgments and understanding. [Full review in Spanish]",The Here After (Efterskalv) (2017)
alberto-bermejo,fresh,,il_nome_del_figlio,Bittersweet fun. [Full review in Spanish],Il nome del figlio (An Italian Name) (2015)
alberto-bermejo,fresh,2/5,the_magnificent_seven_2016,A film with an endless gunshot salad in the middle of it resulting in an exhausting experience. [Full review in Spanish],The Magnificent Seven (2016)
alberto-bermejo,fresh,3/5,fences_2016,A gritty drama about frustration and racial determinism in which Washington stands as the overall responsibility. [Full review in Spanish],Fences (2016)
alberto-bermejo,fresh,3/5,fatima_2016,"A generational portrait full of humanity, of kind vocation and formally sober. [Full review in Spanish]",Fatima (2016)
alberto-bermejo,rotten,,god_willing_2015,"The first part works but then it slowly becomes propaganda, making it feel too artificial. [Full review in Spanish]",God Willing (Se Dio Vuole) (2015)
alberto-bermejo,fresh,2/4,arabian_nights_volume_3_the_enchanted_one,A colorful interpretation of the Portuguese crisis seen through a fantasy lens. [Full review in Spanish],"Arabian Nights: Volume 3, the Enchanted One (As Mil e Uma Noites: Volume 3, O Encantado) (2015)"
alberto-bermejo,fresh,3/5,marguerite,An exciting story transformed into a romantic comedy of sorts with some surreal moments. [Full review in Spanish],Marguerite (2016)
alberto-bermejo,rotten,2/5,the_dressmaker,"A weird, incoherent, and unsettling tale that is really just a bunch of crazy and eccentric stories. [Full review in Spanish]",The Dressmaker (2016)
alberto-bermejo,fresh,3/5,the_trip_to_italy_2014,"A culinary journey through the beautiful Italian geography, mired in an irrepressible chattering where Byron or Shelley's poems are recited. [Full review in Spanish]",The Trip To Italy (2014)
alberto-bermejo,fresh,,peace_to_us_in_our_dreams_2015,A slow burn film that explores the mysteries of human nature. [Full review in Spanish],Peace to Us in Our Dreams (2015)
alberto-bermejo,fresh,4/5,coming_home_2014,"A slow, emotional and sensible tale that showcases the narrative abilities of it's director. Full review in Spanish]",Coming Home (2015)
alberto-bermejo,fresh,3/5,elvis_and_nixon_2016,A funny and speculative comedy with an historical context. [Full review in Spanish],Elvis & Nixon (2016)
alberto-bermejo,fresh,3/5,i_am_nojoom_age_10_and_divorced,A drama with an entertaining plot and semi-documentary characteristics that points out a horrible situation. [Full review in Spanish],"I Am Nojoom, Age 10 And Divorced (2014)"
alberto-bermejo,rotten,2/5,petes_dragon_2016,"There's no animation or musicals, just an uninspired dragon. [Full review in Spanish]",Pete's Dragon (2016)
alberto-bermejo,fresh,3/5,suburra_2015,An effective thriller structured from a soft ensemble story. [Full review in Spanish],Suburra (2015)
alberto-bermejo,rotten,2/5,the_wild_life,"A film that reproduces the recipe for a more commercial cinema for adults, adapted to children's profitable market. [Full review in Spanish]",The Wild Life (2016)
alberto-bermejo,fresh,3/5,janis_little_girl_blue,An interesting exploration of Janis Joplin's complex life on and off stage. [Full review in Spanish],Janis: Little Girl Blue (2015)
alberto-bermejo,fresh,,born_in_syria,"A documentary in which the director takes the children's point of view, the innocent and less politicized victims. [Full review in Spanish]",Born in Syria (Nacido en Siria) (2016)
alberto-bermejo,fresh,3/5,on_body_and_soul,Apparently simple but with complexity. [Full Review in Spanish],On Body and Soul (A Teströl és Lélekröl) (2018)
