critic_id,critic_meter_score,critic_rating,movie_id,movie_review_blurb,movie_title
adam-starkey,fresh,4/5,star_wars_the_last_jedi,"It feels fresh, exciting and playful, without losing the operatic grandeur Star Wars thrives upon.",Star Wars: The Last Jedi (2017)
adam-starkey,fresh,3/5,kingsman_the_golden_circle,"It's still a thrilling ride with action sequences unmatched in their high-velocity blasts, but the new additions struggle to conceal the familiarity beneath this secret service.",Kingsman: The Golden Circle (2017)
adam-starkey,fresh,4/5,the_lego_batman_movie,"Spin-off Lego Batman similarly shouldn't work, with Batman's overcompensating 'bro' jibes working perfectly as a funny sideshow, but his standalone venture has become perhaps the greatest exploration of the Caped Crusader yet.",The Lego Batman Movie (2017)
adam-starkey,rotten,2/5,kong_skull_island,"This is a generic, tonally awkward monster showcase which forgets about both charm and heart, in its humans and King Kong himself.",Kong: Skull Island (2017)
adam-starkey,fresh,3/5,the_fate_of_the_furious,"It's a loud, carefree blockbuster which knows exactly what its audience wants.",The Fate of the Furious (2017)
adam-starkey,fresh,4/5,raw_2017,"Its tonal combination won't be for everyone, but for those who roll with its depravity and perverse humour, you'll find one of the most memorable and wickedly brilliant film experiences of the year.",Raw (2017)
adam-starkey,fresh,3/5,ghost_in_the_shell_2017,"While the original film coated this main thread with complex philosophical concepts about morality, this version makes fleeting references without exploring these ideas.",Ghost in the Shell (2017)
adam-sternbergh,rotten,2/4,bad_boys_ii,"This kind of film should feel like a fun summer romp. But at almost two and a half hours, Bad Boys II feels more like a fun summer romp followed by a mugging, followed by a chemistry exam.",Bad Boys II (2003)
adam-sternbergh,rotten,2.5/4,mona_lisa_smile,It's a movie that gets to rail against injustice without making anyone in the audience feel the slightest bit uncomfortable.,Mona Lisa Smile (2003)
adam-sternbergh,fresh,2.5/4,chasing_liberty,"It's light, airy fun, with the cheery snap of bubblegum and the proficiency of a well-turned sitcom.",Chasing Liberty (2004)
adam-sternbergh,fresh,2.5/4,along_came_polly,Unfolds with brisk professionalism and enough smiles to keep you engaged.,Along Came Polly (2004)
adam-sternbergh,fresh,3.5/4,1128577-peter_pan,"The promotional tag line promises a Peter Pan like you've never seen before, and that's true. But moreover, this feels like Peter Pan as it always should have been done.",Peter Pan (2003)
adam-sternbergh,fresh,4/4,my_architect,A rough-hewn film that's studded with lyrical provocations and moments of the purest beauty.,My Architect (2004)
adam-sternbergh,rotten,1.5/4,twisted,Hardly makes any sense at all.,Twisted (2004)
adam-sternbergh,rotten,2.5/4,dawn_of_the_dead,"The remake shows all the guts of the original, but there's not a glimpse of its brains or its heart.",Dawn of the Dead (2004)
adam-sternbergh,fresh,,kamikaze_89,It's completely bonkers and entirely charming.,Kamikaze '89 (1983)
adam-sternbergh,rotten,2/4,50_first_dates,Feels like an improv sketch that can't get off the ground because the performers keep cracking up and having to start over.,50 First Dates (2004)
adam-sweeting,rotten,2/5,the_girl_on_the_train_2016,"Despite a high-octane girl-power cast and the lustrous screenwriting reputation of Erin Cressida Wilson, this thing clanks along like the 3am milk train to Exeter sidings.",The Girl on the Train (2016)
adam-sweeting,fresh,3/5,free_state_of_jones,"A biblically bewhiskered, burning-eyed McConaughey rises to the occasion, inspiring his compatriots with fluent rhetoric which is all the more persuasive for being delivered in the actor's mellifluous, musical Southern tones.",Free State of Jones (2016)
adam-sweeting,fresh,3/5,the_magnificent_seven_2016,"Maybe it's impossible to make classic Westerns any more. We'd probably need to unlearn lots of stuff we think we know first. This isn't one, but it would certainly fill some time on a long flight, or on your iPad in the middle of a sleepless night.",The Magnificent Seven (2016)
adam-sweeting,rotten,2/5,the_girl_with_all_the_gifts,Director Colm McCarthy hasn't generated enough filmic propulsion to lift it out of the deep wheel-ruts left by its numerous antecedents.,The Girl With All the Gifts (2017)
adam-sweeting,fresh,4/5,hell_or_high_water,The plot functions with lean efficiency... but the real purpose of screenwriter Taylor Sheridan and director David Mackenzie is to evoke an American south-west that time forgot.,Hell or High Water (2016)
adam-sweeting,rotten,2/5,jason_bourne,It feels like the film is searching for reasons to be relevant rather than being driven by any urgent imperatives of its own.,Jason Bourne (2016)
adam-sweeting,fresh,4/5,star_trek_beyond,"This is the third of the rebooted new generation Star Treks, and ultimately leaves you with the feeling that the intrepid crew of the starship Enterprise continue to boldly go, but still haven't quite arrived.",Star Trek Beyond (2016)
adam-sweeting,rotten,2/5,the_legend_of_tarzan,Not even the great Sam Jackson can single-handedly pump all the water out of this sinking ship.,The Legend of Tarzan (2016)
adam-sweeting,fresh,4/5,elvis_and_nixon_2016,"This is a movie that just works, and it's a joy.",Elvis & Nixon (2016)
adam-sweeting,fresh,4/5,blood_father,"Having been to Hollywood hell and back, Mel Gibson is perfectly placed to play the battered big daddy par excellence.",Blood Father (2016)
adam-sweeting,fresh,4/5,nerve_2016,"Nerve is a moral fable for the social media era, and a Cinderella story that turns into The Hunger Games. Luckily, it's much more fun than that makes it sound.",Nerve (2016)
adam-sweeting,fresh,4/5,a_monster_calls,J A Bayona has conjured a bittersweet and often painfully moving account of bereavement and growing up.,A Monster Calls (2017)
adam-sweeting,rotten,3/5,lion_2016,"Obviously an extraordinary experience for the real-life protagonists, but for the movie viewer not so much.",Lion (2016)
adam-sweeting,fresh,5/5,manchester_by_the_sea,"It oozes foreboding, yet Lonergan also conjures episodes of reviving wit.",Manchester by the Sea (2016)
adam-sweeting,fresh,4/5,snowden,"Gordon-Levitt is pitch perfect in the title role, gradually revealing the steely inner core behind his nerd-like exterior, and skilfully evoking Snowden's process of disillusionment as he sees more and more of the skull beneath the skin of his homeland.",Snowden (2016)
adam-sweeting,fresh,4/5,the_birth_of_a_nation_2016,This is vivid and unsettling film-making.,The Birth of a Nation (2016)
adam-sweeting,fresh,3/5,arrival_2016,"All this theoretical stuff is offset by some nicely unfussy performances... Still, the flick could use a little less conversation and a little more action.",Arrival (2016)
adam-sweeting,fresh,5/5,their_finest_2017,Huge fun.,Their Finest (2017)
adam-sweeting,rotten,2/5,brimstone_2017,"A hideous farrago of sadism, misogyny and sexual perversion. With more than a dash of pretension.",Brimstone (2017)
adam-sweeting,fresh,3/5,star_trek_into_darkness,"Into Darkness is an enjoyably solid effort, but it suffers from a lack of the innovation and inspiration of its predecessor (or indeed of Abrams's best work on TV).",Star Trek Into Darkness (2013)
adam-sweeting,fresh,3/5,the_wailing,"Farce frequently threatens to intervene, but the thunderous shamanistic rituals give you your money's worth.",The Wailing (Goksung) (2016)
adam-sweeting,fresh,3/5,ouija_origin_of_evil,This movie would be ideal for a Halloween night drive-in.,Ouija: Origin of Evil (2016)
adam-sweeting,rotten,2/5,jack_reacher_never_go_back,"Nothing quite gels in his portrayal of the rootless, apparently emotionless Reacher, possibly because there's no real substance in the way it's written. He rights wrongs. He trashes villains. Then he hitches a ride into the distance.",Jack Reacher: Never Go Back (2016)
adam-sweeting,fresh,4/5,everest_2015,"I don't usually suffer from chattering teeth and attacks of vertigo while watching a movie, but as this panorama of Himalayan disaster reached its climax I began to fear that I might need paramedics and an emergency evacuation.",Everest (2015)
adam-sweeting,fresh,3/5,a_united_kingdom,"It's an amazing real-life tale, and the brutal realpolitik underpinning it... still carries powerful resonance.",A United Kingdom (2017)
adam-sweeting,rotten,2/5,warcraft,"At the end of the day though, it's what it is -- a big-budget commercial franchise spun off from a computer game. After two hours it doesn't really end, it just sets up the next installment.",Warcraft (2016)
adam-sweeting,fresh,4/5,a_bigger_splash_2016,"While the pain is real enough, Guadagnino lightens the load with irony and black humour.",A Bigger Splash (2016)
adam-sweeting,fresh,5/5,captain_america_civil_war,"Funny, sad, satirical, spectacular... this is that rare blockbuster that proves that more can be more.",Captain America: Civil War (2016)
adam-sweeting,fresh,,gone_girl,"It's long at 145 minutes, but it needed space to accommodate its titillating mix of police procedural, whodunnit, social satire and psychological drama.",Gone Girl (2014)
adam-sweeting,fresh,3/5,the_gunman_2015,"This is a watchable thriller with enough all-action set pieces to carry you along, particularly a lengthy sequence in the Barcelona bullring.",The Gunman (2015)
adam-sweeting,fresh,3/5,the_voices,Ryan Reynolds shines in Marjane Satrapi's surreal portrait of an American psycho.,The Voices (2015)
adam-sweeting,fresh,,captain_america_the_first_avenger,"As summer blockbusters go, it's a notch or two above average.",Captain America: The First Avenger (2011)
adam-sweeting,rotten,2/5,mad_max_fury_road,"If you're a hardcore computer gamer inured to marathon sessions of annihilation while being pulverised by Death Metal from wall-to-wall speaker stacks, this may be the movie for you. For myself, not so much.",Mad Max: Fury Road (2015)
adam-sweeting,fresh,5/5,skyfall,"This is a terrific James Bond movie, thoughtfully written, shrewdly cast and taking stock of everything that the 50-year-old franchise has come to mean. But even if it wasn't a Bond film, it would still be darn good.",Skyfall (2012)
adam-sweeting,fresh,4/5,spectre_2015,"This isn't the perfect Bond. It's over-long at two and half hours, and there are intermittent longueurs before it finally gets all the afterburners firing for the concluding 45 minutes. But lots of it is great, too.",Spectre (2015)
adam-sweeting,fresh,4/5,steve_mcqueen_the_man_and_le_mans,"Even if you hate motor racing, The Man & Le Mans offers illuminating insights into McQueen's life and career.",Steve McQueen: The Man & Le Mans (2015)
adam-sweeting,rotten,1/5,love_the_coopers,"This would-be seasonal sackful of joy from director Jessie Nelson doesn't shrink from quoting It's a Wonderful Life, both visually and verbally. It's more like an SOS than a homage, though.",Love the Coopers (2015)
adam-sweeting,fresh,4/5,black_mass_2015,"Black Mass moves like a heavyweight, and when Cooper lands his punches they hurt. I can't imagine it's going to do much for the South Boston tourist trade, though.",Black Mass (2015)
adam-sweeting,fresh,4/5,joy_2014,"Despite its sheen of fairy-dust, much of Joy is about the brutal obstacle course of American capitalism, permanently poised to asset-strip the unwary.",Joy (2015)
adam-sweeting,fresh,3/5,black_sea,"It's a tense and watchable tale but without any real surprises, and demands that you drown a little too much of your disbelief.",Black Sea (2015)
adam-sweeting,fresh,4/5,mission_impossible_rogue_nation,"Perhaps it's a shade lighter on the mind-warping trickery-within-chicanery effects seen in previous Missions, but on the other hand the interplay between the characters achieves a lightness of touch rare in your average blockbuster.",Mission: Impossible Rogue Nation (2015)
adam-sweeting,fresh,4/5,far_from_the_madding_crowd_2014,"This is a fine story splendidly designed, performed and shot, and it will be fascinating to see who emerges clutching what on Oscar night.",Far From the Madding Crowd (2015)
adam-sweeting,fresh,4/5,mr_holmes,Mr Holmes is a quiet triumph whose ripples will keep washing over you long after you've left the cinema.,Mr. Holmes (2015)
adam-sweeting,fresh,4/5,the_big_short,"As an investigation of a bout of collective insanity which almost destroyed the civilised world, this is a ride worth taking.",The Big Short (2015)
adam-sweeting,fresh,5/5,the_revenant_2015,"As much as it's a tale of elemental violence and barbarity, it's also about the powerful motivating forces of love and loyalty.",The Revenant (2015)
adam-sweeting,fresh,3/5,the_survivalist_2017,"The Survivalist makes for austere viewing purged of any glimpse of levity, but Fingleton has eked out his limited resources with skill. His progress ought to be worth watching.",The Survivalist (2017)
adam-sweeting,fresh,3/5,the_accountant_2016,"You could forgive The Accountant most of its foibles if it didn't hinge on a late twist which can only be described as preposterous, and which fatally deflates the drama at a critical moment.",The Accountant (2016)
adam-sweeting,rotten,,london_has_fallen,"The get-the-President movie, a genre we might term ""POTUS in Peril"", has had a chequered history... but [London Has Fallen] adds almost nothing in the way of innovation or inspiration.",London Has Fallen (2016)
adam-sweeting,rotten,2/5,batman_v_superman_dawn_of_justice,They should have got Perry White to go through the script with his blue pencil.,Batman v Superman: Dawn of Justice (2016)
adam-sweeting,fresh,3/5,eddie_the_eagle,Eddie the Eagle might just tap into that teeming ocean of Saturday night punter-hood that lies somewhere between Mamma Mia! and Made in Dagenham.,Eddie The Eagle (2016)
adam-sweeting,fresh,3/5,midnight_special_2015,"Whatever it is, absorbing work from Shannon, Dunst, Driver and Edgerton ensures that it will hold your attention right up to the closing credits.",Midnight Special (2016)
adam-sweeting,rotten,3/5,the_take_2016,"It's entertaining enough if you stick your brain in ""Park"", but once the action stops you'll find your plate devoid of food for thought.",The Take (Bastille Day) (2016)
adam-sweeting,fresh,3/5,miles_ahead_2016,"See this movie for Cheadle's crackling performance and the musical content, not least a concluding comeback performance featuring the real Wayne Shorter and Herbie Hancock in Miles's band.",Miles Ahead (2016)
adam-sweeting,fresh,3/5,x_men_apocalypse,"While the rest of the film is lit up by a string of spectacular set-pieces, after two and a half hours, the concluding clash of the titans feels more like an obligation than a delight.",X-Men: Apocalypse (2016)
adam-sweeting,fresh,3/5,allied,"While it makes for a moderately amusing evening out, this World War Two espionage-romance caper doesn't stand up to a lot of scrutiny.",Allied (2016)
adam-sweeting,fresh,4/5,good_kill,The framework provides scope for some strong performances.,Good Kill (2015)
adam-sweeting,fresh,3/5,crash_and_burn_2016,"[Crash and Burn] puts vivid flesh on the story's bones with a plentiful stash of archive footage, a colourful bunch of talking heads, and plenty of opinionated input from Byrne himself.",Crash and Burn (2016)
adam-sweeting,fresh,4/5,a_fantastic_woman,Sebastian Lelio's story of a Spanish trans woman running a gauntlet of hostility and abuse from her dead lover's family cuts to the core of our expectations about equality or mere civilised behaviour.,A Fantastic Woman (Una mujer fantástica) (2018)
adam-sweeting,fresh,3/5,brigsby_bear_2017,Dave McCary's bizarre but endearing indy feature takes a potentially hideous tale of abduction and control and transforms it using the amazing healing powers of fantasy and creativity.,Brigsby Bear (2017)
adam-sweeting,rotten,2/5,1_2017,"Crude, violent and generally unpleasant tale about duelling biker gangs in Australia.",1% (2017)
adam-sweeting,fresh,4/5,blade_of_the_immortal,"It's gruelling, yet strangely refreshing.",Blade of the Immortal (Mugen no jûnin) (2017)
adam-sweeting,fresh,3/5,redoubtable,"Havanicius sprays his subject with acid wit, and will delight cinéastes with several cunning pastiches of Godard's film-making style, though it's difficult to imagine that the venerable auteur, now 86, will see the joke.",Redoubtable (Le redoutable) (2017)
adam-sweeting,fresh,3/5,my_generation_2017,"The story isn't exactly unfamiliar, but director David Batty has unearthed a treasure trove of contemporary footage, including heaps of excellent colour material, and the soundtrack is like a movie in itself.",My Generation (2017)
adam-sweeting,rotten,2/5,george_michael_freedom,"I tried to watch without prejudice, but in the end I felt I'd just been watching a supersized commercial.",George Michael: Freedom (2017)
adam-sweeting,fresh,4/5,ferrari_race_to_immortality,"This film isn't designed as a multiplex-buster, but anyone with a taste for motorsport history will find it irresistible.",Ferrari: Race to Immortality (2017)
adam-sweeting,rotten,2/5,blackhat,"Mann's problem is that, like other directors before him, he can't find a way to make cybercrime look very interesting on screen.",Blackhat (2015)
adam-sweeting,rotten,3/5,queen_and_country,"It feels like being dropped into series five of a long-running TV drama, where the characters keep doing pretty much what they've always done but you haven't been part of the journey.",Queen and Country (2015)
adam-sweeting,rotten,3/5,the_man_from_uncle,"Where the TV show's Robert Vaughn and David McCallum enjoyed an effortlessly bickering, bantering rapport, Cavill and Armie Hammer's Kuryakin look as if they've just been crated to the set by FedEx and have never met before.",The Man From U.N.C.L.E. (2015)
adam-sweeting,fresh,3/5,southpaw_2015,"Southpaw is always watchable, and visceral enough to let you temporarily overlook the holes and pitfalls, but it's frustrating because it could have been much more.",Southpaw (2015)
adam-sweeting,fresh,4/5,mi_5_2015,"Making the transition from long-arc TV series to 100-minute feature film is no simple matter, but they've accomplished it with some skill here.",MI-5 (Spooks: The Greater Good) (2015)
adam-sweeting,rotten,3/5,child_44,"You're left with the sense of a film attempting to say some ambitious things about a specific time in history and what a crushing totalitarian system can do to the human spirit, but the ""thriller"" part shrivels up along the way.",Child 44 (2015)
adam-sweeting,fresh,4/5,jupiter_ascending_2014,"Sprawling and over-long as it is, this is a movie with a good heart and a sense of humour.",Jupiter Ascending (2015)
adam-sweeting,rotten,2/5,coherence_2013,Coherence resembles a postgrad science project masquerading as drama.,Coherence (2014)
adam-sweeting,rotten,2/5,the_greatest_showman_2017,"Played with frantic energy and dentifrice-exhibiting bonhomie by Hugh Jackman, this Barnum is a feel-good character who exists in only two dimensions.",The Greatest Showman (2017)
adam-sweeting,fresh,5/5,mollys_game,Sorkin continues to enjoy himself hugely as the piece moves into its courtroom endgame.,Molly's Game (2018)
adam-sweeting,fresh,3/5,hostiles,"The best of Hostiles is powerful and memorable, its strengths amplified by Masanobu Takayanagi's haunting cinematography and Max Richter's score.",Hostiles (2018)
adam-sweeting,rotten,2/5,eric_clapton_a_life_in_12_bars,"... the longer this one goes on, the less it has to say. Nor is it obvious why it has been made now.",Eric Clapton: A Life in 12 Bars (2017)
adam-sweeting,fresh,3/5,the_commuter,"It's formulaic and you can probably guess the ending, but it's a pacy, enjoyable thriller capable of laughing at itself.",The Commuter (2018)
adam-sweeting,fresh,4/5,the_shape_of_water_2017,"It's a film that doesn't want to be categorised, but it's no trouble at all to lose yourself in its swirling currents.",The Shape of Water (2017)
adam-sweeting,fresh,3/5,red_sparrow,"Many bluffs, feints and subterfuges are in store before the piece reaches its quite satisfying destination, mostly capably handled by its strong cast (even if they are doomed to speak with those preposterous pseudo-Slavic rolled ""r""s).",Red Sparrow (2018)
adam-sweeting,fresh,4/5,you_were_never_really_here,"It's a film distinguished by the force of its images and the compression of its narrative, and while its impact leaves you dazed, you can't quite believe that what you've just seen ever happened.",You Were Never Really Here (2018)
adam-sweeting,fresh,3/5,passengers_2016,"This isn't 2001: A Space Odyssey, or even The Martian, but it's an entertaining movie offering some chewy food for thought.",Passengers (2016)
adam-sweeting,fresh,4/5,journeys_end_2018,"Armed with a taut, uncluttered screenplay by Simon Reade and a splendid group of actors, Dibb evokes the terror and misery of the trenches without lapsing into preachiness or sentimentality.",Journey's End (2018)
adam-sweeting,fresh,4/5,ingrid_goes_west,This debut feature by Matt Spicer is a piercingly smart satire on the corrosive vapidity of social-media culture.,Ingrid Goes West (2017)
adam-sweeting,fresh,4/5,the_light_of_the_moon,"The Light of the Moon is the first feature by writer-director Jessica M Thompson, who has leveraged maximum value from her cast and a shoestring budget to create a low-key but potent sign-of-the-times bulletin.",The Light of the Moon (2017)
adam-sweeting,fresh,3/5,breathe_2017,"Most of the plaudits belong to Claire Foy, who brings a finely-judged mix of concern, compassion and bloody-minded determination to the role of Diana.",Breathe (2017)
adam-sweeting,fresh,3/5,live_by_night,"It's all fine, entertaining stuff, bookended with some rip-roaring set-pieces.",Live By Night (2017)
adam-sweeting,fresh,4/5,the_racer_and_the_jailbird,"Against the odds, it's a love affair for the ages, and the two charismatic leads successfully bring a haunting telepathy to their affair.",The Racer and the Jailbird (Le Fidèle) (2017)
adam-sweeting,fresh,3/5,hacksaw_ridge,"Gibson's film is clean, sober and shot through with a respectful piety, but somehow this scarcely believable story manages to feel a little flat and somewhat predictable.",Hacksaw Ridge (2016)
adam-sweeting,fresh,3/5,fences_2016,[Washington] has a terrific cast at his disposal.,Fences (2016)
adam-sweeting,fresh,3/5,the_founder,"Keaton vividly and remorselessly projects obsessiveness, cussedness and raging ambition.",The Founder (2017)
adam-sweeting,fresh,4/5,logan_2017,The last of Logan is also the best of Logan.,Logan (2017)
adam-sweeting,fresh,5/5,elle_2016,"A perplexing but electrifying mixture of sexual violence, black humour and social satire.",Elle (2016)
adam-sweeting,fresh,3/5,life_2017,"Startlingly original it ain't. Nonetheless, to give him his due, Espinosa understands enough about what viewers can't help getting sucked into despite themselves to deliver a healthy ratio of toe-curling, knuckle-gnawing moments of panic.",Life (2017)
adam-sweeting,fresh,3/5,ghost_in_the_shell_2017,"Ghost in the Shell carries a philosophical message alongside its slam-bang action and infinite arsenal of computerised effects. In Blade Runner style, it poses the large philosophical question of where technology ends and human consciousness begins.",Ghost in the Shell (2017)
adam-sweeting,fresh,3/5,the_sense_of_an_ending_2017,"Director Ritesh Batra's film treatment offers many incidental pleasures, including its naturalistic London locations and Jim Broadbent's gruff, minor-key portrayal of the central character.",The Sense Of An Ending (2017)
adam-sweeting,fresh,3/5,clash_2017,The film successfully speaks for itself as a cri de coeur for a nation in crisis.,Clash (Eshtebak) (2017)
adam-sweeting,rotten,2/5,the_promise_2017,"For all its noble intentions and the horrors it depicts, the film is undone by its staid, old-fashioned tone.",The Promise (2017)
adam-sweeting,fresh,3/5,alien_covenant,The saving grace is not one but two mischievous turns by Michael Fassbender.,Alien: Covenant (2017)
adam-sweeting,fresh,4/5,t2_trainspotting,"If you loved Trainspotting first time around, you'll probably love this too. If you never saw it, you could start here and go backwards.",T2 Trainspotting (2017)
adam-sweeting,fresh,3/5,mclaren,"Donaldson's film captures this lost era of motor racing through a rich selection of archive and home movie footage, though some newly reconstructed scenes and animations would have been better avoided.",McLaren (2016)
adam-sweeting,fresh,3/5,sachin_a_billion_dreams,"Even at 140 minutes it's difficult to cram in all the achievements of the ""Little Master"", but fans of the Summer Game will thrill to the various career highlights as Tendulkar sets about demolishing bowlers on several continents.",Sachin: A Billion Dreams (2017)
adam-sweeting,fresh,3/5,wonder_woman_2017,"Gal Gadot's Wonder Woman gets a chance to shine in her own Hollywood movie. Gadot makes a pretty fine job of it too, bringing a bit of soul and empathy to the proceedings, but sometimes it's more despite than because of the production surrounding her.",Wonder Woman (2017)
adam-sweeting,rotten,2/5,the_mummy_2017,"The Mummy enjoys itself by updating some corny old horror-flick clichés, but the application of uber-gizmo technology can't camouflage the absence of oomph in the screenplay.",The Mummy (2017)
adam-sweeting,fresh,3/5,whitney_can_i_be_me,"Broomfield paints the broad picture effectively, and the film's closing passages depicting Houston's seemingly irreversible decline are difficult to watch.",Whitney: Can I Be Me (2017)
