critic_id,critic_meter_score,critic_rating,movie_id,movie_review_blurb,movie_title
charles-bramesco,fresh,,alien_covenant,"While it may sometimes exceed its own reach, Covenant extends a grasp so impressively audacious, it might as well come from a director with nothing to lose.",Alien: Covenant (2017)
charles-bramesco,fresh,3/5,papillon_2016,"Hunnam and Malek both hold up their end of the deal. Noer, for his part, meets them halfway ...",Papillon (2017)
charles-bramesco,fresh,3/5,guardians_of_the_galaxy_vol_2,"The introduction of family bonds as a unifying theme represents Gunn's most decisive break from the original's winning formula. Aside from that, the second verse is same as the first.",Guardians of the Galaxy Vol. 2 (2017)
charles-bramesco,fresh,C+,shes_funny_that_way,"She's Funny That Way makes for good fun, though it's not necessarily funny in that, or many other, ways. If nothing else, it's heartening to see Bogdanovich back in the saddle.",She's Funny That Way (2015)
charles-bramesco,fresh,B+,get_me_roger_stone,"The man's a black hole of self-interest and hatred. Get Me Roger Stone is never more effective than when staring directly into that hole, drowning its audience in the black.",Get Me Roger Stone (2017)
charles-bramesco,rotten,1.5/4,we_are_your_friends_2015,"In the line of succession for Channing Tatum's throne as Hollywood's go-to charismatic bro type, Efron's still pretty far down.",We Are Your Friends (2015)
charles-bramesco,rotten,1/4,dragon_blade,Basic elements of production that audiences take for granted-fripperies such as coherent editing or logical character behavior-go horribly awry here and make other films look better by comparison.,Dragon Blade (Tian jiang xiong shi) (2015)
charles-bramesco,fresh,B,into_the_forest,"Though not without its errors, Into The Forest turns a profoundly human eye to what just may be the very end of humanity itself.",Into The Forest (2016)
charles-bramesco,rotten,D,stonewall_2015,"If ""Stonewall"" is what it means for Roland Emmerich to make an artist's statement, please, for the love of god, someone start setting up dynamite charges around the Seven Wonders of the World so that he might return to his wheelhouse.",Stonewall (2015)
charles-bramesco,rotten,1/4,drunk_stoned_brilliant_dead_the_story_of_the_national_lampoon,If only Drunk Stoned Brilliant Dead was a fraction as intelligent or entertaining as its subject.,Drunk Stoned Brilliant Dead: The Story of the National Lampoon (2015)
charles-bramesco,fresh,3/4,yakuza_apocalypse,"Yakuza Apocalypse is not for everyone, but is very, very much for some people.",Yakuza Apocalypse (2015)
charles-bramesco,fresh,3.5/4,crimson_peak,"It all adds up to a gorgeous, tone-perfect haunted house filled with immediate pleasures.",Crimson Peak (2015)
charles-bramesco,rotten,2/4,trumbo,...one thing is certain: Dalton Trumbo would've never written something like Trumbo.,Trumbo (2015)
charles-bramesco,fresh,4/5,spotlight_2015,"The concept of retelling the Spotlight story was so fraught with potential to go horribly, overbearingly awry, and yet McCarthy deftly sidesteps every pitfall with skill.",Spotlight (2015)
charles-bramesco,rotten,3/5,legend_2015,If only the movie surrounding the Krays was half as compelling as the men themselves.,Legend (2015)
charles-bramesco,fresh,5/5,anomalisa,"Even after proving himself an unqualified genius time and time again, every new success from Kaufman lands with the emotional weight of the very first time.",Anomalisa (2015)
charles-bramesco,fresh,3/4,creed_2015,"As Creed's rough-hewn boxer Donnie ""Adonis"" Johnson (née Creed), Jordan is granted another career-making role by [Ryan] Coogler.",Creed (2015)
charles-bramesco,rotten,,the_ridiculous_6,"Defined by the insubstantial amateurishness most frequently found on low-level Vine accounts, The Ridiculous Six practically erases the memory of the A-list Adam Sandler who starred in widely beloved, reliably bankable comedies.",The Ridiculous 6 (2015)
charles-bramesco,rotten,,the_brothers_grimsby,"If your only desire as a moviegoer is to feel something, anything, then Cohen's nearly-hostile intentness on being stickier, smellier, and crasser than anyone else in wide release might get your blood pumping.",The Brothers Grimsby (2016)
charles-bramesco,rotten,,the_rocky_horror_picture_show_lets_do_the_time_warp_again,"A graduate of the High School Musical school of filmmaking (literally), Ortega is also the person responsible for many of the glaring problems here.",The Rocky Horror Picture Show: Let's Do the Time Warp Again (2016)
charles-bramesco,fresh,,train_to_busan,"A zombie movie content not to aspire to any loftier subtextual readings needs little more than a skilled choreographer of action, and there's plenty of evidence that this film had one in Yeon.",Train to Busan (Busanhaeng) (2016)
charles-bramesco,fresh,5/5,moonlight_2016,"A personal/political triptych which offers keen perspectives on masculinity, queer sexuality, racial identity, and the odd angles at which they intersect.",Moonlight (2016)
charles-bramesco,fresh,,actor_martinez,"Actor Martinez is more like a dense work of film criticism that plays like a movie, and an enjoyable one at that.",Actor Martinez (2017)
charles-bramesco,fresh,A-,the_trip_to_spain_2017,The effortless chemistry makes for a supremely pleasant vacation.,The Trip to Spain (2017)
charles-cassady,rotten,2/5,dead_silence,A Nightmare on Dummy St. from Saw creators.,Dead Silence (2007)
charles-cassady,rotten,2/5,death_proof,Tarantino's very bloody half of Grindhouse.,Death Proof (2007)
charles-cassady,fresh,5/5,double_indemnity,"Dark, dialogue-heavy classic of grim suspense.",Double Indemnity (1944)
charles-cassady,fresh,5/5,duck_soup,Nonstop classic Marx Bros. mayhem kids will love.,Duck Soup (1933)
charles-cassady,fresh,5/5,ferris_buellers_day_off,Hilarious comedy classic; language makes it PG-13.,Ferris Bueller's Day Off (1986)
charles-cassady,rotten,2/5,escape_from_la,"Violent, semi-spoofy action sequel is too dark for kids.",John Carpenter's Escape from L.A. (1996)
charles-cassady,fresh,3/5,first_blood,"First and most popular Rambo; and yes, bloody.",First Blood (1982)
charles-cassady,fresh,4/5,fight_club,"Lurid, twisted, and violent. Not for kids.",Fight Club (1999)
charles-cassady,rotten,2/5,inland_empire,"Trippy, twisty thriller is totally out to Lynch.",Inland Empire (2006)
charles-cassady,rotten,1/5,epic_movie,"Raunchy blockbuster spoof is over the top, dumb.",Epic Movie (2007)
charles-cassady,rotten,2/5,cutthroat_island,Geena Davis brings girl power to the pirate ship.,Cutthroat Island (1995)
charles-cassady,rotten,1/5,book_of_shadows_blair_witch_2,Really bad slasher sequel.,Book of Shadows - Blair Witch 2 (2000)
charles-cassady,fresh,3/5,1046227-cool_runnings,"Delightful, tween-friendly story of Jamaican bobsledders.",Cool Runnings (1993)
charles-cassady,rotten,2/5,1004567-commando,"Brainless, explosion-happy action ('80s style).",Commando (1985)
charles-cassady,fresh,4/5,cocoon,"Sex talk, language make iconic '80s sci-fi better for teens.",Cocoon (1985)
charles-cassady,fresh,3/5,1004047-children_of_the_corn,"Classic Stephen King horror, hardly popping.",Children of the Corn (1984)
charles-cassady,rotten,2/5,1003722-casino_royale,Silly 007 spoof tamer than Austin Powers.,Casino Royale (1967)
charles-cassady,rotten,2/5,1215790-carriers,"Gloom, not thrills, in sci-fi drama of worldwide plague.",Carriers (2009)
charles-cassady,fresh,3/5,broken_trail,Lauded miniseries doesn't glamorize the old West.,Broken Trail (2006)
charles-cassady,fresh,4/5,1065684-braveheart,"Mel Gibson's Oscared, bloody Scottish spectacle.",Braveheart (1995)
charles-cassady,fresh,4/5,arsenic_and_old_lace,Cary Grant serial-killer comedy classic is cozy and tame.,Arsenic and Old Lace (1944)
charles-cassady,fresh,5/5,1097260-arabian_nights,"A fresh, but long, take on the classic stories.",Arabian Nights (2000)
charles-cassady,rotten,2/5,flashdance,"Cinderella tale with sex, Spandex, and '80s pop.",Flashdance (1983)
charles-cassady,fresh,3/5,curse_of_the_pink_panther,One of the weaker entries in the series.,Curse of the Pink Panther (1983)
charles-cassady,fresh,4/5,10006919-flight_93,Tense made-for-TV movie about Sept.11 skyjacking.,Flight 93 (2005)
charles-cassady,rotten,1/5,ill_always_know_what_you_did_last_summer,Another violent and unnecessary sequel.,I'll Always Know What You Did Last Summer (2006)
charles-cassady,rotten,2/5,for_your_eyes_only,Sea and ski with 1981's Bond in an average outing.,For Your Eyes Only (1981)
charles-cassady,fresh,3/5,1068044-jumanji,"Some thrills, but may be too much for little ones.",Jumanji (1995)
charles-cassady,fresh,4/5,joseph_and_the_amazing_technicolor_dreamcoat,Stage musical successfully brought to the screen.,Joseph and the Amazing Technicolor Dreamcoat (2000)
charles-cassady,rotten,2/5,stephen-kings-it1990,Stephen King pits kids vs. killer clown from hell.,Stephen King's It (1990)
charles-cassady,rotten,2/5,1010678-invasion_of_the_body_snatchers,"Talky, tame original sci-fi study in paranoia.",Invasion of the Body Snatchers (1956)
charles-cassady,fresh,4/5,1174399-in_the_shadow_of_the_moon,Lofty recap of the Apollo moon program.,In the Shadow of the Moon (2007)
charles-cassady,rotten,2/5,antitrust,Silicon Valley story of good versus evil-sort of.,Antitrust (2001)
charles-cassady,rotten,1/5,i_still_know_what_you_did_last_summer,We know what sequel shouldn't have been made.,I Still Know What You Did Last Summer (1998)
charles-cassady,rotten,2/5,i_know_what_you_did_last_summer,This horror movie is too intense for kids.,I Know What You Did Last Summer (1997)
charles-cassady,rotten,1/5,house_of_d,Off-putting drama of growing up male in the 1970s.,House of D (2004)
charles-cassady,rotten,2/5,hostel_2,Gory torture bloodbath checks in for another stay.,Hostel Part II (2007)
charles-cassady,fresh,3/5,history_of_the_world_part_i,"Dirty jokes, some sparkle in uneven Mel Brooks classic.",History of the World---Part I (1981)
charles-cassady,fresh,3/5,beatles_the_help,"Madcap, nonsensical romp with the Beatles.",Help! (1965)
charles-cassady,rotten,2/5,1104385-hannibal,Thoroughly distasteful. Not for kids.,Hannibal (2001)
charles-cassady,rotten,1/5,halloween_2007,Teen slasher flick remake is brutal and bloody.,Halloween (2007)
charles-cassady,fresh,3/5,1009113-halloween,First Michael Myers slasher fest isn't for kids.,Halloween (1978)
charles-cassady,fresh,4/5,half_nelson,Indie inner-city drama with drug-addict teacher.,Half Nelson (2006)
charles-cassady,fresh,4/5,grave_of_the_fireflies,Japanimation WWII tragedy the saddest. Cartoon. Ever.,Grave of the Fireflies (Hotaru no haka) (1988)
charles-cassady,fresh,4/5,1008415-glory,Excellent Civil War movie for mature teens.,Glory (1989)
charles-cassady,fresh,3/5,gideons_daughter,"Well-acted, witty dad-daughter BBC drama.",Gideon's Daughter (2005)
charles-cassady,fresh,4/5,funny_face,"Bubbly, fashion-crazed Hepburn-Astaire musical.",Funny Face (1957)
charles-cassady,rotten,1/5,friday_the_13th_part_1,"Beware of this infamous, sadistic slasher film.",Friday the 13th (1980)
charles-cassady,fresh,4/5,free_willy_3_the_rescue,For devoted -- and young -- Willy fans only.,Free Willy 3: The Rescue (1997)
charles-cassady,fresh,4/5,free_willy_2_the_adventure_home_1995,This rote sequel will thrill Willy fans.,Free Willy 2: The Adventure Home (1995)
charles-cassady,fresh,4/5,free_willy,A wayward boy befriends a moody killer whale.,Free Willy (1993)
charles-cassady,rotten,1/5,freddy_got_fingered,"Sorry, this one's just vile.",Freddy Got Fingered (2001)
charles-cassady,fresh,3/5,for_a_few_dollars_more,More violence and Clint-itude in Italian Western.,For a Few Dollars More (Per Qualche Dollaro in Più) (1965)
charles-cassady,fresh,3/5,annie_hall,Funny movie about relationships. Not for kids.,Annie Hall (1977)
charles-cassady,fresh,3/5,twilight_zone_the_movie,"TV show is much better; some mature themes, violence.",Twilight Zone: The Movie (1983)
charles-cassady,fresh,4/5,1048301-angels_in_the_outfield,Cute baseball fantasy overshadowed by remake.,Angels in the Outfield (1951)
charles-cassady,fresh,4/5,bicycle_thieves,Bleak black-and-white classic isn't likely to interest kids.,Bicycle Thieves (Ladri di biciclette) (1949)
charles-cassady,rotten,1/5,abandoned,"Slow, moody haunted-house shocker; not for kids.",The Abandoned (2007)
charles-cassady,rotten,2/5,outlander,"Beowulf with aliens and lots of gore, violence.",Outlander (2009)
charles-cassady,fresh,3/5,1007141-fatal_attraction,Adultery-obsession thriller isn't for kids (or bunnies).,Fatal Attraction (1987)
charles-cassady,fresh,3/5,toys,"Despite title, edgy fantasy-fable isn't geared toward kids.",Toys (1992)
charles-cassady,fresh,4/5,the-5000-fingers-of-dr-t,"Colorful, culty Dr. Seuss Hollywood original.","The 5,000 Fingers of Dr. T (1953)"
charles-cassady,rotten,2/5,28_weeks_later,Apocalyptic zombie sequel isn't for the squeamish.,28 Weeks Later... (2007)
charles-cassady,rotten,2/5,1016359-piranha,Extremely gory Jaws rip-off is too much for kids.,Piranha (1978)
charles-cassady,fresh,3/5,delicatessen,Dark comedy-fantasy about cannibalism isn't for kids.,Delicatessen (1992)
charles-cassady,fresh,5/5,rebel_without_a_cause,1950s James Dean teen-rage landmark still resonates.,Rebel Without a Cause (1955)
charles-cassady,fresh,5/5,1008166-general,Silent masterpiece is enter-train-ment for all ages.,The General (1927)
charles-cassady,fresh,3/5,1007517-flash_gordon,Sci-fi comic-strip movie is too violent for younger kids.,Flash Gordon (1980)
charles-cassady,fresh,3/5,1006250-dragnet,"Lots of naughty behavior, laughs in TV cop spoof.",Dragnet (1987)
charles-cassady,rotten,1/5,sorority_row,Satirical shadings can't save sorority slasher schlock.,Sorority Row (2009)
charles-cassady,fresh,3/5,10010155-forever_strong,Uplifting jock drama is predictable but OK for older tweens.,Forever Strong (2008)
charles-cassady,fresh,3/5,watchmen_tales_of_the_black_freighter_and_under_the_hood,Sometimes-gruesome Watchmen extras best for fans.,Watchmen: Tales of the Black Freighter and Under the Hood (2009)
charles-cassady,fresh,4/5,castle_in_the_sky_1989,"Exciting, all-ages anime airborne fantasy epic.",Castle in the Sky (1989)
charles-cassady,rotten,2/5,1058516-street_fighter,Campy video game-derived action-fest.,Street Fighter (1994)
charles-cassady,rotten,2/5,my_bloody_valentine_3_d,Ultra-gory slasher remake isn't for kids.,My Bloody Valentine 3-D (2009)
charles-cassady,fresh,3/5,10010214-fireproof,Christian-themed marriage drama won't grab kids.,Fireproof (2008)
charles-cassady,fresh,3/5,water_horse,Predictable family fantasy not as good as book.,The Water Horse: Legend of the Deep (2007)
charles-cassady,rotten,1/5,p2,"Brutal, minimalist stalker bloodbath. Pass.",P2 (2007)
charles-cassady,rotten,2/4,bratz_the_movie,Material girls in immaterial comedy for tweens.,Bratz: The Movie (2007)
charles-cassady,rotten,2/5,just_visiting,Time travel comedy with bathroom humor.,Just Visiting (2001)
charles-cassady,fresh,3/5,star_trek_vi_the_undiscovered_country,Cold War-influenced exit of classic space crew.,Star Trek VI - The Undiscovered Country (1991)
charles-cassady,rotten,2/5,ali-g-indahouse-the-movie,"Pre-Borat, a raunchy spoof of a hip-hop pretender.",Ali G Indahouse (2004)
charles-cassady,fresh,4/5,alien,Dated but still extremely scary. Not for younger kids.,Alien (1979)
charles-cassady,rotten,2/5,alien_resurrection,"Grotesque carnage, vile characters; steer clear.",Alien Resurrection (1997)
charles-cassady,rotten,2/5,american_history_x,This dark drama is not for kids.,American History X (1998)
charles-cassady,fresh,4/5,amazon_1997,An ambitious and beautiful nature film.,Amazon (1997)
charles-cassady,fresh,4/5,amadeus,"Great movie, but not quite true to history.",Amadeus (1984)
charles-cassady,fresh,4/5,1018909-shot_in_the_dark,Funny Pink Panther sequel. Older tweens+.,A Shot in the Dark (1964)
charles-cassady,fresh,3/5,nightmare_on_elm_street,First feature for knife-handed horror idol Freddy.,A Nightmare on Elm Street (1984)
charles-cassady,fresh,4/5,muppet_family_christmas,"A short-and-sweet, tuneful holiday reunion.",A Muppet Family Christmas (1987)
charles-cassady,fresh,4/5,fistful_of_dollars,"Guns galore in intro ""spaghetti Western"" serving.",A Fistful of Dollars (Per un Pugno di Dollari) (1964)
charles-cassady,fresh,3/5,day_at_the_races,Marx Bros.' big hit may miss with today's kids.,A Day at the Races (1937)
charles-cassady,fresh,3/5,jackie_brown,"Mellower Tarantino still has sex, drugs, swearing, murder.",Jackie Brown (1997)
charles-cassady,rotten,1/5,1066120-scarlet_letter,"Slaughter, sin, and sex in classic-turned-movie misfire.",The Scarlet Letter (1995)
charles-cassady,fresh,3/5,1011813-lady_vanishes,Hitchcock comedy thriller is tame old-school fun.,The Lady Vanishes (1938)
charles-cassady,fresh,4/5,the-best-of-dr-seuss,Classic stories come to life.,The Best of Dr. Seuss (1989)
charles-cassady,fresh,4/5,benji_the_hunted,Benji shines in another simple but engrossing dog tale.,Benji the Hunted (1987)
charles-cassady,fresh,3/5,ed_wood,"Depp-led cult-director bio delves into cross-dressing, kink.",Ed Wood (1994)
charles-cassady,fresh,3/5,1001634-bang_the_drum_slowly,"Talky, leisurely, and poetic baseball drama.",Bang The Drum Slowly (1973)
charles-cassady,fresh,3/5,repo_man,"Defiant, antisocial 'tude in '80s punk sci-fi satire.",Repo Man (1984)
charles-cassady,fresh,3/5,dirty_harry,'70s rebel-cop classic is way too edgy for kids.,Dirty Harry (1971)
charles-cassady,fresh,3/5,rumble_fish,"Teen-gang saga is more intense, violent than the book.",Rumble Fish (1983)
charles-cassady,fresh,3/5,1006717-escape_from_new_york,Extremely dark '80s sci-fi classic is too intense for kids.,Escape from New York (1981)
charles-cassady,rotten,2/5,reign_of_fire,Plodding sci-fi dragon disaster tale is OK for older kids.,Reign of Fire (2002)
charles-cassady,fresh,3/5,1001526-bachelor_party,"'80s sex comedy is extremely raunchy, graphic.",Bachelor Party (1984)
charles-cassady,fresh,3/5,godzilla_king_of_the_monsters,"Giant-monster drama is stiff, dated but still a classic.","Godzilla, King of the Monsters! (1956)"
charles-cassady,fresh,3/5,courage_under_fire,"Military drama deploys plenty of violence, swearing.",Courage Under Fire (1996)
charles-cassady,fresh,3/5,1000617-aliens,"Alien sequel is bigger, faster, scarier.",Aliens (1986)
charles-cassady,rotten,1/5,alien3,"Grim, nihilistic sequel in none-too-cheery series.",Alien3 (1992)
charles-cassady,fresh,3/5,animal_crackers,Beloved but creaky Marx Brothers comedy hit.,Animal Crackers (1930)
charles-cassady,fresh,4/5,1011615-king_kong,Violent but beloved old-school monster movie.,King Kong (1933)
charles-cassady,rotten,2/5,1003075-brewsters_millions,Tamed Pryor in '80s comedy with some salty language.,Brewster's Millions (1985)
charles-cassady,fresh,3/5,let_the_right_one_in,Swedish vampire tale is much grislier than Twilight.,Let the Right One In (2008)
charles-cassady,fresh,4/5,santa_clause,Heartwarming family tale for both kids and adults.,The Santa Clause (1994)
charles-cassady,rotten,1/5,the_room_1998,Cult-phenom amateur melodrama best left to adults.,The Room (2003)
charles-cassady,fresh,4/5,return_of_the_pink_panther,Hilarious Clouseau better in sequel than original.,The Return of the Pink Panther (1975)
charles-cassady,fresh,3/5,1035462-return_of_the_king,"Cartoon tale is darker, more complex than others in series.",The Return of the King (1980)
charles-cassady,fresh,4/5,purple_rose_of_cairo,Whimsical Woody Allen love note to '30s films.,The Purple Rose of Cairo (1985)
charles-cassady,fresh,4/5,pink_panther_strikes_again,The zaniest of the Panther movies.,The Pink Panther Strikes Again (1976)
charles-cassady,fresh,4/5,1016338-pink_panther,Funny and entertaining after all these years.,The Pink Panther (1963)
charles-cassady,rotten,2/5,1015517-omen,Gory original Satanism saga; popular but plodding.,The Omen (1976)
charles-cassady,rotten,1/5,the_number_23,"Absurd, dark, and a miscast Jim Carrey. Yuck.",The Number 23 (2007)
charles-cassady,rotten,2/5,next_karate_kid,Violent sequel doesn't benefit from gender change.,The Next Karate Kid (1994)
charles-cassady,fresh,3/5,1147402-the_muppets_wizard_of_oz,Raucous Muppet spoof of a classic. Tweens and up.,The Muppets' Wizard of Oz (2005)
charles-cassady,fresh,4/5,seventh_seal,Symbolism-filled classic a tough sell for kids.,The Seventh Seal (Det Sjunde inseglet) (1957)
charles-cassady,fresh,5/5,muppets_take_manhattan,Maybe the least-appreciated and best Muppet movie.,The Muppets Take Manhattan (1984)
charles-cassady,fresh,3/5,the_motorcycle_diaries,Subtly political biopic won't interest most teens.,The Motorcycle Diaries (2004)
charles-cassady,fresh,5/5,miracle_of_morgans_creek,Hilarious WWII comedy flirts with taboos.,The Miracle of Morgan's Creek (1944)
charles-cassady,fresh,3/5,lion_the_witch_and_the_wardrobe,Early animated version of the classic.,"The Lion, the Witch and the Wardrobe (1979)"
charles-cassady,fresh,3/5,king_of_kong,Amusing documentary duel at the video arcade.,The King of Kong: A Fistful of Quarters (2007)
charles-cassady,fresh,3/5,karate_kid_part_2,Excessive violence mars so-so sequel.,The Karate Kid Part II (1986)
charles-cassady,fresh,4/5,1010002-hound_of_the_baskervilles,Family-friendly Sherlock classic still a critical favorite.,The Hound of the Baskervilles (1939)
charles-cassady,fresh,4/5,hobbit,Cartoon adaptation of famous book is a great intro for kids.,The Hobbit (1978)
charles-cassady,rotten,2/5,1009699-hitcher,Spare and engrossing original road slaughterfest.,The Hitcher (1986)
charles-cassady,rotten,2/5,1009645-hills_have_eyes,Beware! 70s horror film is ultra violent.,The Hills Have Eyes (1977)
charles-cassady,fresh,3/5,heartbreak_kid,Discussion-worthy '70s anti-romantic comedy.,The Heartbreak Kid (1972)
charles-cassady,fresh,4/5,great_muppet_caper,Muppets in London on a retro musical robbery-romp.,The Great Muppet Caper (1981)
charles-cassady,fresh,4/5,muppet_movie,First Muppet movie is a classic.,The Muppet Movie (1979)
charles-cassady,fresh,4/5,goonies,A classic '80s action-fantasy -- tweens will love!,The Goonies (1985)
charles-cassady,fresh,4/5,silence_of_the_lambs,Thriller that made the serial killer a superstar.,The Silence of the Lambs (1991)
charles-cassady,fresh,4/5,1021015-ten_commandments,"Stirring, even if it's as much showbiz as Bible.",The Ten Commandments (1956)
charles-cassady,fresh,5/5,the_bear_1989,"Live-action animal saga is incredible, and a bit scary.",The Bear (1989)
charles-cassady,fresh,3/5,1021648-tommy,Trippy rock opera with drug references and sexual imagery.,Tommy (1975)
charles-cassady,fresh,4/5,the_three_musketeers_2011,Lively and bawdy retelling of the classic.,The Three Musketeers (2011)
charles-cassady,fresh,4/5,1020333-streetcar_named_desire,"""Stella!"" classic is powerful tale of abuse, alcoholism.",A Streetcar Named Desire (1951)
charles-cassady,fresh,3/5,adventure_of_sherlock_holmes_smarter_brother,Good-natured Sherlock spoof with some dirty-joke humor.,The Adventure of Sherlock Holmes' Smarter Brother (1975)
charles-cassady,fresh,4/5,shine,"Intense, gripping mental-illness music drama.",Shine (1996)
charles-cassady,fresh,4/5,city_of_lost_children,"Bizarre, beautiful French sci-fi with creepy images, themes.",The City of Lost Children (La Cité des Enfants Perdus) (1995)
charles-cassady,fresh,3/5,excalibur,Epic King Arthur saga with illicit affairs and brutality.,Excalibur (1981)
charles-cassady,fresh,4/5,labyrinth,Surreal coming-of-age fantasy -- with Muppets.,Labyrinth (1986)
charles-cassady,fresh,5/5,1024192-wuthering_heights,Best version of the Gothic-romance revenge tale.,Wuthering Heights (1939)
charles-cassady,fresh,3/5,1023543-white_christmas,Musical-comedy classic reprises Irving Berlin hit.,White Christmas (1954)
charles-cassady,fresh,3/5,spy_who_loved_me,1977's 007 still gettin' lucky in underwater lair.,The Spy Who Loved Me (1977)
charles-cassady,rotten,2/5,1023461-when_a_stranger_calls,Grim psychothriller with a few teen urban legends.,When a Stranger Calls (1979)
charles-cassady,rotten,2/5,up_close_and_personal,Glitz! Glamour! Love! TV news ethics?,Up Close & Personal (1996)
charles-cassady,fresh,3/5,uncle_buck,The Candy man can make this iffy movie taste good.,Uncle Buck (1989)
charles-cassady,fresh,4/5,1021964-treasure_island,"Avast! Disney's live-action, seagoing landmark.",Treasure Island (1950)
charles-cassady,fresh,3/5,1021963-treasure_island,Spry adaptation of beloved pirate yarn has a treasured cast.,Treasure Island (1934)
charles-cassady,rotten,1/5,transformers_the_the_movie,An awful toy commercial in disguise.,The Transformers - The Movie (1986)
charles-cassady,rotten,2/5,trail_of_the_pink_panther,A weak link in the brilliant series.,Trail of the Pink Panther (1982)
charles-cassady,rotten,1/5,tomcats,A parade of labored sex gags and bathroom humor.,Tomcats (2001)
charles-cassady,fresh,4/5,three_kings,"Violent, liberal George Clooney Gulf War caper.",Three Kings (1999)
charles-cassady,fresh,5/5,those_magnificent_men_in_their_flying_machines,Top gun of slapstick early-aviation comedies.,Those Magnificent Men in Their Flying Machines (1965)
charles-cassady,rotten,2/5,the_wicker_man_1973,Adult chiller about modern pagans -- no Hogwarts.,The Wicker Man (1973)
charles-cassady,fresh,3/5,wedding_singer,"Not the most original comedy, but many will enjoy.",The Wedding Singer (1998)
charles-cassady,fresh,4/5,viva_las_vegas,Vegas ad is a nonstop song-and-dance delight.,Viva Las Vegas (1964)
charles-cassady,fresh,4/5,the_good_the_bad_and_the_ugly,Potent Italian-Western shoot-'em up/war drama.,"The Good, the Bad and the Ugly (1966)"
charles-cassady,rotten,2/5,hellraiser,Gore-torture-horror-ghoul fantasy from the '80s.,Hellraiser (1987)
charles-cassady,rotten,2/5,1007617-fog,"Not much gore, but still too intense for kids.",The Fog (1979)
