critic_id,critic_meter_score,critic_rating,movie_id,movie_review_blurb,movie_title
natasha-vargas-cooper-12494,fresh,B+,sicko,"The documentarian/stuntman showcases the catastrophic effects of our dysfunctional health-care system so acutely that the film serves its purpose: It puts a fire in your belly, and rage in your heart.",Sicko (2007)
natasha-vargas-cooper-12494,rotten,C,mighty_heart,"A haphazard fusion that smacks of Hollywood self-gratification. For a movie that aims to throw a spotlight on the human costs of international terrorism, it says surprisingly little and renders itself quickly forgettable.",A Mighty Heart (2007)
natasha-vargas-cooper-12494,fresh,A,superbad,Who knew that a raunchy teen sex comedy could be one of the most rambunctious and glorious movies of the year?,Superbad (2007)
natasha-vargas-cooper-12494,fresh,A-,1206571-eleven_minutes,"A superbly crafted, bargain-budget documentary that profiles a fascinating underdog and skillfully explores the troubled territory between reality TV and reality.",Eleven Minutes (2008)
natasha-vargas-cooper-12494,rotten,C-,10009526-public_enemies,"Public Enemies grinds to nothing more than a watered-down escape caper, a chase without context or meaning.",Public Enemies (2009)
natasha-vargas-cooper-12494,fresh,B,sunshine_cleaning,The tenderhearted performances -- from Amy Adams and Emily Blunt -- and glowing characters in Sunshine Cleaning never get a chance to burst through a foggy plot about sisters scrubbing up after grisly crime scenes.,Sunshine Cleaning (2009)
natasha-vargas-cooper-12494,rotten,D+,madea_goes_to_jail,"The movie's titular matron (Perry in drag) is actually a diversion from the film's cornball melodrama, and will likely inspire jeers, instead of applause, even from his most dedicated fans.",Madea Goes to Jail (2009)
natasha-vargas-cooper-12494,fresh,B+,invention_of_lying,"The tone remains the same throughout, though, good spirited and high minded without pretensions. It remains funny -- but forsakes its potential to be a truly original comedy start-to-finish.",The Invention of Lying (2009)
natasha-vargas-cooper-12494,fresh,A-,1196077-cloudy_with_a_chance_of_meatballs,Cloudy sets another high watermark for recent animation movies.,Cloudy With a Chance of Meatballs (2009)
natasha-vargas-cooper-12494,fresh,B-,1205483_nine,This is a flawed gem.,9 (2009)
natasha-vargas-cooper-12494,fresh,B-,bruno,"Sacha Baron Cohen uses his guerilla tactics to 'expose' the vanity and vacuity of Hollywood and the American South. His high-wire humor can be very funny, but here the groans often drown out the giggles.",Bruno (2009)
natasha-vargas-cooper-12494,fresh,B+,away_we_go,"Krasinki is able to anchor the movie with a limber, melancholy performance -- and doesn't draw too heavily from his overflowing reservoir of nice-guy charm.",Away We Go (2009)
natasha-vargas-cooper-12494,fresh,B+,10009083-land_of_the_lost,Will Ferrell justifies his outsized fame in this surprisingly bizarre and dirty adaptation of the campy '70s TV time-travel classic.,Land of the Lost (2009)
natasha-vargas-cooper-12494,fresh,B+,jennifers_body,It's tailor-made for screenings at midnight and slumber parties.,Jennifer's Body (2009)
natasha-vargas-cooper-12494,rotten,C-,1189217-angels_and_demons,"This diligent yet dull religious caper only adds to the long list of Tom Hanks throwaway features, movies best enjoyed on airplanes.",Angels & Demons (2009)
natasha-vargas-cooper-12494,rotten,D,next_day_air,Good lord this movie is boring!,Next Day Air (2009)
natasha-vargas-cooper-12494,fresh,B-,1193906-ghosts_of_girlfriends_past,"Conor has the flamboyant confidence of a matador, but McConaughey draws out the right amount of sleaze and tenderness to transform Conor from a bullfighter to a rodeo clown.",The Ghosts of Girlfriends Past (2009)
natasha-vargas-cooper-12494,fresh,B,1207523-obsessed,The immaculate Beyoncé Knowles and devastatingly handsome Idris Elba attack their silly parts with a ferocity the gives this dumpy little movie the spark it needs to be compelling.,Obsessed (2009)
natasha-vargas-cooper-12494,fresh,B-,1201402-17_again,Afraid that pubescent shrieking and swooning will drown out critical plot points of this zany body-swap flick? No worries! 17 Again is essentially a flipbook of Zac Efron pictures with some sound thrown over it.,17 Again (2009)
natasha-vargas-cooper-12494,rotten,D,observe_and_report,"Unsure if it's supposed to make you love or loathe all the ugly behavior and cheap gags, Observe and Report will make you squirm for all the wrong reasons.",Observe and Report (2009)
natasha-vargas-cooper-12494,fresh,A,i_love_you_man,"This comedy of manners, about the anxieties of modern male friendship, gets the balance of smarts and raunch exactly right. Plus, costars Paul Rudd and Jason Segel could not be more likeable, funny and on their game.","I Love You, Man (2009)"
natasha-vargas-cooper-12494,fresh,B-,10010667-hangover,"It has a couple of stand-out characters in Ed Helms and Zach Galifianakis, and enough T-shirt-worthy catchphrases to keep the chuckles coming.",The Hangover (2009)
nate-chinen,rotten,,django_2018,"The film's story - loosely adapted from Alexis Salatko's novel Folles de Django - manages to feel at once oversimplified, underfed and overburdened.",Django (2018)
nate-chinen,fresh,3/5,louis_2011,"With a pace and cinematic language openly inspired by Charlie Chaplin, it's as much a riff on silent movies as it is a coming-of-age tale with a whiff of political farce.",Louis (2010)
nate-deen,fresh,A+,the_dark_knight,"Brilliantly bleak and chillingly Gothic (credit the enthralling cinematography by Wally Pfister), The Dark Knight emerges as the first truly great film of 2008.",The Dark Knight (2008)
nate-deen,fresh,A-,the_orphanage,"There are no monsters, or slashers, and yet the movie got under my skin so much so that it left me shaky as I walked out of the theater.",The Orphanage (2007)
nate-fisher,fresh,4/5,the_1517_to_paris,"This film courts that kind of lionization far less than one would expect from Eastwood at this stage, and stands out among our contemporary film fare for its humility.",The 15:17 to Paris (2018)
nate-fisher,fresh,4/5,resident_evil_the_final_chapter,"Final Chapter puts mankind on the precipice of genuine collapse, and provides the viewer with encouragement and incitement to press on in spite of it.",Resident Evil: The Final Chapter (2017)
nate-fisher,rotten,2/4,antibirth,It's unfortunate that the only part of the film that works does so by taking the wind out of the rest of it.,Antibirth (2016)
nate-yapp,fresh,,amelie,"Amelíe is like the world's most tanatalizing box of chocolates. Eat one, and its delicious, scrumptious. It plays with your senses in every joyous way.",Amélie (2001)
nate-yapp,fresh,,about_a_boy,Try to sneak past the lightsaber wielding masses and give this one a go. It's good fun.,About a Boy (2002)
nate-yapp,fresh,,1002497-black_hole,"If you can ignore the scientific problems, The Black Hole turns out to be a fairly enjoyable sci-fi flick.",The Black Hole (1979)
nate-yapp,fresh,,platoon,Oliver Stone has perhaps made the best movie that is specifically about Vietnam.,Platoon (1986)
nate-yapp,fresh,,reservoir_dogs,[O]nly a nutcase with a keen creative intellect could have made Reservoir Dogs.,Reservoir Dogs (1992)
nate-yapp,rotten,,cry-baby,"It's worth a rental, if you're in the mood for something offbeat but less filling, but don't expect a revelation.",Cry-Baby (1990)
nate-yapp,rotten,,john_q,It quite literally offended me as a movie-goer.,John Q (2002)
nate-yapp,rotten,,escape_under_pressure,"I won't even discuss the dozens of stupid screenwriting blunders, the one-dimensional characters, or the simple idiocy with which the whole film was executed.",Escape Under Pressure (2000)
nate-yapp,fresh,,american_history_x,"If the message of the film gets a bit didatic, or the storyline balance is a little off ... it hardly matters in the end. American History X is unrelenting.",American History X (1998)
nate-yapp,rotten,,what_dreams_may_come,Keeps poking the viewer with an Emotion stick.,What Dreams May Come (1998)
nate-yapp,fresh,,1017814-rollerball,The DVD is cheap.,Rollerball (1975)
nate-yapp,fresh,4/5,american_pie,One of those movies everybody of a certain age should watch.,American Pie (1999)
nate-yapp,fresh,5/5,seven_samurai_1956,"The Seven Samurai is a brilliant film - the only caveat, in fact, is that the length and the language barrier make it a difficult movie to get through.",Seven Samurai (Shichinin no Samurai) (1956)
nathalie-atkinson,fresh,2.5/4,about_last_night_2014,"The thing is to enjoy yourself at the time, then forget all about it in the morning. The best you can hope for from a one-night stand, really.",About Last Night (2014)
nathalie-atkinson,fresh,4/4,the_great_beauty,"With inevitable debt to Fellini, Sorrentino's nods as reverential as they are wry.",The Great Beauty (2013)
nathalie-atkinson,rotten,2.5/4,the_invisible_woman_2013,"Given what is factually known, The Invisible Woman is admirably accurate but without more speculation and embellishment, it's also rather bloodless.",The Invisible Woman (2013)
nathalie-atkinson,fresh,,american_hustle,"Every time I want to call American Hustle's bluff, it rises to being more than the sum of some of its parts, thanks to the female performances.",American Hustle (2013)
nathalie-atkinson,fresh,3.5/4,vicflo_saw_a_bear,"As Vic, Robitaille is superb -- cordial, with something hinting at gratitude and relief buried in her resignation.",Vic+Flo Saw a Bear (2014)
nathalie-atkinson,fresh,3/4,jingle_bell_rocks,The best-selling singles in America have been Christmas songs and Kezin's look at the b-side -- the business of Xmas -- is entertaining.,Jingle Bell Rocks (2014)
nathalie-atkinson,fresh,3/4,gore_vidal_the_united_states_of_amnesia_2013,"The film has such flavour that it will inspire you to dust off, or a new generation to seek out Vidal's work.",Gore Vidal: The United States Of Amnesia (2014)
nathalie-atkinson,fresh,3/4,short_term_12_2013,"Crettin's script delivers warm, humorous dialogue and his direction a wealth of naturalistic performances, chief among them Larson's understated, incandescent turn as Grace.",Short Term 12 (2013)
nathalie-atkinson,rotten,2/4,blue_is_the_warmest_color,"Beyond this provocation, the movie might have paid attention to what else it had to say rather than treat other elements as unexplored digressions.",Blue Is The Warmest Color (2013)
nathalie-atkinson,fresh,3/4,saving_mr_banks_2013,"The delight here is the performance of Emma Thompson, who portrays the a taskmaster on the page with pursed lips in perpetual scowl, yes, but also on the verge of melting into what passes, for her, for warmth.",Saving Mr. Banks (2013)
nathalie-atkinson,fresh,3/4,cheap_thrills_2013,The result? High and humorous tension both on the screen and in the audience seats.,Cheap Thrills (2014)
nathalie-atkinson,fresh,3.5/4,le_week_end,"The stakes are high but there is no chewing scenery -- it's the natural, casual vitriol that scathes most.",Le Week-End (2014)
nathalie-atkinson,fresh,3/4,the_husband,"Dark and sometimes tender, The Husband is the grim, realistic flip side of a what if - what if Notes on a Scandal focused solely on the drudgery of the husband's life in the wake of the betrayal?",The Husband (2013)
nathalie-atkinson,fresh,3.5/4,casting_by,Donahue makes a compelling case that publicly unsung hero Dougherty (and L.A. counterpart Lynn Stalmaster) had a profound influence on the industry.,Casting By (2013)
nathalie-atkinson,fresh,3/4,mistaken_for_strangers,"The result is at turns aggravating, pathetic and hilarious, a sort of This is Spinal Tap meets American Movie.",Mistaken for Strangers (2014)
nathalie-atkinson,fresh,2.5/4,men_of_the_cloth,"It's still very much worth watching for the time the camera spends in the shops, capturing the slow rhythm of time-consuming, precise and artistic handwork, performed not in romantic locales but dingy rooms and basements.",Men of the Cloth (2013)
nathalie-atkinson,fresh,,the_great_flood_2012,The footage itself isn't always well-preserved but director Bill Morrison incorporates it into the overall effect.,The Great Flood (2014)
nathalie-atkinson,fresh,3/4,when_i_walk_2013,It's incredibly up close and personal like an uplifting and real vlog not meant for others to see.,When I Walk (2013)
nathalie-atkinson,fresh,3/4,afternoon_of_a_faun_tanaquil_le_clercq,"As tragedy of the woman whose whole life was the hothouse of the dance -- including narrating her wistful, matter-of-fact letters and journals during treatment -- the doc exploring the myth of Le Clercq will be a balletomane's delight.",Afternoon of a Faun: Tanaquil Le Clercq (2014)
nathalie-atkinson,fresh,3.5/4,only_lovers_left_alive,"Like their creator, the characters have feasted on a buffet of historical greats... and the broad nature make it feel like [Jarmusch's] most personal, fluently articulated yet. It's also supremely groovy.",Only Lovers Left Alive (2014)
nathalie-atkinson,fresh,3/4,joe_2013,It's a classic redemption narrative where the ongoing temptations of violence culminate in a sort of justice.,Joe (2014)
nathalie-atkinson,rotten,1.5/4,think_like_a_man_too,Tish's original plan to stay in her hotel room and watch TV alone with a glass of wine isn't the worst idea I've heard.,Think Like a Man Too (2014)
nathalie-atkinson,fresh,2.5/4,money_for_nothing_inside_the_federal_reserve,"Money for Nothing: Inside the Federal Reserve is a well-informed, reasoned critique of the Fed, and its role as an enabler in the recent financial crises.",Money for Nothing: Inside the Federal Reserve (2013)
nathalie-atkinson,rotten,1/4,last_vegas_2013,"The reverence for age and the patina of decay make even its tackiest, poorly conceived signs seem like art. Metaphor?",Last Vegas (2013)
nathalie-atkinson,rotten,1.5/5,emperor_2012,"Emperor missed the opportunity to become an engrossing procedural of historic minutiae, like Lincoln.",Emperor (2013)
nathalie-atkinson,rotten,2/4,romeo_and_juliet_2012,It's all such a prettily-spoken blur to care much.,Romeo and Juliet (2013)
nathalie-atkinson,rotten,1.5/4,magic_in_the_moonlight,"Firth notwithstanding, even as a cinematic bagatelle Magic in the Moonlight is virtually charmless and strangely flat.",Magic in the Moonlight (2014)
nathalie-atkinson,fresh,3.5/4,bridesmaids_2011,"It's bawdy and a bit rowdy -- the comedy equivalent of a Lady Remington shaver in that it's just as good as the original Remington for men, only a bit smaller -- and pink.",Bridesmaids (2011)
nathalie-atkinson,fresh,2.5/4,gainsbourg_a_heroic_life,"What elevates Gainsbourg above Behind The Music territory is that peppered with his songs, something the Gainsbourg family has never let any other biographical feature do.",Gainsbourg: A Heroic Life (2011)
nathalie-atkinson,fresh,2.5/4,berberian_sound_studio_2012,"The narrative rule of thumb is show, don't tell, but this film does the opposite, to sinister effect.",Berberian Sound Studio (2013)
nathalie-atkinson,rotten,2/5,knifefight,"For all the knowing monologues mentioning tax breaks for the rich and diet drinks for the poor, Knife Fight feels squeaky-clean -- a remedial spin class that tells more than it shows.",Knife Fight (2013)
nathalie-atkinson,rotten,2/5,mad_ship,"There are many other fine moments of cinematic poetry, if only Marshall could be more consistent with them.",Mad Ship (2013)
nathalie-atkinson,fresh,,birth_story_ina_may_gaskin_and_the_farm_midwives_2012,"It's interesting how in retrospect what [Gaskin] espouses, something so simple could be considered radical. Yet Sara Lamm and Mary Wigmore's documentary Birth Story makes that very point.",Birth Story: Ina May Gaskin and The Farm Midwives (2013)
nathalie-atkinson,fresh,3.5/4,love_marilyn,"The monologues are like exercises from the star's beloved Actors Studio, performances of emotional facets. For the most part these are effectively stark, tender, childlike and raw.","Love, Marilyn (2012)"
nathalie-atkinson,fresh,2.5/4,renoir_2012,At least the French art house biopic is rich in ambiance.,Renoir (2013)
nathalie-atkinson,rotten,,men_at_lunch_2012,"Whether it merits a feature-length documentary or a slot on PBS, I'm not sure.",Men at Lunch (2013)
nathalie-atkinson,rotten,2/4,bruce_cockburn_pacing_the_cage,"It's not a concert documentary, and... [it's] not a biopic, a eulogy or as flattering as it is, even really a tribute. If anything, it's like the space between songs on an album, a moment of reflection.",Bruce Cockburn Pacing The Cage (2012)
nathalie-atkinson,fresh,4/4,much_ado_about_nothing_2012,"This invigorated play is more Frank Capra than Kenneth Brannagh, and reminds me just how much 1930s screwball comedies were in debt to the Bard of Avon.",Much Ado About Nothing (2013)
nathalie-atkinson,rotten,1.5/4,the_bling_ring_2013,"The most curious thing about this movie is that as the cautionary tale it so clearly wants to be, it fails.",The Bling Ring (2013)
nathalie-atkinson,rotten,2.5/4,how_to_make_money_selling_drugs,"Once you've made your point, don't digress into a last-minute lecture on alcohol and tobacco, taxation of pharmaceutical drugs or addiction. This complete shift in tone will lose the audience.",How To Make Money Selling Drugs (2013)
nathalie-atkinson,fresh,3.5/4,museum_hours,"It peers into the twin galleries of art and life, and in particular follows the brief intersection of lives between a security guard (Bobby Sommer) and Anne, one of the museum's regular visitors (Mary Margaret O'Hara).",Museum Hours (2013)
nathalie-atkinson,fresh,,the_venice_syndrome,"Pichler captures the sense of resignation from all angles, through several residents.",The Venice Syndrome (Das Venedig Prinzip) (2012)
nathalie-atkinson,fresh,3.5/4,far_out_isnt_far_enough_the_tomi_ungerer_story,"The art floats and comes to life, animated and illustrating the flights of fantasy that continue unabated at [Ungerer] studio.",Far Out Isn't Far Enough: The Tomi Ungerer Story (2013)
nathalie-atkinson,rotten,1/4,austenland_2013,"It would behoove those who produced this lamentable drama to re-read [Austen's] major works, if indeed they had ever read them at all.",Austenland (2013)
nathalie-atkinson,rotten,1.5/4,filthy_gorgeous_the_bob_guccione_story,"A remarkably incurious feature length documentary, it takes everything Guccione's friends, family and associates have to say at him at face value.",Filthy Gorgeous: The Bob Guccione Story (2013)
nathalie-atkinson,rotten,1/4,baggage_claim,"""First of all, this is the stupidest idea ever,"" someone says, in Baggage Claim. Unfortunately, nobody listened.",Baggage Claim (2013)
nathalie-atkinson,fresh,,the_spy_undercover_operation,"The sort of film that lives in between where True Lies meets Get Smart, and quite fun.",The Spy: Undercover Operation (2013)
nathalie-atkinson,fresh,3/4,muscle_shoals_2013,"As the documentary demonstrates, knowing it when you hear it is one thing, but trying to explain the origin of the Muscle Shoals sound and its qualities is like dancing about architecture.",Muscle Shoals (2013)
nathalie-atkinson,rotten,1/4,girl_most_likely_2013,Even if you added a laugh track the tone is glum.,Girl Most Likely (2013)
nathalie-atkinson,rotten,1/4,diana_2013,"Overall the ""lovelorn princess in a tower"" gambit isn't just melodramatic, it's a dramatic oversimplification.",Diana (2013)
nathalie-atkinson,fresh,3/4,breastmilk,"Is breastfeeding bond or bondage? As the documentary Breastmilk examines, the pendulum swings every generation and there is no clear, correct answer.",Breastmilk (2014)
nathalie-atkinson,fresh,3/4,my_brother_the_devil_2012,The attention El Hosaini gives to the physical structures in this neighbourhood is a poignant reminder of the lack of focus there generally is on the people who live inside them.,My Brother The Devil (2013)
nathalie-atkinson,rotten,2/4,yves_saint_laurent,The genius of the title remains as inscrutable as ever.,Yves Saint Laurent (2014)
nathalie-atkinson,fresh,2.5/4,fort_tilden,Tucked in among the longueurs are moments of savage satirical virtuosity that pinion the zeitgeist.,Fort Tilden (2015)
nathalie-atkinson,fresh,3.5/4,northern_soul,"Rich in period detail, it's as transportative to the shuffling spins, fashion subculture and euphoric, amphetamine-fuelled all-nighters of 1974 Lancashire and the cult-following DJs of the Wigan Casino as a documentary, turned up to 11.",Northern Soul (2015)
nathalie-atkinson,fresh,3/4,mavis,"The movie doesn't linger on the string of bad luck that derailed the younger Staples's promising solo-career opportunities, because she doesn't - she's too busy warming up for the next show.",Mavis! (2016)
nathalie-atkinson,fresh,3/4,peggy_guggenheim_art_addict,"By her own legendary admission, Guggenheim had thousands of lovers and pursued art and sex in equal measure; this documentary goes a way to rebalancing that the addiction of the title actually took precedence.",Peggy Guggenheim: Art Addict (2015)
nathalie-atkinson,fresh,3/4,ingrid_bergman_in_her_own_words,"The screen, always Bergman's supreme medium, is proof of the power of her magnetic and energetic presence.",Ingrid Bergman in Her Own Words (Jag är Ingrid) (2015)
nathalie-atkinson,fresh,3.5/4,mustang_2015,"That there are five sisters allows Erguven to explore the scenario's several possible outcomes, be it happy ending or tragedy or the bittersweet fates in between.",Mustang (2015)
nathalie-atkinson,fresh,2.5/4,harold_and_lillian_a_hollywood_love_story,"The couple are the movie's saving grace - especially Lillian, now 87, who regales in every story, but especially the one about how she doggedly researched accurate drug-lord lifestyles for Scarface.",Harold And Lillian: A Hollywood Love Story (2017)
nathalie-atkinson,fresh,3/4,the_lady_in_the_van,"There's an elegiac, sentimental quality to this film adaptation, from the manipulative meet-cute of Alan and Miss Shepherd through their disputations.",The Lady In The Van (2015)
nathalie-atkinson,rotten,2.5/4,the_hundred_foot_journey,"This is also a feel-good foodie film that require a tolerance for watching actors chewing mouthfuls then going into ecstasies, usually without describing much more detail about flavours or how it tastes besides ""mmmm, it's delicious.""",The Hundred-Foot Journey (2014)
nathalie-atkinson,fresh,3/4,mr_right_2016,"A screwball hit-man comedy in the Grosse Pointe universe, it's like what you'd get if Nora Ephron wrote True Lies while high.",Mr. Right (2016)
nathalie-atkinson,fresh,2.5/4,the_man_from_uncle,"Mesmerizing and clever, but more style than substance.",The Man From U.N.C.L.E. (2015)
nathalie-atkinson,fresh,3/4,river_2016,"In a demanding role light on dialogue, Sutherland's rangy, loping physicality serves both the character and the action well ...",River (2016)
nathalie-atkinson,fresh,3/4,the_measure_of_a_man_2016,On this small scale and rather ordinary canvas the human drama is keenly felt.,The Measure of a Man (La loi du marché) (2016)
nathalie-atkinson,fresh,3.5/4,men_and_chicken,"It's a twisted existential grotesque that wrings thought-provoking pathos and even affection for the lunatics running the menagerie, no mean feat.",Men & Chicken (Mænd & høns) (2016)
nathalie-atkinson,fresh,4/4,love_and_friendship,Adapted with great warmth and wit ...,Love & Friendship (2016)
nathalie-atkinson,fresh,3/4,our_little_sister,"It's subdued, at times even too leisurely, but the film and its characters are luminous, especially lead Ayase Haruka.",Our Little Sister (Umimachi Diary) (2016)
nathalie-atkinson,fresh,,all_we_had,"Even in a rote story, with prosaic direction from Holmes, the lead performances ring true.",All We Had (2016)
nathalie-atkinson,rotten,2/4,table_19,RSVP: Decline with regret.,Table 19 (2017)
nathalie-atkinson,fresh,3/4,my_entire_high_school_sinking_into_the_sea,"Shaw's loose, thick characters throb on the colourful, ever-changing textured and hand-painted celluloid even as the cynical teens quip and quibble like world-weary literati.",My Entire High School Sinking Into the Sea (2017)
nathalie-atkinson,fresh,3/4,a_quiet_passion,"In a series of portrait episodes, Davies treads Dickinson's biographical terrain without presuming to editorialize; instead, Dickinson's poetry speaks for itself in voiceover.",A Quiet Passion (2017)
nathalie-atkinson,fresh,2.5/4,the_commune_2017,"Dyrholm is always exceptional but here as a femme d'un certain age in both home and career letting it all fall apart, she is incandescent, with a stillness that transcends the histrionics around her.",The Commune (Kollektivet) (2017)
nathalie-atkinson,rotten,2.5/4,woodshock_2017,A baffling and unnecessary third-act coup de théâtre abruptly crashes a comedown from the elaborate high.,Woodshock (2017)
nathalie-atkinson,fresh,3/4,francofonia,"""Who would we be without museums?"" Aleksandr Sokurov wonders as he narrates this challenging philosophical essay, and sifts materials back, forth and around in the Louvre's history.",Francofonia (2016)
nathalie-atkinson,fresh,3.5/4,the_diary_of_a_teenage_girl,"Seldom has teenage sexual awakening been covered from a female perspective - with a fickle alternating confidence, self-doubt and voracious appetite - quite so frankly or delicately.",The Diary Of A Teenage Girl (2015)
nathalie-atkinson,fresh,3/4,the_limehouse_golem,"It translates novelist Peter Ackroyd's densely historical and cerebral foray into the horror genre into an entertainment, without being weighed down by Ackroyd's numerous fascinating but imaginative layers and tangents.",The Limehouse Golem (2017)
nathalie-atkinson,rotten,1/4,irrational_man,"Ostensibly about the theory and practice of ethics, if the existential dramedy Irrational Man weren't so clumsy it could almost be a self-parody.",Irrational Man (2015)
