critic_id,critic_meter_score,critic_rating,movie_id,movie_review_blurb,movie_title
aine-oconnor,rotten,2/5,,"The Flag will prove divisive, giving fans of slapstick a hearty guffaw, while anyone favouring subtler humour will possibly be less amused.",The Flag (2016)
aine-oconnor,fresh,5/5,i_daniel_blake,The film's deftness of touch makes it extremely watchable and nowhere near as turgid as it sounds.,"I, Daniel Blake (2017)"
aine-oconnor,rotten,2/5,jack_reacher_never_go_back,"The plot is thin, a bit ridiculous, rather tenuous and silly. But the most unnerving thing is that it is a less than committed performance from Cruise. It's odd.",Jack Reacher: Never Go Back (2016)
aine-oconnor,fresh,3/5,girls_trip,Like a cross between Bridesmaids and The Hangover it pokes a little fun at the self-help business and is enjoyably un-PC.,Girls Trip (2017)
aine-oconnor,fresh,3/5,the_boy_and_the_beast,"Award-winning writer director Mamoru Hosoda's film feels like a classic tale rather than a modern take, the characters are quite two-dimensional, the moral simple, but it is sweet, engaging [and] sometimes funny.",The Boy And The Beast (Bakemono No Ko) (2016)
aine-oconnor,fresh,5/5,dunkirk_2017,"Ambitious, emotional, impressive, beautiful, terrifying and superbly cast, it's a fitting testimony to one of the most remarkable episodes in modern warfare.",Dunkirk (2017)
aine-oconnor,fresh,4/5,the_beguiled,Visibly directed as is Coppola's wont it is a sumptuously beautiful film -- cinematographer Philippe Le Sourd has a field day -- with some wonderful performances but it will leave some viewers a bit cold.,The Beguiled (2017)
aine-oconnor,fresh,3/5,pilgrimage_2017,The casting is excellent which mostly makes up for a story that feels a little thin.,Pilgrimage (2017)
aine-oconnor,fresh,4/5,david_lynch_the_art_life,As a doc about the who and why of David Lynch it is very effective but definitely made by fans for fans.,David Lynch: The Art Life (2017)
aine-oconnor,fresh,3/5,risk_2017,The result is an interesting but ultimately unsatisfying documentary,Risk (2017)
aine-oconnor,fresh,4/5,war_for_the_planet_of_the_apes,"It's a strange enough dynamic where the audience is rooting for the victory of another species but this is where this movie, serious in all senses, takes us.",War for the Planet of the Apes (2017)
aine-oconnor,fresh,4/5,the_midwife_2017,"Confidently told, it doesn't manipulate emotion but allows the script and two great performances to conjure a sweet, affecting, uplifting two hours.",The Midwife (Sage femme) (2017)
aine-oconnor,fresh,4/5,sanctuary_2016,"It's a long overdue look at an important subject, it's brave but surprisingly light and funny.",Sanctuary (2016)
aine-oconnor,fresh,3/5,twice_shy_2016,I really liked the tone of the film and how it dealt with the subject.,Twice Shy (2016)
aine-oconnor,fresh,3/5,from_the_land_of_the_moon,The ending is pretty ridiculous but overall it's engaging if taken as melodrama.,From the Land of the Moon (Mal de pierres) (2017)
aine-oconnor,fresh,5/5,graduate,"If you have never seen it, go; if you have, go again.",The Graduate (1967)
aine-oconnor,fresh,3/5,churchill_2017,"We know what happened on D-Day, but it is interesting to portray Britain's Greatest Briton as a man whose ego is getting in the way.",Churchill (2017)
aine-oconnor,fresh,4/5,cardboard_gangsters,"A film about drug dealers isn't to everyone's taste, but this is a well-made, gritty drama that doesn't glamorise anything or judge anyone, and all to a thumping soundtrack.",Cardboard Gangsters (2017)
aine-oconnor,fresh,4/5,whitney_can_i_be_me,"A must for fans, non-fans will enjoy too.",Whitney: Can I Be Me (2017)
aine-oconnor,rotten,2/5,nails_2017,"The actual spooky stuff provides a few jumps, the performances are good but overall the story is too thin, and that dilutes the impact.",Nails (2017)
aine-oconnor,fresh,4/5,norman_2017,Richard Gere is great to behold.,Norman (Norman: The Moderate Rise and Tragic Fall of a New York Fixer) (2017)
aine-oconnor,fresh,3/5,berlin_syndrome,Both leads opt to underplay their roles and it works well in what is an effective and mostly psychological horror.,Berlin Syndrome (2017)
aine-oconnor,fresh,4/5,after_the_storm_2017,[A] bittersweet and surprisingly light Japanese delicacy.,After the Storm (Umi yori mo mada fukaku) (2017)
aine-oconnor,fresh,4/5,the_red_turtle,"The film is simple, not overwhelmingly meaningful in any kind of thought-provoking way, but it is a beautiful and transporting little mini-world of its own.",The Red Turtle (La tortue rouge) (2017)
aine-oconnor,rotten,1/5,diary_of_a_wimpy_kid_the_long_haul,"The script is poor, the acting worse.",Diary Of A Wimpy Kid: The Long Haul (2017)
aine-oconnor,fresh,3/5,inversion_2017,Tehran's poor air quality is a defining issue and a metaphor for the oppression of women in Behnam Behzadi's understated but effective film.,Inversion (Varoonegi) (2017)
aine-oconnor,fresh,3/5,snatched_2017,"It's short, intentionally ridiculous and funny in places. Not hilarious.",Snatched (2017)
aine-oconnor,fresh,4/5,miss_sloane,"It's all fast dialogue, archetypes and some genre cliches but in this world principles can show in strange places, and although Sloane shows cracks, there is, refreshingly, no big ole explainer backstory.",Miss Sloane (2016)
aine-oconnor,rotten,2/5,47_meters_down,"The stars do what they can with the script and scuba tanks, and all in all it's two stars but oddly viewable.",47 Meters Down (2017)
aine-oconnor,rotten,2/5,a_ghost_story,"It is beautifully shot, as if through a filter. There is minimal dialogue and Lowery plays with the ghost and haunted house tropes. It lit only fires of irritation for me and the stars' dowdy low-key love felt hardly worth a haunting.",A Ghost Story (2017)
aine-oconnor,rotten,2/5,the_nut_job_2_nutty_by_nature,Derivative and predictable.,The Nut Job 2: Nutty by Nature (2017)
aine-oconnor,fresh,3/5,atomic_blonde_2017,"!t's all very watchable, Le Carre-esque, Cold War fun.",Atomic Blonde (2017)
aine-oconnor,fresh,3/5,finding_your_feet,"The characters are very cliched and it's all rather hackneyed. But that is most likely nit-picking to a lot of people and fair enough, so for many there will be great enjoyment from a sweet, innocuous and well-intentioned film.",Finding Your Feet (2018)
aine-oconnor,fresh,4/5,black_panther_2018,"I confess to superhero fatigue but this diversity fest is refreshing -- it takes on race and gender, it's quite serious, both in terms of politics and lack of humour, but it is well made by director Ryan Coogler, [and] has lots of action and heart.",Black Panther (2018)
aine-oconnor,fresh,4/5,the_shape_of_water_2017,"A beautiful homage to cinema, its moral is far from subtle, but Sally Hawkins's wonderful performance raises it from cute oddity to emotional journey.",The Shape of Water (2017)
aine-oconnor,fresh,4/5,glory_2017,"Shot with wonderful attention to detail, from the hands of the watch to the weight of a wrench, Glory is atmospheric and well acted and an awful sense of horrible inevitability leads to a surprising ending.",Glory (2017)
aine-oconnor,fresh,5/5,coco_2017,"It requires a lot of exposition but it's well done and once complete, this gloriously animated, musically lovely and supremely Mexican visual feast flies along.",Coco (2017)
aine-oconnor,fresh,5/5,the_post,It's also a pertinent reminder of the power journalism once had in holding governments to account. And it's a great old yarn.,The Post (2018)
aine-oconnor,fresh,4/5,hostiles,"Inevitably brutal, it is strongest on the perils of dehumanisation.",Hostiles (2018)
aine-oconnor,fresh,3/5,jumanji_welcome_to_the_jungle,"It's not strictly a kids' film, but from perhaps age six it is one that children, teens and adults will enjoy. It's great fun and nowhere near as annoying as a cast including Jack Black and Kevin Hart should be.",Jumanji: Welcome to the Jungle (2017)
aine-oconnor,fresh,3/5,the_greatest_showman_2017,"As a musical The Greatest Showman works. It's not quite up to Baz Luhrmann level but is definitely of that ilk, it looks good, the costumes and sets are colourful and dreamy and the performers give it socks... However, as a biopic it works less well.",The Greatest Showman (2017)
aine-oconnor,fresh,4/5,the_prince_of_nothingwood,"Kronlund's chain-smoking presence in the doc works well, her genuine anxiety over safety in the still violent country contrasting with Salim's very visible disregard for caution.",The Prince of Nothingwood (2017)
aine-oconnor,fresh,3/5,ferdinand,"Although it is unlikely to enter into the realm of animation classics, Ferdinand is sweet and well-intentioned.",Ferdinand (2017)
aine-oconnor,fresh,4/5,star_wars_the_last_jedi,"The Last Jedi is good, in parts very good but not as good as The Force Awakens. It's too long but not tedious, it's often funny and full of action.",Star Wars: The Last Jedi (2017)
aine-oconnor,fresh,4/5,mindhorn,"Barratt is perfect in the role and the film will especially (but not exclusively) amuse people familiar with 1980s cop shows, via Alan Partridge.",Mindhorn (2016)
aine-oconnor,fresh,4/5,better_watch_out,"An interesting take on the home invasion model it's well acted, tongue in cheek, often funny and although not terrifying provides a few jumps and more than the average number of surprises.",Better Watch Out (2017)
aine-oconnor,fresh,4/5,the_disaster_artist,"Although the humour is Marmite, the story is good.",The Disaster Artist (2017)
aine-oconnor,fresh,4/5,stronger_2017,"Gyllenhaal is great but the film's richness is in Erin, a well-written character given great life by Maslany.",Stronger (2017)
aine-oconnor,fresh,4/5,wonder,"[Jason] Tremblay was wonderful in Room and he is again here, [Julia] Roberts is suitably fierce, [Owen] Wilson keeps it low key.",Wonder (2017)
aine-oconnor,fresh,4/5,the_man_who_invented_christmas,"It's simple, nice and very enjoyable.",The Man Who Invented Christmas (2017)
aine-oconnor,fresh,4/5,battle_of_the_sexes,"Co-directors Valerie Faris and Jonathon Dayton, working from Simon Beaufoy's screenplay, deliver a layered, moving, funny and fascinating movie.",Battle of the Sexes (2017)
aine-oconnor,fresh,4/5,film_stars_dont_die_in_liverpool,"The performances, and chemistry, are great and there is much to enjoy in a My Week With Marilyn kind of way.",Film Stars Don't Die in Liverpool (2017)
aine-oconnor,rotten,2/5,home_again_2017,... terribly bland.,Home Again (2017)
aine-oconnor,fresh,3/5,kingsman_the_golden_circle,"It's a far-fetched, fun, loud, cameo-rich spectacle.",Kingsman: The Golden Circle (2017)
aine-oconnor,fresh,4/5,it_2017,"Too long, but very good, director Andres Muschietti has done a really nice job and the kids are great.",It (2017)
aine-oconnor,fresh,4/5,an_inconvenient_sequel_truth_to_power,"It is most likely to preach to the converted and although Gore was right about too much 10 years ago, the film is not without hope.",An Inconvenient Sequel: Truth To Power (2017)
aine-oconnor,fresh,3/5,final_portrait,"Like most modern biopics, it focuses on a short period in his life rather than the whole span but it gives a good sense of the man.",Final Portrait (2018)
aine-oconnor,fresh,,the_dark_tower_2017,"The dialogue is dodgy, the emotional impact weak, the story squished. However, the effects are good, there are a few laughs and it will please an audience younger than it should.",The Dark Tower (2017)
aine-oconnor,fresh,4/5,brigsby_bear_2017,"It's funny, sweet and a tiny bit odd.",Brigsby Bear (2017)
aine-oconnor,fresh,3/5,the_journey_2017,Difficult roles are played well in this unlikely reluctant buddy road movie.,The Journey (2017)
aine-oconnor,fresh,4/5,i_am_not_madame_bovary,"A long, slow burning, often funny, modern fable.",I Am Not Madame Bovary (2016)
aine-oconnor,fresh,4/5,lady_macbeth,"There are lots of moral issues raised: control vs freedom, freedom vs power, the crossing of moral boundaries and the notion that lust in women is akin to evil. I really liked it.",Lady Macbeth (2017)
aine-oconnor,fresh,3/5,endless_poetry,"Jodorowsky, who appears occasionally to give his younger self advice, delivers what is perhaps his most accessible film, one in which his admiration for Fellini is evident. It appears random but has some really impactful emotional insights.",Endless Poetry (Poesía Sin Fin) (2017)
aine-oconnor,rotten,2/5,suntan_2017,"Bar basic human standards, it is hard to feel for anyone involved.",Suntan (2017)
aine-oconnor,fresh,4/5,uncle_howard,It felt a little tangential in the beginning but the doc comes together properly when it is more about Howard and it does give a strong sense of the man and his work.,Uncle Howard (2016)
aine-oconnor,fresh,4/5,the_black_hen_2015,"Some of the acting is amateur but it works, leaving a sense of damage that honours the thousands of known casualties of the war.",The Black Hen (Kalo Pothi) (2015)
aine-oconnor,fresh,4/5,united_states_of_love_2016,"It's beautifully shot by Oleg Mutu but a little too self-consciously directed on occasion with too many of the gorgeous, nearly still life shots and too many back of head shots but its aim is mostly true and the emotions linger.",United States of Love (Estados Unidos de Amor) (2016)
aine-oconnor,fresh,3/5,the_birth_of_a_nation_2016,Manipulative but engaging.,The Birth of a Nation (2016)
aine-oconnor,fresh,4/5,life_animated,"This informative, very affecting film is excellent on both the perspective of those with autism and those who love them.","Life, Animated (2016)"
aine-oconnor,rotten,2/5,how_to_be_single_2016,"Johnson is an appealing lead and although the message is mixed and some of the scenes are awkwardly badly written, it holds together fine over two hours and there are funny moments.",How To Be Single (2016)
aine-oconnor,fresh,3/5,freeheld_2015,"Half love story, half kind of courtroom drama, over-egging the emotion in the film diminishes the story's emotional richness. So, three stars for story rather than delivery.",Freeheld (2015)
aine-oconnor,fresh,3/5,the_finest_hours,"Not a truly great film, but a really nice one.",The Finest Hours (2016)
aine-oconnor,fresh,3/5,bleed_for_this,"It adheres to all the genre conventions and, although not a classic, is engaging and enjoyable.",Bleed For This (2016)
aine-oconnor,fresh,5/5,moana_2016,"The literal and metaphorical journey is predictable but fun, funny and beautiful. It's got a lovely score and a great tone, ye parents of wee daughters might finally be able to let Frozen go.",Moana (2016)
aine-oconnor,fresh,4/5,silence_2017,"Rodrigo Prieto's cinematography is beautiful, Scorsese's direction restrained and the performances excellent.",Silence (2017)
aine-oconnor,fresh,4/5,fantastic_beasts_and_where_to_find_them,"There's a timely, if somewhat clunky moral about fear and bigotry and it looks amazing. The performances are very good and it is a full cinematic experience.",Fantastic Beasts and Where to Find Them (2016)
aine-oconnor,fresh,3/5,gimme_danger,"It is a bit too detailed for non fans but as an art doc it works, and as an ode to Iggy and the Stooges it shines.",Gimme Danger (2016)
aine-oconnor,rotten,,focus_2014,Nowhere near as clever as aims to be.,Focus (2015)
aine-oconnor,fresh,,the_second_best_exotic_marigold_hotel,"Fans of the first film will enjoy this, which is basically more of the same with added Richard Gere.",The Second Best Exotic Marigold Hotel (2015)
aine-oconnor,fresh,,dolphin_tale_2,"The aquatic photography is very good and there feels like genuine emotion for Winter. It's formulaic and predictable, but hey, it sort of has to be.",Dolphin Tale 2 (2014)
aine-oconnor,rotten,,life_after_beth,Whilst not truly awful it just didn't work well on any level for me and it missed most of its marks.,Life After Beth (2014)
aine-oconnor,rotten,2/5,a_street_cat_named_bob,As someone who never watches cat videos on YouTube I may be just missing something cat video fans will savour.,A Street Cat Named Bob (2016)
aine-oconnor,rotten,3/5,the_land_of_the_enlightened,"It is rather style over substance, and raises more questions than it answers.",The Land of the Enlightened (2016)
aine-oconnor,fresh,,gone_girl,"The story is good, the performances too, it's long but it's worth it.",Gone Girl (2014)
aine-oconnor,fresh,4/5,train_to_busan,"Writer/director Sang-ho Yeon is stronger in the action scenes than in the emotional and social ones but overall delivers a largely exciting, sometimes funny and zombie thriller-drama with some fantastic shots and set pieces.",Train to Busan (Busanhaeng) (2016)
aine-oconnor,fresh,4/5,doctor_strange_2016,"Like a cross between later Harry Potter and 2001: A Space Odyssey, it might baffle younger children, but works very well on most levels.",Doctor Strange (2016)
aine-oconnor,fresh,3/5,trolls,"It's sweet, funny, irreverent and gender-balanced. It has fab tunes and the message about happiness is a great one.",Trolls (2016)
aine-oconnor,fresh,4/5,queen_of_katwe_2016,"It's uplifting, feel-good, nice, well shot and really well acted.",Queen of Katwe (2016)
aine-oconnor,fresh,4/5,the_innocents_2016,"Heartbreaking and heart-warming, it examines faith, love, honour, shame and obedience versus free will.",The Innocents (Les innocentes) (2016)
aine-oconnor,fresh,3/5,sing_2016,"Although not terribly original, it is sweet and fun.",Sing (2016)
aine-oconnor,fresh,3/5,the_eagle_huntress,"It's interesting, beautiful and Aisholpan and her dad are so sweet that it makes for lovely viewing.",The Eagle Huntress (2016)
aine-oconnor,fresh,4/5,lion_2016,The award-baiting performances are really good and it is beautifully shot by cinematographer Greig Fraser.,Lion (2016)
aine-oconnor,fresh,3/5,the_promise_2017,"The fictional love triangle does overshadow the evil at times but, that said, I do know more about the genocide than I did and the film, which has some good performances, is extremely watchable.",The Promise (2017)
aine-oconnor,fresh,4/5,handsome_devil,"Unashamedly feelgood, it makes its point lightly and really enjoyably.",Handsome Devil (2017)
aine-oconnor,fresh,3/5,rules_dont_apply,"It's too long but there is a light touch to this often funny look back to old Hollywood. Fans of nice, gentle entertainment should enjoy it.",Rules Don't Apply (2016)
aine-oconnor,fresh,4/5,the_zookeepers_wife_2017,"Although not as emotionally involving as it could have been, Chastain is as wonderful as ever as the plot revolves around her.",The Zookeeper's Wife (2017)
aine-oconnor,fresh,4/5,their_finest_2017,"There is lots going on but it works very well. Nighy's schtick is more nuanced than usual and Arterton and Claflin are great, individually and together. Sweet, cameo-laden and really enjoyable.",Their Finest (2017)
aine-oconnor,rotten,2/5,unforgettable_2017,"There are accidentally bad films and unapologetically bad films. Accidentally bad ones are sometimes sad, often boring. Unapologetically bad ones, however, tend to be neither sad nor boring -- and so it is with Unforgettable.",Unforgettable (2017)
aine-oconnor,fresh,4/5,raw_2017,"This is cleverly written and directed by debut filmmaker Julia Ducournau, really well acted by its young stars and while definitely somewhere in the horror genre, it has elements of thriller, sexual politics and proper coming-of-age drama.",Raw (2017)
aine-oconnor,fresh,4/5,free_fire,"It is original, undemanding, award-bait-free, fun-based cinema and there is an awful lot to be said for that.",Free Fire (2017)
aine-oconnor,rotten,2/5,xxx_return_of_xander_cage,"The plot is thin, the characters one-dimensional and the action non-stop.",xXx: Return of Xander Cage (2017)
aine-oconnor,fresh,4/5,the_salesman_2017,A wonderfully powerful study of complex human emotion.,The Salesman (Forushande) (2017)
aine-oconnor,fresh,3/5,personal_shopper,"As in his last film, Clouds of Sils Maria, Assayas is ably helped by an interesting performance from Kristen Stewart.",Personal Shopper (2017)
aine-oconnor,fresh,3/5,beauty_and_the_beast_2017,"This is sweet, enjoyable and it is always visually sumptuous.",Beauty and the Beast (2017)
aine-oconnor,fresh,4/5,elle_2016,It is complicated but it's also strangely enjoyable.,Elle (2016)
aine-oconnor,fresh,3/5,the_secret_scripture,"It could have been better, but many people will still enjoy this a lot, especially if you view it separate from the novel.",The Secret Scripture (2017)
aine-oconnor,rotten,1/5,fist_fight_2017,Sadly I can't think of anyone who would find Fist Fight terribly funny.,Fist Fight (2017)
aine-oconnor,fresh,4/5,denial_2016,"The film focuses on the legal arguments and the relationships, and does so well. It's a fraught topic and a difficult line to tread. They manage it and the performances make the film.",Denial (2016)
aine-oconnor,fresh,3/5,viceroys_house,It's informative and enjoyable.,Viceroy's House (2017)
aine-oconnor,fresh,3/5,gold_2017,"It's one thing giving a great performance in a great movie, it's another thing entirely to shine in a mediocre film. And while Gold tells a good story not particularly well -- it is further proof of the McConnaissance.",Gold (2017)
aine-oconnor,fresh,4/5,the_lego_batman_movie,"It's a little too long, there is only so much Batman deconstruction anyone can take, but it's star-studded, smart and funny.",The Lego Batman Movie (2017)
aine-oconnor,fresh,5/5,meetings_with_ivor,It's a great insight into a fascinating man.,Meetings With Ivor (2017)
aine-oconnor,fresh,4/5,loving_2016,"Important, effective and beautifully told.",Loving (2016)
aine-oconnor,fresh,3/5,john_wick_chapter_2,"The original film... was adored by many, but it simply is not everyone's cup of celluloid. And this sequel is not going to broaden its appeal. It will however seriously satisfy fans of the first film.",John Wick: Chapter 2 (2017)
aine-oconnor,fresh,4/5,the_founder,"John Lee Hancock's film is a timely look at a moment in American history. Keaton is always watchable and the slight moral ambiguity, leaving the audience to draw their own conclusion, adds a nice layer.",The Founder (2017)
aine-oconnor,fresh,3/5,fences_2016,"This is clearly an impressive piece of work, but it borders on self-indulgence and its appeal is not that broad.",Fences (2016)
aine-oconnor,rotten,2/5,its_only_the_end_of_the_world,"It's supposed to be about self-pity and self-involvement stymying empathy, but the characters are more caricatures and it felt overwrought.",It's Only the End of the World (Juste la fin du monde) (2016)
aine-oconnor,fresh,4/5,george_best_all_by_himself,"The sum total is effective and certainly no hagiography, it paints a rather complete and sad story.",George Best: All by Himself (2017)
aine-oconnor,fresh,5/5,hidden_figures,Very uplifting.,Hidden Figures (2017)
aisha-harris,rotten,,very_semi_serious_2015,It gets a bit lost in the weeds.,Very Semi-Serious (2015)
aisha-harris,fresh,4/5,europa_report,It becomes refreshingly clear early on that this is a rare modern science-fiction film where the filmmakers aren't afraid to pack actual science into their narrative.,Europa Report (2013)
aisha-harris,fresh,3/5,the_time_being,"The Time Being is a visual pleasure, with Cicin-Sain unveiling shot after shot of glorious landscapes and striking silhouettes. It's a shame, then, that Bentley's performance as Daniel isn't more fully engaged.",The Time Being (2013)
aisha-harris,fresh,,closed_circuit_2013,There are enough genuine moments of surprise to make this genre exercise an invigorating one.,Closed Circuit (2013)
aisha-harris,rotten,2/5,winnie_mandela,"Director Darrell Roodt's by-the-numbers biopic suffers from clunky dialogue and shallow characterization, all while never deciding what to make of its leading lady.",Winnie Mandela (2013)
aisha-harris,fresh,,tammy_2014,"The playful energy between McCarthy and her completely game co-star, Susan Sarandon is more than enough to keep the movie humming along.",Tammy (2014)
aisha-harris,rotten,,dear_white_people,"I nodded my head in agreement many times while watching Dear White People, but I can't say I was ever truly compelled by the story it tells.",Dear White People (2014)
aisha-harris,rotten,,the_interview_2014,"If you like your dictator mockery served on a sharper, smarter dish, you should probably just do what everyone else seems to be doing, and rewatch Team America: World Police.",The Interview (2014)
aisha-harris,fresh,,z_for_zachariah,Zobel and Modi have crafted a thoughtful narrative about the experience of navigating and attempting to accommodate others' personalities.,Z For Zachariah (2015)
aisha-harris,fresh,,live_from_new_york,It's refreshing to see a retrospective of the show that's not bogged down by overly detailed timelines and the desire to wax nostalgic.,Live From New York! (2015)
aisha-harris,fresh,,mudbound,"Mudbound is the work of a filmmaker whose vision is uninhibited. Even when it falters through later narrative twists that become almost too much to bear, it's a captivating experience-one that we're lucky exists.",Mudbound (2017)
aisha-harris,fresh,,chi_raq,"Lee has managed to again make a movie worth debating, wrestling with, and maybe even hating, depending upon how you feel about him as a director.",Chi-Raq (2015)
aisha-harris,fresh,,the_magnificent_seven_2016,"The Magnificent Seven, as derivative as it may be, makes for a decent couple of hours wasted.",The Magnificent Seven (2016)
aisha-harris,fresh,,get_out,"Only grows more darkly relevant as the main story gets going, masterfully unfurling all of the real-life anxieties of Existing While Black while simultaneously mining that situation for all its twisted absurdity.",Get Out (2017)
aisha-harris,fresh,,beauty_and_the_beast_2017,You'll probably walk away longing to revisit the original for the ump-hundredth time. But isn't that the point?,Beauty and the Beast (2017)
aisha-harris,rotten,,all_eyez_on_me_2017,"The last 20 minutes or so of the film try desperately to create drama out of an ending we all already know, milking every moment for maximum ominousness.",All Eyez on Me (2017)
