critic_id,critic_meter_score,critic_rating,movie_id,movie_review_blurb,movie_title
alex-doenau,fresh,,a_royal_night_out,"Of virtually no use as a socio-historical document, this is a movie that thrives on the appeal of its bright-eyed leads and the intervention of outrageous fortune. Fortunately for A Royal Night Out, that's enough.",A Royal Night Out (2015)
alex-doenau,fresh,,the_boss_2016,Many modern comedies don't have much in the way of laughs or serviceable plots. That The Boss manages to land an admirable number of jokes while almost telling its story in a satisfactory manner feels like a triumph.,The Boss (2016)
alex-doenau,fresh,,strangerland_2015,Strangerland works surprisingly well for a film that hinges on bad teenage poetry delivered in a completely disaffected tone.,Strangerland (2015)
alex-doenau,fresh,,captain_america_civil_war,"Captain America: Civil War is overflowing with characters, taking old favourites, introducing new ones, and making them all work together in glorious harmony.",Captain America: Civil War (2016)
alex-doenau,fresh,,it_2017,"It may be less familiar to fans of either of the original works: something new may come from the old, and that's exciting; in the meantime It stands as a solid half-an-adaptation of a genre classic and a legitimate horror film.",It (2017)
alex-doenau,fresh,,the_big_sick,"Without overemphasising either the laughs or the emotion, The Big Sick is a romantic comedy that feels genuine.",The Big Sick (2017)
alex-doenau,fresh,,atomic_blonde_2017,There are many people willing to watch Charlize Theron commit violent acts; Atomic Blonde is one such vehicle that never fails to deliver in that regard.,Atomic Blonde (2017)
alex-doenau,fresh,,war_for_the_planet_of_the_apes,War for the Planet of the Apes is overall a polished work that often explodes before your eyes into something truly radiant.,War for the Planet of the Apes (2017)
alex-doenau,rotten,,paris_can_wait,"Ill-conceived and clumsily executed, this is the sort of film that coasts on the names involved and is too indifferent to care if audiences actually like it.",Paris Can Wait (Bonjour Anne) (2017)
alex-doenau,fresh,,dunkirk_2017,As an examination of collective triumph and spirit it is a decisive victory.,Dunkirk (2017)
alex-doenau,rotten,,baby_driver,Baby Driver is too much the soulless good boy doing bad things; what it lacks in substance it can't hope to make up for in style.,Baby Driver (2017)
alex-doenau,fresh,,the_beguiled,"To watch The Beguiled is to see a director at the peak of her craft, in full control of her facilities.",The Beguiled (2017)
alex-doenau,fresh,,spider_man_homecoming,"It is a film that shows that cohesion of universe, a clear vision for a character, and a whole lot of money can make something of lasting value, and not just an eyesore that fizzles out after a single weekend.",Spider-Man: Homecoming (2017)
alex-doenau,rotten,,rough_night,"Rough Night is a film of few surprises and fewer delights, a one-idea film that has difficulty filling out its overly generous 101 minutes.",Rough Night (2017)
alex-doenau,fresh,,fun_mom_dinner,"Fun Mom Dinner is as the name suggests, and it's one of those gifts you're supposed to give yourself once a day.",Fun Mom Dinner (2017)
alex-doenau,fresh,,brigsby_bear_2017,"Brigsby Bear is the sort of festival film that other festival films dream of being. Certainly it's quirky, but it's informed by an unassailable sincerity at its heart that dares you to accept it.",Brigsby Bear (2017)
alex-doenau,fresh,,patti_cakes,"Patti Cake$ isn't exactly a rare film, but it is a fine addition to the pantheon of underdog movies.",Patti Cake$ (2017)
alex-doenau,fresh,,the_other_side_of_hope,"The Other Side of Hope is a delicate balancing act that engages with the optimism deep within all of our souls, and it satisfies at a primal level.",The Other Side of Hope (Toivon tuolla puolen) (2017)
alex-doenau,fresh,,wonder_woman_2017,"With strong characterisation from a largely committed cast, coherent action and a rare confidence in its mise-en-scène, Wonder Woman is a comic book movie the way they should be done.",Wonder Woman (2017)
alex-doenau,rotten,,baywatch_2017,"Baywatch is the latest in an increasingly long line of TV adaptation misfires, and it's one with some of the biggest names attached.",Baywatch (2017)
alex-doenau,fresh,,king_arthur_legend_of_the_sword,"King Arthur: Legend of the Sword could have been one thing or the other -- one entertaining, one stock standard -- but it settles on an unhappy medium that is never tonally consistent.",King Arthur: Legend Of The Sword (2017)
alex-doenau,fresh,,guardians_of_the_galaxy_vol_2,"This is James Gunn taking his hundreds of millions of dollars and trying something more personal and heartfelt than one might have expected from a film whose ensemble include a trash panda, a twig and a woman with antennae protruding from her head.",Guardians of the Galaxy Vol. 2 (2017)
alex-doenau,fresh,,their_finest_2017,"Their Finest is not the kind of film on which wars are won, but it is exactly what a key demographic loves at the Australian box office. A calculated crowd-pleaser.",Their Finest (2017)
alex-doenau,rotten,,chips,"CHIPS is a vulgar and unthrilling comedy based on a forty-year-old franchise that no one looks particularly fondly on, its only claim to memorability being its repeated reference to analingus.",CHIPS (2017)
alex-doenau,rotten,,ghost_in_the_shell_2017,"Ghost in the Shell is a movie that could have been a clean sweep, but the only elements that work are those that are directly taken from the 1995 and 2004 iterations, and even they are twisted into meaninglessness.",Ghost in the Shell (2017)
alex-doenau,fresh,,beauty_and_the_beast_2017,"It's not great as a musical, but as a piece of dramatic fiction it has something to recommend it that pushes it across the line into satisfactory, even entertaining, cinema.",Beauty and the Beast (2017)
alex-doenau,fresh,,sabans_power_rangers,"Power Rangers is a movie that is better than it probably should have been, but one that waits until it's almost entirely too late to strike the tone that it's most comfortable with.",Saban's Power Rangers (2017)
alex-doenau,fresh,,the_eagle_huntress,The Eagle Huntress is an organic documentary made by a director who has an affinity for the serendipitous and an eye for on screen talent and scenery.,The Eagle Huntress (2016)
alex-doenau,fresh,,jasper_jones,"Well scripted, shot, and acted, there's very little not to recommend it: it streamlines a story without sacrificing complexity, and it is both entertaining and thoughtful while it's at it. It's enough to give you faith in the industry.",Jasper Jones (2016)
alex-doenau,rotten,,a_few_less_men,"A Few Less Men is a throwback of a film, and not in a good way; it's messy rather than scrappy, and it just ends.",A Few Less Men (2016)
alex-doenau,fresh,,the_mummy_2017,"Despite a few hiccups of self-seriousness, there is a certain goofy tone that gets struck throughout that speaks of promise for the works to come.",The Mummy (2017)
alex-doenau,fresh,,logan_2017,"Logan is a deliberately scuffed up work of comic adaptation art, and Jackman and Stewart could not have chosen to end their X careers on a higher note.",Logan (2017)
alex-doenau,rotten,,the_emoji_movie,"Sad to look at and joyless to watch, there's nothing on offer here for anyone but the least-demanding child.",The Emoji Movie (2017)
alex-doenau,rotten,,american_assassin_2017,"American Assassin is a decently made tour of Europe, utilising easy target villains to maximise cheering from audiences willing to accept diplomacy down the barrel of a gun...as long as the gun is held by a nominally handsome American man.",American Assassin (2017)
alex-doenau,fresh,,the_jungle_book_2016,This is a new children's classic with genuine substance and care evident in every frame.,The Jungle Book (2016)
alex-doenau,rotten,,initiation_love,"Initiation Love is one third of a good movie, let down by 80 minutes of consistent frustration and inconsistent meeting of audience expectations.",Initiation Love (Inishieshon Rabu) (2015)
alex-doenau,rotten,,la_la_la_at_rock_bottom,"La La La at Rock Bottom evaporates like so many lost memories. It's not an unpleasant film, but it's missing key elements that would have provided both narrative satisfaction and cohesive characterisation.",La La La at Rock Bottom (Misono Universe) (2015)
alex-doenau,fresh,,lady_bird,"Lady Bird is a teen movie written by someone who remembers what it was like to be a teen, and one that understands that a character can be difficult without being irredeemable.",Lady Bird (2017)
alex-doenau,fresh,,black_panther_2018,"Black Panther gives you everything that you want from a Marvel movie, but it goes just that little bit further to sink its claws in and reward its unsuspecting audience.",Black Panther (2018)
alex-doenau,fresh,,sweet_country_2018,"Sweet Country is a landmark work of Australian cinema, even if it lacks commerciality: what it does offer is the diamond hardness of certainty. Few films are as sincere as this one.",Sweet Country (2018)
alex-doenau,rotten,,darkest_hour_2017,"Ultimately, if you want to hear Churchill talking about fighting them on the beaches, you could just watch Dunkirk again - Oldman's performance is literally transformative, but Darkest Hour is just another pedestrian biopic.",Darkest Hour (2017)
alex-doenau,fresh,,three_billboards_outside_ebbing_missouri,"If Mildred is not a memorable character, the movie isn't being watched correctly.","Three Billboards Outside Ebbing, Missouri (2017)"
alex-doenau,fresh,,jumanji_welcome_to_the_jungle,"Jumanji: Welcome to the Jungle is a decent light-comedy adventure film that forgets much of what distinguished its predecessor, but stands on its own feet.",Jumanji: Welcome to the Jungle (2017)
alex-doenau,fresh,,downsizing,"Downsizing would have been compromised if it had been designed to please everybody; Payne's undiluted vision is admirable, and you almost owe it to him to try it out.",Downsizing (2017)
alex-doenau,fresh,,star_wars_the_last_jedi,"If you can accept the excess, the weird humour, the entirely inessential subplot, and the fact that it could stand to end a scene earlier, then the series will continue to thrive in a galaxy far, far away.",Star Wars: The Last Jedi (2017)
alex-doenau,fresh,,paddington_2,"If more writers and directors respected their audiences as King and Farnaby clearly does, the world's entertainment output would be significantly improved. Just like the bear himself, Paddington 2 makes the world a slightly better place.",Paddington 2 (2018)
alex-doenau,rotten,,kingsman_the_golden_circle,The Golden Circle has the scent of missed potential.,Kingsman: The Golden Circle (2017)
alex-doenau,rotten,,flower_and_sword,"Given the span of the film and the capriciousness of Hideyoshi Toyotomi, Flower and Sword has an awkward balance to it that one of Senko's creations would probably never suffer.",Flower And Sword (Hana Ikusa) (2017)
alex-doenau,fresh,,midnight_diner_2,"Midnight Diner 2 is a pleasant anthology film. It definitely feels like three episodes of a television series, and has only the slightest arc as its outer shell, but it's a nice experience, and if you want more, you can always go home and watch it.",Midnight Diner 2 (Zoku Shinya Shokudô) (2016)
alex-doenau,fresh,,the_disaster_artist,"The Disaster Artist is a movie that supplements an excellent film and an entertaining book while not quite hitting either's mark, but it is entertaining.",The Disaster Artist (2017)
alex-doenau,rotten,,my_uncle,"Cuteness and jauntiness can only go so far if there's no substance backing them up. My Uncle, a Japanese film with a name suggestive of a much loved, much older French film, is that insubstantial film.",My Uncle (Boku No Ojisan) (2016)
alex-doenau,fresh,,relife,ReLIFE is fairly standard manga-to-live-action adaptation fare that hits all of the right notes without exactly developing them.,ReLIFE (2017)
alex-doenau,fresh,,her_love_boils_bathwater,"Her Love Boils Bathwater very firmly belongs to its genre, but it innovates and expands on its hallmarks in such a way that it is able to sufficiently stand out.",Her Love Boils Bathwater (Yu Wo Wakasuhodo No Atsui Ai) (2016)
alex-doenau,fresh,,mumon_the_land_of_stealth,Mumon: Land Of Stealth is a movie that blinds its audience with flashily committed murders and then judges them for daring to enjoy the mayhem.,Mumon: The Land Of Stealth (Shinobi No Kuni) (2017)
alex-doenau,fresh,,justice_league_2017,Justice League is not the finest film in the DC Extended Universe - that honour is likely going to belong to Wonder Woman for a while yet - but it's much more in line with an actual movie than the first three outings.,Justice League (2017)
alex-doenau,fresh,,tori_girl,Tori Girl is a fun and compact movie that combines the best of cycling with human-assisted flight.,Tori Girl! (Tori gâru!) (2017)
alex-doenau,fresh,,thor_ragnarok_2017,Taking a character who has become embedded in the popular psyche and doing something slightly twisted with them is a good way of ensuring continuity while thumbing one's nose at the familiarity of contempt.,Thor: Ragnarok (2017)
alex-doenau,rotten,,suburbicon,"Perhaps the Coens could have made a better film of Suburbicon, but their friend Clooney has presented a collection of moments that never quite meld.",Suburbicon (2017)
alex-doenau,fresh,,happy_death_day,It's a refreshing piece of light horror that eschews gratuity for the sake of efficient storytelling that occasionally allows for both tongue-in-cheek and knife-in-gut and effectively stands astride multiple genre boundaries.,Happy Death Day (2017)
alex-doenau,fresh,,american_made_2017,"American Assassin is a decently made tour of Europe, utilising easy target villains to maximise cheering from audiences willing to accept diplomacy down the barrel of a gun... as long as the gun is held by a nominally handsome American man.",American Made (2017)
alex-doenau,rotten,,wonder_wheel,"Wonder Wheel has a fundamentally solid concept and theme, but Allen's approach to heaping on miseries and neuroses becomes exhausting, and the film collapses under its own weight.",Wonder Wheel (2017)
alex-doenau,fresh,,miss_sloane,"Miss Sloane is a taut ""thriller"", for lack of a better genre pigeonhole, brilliantly acted and intriguingly constructed, with only several baffling creative decisions bringing it slightly down.",Miss Sloane (2016)
alex-doenau,fresh,,alien_covenant,"Alien Covenant is often intriguing, but it feels more like an explanation engine than a movie.",Alien: Covenant (2017)
alex-doenau,fresh,,hidden_figures,"A movie that is important, well-performed, and entertaining. It's a real crowd-pleaser, in other words.",Hidden Figures (2017)
alex-doenau,fresh,,suicide_squad_2016,Suicide Squad is a movie that contains moments of legitimate entertainment value that far outweigh any of its shortcomings.,Suicide Squad (2016)
alex-doenau,rotten,,jason_bourne,"While it doesn't need humour, it suffers from a terminal lack of charisma and imagination, leaving the world exactly as it was two hours before it started.",Jason Bourne (2016)
alex-doenau,fresh,,star_trek_beyond,"You could ask for more, but Star Trek Beyond is more than enough to be contented with.",Star Trek Beyond (2016)
alex-doenau,fresh,,love_and_friendship,"Beckinsale is the perfect vessel for this dialogue, rattling off completely un-self aware statements and insults that border on the ridiculous with a straight face.",Love & Friendship (2016)
alex-doenau,fresh,,being_17,"Being 17 is not a perfect film, but it is a remarkably measured examination of teenage infatuation and conflicting emotions.",Being 17 (Quand on a 17 ans) (2016)
alex-doenau,fresh,,sing_street,"With a great cast, soundtrack and a tender soul, Sing Street deserves to be an enduring antidote to nostalgia, a giant of modern Irish cinema.",Sing Street (2016)
alex-doenau,fresh,,ghostbusters_2016,"Without memorable ghostly lore, there's the definite feel that there should be something more to Ghostbusters, but the four women and their dopey receptionist are enough to carry it over the line.",Ghostbusters (2016)
alex-doenau,rotten,,maggies_plan_2016,"Maggie's Plan is a movie that flirts with greatness, but it frequently becomes hung up on its own artifice.",Maggie's Plan (2016)
alex-doenau,rotten,,the_bfg_2016,"The BFG is dull and ugly. With no evidence of the charm of its source material, its screenwriter, or its director, it deserves to sink into obscurity.",The BFG (2016)
alex-doenau,rotten,,t2_trainspotting,"It can be worth revisiting once youthful characters decades later, but often people get less interesting as they get older: T2 Trainspotting has less to say than its classic antecedent, and takes significantly more time to say it.",T2 Trainspotting (2017)
alex-doenau,fresh,,everybody_wants_some,"Here we have a celebration of male camaraderie and masculinity that comes at the expense of no one, a sex comedy that is both sexy and comedic.",Everybody Wants Some!! (2016)
alex-doenau,fresh,,mom_and_me_2017,"A 77-minute heartfelt confection that is both tailored specifically to each pair it represents and demonstrates the strains of universality, truly making Mom and Me hit home with audiences that have ever had any sort of maternal relationships.",Mom and Me (2017)
alex-doenau,fresh,,goat_2016,"Even when it is at its most extreme, it feels painfully believable.",Goat (2016)
alex-doenau,fresh,,land_of_mine,"Land of Mine is not a conventionally entertaining movie, but it is very well made.",Land of Mine (Under Sandet) (2017)
alex-doenau,fresh,,swiss_army_man,"Buoyed by two committed performances, excellent sound design and a total lack of concern for discerning between the real and the illusive, this is a film to take away from the cinema with you. What you do with it after that, however, who knows.",Swiss Army Man (2016)
alex-doenau,fresh,,mustang_2015,This is accomplished debut film making with an important message with the promise of more great works to come.,Mustang (2015)
alex-doenau,fresh,,certain_women_2016,"With no answers, great actresses and few rewards, Certain Women is a tough but worthy trip.",Certain Women (2016)
alex-doenau,rotten,,its_only_the_end_of_the_world,"A claustrophobic, up close and overly blunt piece, It's Only the End of the World doesn't even have the normal style that Dolan has to fall back on when his films aren't working on a thematic level.",It's Only the End of the World (Juste la fin du monde) (2016)
alex-doenau,fresh,,money_monster,Technical accomplishment pushes Money Monster over the line from a competent thriller on paper to a breathless 98 minutes that pop.,Money Monster (2016)
alex-doenau,rotten,,teenage_mutant_ninja_turtles_out_of_the_shadows,"Teenage Mutant Ninja Turtles: Out of the Shadows doesn't look good, has some truly awful dialogue and even the most forgiving Turtle fan may not be able to overlook its manifold shortcomings.",Teenage Mutant Ninja Turtles: Out of the Shadows (2016)
alex-doenau,fresh,,now_you_see_me_2,"Films that are entertaining without having substance to them aren't uncommon, but Now You See Me 2 is the epitome of the empty flash.",Now You See Me 2 (2016)
alex-doenau,rotten,,alice_in_wonderland_through_the_looking_glass,[Alice Through the Looking Glass] takes echoes of familiar material and jams them together with limited success.,Alice Through the Looking Glass (2016)
alex-doenau,fresh,,whiskey_tango_foxtrot,"While its portrayal of the country that it calls home is not strictly authentic, the movie has an element of human truth that carries it over the line.",Whiskey Tango Foxtrot (2016)
alex-doenau,fresh,,florence_foster_jenkins_2016,"Despite its imperfections, Florence Foster Jenkins is a heartfelt piece of cinema, and its emotional core leaves the screen with you.",Florence Foster Jenkins (2016)
alex-doenau,fresh,,neighbors_2_sorority_rising,"Bad Neighbours 2 is a legitimately funny comedy with a story, the minor miracle of modern filmmaking. It flirts with social commentary, takes advantage of most of its ensemble, and at least vaguely attempts to sequel-proof itself.",Neighbors 2: Sorority Rising (2016)
alex-doenau,fresh,,eddie_the_eagle,"The outcome of Eddie the Eagle is apparent to anyone who's ever seen a sports movie before, but that really doesn't matter.",Eddie The Eagle (2016)
alex-doenau,rotten,,marguerite,Catherine Frot is exceptional in the lead in the most literal sense of the word: she's the exception to an otherwise awful movie.,Marguerite (2016)
alex-doenau,rotten,,hardcore_henry,"You can respect the sheer amount of effort that would have had to have gone into choreographing this film just so, but whether you'll enjoy it is another matter entirely.",Hardcore Henry (2016)
alex-doenau,rotten,,sausage_party,"We know that everyone involved in this movie has made superior material, so it's a shame to see Rogen and company slumming in their own filth.",Sausage Party (2016)
alex-doenau,rotten,,central_intelligence,"It doesn't blaze a trail, and it's not terrible, but it's far from memorable.",Central Intelligence (2016)
alex-doenau,fresh,,tickled,"Tickled is one of the strangest documentaries to see release in recent times, and while it offers some solutions it raises a lot of questions that cut to the heart of the human experience.",Tickled (2016)
alex-doenau,fresh,,silence_2017,"Devoid of flash, overflowing with excellent performances, and abundantly endowed with meaning -- to the point that subtext is practically non-existent -- Silence is the film Scorsese felt that he had to make.",Silence (2017)
alex-doenau,fresh,,bad_moms,"Bad Moms is the American mom party movie that you didn't know you wanted, and while it's never more than a pleasant diversion, that's sometimes exactly what you want out of a comedy.",Bad Moms (2016)
alex-doenau,fresh,,gold_2017,Gold is that strange beast: an okay story elevated by a performance richer than the material truly deserves.,Gold (2017)
alex-doenau,fresh,,jackie_2016,"More mood piece than standard narrative, more character sketch than study, Jackie is a fascinating film that rewards as it confounds.",Jackie (2016)
alex-doenau,rotten,,monster_trucks_2017,"As these weird vanity projects go, it's not a terrible one: there's a chance that, many years hence, adults will look upon it fondly as a relic of their motor-obsessed youth; it just has nothing to offer for anyone with an age in the double digits.",Monster Trucks (2017)
alex-doenau,rotten,,assassins_creed,"Being based on a video game does not automatically make your movie bad... a movie can be completely awful on its own terms, regardless of its source material, and Assassin's Creed is that movie.",Assassin's Creed (2016)
alex-doenau,fresh,,la_la_land,"Chazelle combines familiarity with wildly creative execution, proving that style is substance.",La La Land (2016)
alex-doenau,fresh,,rogue_one_a_star_wars_story,"There's a sense of familiarity and a refreshing sense of being offered something we haven't quite seen before, and that Rogue One is actually entertaining about it makes the experience all the sweeter.",Rogue One: A Star Wars Story (2016)
alex-doenau,fresh,,office_christmas_party,"Office Christmas Party is a tightly wound and heavily calculated movie that possibly could have stood to be a bit looser than it turned out, but it is amiable enough.",Office Christmas Party (2016)
alex-doenau,fresh,,the_mohican_comes_home,"When you've got a small unit as well realised as this one, you want to spend as much time with it as possible.",The Mohican Comes Home (Mohican kokyô ni kaeru) (2016)
alex-doenau,fresh,,billy_lynns_long_halftime_walk,"The audience leaves Billy Lynn's Long Halftime Walk on the same bearing as its characters: bemused, perhaps, but happy to have their company.",Billy Lynn's Long Halftime Walk (2016)
alex-doenau,rotten,,wolf_girl_and_black_prince,There's a lot here that would have made a more generic movie -- and a more easily enjoyable one -- if it had literally anything else to fill the void of its male lead's personality.,Wolf Girl and Black Prince (2016)
alex-doenau,rotten,,creepy,Creepy is the sort of film that will appeal to the sort of viewer who enjoys deeply unpleasant suburban nightmares with vaguely defined psychological underpinnings.,Creepy (Kuripi: Itsuwari no rinjin) (2016)
alex-doenau,rotten,,the_great_wall_2017,"It's too late to call The Great Wall an expensive failure, but it's not likely to leave many satisfied viewers in its wake.",The Great Wall (2017)
alex-doenau,fresh,,i_daniel_blake,"Incredibly well researched, written, directed and performed, I, Daniel Blake refuses to be ignored and spoken down to.","I, Daniel Blake (2017)"
alex-doenau,fresh,,the_shallows,"Compact enough to get its point across without throwing too many random elements at the screen, this is simple but relatively intelligent cinema.",The Shallows (2016)
alex-doenau,rotten,,storks,"Though there's nothing actively offensive about the execution of Storks, there's simply nothing compelling about it, either.",Storks (2016)
alex-doenau,fresh,,the_magnificent_seven_2016,"Westerns have enjoyed a small renaissance over the last decade. The Magnificent Seven may not be the best of them, but it's a respectable effort with a game cast helmed by a justifiably confident director.",The Magnificent Seven (2016)
alex-doenau,rotten,,miss_peregrines_home_for_peculiar_children,"The best that can be said for this film is that its third act diverges so significantly from the source material that it could easily get away with not becoming a series, a small mercy for us all.",Miss Peregrine's Home for Peculiar Children (2016)
