critic_id,critic_meter_score,critic_rating,movie_id,movie_review_blurb,movie_title
charlie-oughton,fresh,9/10,the_lesson_2015,Thoughtful and oddly poignant.,The Lesson (2015)
charlie-oughton,fresh,9/10,fury_of_the_demon,Fury of the Demon works wonderfully because it presents a little known aspect of the life of a man who changed the world to an audience it expects to be intelligent.,Fury of the Demon (La Rage du Démon) (2016)
charlie-oughton,fresh,8/10,hostage_to_the_devil,"Hostage to the Devil fascinates with its focus on a renegade, dinner-party darling exorcist and the social factors that made him a star.",Hostage to the Devil (2016)
charlie-oughton,fresh,8/10,ibiza_undead,"What it lacks in some seasoned performers it makes up for in pure, putrefied pizzazz. Yet, for all its 'ard man posturing, it is an equal opportunities stalkathon and is all the more intriguing for it.",Ibiza Undead (2016)
charlie-oughton,fresh,8/10,my_bloody_banjo,[My Bloody Banjo] has genuinely hugely enjoyable segments.,My Bloody Banjo (2015)
charlie-oughton,fresh,9/10,the-killing-of-america,The Killing of America manages to be harrowing today as its stark warnings have gone unheeded. The killers it showcases have gone on to become pop culture and the editing of them alongside scenes of violence truly cuts to the quick.,The Killing of America (1982)
charlie-oughton,rotten,6/10,freeheld_2015,"It teeters on the edge of camp pretension before whipping out its raison d'etre and being unapologetically political. That said, the sheer amount of bodily fluids displayed before it forecloses means it slightly outstays its welcome.",Freeheld (2015)
charlie-oughton,fresh,7/10,eat_locals,Parallels with everything from Shaun of the Dead to What We Do In the Shadows go down a treat. There's even a nice little bit of social class dialogue bubbling under the surface that results in a final and very wry political money shot.,Eat Locals (2016)
charlie-oughton,fresh,9/10,lowlife_2017,The lustre of Lowlife is that it doesn't pull its punches but finds beauty and a curious humanity in the chaos of the crime-ridden city.,Lowlife (2017)
charlie-oughton,fresh,7/10,the_terror_of_hallows_eve,"The Terror of Hallow's Eve mixes old-fashioned movie magic with psychologically more daring horror. That said, more monsters don't make things merrier but if the psychology exists, they're real.",The Terror of Hallow's Eve (2017)
charlie-oughton,fresh,8/10,better_watch_out,Better Watch Out plays the audience at their own game. It pleasures and punishes them for trying to pre-guess its gifts. It is deeply unnerving and adorably sinister.,Better Watch Out (2017)
charlie-oughton,fresh,10/10,it_2017,"IT is horror with heart and high jinks. If taking on a killer clown and all IT's compadres leads to the adventure the Losers have, you'll float, too.",It (2017)
charlie-oughton,fresh,9/10,cannibal_fog,"Cannibal Fog is a finely mixed, jangling masterpiece of humanity masquerading as merry mayhem.",Cannibal Fog (2014)
charlie-oughton,fresh,7/10,cult_of_chucky,"Cult of Chucky takes the franchise to its (psycho!)logical conclusion. There is daffy, orange Easter eggs aplenty and enough blood to entertain the (as yet) uninitiated.",Cult of Chucky (2017)
charlie-phillips,fresh,4/5,the_russian_woodpecker,"Gracia succeeds brilliantly in delivering a chilling warning about where Putin and his spooks might go next, by giving Fedor full licence to act the biblical prophet.",The Russian Woodpecker (2015)
charlie-phillips,fresh,3/5,generation_revolution,"The passion and idealism oozes off the screen, even if it's ultimately a rather sad story.",Generation Revolution (2016)
charlie-phillips,fresh,4/5,the_workers_cup,A brave and engrossing look at the 2015 football tournament from the perspective of the stadium construction workers.,The Workers Cup (2017)
charlie-phillips,fresh,5/5,casting_jonbenet,"Is it a crime documentary? A satire of prurient crime documentaries? A drama? A piece of avant garde theatre? Casting JonBenét is all of these, and a brilliant original in multiple dimensions.",Casting JonBenét (2017)
charlie-phillips,fresh,4/5,last_men_in_aleppo,Last Men in Aleppo is one of the most difficult documentaries you'll see this year.,Last Men in Aleppo (2017)
charlie-phillips,fresh,3/5,nobody_speak_trials_of_the_free_press,"For those who haven't noticed their freedom of speech ebbing away, this film is certainly an important warning, but they should probably watch some more news videos and read some more papers.",Nobody Speak: Trials of the Free Press (2017)
charlie-phillips,fresh,5/5,city_of_ghosts_2017,"Heineman may have made the definitive contemporary documentary about the tragedy of Syria, as well as an epoch-defining piece on modern media tactics.",City of Ghosts (2017)
charlie-phillips,fresh,3/5,robin_williams_come_inside_my_mind,"This narrative is at its best when we hear direct from Williams, in intimate interview recordings in which he reflects back on life with seriousness that might surprise fans who knew him only as a manic clown.",Robin Williams: Come Inside My Mind (2018)
charlie-phillips,fresh,4/5,our_new_president,An irrational documentary for irrational times.,Our New President (2018)
charlie-phillips,fresh,4/5,matangimayamia,"The film comes from a place of deep admiration for MIA, but unlike more fawning biographies, it makes a convincing case that this admiration is well earned.",MATANGI/MAYA/M.I.A. (2018)
charlie-phillips,fresh,5/5,shirkers,"But this is so much more than a film about a film, it's about young women breaking the rules set in a conservative country - the process of doing that was a lot more powerful than finishing the actual film.",Shirkers (2018)
charlie-phillips,fresh,5/5,strong_island,"The documentary won't bring William Ford back, and it may give Yance Ford some catharsis, but more importantly it could and should lead to greater justice and empowerment.",Strong Island (2017)
charlie-schmidlin,rotten,D,delivery_man,"There are themes of familial connection and responsibility drenched across every frame of it, but aside from a few performances and amusing asides, Delivery Man is a bland translation of a sweet, but already flawed original.",Delivery Man (2013)
charlie-schmidlin,rotten,D+,cut_bank,"""Cut Bank"" fades into the background while its veteran actors look for ways to keep interested.",Cut Bank (2015)
charlie-schmidlin,rotten,C,jersey_boys,"""Jersey Boys"" is wall-to-wall fantasyland showbiz, expertly shot and boasting fine performances, but it is in the spirit world between stage and screen where it loses its footing.",Jersey Boys (2014)
charlie-schmidlin,fresh,B,evolution_of_a_criminal,"However muddled the line between reality and fiction stands in any documentary, an extra pause for skepticism occurs when the filmmaker steps in front of the camera.",Evolution Of A Criminal (2014)
charlie-schmidlin,rotten,D+,transcendence_2014,"...in mounting his feature directorial debut, Transcendence, Pfister has chosen to tackle familiarity head on, carving out a new arena for himself while rigging the grounds with pitfalls at every step.",Transcendence (2014)
charlie-schmidlin,fresh,C+,noah_2014,"It is...a grounded journey outwards on ideas of regret, mercy, and revenge, and at 139 minutes the film makes every attempt, coherent or not, to thoroughly address each one.",Noah (2014)
charlie-schmidlin,fresh,A-,war_witch,"The film is a laser-focused fable threatened occasionally by its drifts into character shorthand, but equaled by a wrenching lead performance by Rachel Mwanza that results in one of the finest of the year.",War Witch (2013)
charlie-schmidlin,rotten,C-,oldboy_2013,"""One of the most frustratingly accomplished disappointments this year.""",Oldboy (2013)
charlie-schmidlin,fresh,A-,is_the_man_who_is_tall_happy_an_animated_conversation_with_noam_chomsky,"""If you're willing to be puzzled, you're able to learn,"" Chomsky says...To his credit (and without affectation), Gondry doesn't cloak the fact that he is often perplexed by his subject. Because of his confusion though, we are able to learn quite a lot.",Is the Man Who Is Tall Happy?: An Animated Conversation with Noam Chomsky (2013)
charlie-schmidlin,fresh,B,lone_survivor,"A deeply intense, detached museum piece -- hosting a small, intriguing plaque that might lead you to the denser story elsewhere, if you so wish.",Lone Survivor (2014)
charlie-schmidlin,fresh,3.5/4,the_end_of_love,"Mark Webber's ""The End of Love"" connects and lingers by making incredible effort seem natural.",The End of Love (2013)
charlie-schmidlin,fresh,C+,enders-game,"""As a mainstream sci-fi film, this enjoyable, occasionally poignant effort too often feels messy in the wrong ways.""",Ender's Game (2013)
charlie-schmidlin,fresh,C,the_inevitable_defeat_of_mister_and_pete,"A wonderful document of inner-city oppression and two young actors' beginning steps, The Inevitable Defeat of Mister and Pete struggles to establish a cohesive center, and ultimately fumbles any tension on the path toward its title's possible fate.",The Inevitable Defeat of Mister & Pete (2013)
charlie-schmidlin,rotten,D,cbgb,It takes a lot of effort to take the underdog stomping grounds of New York's top punk acts and turn them into the Central Perk from Friends-albeit with slightly more stain-but CBGB does it with total conviction.,CBGB (2013)
charlie-schmidlin,rotten,D,insidious_chapter_2,"Wilson's new role is that of stock Lifetime-movie aggressor, veering between tortured monologues and ham-fisted apologies to the hysterical Byrne, who stumbles through the film like a Mr. Magoo caught in cobwebs.",Insidious: Chapter 2 (2013)
charlie-schmidlin,fresh,B,how_i_live_now,"...Macdonald's signature intensity, combined with another sneak attack performance from Saoirse Ronan, assembles a thrilling genre entry that stands firmly alongside its contemporaries in terms of quality.",How I Live Now (2013)
charlie-schmidlin,fresh,B,superman_man_of_steel,"Goyer and Nolan have crafted in Man of Steel a taut, exploratory vision...Together, they've humanized an icon...although they've undervalued the integral supporting roles in much of the same manner.",Man of Steel (2013)
charlie-schmidlin,rotten,C-,upside_down_2012,"Upside Down is a film built on binary elements -- lavishly and ambitiously executed -- yet with its laughably undercooked romantic core, it remains foolishly stubborn towards anything more nuanced.",Upside Down (2013)
charlie-schmidlin,rotten,1/4,the_condemned_2013,"""The Condemned"" is nothing but a creaky façade.",The Condemned (2013)
charlie-schmidlin,rotten,2.5/4,john_dies_at_the_end,"What Coscarelli's achieved doesn't feel like an adaptation. It feels more like he seems he skimmed the source material, burned it, and then assembled a vague recollection on film after three days of untold indulgences.",John Dies at the End (2013)
charlie-schmidlin,fresh,A-,man_from_reno,"Dave Boyle's ""Man From Reno"" is the type of film where alleyways are home offices, every bar matchbox has an unknown number inside, and if a character enters a bookshop, you better believe old issues of ""True Detective"" are hanging visibly in frame.",Man from Reno (2015)
charlie-schmidlin,fresh,B,out_of_the_furnace,"Loyalty and consequence collide in the ""Crazy Heart"" director's sophomore feature...but while those themes eventually result in payoffs that are noticeably muted and confused, the film is luckily powered by a powerful trio of performances at its core...",Out of the Furnace (2013)
charlie-schmidlin,rotten,C,the_gambler_2015,"""The Gambler"" is a flawed, well-shot throwback that feels swayed by studio interference, full of performances serving a script that limits their efforts to one-liners.",The Gambler (2014)
charlie-schmidlin,fresh,B-,american_sniper,"Four or five stunning sequences in ""American Sniper,"" including an intense firefight finale set during a sand storm, prove Eastwood still has his own capable handle on cinema.",American Sniper (2015)
charlie-schmidlin,fresh,A,selma,"""Selma"" is vital correspondence, filmmaking lived on the streets where brutal facts were ignored then reported, and now snatched back from history to sustain a spirit few films can or will possess.",Selma (2015)
charlie-schmidlin,fresh,B,in_a_valley_of_violence,"With an enjoyable atmosphere, solid performances from Hawke, Travolta, Farmiga, and one gifted canine, In A Valley of Violence ends up a solid entry in a genre gradually fading from mainstream cinema.",In a Valley of Violence (2016)
charlie-schmidlin,rotten,C+,dont_breathe_2016,Don't Breathe indeed reaches a unique destination in horror filmmaking. Unfortunately it fails to deliver a worthy emotional hook to pin its savagery onto.,Don't Breathe (2016)
charlie-schmidlin,rotten,D,too_late,A confounding misfire.,Too Late (2016)
charlie-schmidlin,fresh,A,dont_think_twice,"An entertaining, thoughtful portrait of friends in crisis when success is near.",Don't Think Twice (2016)
charlie-schmidlin,rotten,C,keanu_2016,...a patchy mix between kidnapping crime comedy and glorified cat video.,Keanu (2016)
charlie-schmidlin,fresh,B+,everybody_wants_some,"The strength of Linklater's films have always been their ability to capture the textures of lived experience, and ""Everyone Wants Some!!"" is no different in that regard.",Everybody Wants Some!! (2016)
charlie-schmidlin,fresh,B+,band_of_robbers_2016,"The end result may read as a gussied-up Funny or Die conceit at times, but through a surprising dramatic focus and well-written script it still performs wonderfully as an absurdist crime comedy with a wicked streak.",Band Of Robbers (2016)
charlie-schmidlin,fresh,B+,can_you_dig_this,"There are shades of activism, real heart, and an inspiring tone, delivered entertainingly with a group of expertly chosen subjects.",Can You Dig This (2015)
charlie-schmidlin,fresh,A,krisha_2016,"The film's brief 83-minute running time only compounds Krishna as a sharp breath with no exhale; shot and paced like a thriller, the film is a dreamlike view into a woman's inner life that ensures a tragic end.",Krisha (2016)
charlie-schmidlin,rotten,C+,the_trust_2016,"The Trust is many [...] things - darkly funny, flawed, with an eminently watchable dynamic between Cage and Wood - but from frame one it reasonably entertains.",The Trust (2016)
charlie-schmidlin,fresh,B+,the_big_short,"""The Big Short"" ends up an energetic and absorbing, marked deeply by its director's uniquely surreal vision.",The Big Short (2015)
charlie-schmidlin,fresh,B,field_niggas,"Intimate, singular, and hallucinatory on all aesthetic levels, the film strips politics down to the bone, not always successful but never opportunistic.",Field Niggas (2015)
charlie-schmidlin,fresh,B+,the_young_kieslowski_2015,There's a charmer in here that's a fake-out of the most welcome kind.,The Young Kieslowski (2015)
charlie-schmidlin,fresh,A-,brand_a_second_coming,It's a fascinating angle on a multi-faceted individual.,Brand: A Second Coming (2015)
charlie-schmidlin,fresh,B-,6_years_2015,"There is enough in 6 Years from Farmiga and Rosenfield's performances to warrant a watch, and Fidell's ideas and subtle developments around such a challenging story are heartfelt and mostly well-rendered.",6 Years (2015)
charlie-schmidlin,rotten,C-,the_boy_2015,The director tries to generate a pace that his dramatic efforts fail to match.,The Boy (2015)
charlie-schmidlin,fresh,A-,the_babushkas_of_chernobyl,"""The Babushkas of Chernobyl"" both comments on and cuts through the Area 51-esque nature of the region, providing incredible depth and access to a situation that anybody who's hesitated before leaving an old neighborhood can believe.",The Babushkas Of Chernobyl (2015)
charlie-schmidlin,fresh,B-,7_chinese_brothers,"Schwartzman is the fulcrum element in the film, highlighting a tried-but-true blend of low-key delivery, disarming comic timing and fits of impotent anger that he's perfected.",7 Chinese Brothers (2015)
charlie-schmidlin,rotten,C+,furious_7,"""Furious 7"" finds the franchise at an unwanted crossroads, but it makes such a play for the diehard fans that it leaves everyone else at somewhat of a loss.",Furious 7 (2015)
charlie-schmidlin,fresh,A-,trainwreck,"""Trainwreck"" allows a new development and angle to Apatow's trademark anxieties through a unique point of view, and is one of his most hilarious and finely-tuned films to date.",Trainwreck (2015)
charlie-schmidlin,rotten,C,concussion_2015,"A lack of pace and illuminating insight are what keep ""Concussion"" from lasting resonance, its flaws threatening to dull the issue for drama in a way that the NFL could only appreciate.",Concussion (2015)
charlie-schmidlin,rotten,C-,sausage_party,Its half-baked political ideas take away from the wholly satisfying and surreal Pixar riff it could have been.,Sausage Party (2016)
charlie-smith,fresh,,dr_cabbie,"It's still a distinctly Canadian movie, delivered entirely in English and lacking the lengthy and well-choreographed dance performances that have become a trademark of Indian cinema.",Dr. Cabbie (2014)
charlie-smith,fresh,,mountain_men_2016,"Tyler Labine carries a lot of the film against his straight man Crawford, like the grizzled spawn of Seth Rogen and Jack Black -- a jovial head in parkas and earflap toques.",Mountain Men (2016)
charlie-theobald,fresh,4/5,kubo_and_the_two_strings_2016,"A touching expression of loss, worth repeat viewings for its poetic visuals alone.",Kubo and the Two Strings (2016)
charlie-theobald,fresh,,almost_holy,"This is a film that challenges us to accept a flawed protagonist. His faults do not negate his charitable work, but it is up to us to decide whether they make him less of a hero.",Almost Holy (Crocodile Gennadiy) (2016)
charlie-theobald,fresh,3/5,men_and_chicken,"Hilarious, charming, and slightly traumatic.",Men & Chicken (Mænd & høns) (2016)
charlie-theobald,rotten,2/5,now_you_see_me_2,Entertaining but underwhelming.,Now You See Me 2 (2016)
charline-jao,fresh,,tramps_2016,"Tramps won't stay in your mind for days after, but it's a genuine delight.",Tramps (2016)
charline-jao,fresh,4/5,ocean_waves_2016,"I can understand this coming across as dull, but Ocean Waves' embrace of the everyday is really its strength.",Ocean Waves (Umi ga kikoeru) (2016)
charline-jao,fresh,4.5/5,the_handmaiden,"Fan of [Park's] will no doubt be sucked in by the distinct style, cinematography, and lush colors.",The Handmaiden (Ah-ga-ssi) (2016)
charline-jao,fresh,4.5/5,long_way_north,It's a gorgeous treat.,Long Way North (Tout en haut du monde) (2016)
charline-jao,rotten,2/5,the_neon_demon,"Pushing aside the earlier predatory male character in favor of a ""women eat each other alive, but literally"" story makes it fall short for me.",The Neon Demon (2016)
charline-jao,rotten,2/5,sing_2016,Despite having a star-filled cast and adorable animals I spent a great deal of the movie reminiscing about how much I enjoyed the animal world of Zootopia more.,Sing (2016)
charline-jao,fresh,3.5/5,the_king_2017,With parallels to real-life scandals and offhanded references to moments like the June Democracy Movement... The King succeeds as a political drama invested in the constantly changing dynamics of power.,The King (2017)
charline-jao,fresh,4/5,my_entire_high_school_sinking_into_the_sea,"With so much going on, this is a coming-of-age that doesn't really slow down.",My Entire High School Sinking Into the Sea (2017)
charline-jao,fresh,5/5,a_suitable_girl,There are a lot of genuinely devastating moments in the film.,A Suitable Girl (2017)
charline-jao,fresh,3.5/5,cars_3,"Is it Toy Story 3 or Finding Dory? No, but it's an effective send-off to the Cars world and a good choice for the family.",Cars 3 (2017)
charline-jao,rotten,2/5,the_bad_batch,"Despite an exciting premise that featured a Mad Max-esque lawless wasteland, Jason Momoa, Keanu Reeves, and cannibalism with the director of A Girl Walks Home Alone at Night, the film was wholly underwhelming.",The Bad Batch (2017)
charline-jao,fresh,5/5,my_cousin_rachel_2017,"As a mid-twentieth century writer revisiting the 19th century, du Maurier played with tropes and archetypes, and in this adaptation, Rachel Weisz as the title character is a sight to behold.",My Cousin Rachel (2017)
charline-jao,fresh,4.5/5,okja,It's one of Netflix's best original films.,Okja (2017)
charline-jao,rotten,1.5/5,victoria_and_abdul,Karim doesn't need to be a fierce anti-colonial advocate-that might be a bit of a historical jump-but to try and focus on their human connection absent of the conflicts of nation feels dishonest or irresponsible.,Victoria & Abdul (2017)
charline-jao,fresh,5/5,the_girl_without_hands_2017,"As we continue to see animation progress and become more and more realistic, the French animated film The Girl Without Hands or La Jeune Fille sans mains is a reminder that the medium can be just as compelling with simple and evocative strokes",The Girl Without Hands (La Jeune fille sans mains) (2017)
charlotte-cook,rotten,2/5,water_for_elephants,"It will be a welcome relief to see Pattinson one day cast in a film not primarily targeted at women, or, indeed, one where he is forlorn and lovesick most of the time.",Water for Elephants (2011)
charlotte-cook,fresh,3/5,justin_bieber_never_say_never,"Surprisingly engaging. Biased, but by no means a bad film.",Justin Bieber: Never Say Never (2011)
charlotte-heathcote,fresh,5/5,blade_runner_2049,"Against all the odds, Blade Runner 2049 is a majestic, uncompromising science-fiction epic that stands shoulder to shoulder with its predecessor as a film of wondrous images and thought-provoking reflections on what it means to be human.",Blade Runner 2049 (2017)
charlotte-keeys,fresh,3/5,d_train,The D Train certainly takes you on a fun ride.,The D Train (2015)
charlotte-keeys,rotten,1/5,the_messenger_2014,"Do we really need a ""gritty"" British version of The Sixth Sense?",The Messenger (2014)
charlotte-keeys,fresh,3/5,iona_2015,Melancholy characters shine in this powerful portrait of island life.,Iona (2015)
charlotte-keeys,fresh,4/5,letters_to_max,A poignant emotional journey which lingers in the subconscious for longer than expected.,Letters To Max (2014)
charlotte-osullivan,rotten,3/5,morrissey_25_live,His voice sounds thin and he moves with the awkward swagger of a man who's recently conquered his paunch.,Morrissey 25: Live (2013)
charlotte-osullivan,rotten,3/5,lovelace,One thing's for sure: this exposé ain't deep.,Lovelace (2013)
charlotte-osullivan,fresh,4/5,blackfish_2013,Cruelty begets cruelty and whales don't belong in the circus.,Blackfish (2013)
charlotte-osullivan,fresh,3/5,dial_m_for_murder,"Ray Milland is great as cold fish Tony Wendice, a former tennis pro who plans to bump off his adulterous wife. Still, Grace Kelly is mis-cast (or misdirected) as the spouse in question.",Dial M for Murder (1954)
charlotte-osullivan,fresh,3/5,days_of_grace,So confusing (especially if you're a football dolt) that you may have trouble identifying the different narrative strands. It's still gripping.,Days of Grace (2015)
charlotte-osullivan,fresh,3/5,viramundo,"When the mood takes him, he's still on song.",Viramundo (2013)
charlotte-osullivan,rotten,3/5,the_wolverine_2012,"Whether in the fights or the love scenes, we don't know where to invest our emotional energy.",The Wolverine (2013)
charlotte-osullivan,rotten,2/5,suspension_of_disbelief_2013,A pretentious bit of fluff ...,Suspension Of Disbelief (2013)
charlotte-osullivan,fresh,3/5,snabba_cash_2012,"Easy to watch, then, but hard to champion as a must-see.",Snabba cash (Easy Money) (2012)
charlotte-osullivan,fresh,4/5,jurassic_park,Jurassic Park is the most self-reflexive blockbuster ever made ...,Jurassic Park (1993)
charlotte-osullivan,fresh,4/5,we_steal_secrets_the_story_of_wikileaks_2013,We Steal Secrets is much concerned with conspiracy theories and may well wind up fuelling new ones.,We Steal Secrets: The Story Of Wikileaks (2013)
charlotte-osullivan,rotten,2/5,the_frozen_ground,"First time writer/director Scott Walker claims the whole thing is based on conversations he had with the real life woman who, as a teenager, helped police capture Alaskan serial killer, Robert Hansen. You can't hear her voice.",The Frozen Ground (2013)
charlotte-osullivan,fresh,4/5,wadjda_2013,Wadjda is anti-everything groups such as the Taliban stand for. It's about the joy of making yourself heard.,Wadjda (2013)
charlotte-osullivan,fresh,3/5,les_invisibles_2012,"It is astonishing how much white heat is generated by the conversations that follow, and 45 year old documentary maker Sebastien Lifshitz is to be congratulated for selecting such a special bunch.",Les Invisibles (2012)
charlotte-osullivan,fresh,4/5,blancanieves,Pablo Berger's brainchild is truly enchanting.,Blancanieves (2013)
charlotte-osullivan,rotten,2/5,trap_for_cinderella_2013,Softley is a great director but has maybe let his own obsession - with Sebastien Japrisot's 1962 novel - blind him to the essential lameness of the project. Someone lend this man a good book.,Trap For Cinderella (2013)
charlotte-osullivan,rotten,2/5,the_moo_man_2013,Lesson for the day: never underestimate the emotional pull of a dying cow.,The Moo Man (2013)
charlotte-osullivan,rotten,2/5,citadel_2012,"[A] confused, mostly clunky, but occasionally involving, low-budget horror/thriller ...",Citadel (2012)
charlotte-osullivan,fresh,3/5,the_deep_2013,"A gritty, if ultimately underwhelming, drama from Iceland, based on real events that took place in 1984.",The Deep (2013)
charlotte-osullivan,rotten,2/5,play_2011,What a weird film.,Play (2011)
charlotte-osullivan,fresh,3/5,breathe_in,The performances are excellent. The script is a dud.,Breathe In (2014)
charlotte-osullivan,fresh,3/5,eden_2012,"It's based on the experiences of a real life Korean woman, Chong Kim, but you can just tell that many of the facts have been massaged.",Eden (2013)
