critic_id,critic_meter_score,critic_rating,movie_id,movie_review_blurb,movie_title
alan-scherstuhl,fresh,,the_to_do_list,"Like first sex, writer-director Maggie Carey's debut feature, The To Do List, is quick and messy, fitfully pleasurable, full of promise but not quite adept at getting everyone off.",The To Do List (2013)
alan-scherstuhl,fresh,,blackfish_2013,"The movie is revealing, wrenching, and important, a reminder that what feels wrong in our gut-the effort to turn free-roaming and unknowable beasts into caged vaudevillians-is always worth investigating.",Blackfish (2013)
alan-scherstuhl,fresh,,the_conjuring,"Damned if director James Wan, the auteur of Saw's rusted-edge cruelty, isn't an ace with enjoyable spookhouse trap-springing.",The Conjuring (2013)
alan-scherstuhl,fresh,,violet_and_daisy,"The key relationships are well drawn, if not especially revealing of anything human, and director Fletcher sometimes dares some welcome absurdity.",Violet & Daisy (2013)
alan-scherstuhl,fresh,,les_coquillettes,"Distinguished by bristling comic performances, from both the women and their quarry ...",Les Coquillettes (2013)
alan-scherstuhl,fresh,,sing_me_the_songs_that_say_i_love_you_a_concert_for_kate_mcgarrigle_2013,"The film is both celebration and elegy, a sing-along and a cry-along, a cathartic moan and a perfect bliss-out.",Sing Me the Songs That Say I Love You: A Concert for Kate McGarrigle (2013)
alan-scherstuhl,rotten,,white_house_down,"White House Down stands as a singular achievement in parody, its auteur's intentions be damned.",White House Down (2013)
alan-scherstuhl,rotten,,hating_breitbart,"[A] shapeless, uncritical documentary.",Hating Breitbart (2012)
alan-scherstuhl,fresh,,some_girls_2013,"It doesn't take pattern-recognition software to catch some shared, troubling concerns here. But the charitable viewer will remember that ugly themes aren't necessarily a thesis.",Some Girl(s) (2013)
alan-scherstuhl,rotten,,downloaded_2013,The doc is only about as revealing as a middling magazine article on the subject. But it will fascinate and frustrate anyone already interested ...,Downloaded (2013)
alan-scherstuhl,fresh,,monsters_university,"Even when Pixar isn't aspiring to an idea, it has a way with genre.",Monsters University (2013)
alan-scherstuhl,fresh,,the_attack_2012,Arresting and upsetting ...,The Attack (2013)
alan-scherstuhl,fresh,,this_is_the_end,"This is all performed with brio, by likable performers with expert timing, ace chemistry, and a directing team eager to let them tear loose. But it can wear you down.",This Is the End (2013)
alan-scherstuhl,fresh,,crystal_fairy,Every clear-eyed insight into why pushy people insist on pushing is matched by loose ensemble humor and lyric reveries ...,Crystal Fairy (2013)
alan-scherstuhl,fresh,,prince_avalanche_2013,"It's a schlubby, existential, black-box-theater character study, steeped in warm silences and anxious boys' talk, sugared up with sublime shots of fire-ravaged forest and wild streams percolating with raindrops.",Prince Avalanche (2013)
alan-scherstuhl,fresh,,jurassic_park,"That T. rex is worth the wait, but the wait itself is even more memorable.",Jurassic Park (1993)
alan-scherstuhl,fresh,,gi_joe_retaliation,It's not enough to call this the rare franchise action movie to bring the goods; it's the even rarer one whose creators seem to understand what the goods even are.,G.I. Joe: Retaliation (2013)
alan-scherstuhl,fresh,,this_is_40,"Much like marriage, This Is 40 is somewhat formless, and it almost never hurries up. But life is improved by having the option.",This is 40 (2012)
alan-scherstuhl,rotten,,stand_up_guys,It plays out like you would fear.,Stand Up Guys (2013)
alan-scherstuhl,fresh,,tchoupitoulas,"Questions about the literal truth of Tchoupitoulas are thorny and perhaps besides the point. After all, the filmmakers aren't hiding the artifice.",Tchoupitoulas (2012)
alan-scherstuhl,rotten,,hyde_park_on_hudson,"It's dispiriting that a film about the romantic life of Franklin D. Roosevelt, who cultivated a small coterie of mistresses, should exhibit so little interest in what engaged its hero ...",Hyde Park on Hudson (2012)
alan-scherstuhl,fresh,,wagner_and_me,This sprightly doc considers one of the tougher questions of morality and aesthetics ...,Wagner & Me (2012)
alan-scherstuhl,rotten,,addicted_to_fame,"Cheap-o, disingenuous ...",Addicted To Fame (2012)
alan-scherstuhl,fresh,,lincoln_2011,"Lincoln is the work of a different director, one truly fascinated by why his subjects do what they do, one who invests each moment with the artistry he has often reserved for setpieces.",Lincoln (2012)
alan-scherstuhl,fresh,,miami_connection_2011,"Absurd, yes, but director Richard Park and his game and guileless cast have the highest of spirits, and the nonsense bubbles like a bottle uncorked.",Miami Connection (2012)
alan-scherstuhl,fresh,,west_of_memphis,This is a movie that can stun you.,West of Memphis (2012)
alan-scherstuhl,fresh,,the_details_2010,"As if to justify its own title, The Details is familiar in its plotting but uproarious in its incidents.",The Details (2012)
alan-scherstuhl,fresh,,bad_25_2012,Spike Lee has given the world the first tribute that fully measures up to Jackson the artist. Come on and get you sham on.,Bad 25 (2012)
alan-scherstuhl,rotten,,atlas_shrugged_part_ii,"Seriously, if this is the best promotion of itself that the free market can manage, it really would benefit from the help of a Ministry of Culture or something.",Atlas Shrugged: Part II (2012)
alan-scherstuhl,fresh,,seven_psychopaths,The movie in which Martin McDonagh the scabrous playwright and Martin McDonagh the high-end junk filmmaker at last craft a doozy both can brag about to their mates.,Seven Psychopaths (2012)
alan-scherstuhl,fresh,,my_father_and_the_man_in_black,"As Cash might say, it has the heart, and it has the blood, and by the time childhood chatter is played back again, feeling is soaked through it like the sweat in Cash's guitar strap.",My Father and the Man in Black (2013)
alan-scherstuhl,rotten,,headshot_2010,"Neither fresh nor especially satisfying, but Ratanaruang distinguishes the hunt with his fluid kineticism, especially in the just-a-touch-too-infrequent shoot-outs and beatdowns.",Headshot (2012)
alan-scherstuhl,rotten,,2016_obamas_america,"The film is a sleepy dud, a polemic that, like D'Souza himself, is at once both outrageous and deeply boring.",2016: Obama's America (2012)
alan-scherstuhl,fresh,,shut_up_little_man,"The tapes are great. More than just a flophouse Punch and Judy show, the Raymond vs. Peter dustups elevate cruel bickering to a ritual through which we live life's pain.",Shut Up Little Man! (2011)
alan-scherstuhl,fresh,,lila_and_eve,"It's an actors' piece rather than an action flick, and Davis finds new, moving nuance in the film's familiar beats.",Lila & Eve (2015)
alan-scherstuhl,fresh,,dinotasia,"If they're never fully convincing as photo-realistic figures, they're certainly as much good gory fun to watch as any old-school monster kids had to stick with dreary first acts to see.",Dinotasia (2012)
alan-scherstuhl,fresh,,the_host_2013,"The Host's infelicities-drab dialogue, ridiculous plotting, more emotional crises than there is story-are enlivened by its thematic eccentricities.",The Host (2013)
alan-scherstuhl,fresh,,cirque_du_soleil_worlds_away,The rare movie whose title serves as an accurate indicator of whether you will enjoy seeing it.,Cirque Du Soleil: Worlds Away (2012)
alan-scherstuhl,fresh,,stolen_seas_2013,This drama is couched in illuminating context ...,Stolen Seas (2013)
alan-scherstuhl,fresh,,wrong_2011,"The film's heady buzz is invigorating, and there are substantial pleasures-and laughs-to be found in all its real-life-just-gone-sour strangeness.",Wrong (2013)
alan-scherstuhl,fresh,,detour_2013,"During the best sequences, Detour feels like three heady improvisations all happening at once ...",Detour (2013)
alan-scherstuhl,fresh,,my_brother_the_devil_2012,"A tender, bracing fraternal drama of London's gang life, the immigrant experience, and questions no smaller than what ""manhood"" might mean to young men whose traditional cultures are colliding with the worst-and the best-of the secular west.",My Brother The Devil (2013)
alan-scherstuhl,rotten,,leonie_2011,"""Love is one of life's most spiritual and beautiful chapters,"" Mortimer is forced to purr. Later: ""It seems I am fated to move wherever it is I seek to build my dream.""",Leonie (2013)
alan-scherstuhl,fresh,,,"Jane Campion's smart, bracing, hugely enjoyable mystery rural noir ...",
alan-scherstuhl,fresh,,philip_roth_unmasked,"Roth was dashing, charming, a little dangerous, one of his college friends tells us, but she doesn't need to say it. It's manifest, and it's still true.",Philip Roth: Unmasked (2013)
alan-scherstuhl,rotten,,the_incredible_burt_wonderstone,"Carell again plays oblivious in the fitfully inspired magician comedy The Incredible Burt Wonderstone, but he doesn't play human.",The Incredible Burt Wonderstone (2013)
alan-scherstuhl,fresh,,clip,Maja Milos's aggressive and upsetting first film ...,Clip (2013)
alan-scherstuhl,fresh,,infancia_clandestina,"A charming, involving first feature, Clandestine Childhood muscles its familiar coming-of-age material into something more vibrant and urgent than the usual.",Clandestine Childhood (2013)
alan-scherstuhl,fresh,,citizen_hearst_2012,Sometimes Citizen Hearst feels as breezy and electric as the newsreels Hearst pioneered; other times it feels like the video they'll make you watch during orientation on your first day at 300 West 57th.,Citizen Hearst (2013)
alan-scherstuhl,fresh,,the_monk_2011,"The finale, in which godly rites are juxtaposed against the vilest of sins, builds to an unholy power.",Le moine (The Monk) (2013)
alan-scherstuhl,rotten,,dark_skies_2013,"Stewart has some lofty ambitions, some of which he almost fulfills.",Dark Skies (2013)
alan-scherstuhl,rotten,,a_good_day_to_die_hard,"No two viewers will assemble the same narrative from this Rorschach of running men, crashing glass, and hollered exposition.",A Good Day To Die Hard (2013)
alan-scherstuhl,fresh,,beautiful_creatures_2013,"Its primness aside, the movie is terrific fun and much more affecting than Twilight or Supernatural.",Beautiful Creatures (2013)
alan-scherstuhl,rotten,,saving_lincoln,Imagine the stiffness of a Star Wars prequel but without the bravura technique.,Saving Lincoln (2013)
alan-scherstuhl,rotten,,identity_thief,"McCarthy gets bashed about like a Stooge, and she bashes back with riotous abandon. Sadly, the rest of the movie is a shambles.",Identity Thief (2013)
alan-scherstuhl,fresh,,sound_city,"Grohl treats us to just more than an hour celebrating the history of Sound City, the Van Nuys dump where a clutch of rock's great records were bashed out-but the movie's 107 minutes long.",Sound City (2013)
alan-scherstuhl,fresh,,happy_people_a_year_in_the_taiga,"It's fitting that this film of people making do with what they have should itself look somewhat humble, without lyricism, a work not of beauty but of work-which is the thing that makes it beautiful, no matter who directed it.",Happy People: A Year in the Taiga (2013)
alan-scherstuhl,rotten,,the_other_side_of_the_ice,"Too much of the movie is just people being crabby (or, later, dumb!) in fascinating places, which is less enthralling than the places themselves.",The Other Side of the Ice (2013)
alan-scherstuhl,fresh,,night_moves_2013,The most radical thing about this eco-terrorism drama is its quiet patience and formal vigor.,Night Moves (2014)
alan-scherstuhl,rotten,,the_patience_stone,"The movie makes all this single-room, beating-her-breast stuff more punishing than the novel does, and less rewarding as well.",The Patience Stone (2013)
alan-scherstuhl,fresh,,kick_ass_2_2013,"You might not mind that director Jeff Wadlow, even more than Vaughn, has made sure that it's only the images that are provocative--never the ideas.",Kick-Ass 2 (2013)
alan-scherstuhl,fresh,,jodorowskys_dune,Fascinating and perversely uplifting ...,Jodorowsky's Dune (2014)
alan-scherstuhl,rotten,,anita_2013,"So shapeless in its hagiography, so triumphal in its vagueness, so hapless in arguing its case.",Anita (2014)
alan-scherstuhl,fresh,,big_men_2013,Here's the rare current-affairs documentary that doesn't just show us something gone wrong in some part of our world.,Big Men (2014)
alan-scherstuhl,fresh,,sparks_2013,"Here's a hearty keep-at-it award for Christopher Folino and Todd Burrows, directors of this restless, reckless superhero crime curio ...",Sparks (2014)
alan-scherstuhl,fresh,,teenage_2013,"The engrossing, sometimes frustrating cine-essay Teenage offers occasional moments of thrilling revelation ...",Teenage (2014)
alan-scherstuhl,rotten,,mr_peabody_and_sherman,"More puns, less story, please.",Mr. Peabody & Sherman (2014)
alan-scherstuhl,fresh,,particle_fever,"A dazzling, dizzying documentary about nothing less than whether we exist in a coherent universe of ordered, even beautiful laws ...",Particle Fever (2014)
alan-scherstuhl,rotten,,son_of_god_2014,"This is more a pageant than a story about characters and their motivations; it's as brusque in its storytelling as an illustrated children's bible, which would at least offer some mystery and grandeur in the composition of its images.",Son Of God (2014)
alan-scherstuhl,rotten,,cheap_thrills_2013,"By the end, Cheap Thrills too closely resembles the behavior it depicts.",Cheap Thrills (2014)
alan-scherstuhl,fresh,,kids_for_cash,"The documentary is stellar, despite some vague visual-metaphor stuff involving dioramas in an attic. Bring something you can punch, as you will be furious.",Kids for Cash (2014)
alan-scherstuhl,fresh,,elaine_stritch_shoot_me_2013,"As much a playdate as portrait, a jumble of salty highlights attesting to the pleasure of her company.",Elaine Stritch: Shoot Me (2014)
alan-scherstuhl,fresh,,in_secret,"In Secret boasts vigor and thematic richness, that feeling of artists expressing something vital rather than just banging out that year's script from the drawer.",In Secret (2014)
alan-scherstuhl,fresh,,about_last_night_2014,"Mostly, Hart aces his many showcase moments, not so much stealing the movie as occasionally letting the other actors possess it for a while.",About Last Night (2014)
alan-scherstuhl,fresh,,7_boxes,"The film surges by, powered by high spirits, well-plotted surprises, and the directors' admirable attention to both the real and romantic ...",7 Boxes (2014)
alan-scherstuhl,fresh,,a_field_in_england,"The film, Wheatley's fourth, feels both reckless yet fully controlled, a jest that's dead serious in the manner of Yorick's skull, which gets a sort of cameo in the final act.",A Field in England (2014)
alan-scherstuhl,fresh,,the_wait_2013,"Gorgeous and haunting, inscrutable but rewarding of scrutiny, writer-director M. Blash's The Wait achieves the rare distinction of being warm and unsettling at the same time ...",The Wait (2014)
alan-scherstuhl,rotten,,i_frankenstein,"It doesn't come close to working, but it's sweet that they tried.","I, Frankenstein (2014)"
alan-scherstuhl,rotten,,24_exposures,It's too high-minded to offer the cheap comforts of genre but too low-minded to skip one last chance to ogle the kind of woman viewers might have a crush on in real life.,24 Exposures (2014)
alan-scherstuhl,fresh,,pompeii_2013,"Unlike most city-go-smash setpieces, this is vibrant and surprising, only occasionally rote, the shots of screaming crowds and raining fire a skin over the heart and muscle of a story better told than many.",Pompeii (2014)
alan-scherstuhl,fresh,,will_you_still_love_me_tomorrow_2013,"Here's a slight, likable charmer starring a slight, likable charmer ...",Will You Still Love Me Tomorrow? (2014)
alan-scherstuhl,fresh,,go_down_death_2013,A captivating excursion into surrealist Americana ...,Go Down Death (2014)
alan-scherstuhl,fresh,,the_galapagos_affair_satan_came_to_eden,"At the birthplace of Darwinism, we witness human potential give way to animalism.",The Galapagos Affair: Satan Came To Eden (2014)
alan-scherstuhl,fresh,,the_life_and_crimes_of_doris_payne,Who knew that being lied to for 75 minutes could be so agreeable - and revealing?,The Life and Crimes of Doris Payne (2014)
alan-scherstuhl,fresh,,elena_2013,"A pained and gorgeous summoning, Petra Costa's haunted doc Elena dances with death, memory, and family, seducing viewers and then breaking their hearts.",Elena (2014)
alan-scherstuhl,fresh,,frequencies,"Like youth itself, the opening of Frequencies - an uncommonly ambitious science-fiction romance - is sparkling and unsettling at once.",Frequencies (2014)
alan-scherstuhl,fresh,,stand_clear_of_the_closing_doors,Stand Clear of the Closing Doors becomes dedicated to showing us everything millions of people glance at each day but don't actually regard.,Stand Clear Of The Closing Doors (2014)
alan-scherstuhl,fresh,,american_jesus,"Distinguished by stirring photography, empathetic interviewing, and a shrewd sense of who to let talk and who to cut off.",American Jesus (2014)
alan-scherstuhl,fresh,,million_dollar_arm,Much of Million Dollar Arm is pretty good for a movie committed to the wrong character's story.,Million Dollar Arm (2014)
alan-scherstuhl,fresh,,the_double_2013,"The Double, with its inviting alienation, nails a curious mood that's been too long absent from contemporary film ...",The Double (2014)
alan-scherstuhl,fresh,,devils_knot,"Other than [an] act of honest argumentation, Egoyan's Devil's Knot offers little for anyone who has followed the case or seen any of the other docs.",Devil's Knot (2014)
alan-scherstuhl,fresh,,alien_abduction_2014,"Credit this spirited, uncommonly effective found-footage thriller for breaking the templates promised by its genre and title.",Alien Abduction (2014)
alan-scherstuhl,fresh,,blood_glacier,"The monsters are a scream, squishing crossbreeds that are all fur and teeth and exposed, pulsing, ready-to-burst viscera. And the screamers are a bit monstrous ...",Blood Glacier (2014)
alan-scherstuhl,rotten,,now_in_the_wings_on_a_world_stage,"In the end, all NOW reveals is that talented people did a difficult thing in far-off places - and that now they have a video scrapbook.",NOW: In the Wings on a World Stage (2014)
alan-scherstuhl,fresh,,locke,"Although we're never taken far beyond the hero's windshield, it's still very much a movie rather than some stagebound theater piece.",Locke (2014)
alan-scherstuhl,fresh,,next_goal_wins,"If you're a person, and you find other people worth your time and attention, Next Goal Wins will stir you ...",Next Goal Wins (2014)
alan-scherstuhl,fresh,,heaven_is_for_real,"Unlike many of the features targeted to what Hollywood is calling the ""faith audience,"" the movie is well-acted and shot, often thoughtful and (intentionally) funny.",Heaven Is for Real (2014)
alan-scherstuhl,rotten,,the_railway_man,Has it ever occurred to contemporary commercial filmmakers that maybe audiences could take a movie's word for it that a character has been tortured?,The Railway Man (2014)
alan-scherstuhl,fresh,,a_fragile_trust_plagiarism_power_and_jayson_blair_at_the_new_york_times_2013,"While mostly well made, and certain to serve as a handy précis for the J-school set, A Fragile Trust is more a soiling reminder than a revelation for anyone already familiar with Blair's case.","A Fragile Trust: Plagiarism, Power And Jayson Blair At The New York Times (2014)"
alan-scherstuhl,fresh,,alan_partridge,"The story is a familiar one of corporate takeovers and the sacking of longtime employees, but with a welcome, biting surprise, all filmed with the carpet-store flatness that is Coogan's element ...",Alan Partridge (2014)
alan-scherstuhl,fresh,,flex_is_kings_2013,"An eye-popper showing the old pop and lock brought to thrilling, disorienting extremes, Deidre Schoo and Michael Beach Nichols's Flex Is Kings movingly documents the flex dance scene centered around Brooklyn's BattleFest.",Flex Is Kings (2014)
alan-scherstuhl,rotten,,the_amazing_spider_man_2,"Never a disaster but only fitfully inspired, The Amazing Spider-Man 2 doesn't quite end well, but it does end promisingly, with hints of a huge supervillain team-up to come.",The Amazing Spider-Man 2 (2014)
alan-scherstuhl,fresh,,austenland_2013,Austenland the movie is built on the understanding that fantasy is healthy until you elect to live in it-and that sometimes a chase to the airport isn't something you should bother with in the real world.,Austenland (2013)
alan-scherstuhl,fresh,,when_i_saw_you,"Here's a story of refugee life from the perspective of a brash and attentive kid, one just discovering - and often rejecting - the political realities grown-ups accept.",When I Saw You (2012)
alan-scherstuhl,fresh,,hours_2013,"Here's a hero who's maybe like you, suffering like you might but also scraping through like you hope you could.",Hours (2013)
alan-scherstuhl,fresh,,god_loves_uganda_2013,"Kudos to the filmmakers for so adeptly laying out the history of American evangelicals' Ugandan mission, and for noting that HIV infection rates there have gone up since the abstinence-only education started.",God Loves Uganda (2013)
alan-scherstuhl,fresh,,zero_charisma,"This is raw and affecting, a real movie rather than fan-con fun.",Zero Charisma (2013)
alan-scherstuhl,fresh,,a_river_changes_course_2013,"For the most part, the narrative here feels generational, representative, rather than invested in the specific incidents of specific lives.",A River Changes Course (2013)
alan-scherstuhl,fresh,,aka_doc_pomus_2012,"Even if you know this history already, A.K.A. Doc Pomus is vital and endearing, a celebration of a great artist, a great character, and the universality of great pop.",A.K.A. Doc Pomus (2013)
alan-scherstuhl,fresh,,vikingdom,"The first Hobbit picture's digital armies have a higher pixel rate, but Vikingdom packs in twice as much fun and thrice as much incident in much less running time.",Vikingdom (2013)
alan-scherstuhl,fresh,,muscle_shoals_2013,"The archival footage is strong, Camalier is generous with musical clips, and the talking heads generate some drama when describing epochal moments like Aretha's first session.",Muscle Shoals (2013)
alan-scherstuhl,fresh,,out_in_the_dark,"The movie is involving, the romance affecting, the sex sound, and the catch-as-catch-can handheld camerawork smartly appropriate for the scenario ...",Out in the Dark (2013)
alan-scherstuhl,fresh,,a_single_shot,"David M. Rosenthal's sturdy, nasty rural noir, based on Matthew F. Jones's novel, is so sharp and rusted through that, after taking it in, you'll likely need a tetanus shot.",A Single Shot (2013)
alan-scherstuhl,fresh,,all_is_lost_2013,"The will to survive is moving enough-here it is, stripped to its elements, and if you can't bring yourself to care about something that simple then the problem is you, not the movies.",All Is Lost (2013)
alan-scherstuhl,fresh,,the_wizard_of_oz_1939,"Even swollen to IMAX size, the movie is sharper than you've ever seen it, and the vaudevillian brilliance of the choreography (and Ray Bolger's straw-boned tumbling) is entirely undiminished.",The Wizard of Oz (1939)
alan-scherstuhl,fresh,,wadjda_2013,"A simple, solid, deeply affecting film, Wadjda is something rare: the work of a female Saudi filmmaker, Haifaa Al Mansour, and a feature from a country that has long outlawed cinemas.",Wadjda (2013)
alan-scherstuhl,fresh,,blue_caprice_2013,"The tragedy, the fresh revelation of Blue Caprice is in seeing this boy with all such humanity stolen from him.",Blue Caprice (2013)
alan-scherstuhl,rotten,,salinger,"What the movie gets hilariously, howlingly wrong is the idea that a life like Salinger's-so extraordinary, yet so willfully humdrum-could somehow be captured by the most shopworn of cinematic techniques.",Salinger (2013)
alan-scherstuhl,fresh,,tokyo_waka_a_city_poem_2013,"An edifying whole, a film of beauty and revelation ...",Tokyo Waka: A City Poem (2013)
alan-scherstuhl,fresh,,passion_2013,"Passion is pretty good. If you cared enough to make a list, it might be your fifth or sixth favorite De Palma.",Passion (2013)
alan-scherstuhl,fresh,,i_declare_war_2012,Its heroes are kids; its villains are kids; its fantasies are kids'. But its truths are adult.,I Declare War (2013)
alan-scherstuhl,fresh,,una_noche_2013,"This urban slice-of-life becomes a tale of arguing kids, each touchingly preoccupied with his or her own sexual identity, all at odds with the elements themselves.",Una noche (One Night) (2013)
alan-scherstuhl,fresh,,first_comes_love_2012,"First Comes Love is, before anything else, a portrait of a longing so deep that even the commandingly articulate Davenport struggles to put it into words.",First Comes Love (2013)
alan-scherstuhl,fresh,,after_tiller_2013,"The film is warm and scrupulous, like a sunny women's clinic.",After Tiller (2013)
alan-scherstuhl,rotten,,grudge_match_2014,Drab and plodding as a matter of principle.,Grudge Match (2013)
alan-scherstuhl,rotten,,the_fifth_estate,"A film that, for all its restlessness, feels staid and dated.",The Fifth Estate (2013)
alan-scherstuhl,fresh,,enzo_avitabile_music_life,"Demme has crafted yet another superb document of musicians at work, one as much about creation-and the sources of inspiration-as it is about performance.",Enzo Avitabile Music Life (2013)
alan-scherstuhl,fresh,,the_hobbit_the_desolation_of_smaug,"Sure, all the studios offer anymore are big, dumb adventure spectacles, but that's not a knock against the achievement of this one, which at least parades wonders before us, not the least being the greatest dragon in the history of movies.",The Hobbit: The Desolation of Smaug (2013)
alan-scherstuhl,fresh,,lenny_cooke_2013,"Shooting over a decade, the filmmakers introduce us to both the cocksure wunderkind and the man with his promise behind him.",Lenny Cooke (2013)
